id;title;price;available_quantity;sold_quantity;buying_mode;listing_type_id;accepts_mercadopago;original_price;category_id;category_name
MCO583306749;Over The Rainbow Caja Musical El Mago De Oz Color Madera;40000;1;1;buy_it_now;gold_pro;True;;MCO1885;Antigüedades y Colecciones
MCO461431347;Alcancía Roba Monedas Mischief Saving Box;39900;1;5;buy_it_now;gold_pro;True;;MCO30107;Antigüedades y Colecciones
MCO532986168;Sudan 2 Pound 2017;7000;1;2;buy_it_now;gold_special;True;;MCO9356;Antigüedades y Colecciones
MCO522289089;Digimon Caja Musical ;34000;1;3;buy_it_now;gold_special;True;;MCO1885;Antigüedades y Colecciones
MCO466622976;Moneda De 5 Centavos De Colombia De 1886 En Niquel 5 Unidade;37500;1;5;buy_it_now;gold_special;True;;MCO9355;Antigüedades y Colecciones
MCO556751160;Llavero Casco Destapador  Combo 32 Unidades;48000;50;1;buy_it_now;gold_special;True;;MCO172914;Antigüedades y Colecciones
MCO587954554;Calaveran Figura De India Accesorios De Colección Decorativo;37000;1;1;buy_it_now;gold_pro;True;;MCO442201;Antigüedades y Colecciones
MCO583307229;You Are My Sunshine Caja Musical Color Negro Johnny Cash;40000;1;1;buy_it_now;gold_pro;True;;MCO1885;Antigüedades y Colecciones
MCO475362838;Belarus 100 Rublos 2000 Unc;4500;1;2;buy_it_now;gold_special;True;;MCO9356;Antigüedades y Colecciones
MCO577797832;Protector De Almohadilla De Escritorio De Cuero, Alfombrilla;107990;1;1;buy_it_now;gold_special;True;;MCO442097;Antigüedades y Colecciones
MCO583245708;Godfather Caja Musical El Padrino Color Madera;40000;1;1;buy_it_now;gold_pro;True;;MCO1885;Antigüedades y Colecciones
MCO583298847;Feliz Navidad Caja Musical We Wish You A Merry Christmas ;40000;1;1;buy_it_now;gold_pro;True;;MCO1885;Antigüedades y Colecciones
MCO586130973;Moneda Conmemorativa Saint George Operación De La Libertad;41999;1;1;buy_it_now;gold_pro;True;;MCO9355;Antigüedades y Colecciones
MCO474547956;Uzbekistan 200 Sum 1997 ;4500;1;3;buy_it_now;gold_special;True;;MCO9356;Antigüedades y Colecciones
MCO525058557;Game Of Thrones Caja Musical Cuerda;43500;1;1;buy_it_now;gold_special;True;;MCO1885;Antigüedades y Colecciones
MCO567102009;Alcancía Colores En Madera Con Frente De Vidrio Para Regalo;45000;1;2;buy_it_now;gold_pro;True;;MCO30107;Antigüedades y Colecciones
MCO571620764;Amelie Caja Musical ;40000;1;1;buy_it_now;gold_pro;True;;MCO1885;Antigüedades y Colecciones
MCO522290055;Doraemon Caja Musical ;34000;1;3;buy_it_now;gold_special;True;;MCO1885;Antigüedades y Colecciones
MCO543706828;Alcancía Electrónica Gato Roba Monedas;41900;50;1;buy_it_now;gold_pro;True;;MCO30107;Antigüedades y Colecciones
MCO546620722;Billete De 1 Peso Banco Central De Cuba 2016;4000;50;2;buy_it_now;gold_special;True;;MCO9356;Antigüedades y Colecciones
MCO592309364;Botella Metálica Personalizada Harry Potter;34500;500;2;buy_it_now;gold_pro;True;;MCO172910;Antigüedades y Colecciones
MCO531717306;Llavero Martillo De Thor Avengers Marvel 7 Cm ;14900;1;3;buy_it_now;gold_special;True;;MCO172914;Antigüedades y Colecciones
MCO517047777;Llavero Dije Game Of Throne Juego De Tronos Metal ;12900;1;4;buy_it_now;gold_special;True;;MCO172914;Antigüedades y Colecciones
MCO509648365;Llavero Coleccionable Avengers Ojo De Agamotto  - 5 Cm Aprox;20000;1;3;buy_it_now;gold_special;True;;MCO172914;Antigüedades y Colecciones
MCO475364000;Nicaragua 25 Centavos 1991 Unc;4500;1;4;buy_it_now;gold_special;True;;MCO9356;Antigüedades y Colecciones
MCO547187418;Blancanieves Caja Musical ;34000;1;2;buy_it_now;gold_special;True;;MCO1885;Antigüedades y Colecciones
MCO479743418;Organizador De Escritorio Gato En Mdf;50000;50;5;buy_it_now;gold_special;True;;MCO1885;Antigüedades y Colecciones
MCO549764911;Álbum Vacío Garbage Pail Kids Años 80 Colombiano Y Láminas;69999;1;2;buy_it_now;gold_special;True;;MCO1885;Antigüedades y Colecciones
MCO550459491;Lanyard Portacarnet-llaves Avengers Marvel;14000;1;2;buy_it_now;gold_special;True;;MCO172914;Antigüedades y Colecciones
MCO555704844;Colombia Moneda 2 Pesos 1977;2000;1;5;buy_it_now;gold_special;True;;MCO9355;Antigüedades y Colecciones
MCO546585103;Camboya 2000 Riels 2007;9000;1;2;buy_it_now;gold_special;True;;MCO9356;Antigüedades y Colecciones
MCO590635740;Harry Potter Giratorio Sombrero Slytherin Gryffindor;20000;1;1;buy_it_now;gold_special;True;;MCO172914;Antigüedades y Colecciones
MCO595888621;Copa Shots Aguardientera Cráneo Vikingo Vaso Resina 75ml;19900;1;2;buy_it_now;gold_pro;True;;MCO1885;Antigüedades y Colecciones
MCO537789093;Wonderwoman Mujer Maravilla Liga De La Justicia Llavero ;18800;1;2;buy_it_now;gold_pro;True;;MCO172914;Antigüedades y Colecciones
MCO492338362;Botella Deportiva Barbie Active 700 Ml;14900;1;1;buy_it_now;gold_pro;True;29900.0;MCO172910;Antigüedades y Colecciones
MCO531719862;Llavero Escudo Del Capitan America Avengers Marvel ;16900;1;3;buy_it_now;gold_special;True;;MCO172914;Antigüedades y Colecciones
MCO488521535;Set Billetes St. Tomé & Príncipe Dobras 1996 Papel Moneda Un;59000;1;2;buy_it_now;gold_special;True;;MCO9356;Antigüedades y Colecciones
MCO499898316;Infinity War Capitan America Llavero Marvel Avenger;10000;1;5;buy_it_now;gold_pro;True;;MCO172914;Antigüedades y Colecciones
MCO553970712;Llavero - Goma Los Vengadores - Marvel Super Heroes ;12000;1;1;buy_it_now;gold_special;True;;MCO172914;Antigüedades y Colecciones
MCO531859835;Corneta En Bronce Decorativa Sin Boquilla;200000;1;0;buy_it_now;gold_special;True;;MCO1885;Antigüedades y Colecciones
MCO550729015;Paquete De 100 Estrellas En Madera Para Decorar Pintar;10000;1;5;buy_it_now;gold_pro;True;;MCO1885;Antigüedades y Colecciones
MCO474547624;Indonesia 1000 Rupias 2009;4500;1;2;buy_it_now;gold_special;True;;MCO9356;Antigüedades y Colecciones
MCO586654208; Llavero Con Luz Y Sonido Sin Rostro Chihiro;13000;1;2;buy_it_now;gold_special;True;;MCO172914;Antigüedades y Colecciones
MCO594944626;Colombia  Monedas 21/2 Centavos 1881 Grande Y Pequeña;18000;1;2;buy_it_now;gold_special;True;;MCO9355;Antigüedades y Colecciones
MCO492338216;Botella My Little Pony Tritan;5900;1;2;buy_it_now;gold_pro;True;11900.0;MCO172910;Antigüedades y Colecciones
MCO595632975;Colombia Moneda 5 Centavos 1886 ;5000;1;4;buy_it_now;gold_special;True;;MCO9355;Antigüedades y Colecciones
MCO597274247;Colombia Moneda 1 Centavo 1949;8000;1;3;buy_it_now;gold_special;True;;MCO9355;Antigüedades y Colecciones
MCO474548049;Vietnam 1000 Dong 1988 Unc;4500;1;2;buy_it_now;gold_special;True;;MCO9356;Antigüedades y Colecciones
MCO579145588;Cordones Resortados Para Teléfono 3 Mts Paquete X 20 Unds;70000;500;1;buy_it_now;gold_special;True;;MCO442119;Antigüedades y Colecciones
MCO595623455;Colombia Moneda 2 Centavos 1933;6000;1;4;buy_it_now;gold_special;True;;MCO9355;Antigüedades y Colecciones
MCO521377809;Tetera Antigua Japonesa En Porcelana Con Filtro Precio X C/u;70000;1;1;buy_it_now;gold_special;True;;MCO439433;Antigüedades y Colecciones
MCO468956671;Llavero Moto Casco Hjc Mujer Key Chain Motogp Valentino Ross;12500;1;5;buy_it_now;gold_special;True;;MCO172914;Antigüedades y Colecciones
MCO493617437;Maquina Coser Antigua Juguete Hojalata Japan Precio X C/u;120000;1;1;buy_it_now;gold_special;True;;MCO442139;Antigüedades y Colecciones
MCO459529390;Kennedy Half Dollars 2003 - 2007 1974 Whitman New Album;292000;1;1;buy_it_now;gold_special;True;;MCO9356;Antigüedades y Colecciones
MCO558807312;Glorificador Budweiser Exhibidor Nuevo Envío Inmediato;267000;1;1;buy_it_now;gold_pro;True;;MCO1885;Antigüedades y Colecciones
MCO473281620;Sal Rosa Himalayan Del Océano Antiguo, Grueso - Bolso De 5 ;196990;1;1;buy_it_now;gold_special;True;;MCO439433;Antigüedades y Colecciones
MCO593225987;Cohiba Espléndido  Edición Especial ;270000;1;1;buy_it_now;gold_special;True;;MCO1885;Antigüedades y Colecciones
MCO459214402;Llavero Carro Mercedes Chevrolet Mazda Peugeot Ford Lujo Log;15900;1;25;buy_it_now;gold_special;True;;MCO172914;Antigüedades y Colecciones
MCO499100441;Billete De Colombia 2000 Pesos Formato Grande Au 2001 Y 2002;27000;1;5;buy_it_now;gold_special;True;;MCO9356;Antigüedades y Colecciones
MCO472022331;Frutero Antiguo Cristal Azul France Precio X C/u ;120000;1;1;buy_it_now;gold_special;True;;MCO439433;Antigüedades y Colecciones
MCO568912571;Martillo Maso En Nylon Trabajar Cuero A Mano Vito Leather;76000;1;1;buy_it_now;gold_special;True;;MCO1885;Antigüedades y Colecciones
MCO563920628;Palabras Divertidas Y Desafiantes Juegos De Palabras Fa...;171900;1;1;buy_it_now;gold_special;True;;MCO442063;Antigüedades y Colecciones
MCO449790414;4 Frutas Cobre Plateadas, Zanahoria, Banano Pera Durazno Xcu;120000;1;1;buy_it_now;gold_special;True;;MCO439433;Antigüedades y Colecciones
MCO561552590;Replica Balsa Muisca Museo Del Oro;250000;1;1;buy_it_now;gold_special;True;;MCO1885;Antigüedades y Colecciones
MCO488365320;Billete Ghana 10 Cedis 1978 Billete Reposición Z1 Papel Unc;52000;1;1;buy_it_now;gold_special;True;;MCO9356;Antigüedades y Colecciones
MCO539067806;Placas Poster Decorativos Metalicas Vintage Retro 30x15 Cm.;119900;500;5;buy_it_now;gold_pro;True;;MCO168946;Antigüedades y Colecciones
MCO479750048;Llavero Carro Moto Amortiguador Miniatura Espiral Resorte;9900;50;5;buy_it_now;gold_special;True;;MCO172914;Antigüedades y Colecciones
MCO516560092;Llavero Coleccionable Calavera En Bicicleta Divertido ;7990;1;2;buy_it_now;gold_pro;True;;MCO9355;Antigüedades y Colecciones
MCO460713641;Pipa Para Fumar Filtro De Ébano Scotte Lobular Ebony;166019;1;3;buy_it_now;gold_special;True;;MCO1885;Antigüedades y Colecciones
MCO595652164;Mapa De Antioquia  Para Raspar Mapa Turístico Scratch Poster;45900;50;0;buy_it_now;gold_pro;True;;MCO168946;Antigüedades y Colecciones
MCO527993348;Trio De Billetes Kenya 50 , 100 , 200 Shilingi  Unc;52000;1;1;buy_it_now;gold_special;True;;MCO9356;Antigüedades y Colecciones
MCO455011958;Carreta Antigua En Madera Precio X Cada Una;70000;1;2;buy_it_now;gold_special;True;;MCO439433;Antigüedades y Colecciones
MCO567138666;Alcancía Electrónica De Monedas Animalitos  Monedas Caja;34950;1;1;buy_it_now;gold_pro;True;;MCO9355;Antigüedades y Colecciones
MCO531529738;Kincrea Herramientas Para Hacer Joyas Con Kit De Suministros;182990;1;1;buy_it_now;gold_pro;True;;MCO1885;Antigüedades y Colecciones
MCO584531225; Botellas Roll-on De Vidrio Vivaplex 24 Frosted Amber 10 Ml;116990;1;1;buy_it_now;gold_special;True;;MCO172910;Antigüedades y Colecciones
MCO582335782;Billete Colombia 10 Centavos Banco Nacional Año 1893 Unc;350000;1;1;buy_it_now;gold_special;True;;MCO9356;Antigüedades y Colecciones
MCO467347160;Ouai Ola Spray Tamaño Viaje 17 Oz;182990;1;1;buy_it_now;gold_special;True;;MCO172910;Antigüedades y Colecciones
MCO599090767;Señor De Los Anillos Árbol Mide 28 Cm;145000;1;1;buy_it_now;gold_special;True;;MCO1885;Antigüedades y Colecciones
MCO469722466;Llavero Lujo Carro Marca Kia Porta Logo Regal Rio Pican Cera;22900;1;5;buy_it_now;gold_special;True;;MCO172914;Antigüedades y Colecciones
MCO567131728;Poporo Quimbaya Réplica En Metal Bronce;150000;1;1;buy_it_now;gold_special;True;;MCO442201;Antigüedades y Colecciones
MCO575612496;Llavero De Lujo Para Carro Marca Logo Emblema Porsche Cuero;34900;1;1;buy_it_now;gold_special;True;;MCO172914;Antigüedades y Colecciones
MCO578230259;Alcancía Furgoneta Antigua Bandera Estampada ;30900;1;1;buy_it_now;gold_pro;True;;MCO1885;Antigüedades y Colecciones
MCO527995237;Billete De Burundi 10.000 Francos 2018 Papel Moneda Unc;40000;1;1;buy_it_now;gold_special;True;;MCO9356;Antigüedades y Colecciones
MCO515059805;Llavero De Lujo Carro Marca Mazda 3 Logo Emblema Elegante ;16900;1;2;buy_it_now;gold_special;True;;MCO172914;Antigüedades y Colecciones
MCO564055560;Monedas De Colección  Suiwoyou Hobo Coin 1963 Franklin Half;150686;1;1;buy_it_now;gold_pro;True;;MCO9355;Antigüedades y Colecciones
MCO558126467;Tractomula Carro Tanque Madera;99900;1;1;buy_it_now;gold_pro;True;;MCO1885;Antigüedades y Colecciones
MCO500689151;Llavero Carro Moto Lujo Suzuki Swift Vitara Logo Gsx Marca;21900;1;5;buy_it_now;gold_special;True;;MCO172914;Antigüedades y Colecciones
MCO467534737;Billete Djibouti 40 Francos 40 Aniversario Independencia Unc;33000;1;5;buy_it_now;gold_special;True;;MCO9356;Antigüedades y Colecciones
MCO579513697;Llavero Official Racing Valentino Rossi Vr|46 Moto Gp;19900;1;2;buy_it_now;gold_pro;True;;MCO172914;Antigüedades y Colecciones
MCO534517139;Reloj De Pared Personalizado Con Tus Fotos O Logos 20cmx20cm;20000;1;1;buy_it_now;gold_special;True;;MCO1885;Antigüedades y Colecciones
MCO488492978;Llavero Lujo Carro Marca Dodge Porta Llaves Souvenir Journey;22900;1;5;buy_it_now;gold_special;True;;MCO172914;Antigüedades y Colecciones
MCO533297931;Mini Llavero Casco Moto Gp Ducati Bmw Ktm Akt Bws Pulsar Kym;10500;50;3;buy_it_now;gold_special;True;;MCO172914;Antigüedades y Colecciones
MCO487789056;Billete Rusia 100 Rublos 2014 Unc Conmemorativo;32000;1;2;buy_it_now;gold_special;True;;MCO9356;Antigüedades y Colecciones
MCO554685001;Talla Guadua Decora Pintura Al Óleo Artesanía Arte Caballos ;150000;50;1;buy_it_now;gold_pro;True;;MCO1885;Antigüedades y Colecciones
MCO467965241;Llavero Carro Lujo Volkswagen Audi Nissan Mazda Hyundai Bmw;27900;100;25;buy_it_now;gold_special;True;;MCO172914;Antigüedades y Colecciones
MCO535039401;Llavero/dark Souls 3 Espada De Artorias/cosplay+envio Gratis;24900;1;3;buy_it_now;gold_pro;True;;MCO172914;Antigüedades y Colecciones
MCO506568452;Alcancias Personalizada;20000;1;1;buy_it_now;gold_pro;True;;MCO1885;Antigüedades y Colecciones
MCO501738034;Llavero Lujo Carro Marca Chevrolet Souvenir Emblema Logo Reg;28500;1;5;buy_it_now;gold_special;True;;MCO172914;Antigüedades y Colecciones
MCO499108766;Billete De Seychelles 25 Rupias 1998 Papel Moneda Unc;33000;1;1;buy_it_now;gold_special;True;;MCO9356;Antigüedades y Colecciones
MCO481802705;Llavero De Lujo Para Carro Logo Citroen C3 C4 C5 Ds Picass  ;22900;1;3;buy_it_now;gold_special;True;;MCO172914;Antigüedades y Colecciones
MCO591394680;Encendedor Genuino Cohiba 4 Llamas Metal Puro Tabaco Candela;164000;1;1;buy_it_now;gold_special;True;;MCO1885;Antigüedades y Colecciones
MCO546453639;Cuerda Colgante Cuello Llavero Tira Marca Mazda 3 2 Cx 3 5 ;19900;1;1;buy_it_now;gold_special;True;;MCO442102;Antigüedades y Colecciones
MCO534536513;Jarra Antigua En Cristal Y Antimonio Italy Precio X C/u ;80000;1;1;buy_it_now;gold_special;True;;MCO439433;Antigüedades y Colecciones
MCO593549117;Llavero Funko Pop: The Walking Dead Daryl Dixon;29999;1;1;buy_it_now;gold_special;True;;MCO172914;Antigüedades y Colecciones
MCO558955823;Soporte Para Bastidor De Bordado;199000;1;2;buy_it_now;gold_pro;True;;MCO1885;Antigüedades y Colecciones
MCO527994983;Billete De Republica Dominicana 100 Pesos Papel Moneda Unc;27500;1;1;buy_it_now;gold_special;True;;MCO9356;Antigüedades y Colecciones
MCO481798879;Llavero Carro Lujo Nissan Emblema Patrol Sentra Versa March;22900;1;5;buy_it_now;gold_special;True;;MCO172914;Antigüedades y Colecciones
MCO562542970;Llavero De Lujo Elegante Marca Logo Volvo Xc 60 S60 V40 Xc90;23000;1;4;buy_it_now;gold_special;True;;MCO172914;Antigüedades y Colecciones
MCO542506529;Cruz Para Pared En Acero 26cm;40000;1;3;buy_it_now;gold_pro;True;;MCO1885;Antigüedades y Colecciones
MCO504296411;Billete Seychelles 25 Rupias 2016 Papel Moneda Unc;32000;1;1;buy_it_now;gold_special;True;;MCO9356;Antigüedades y Colecciones
MCO500695114;Llavero Carro Lujo Skoda Fabia Felicia Octavia Yeti Kodiaq;21900;1;5;buy_it_now;gold_special;True;;MCO172914;Antigüedades y Colecciones
MCO501738147;Llavero Lujo Carro Marca Hyundai Logo Regalo Accesorio Emble;28500;1;5;buy_it_now;gold_special;True;;MCO172914;Antigüedades y Colecciones
MCO525969059;Dispensador Dulces M&m Tipo Avion De Coleccion  Sensacional;120000;1;5;buy_it_now;gold_pro;True;;MCO1885;Antigüedades y Colecciones
MCO514544750;Llavero Carro Lujo Elegante Marca Bmw Toyota Mercedes Benz ;16000;1;1;buy_it_now;gold_special;True;;MCO172914;Antigüedades y Colecciones
MCO478842493;Llavero De Carro Lujo Bmw Chevrolet Toyota Jeep Audi Honda;28500;100;4;buy_it_now;gold_special;True;;MCO172914;Antigüedades y Colecciones
MCO488433828;Billete Isla De Jersey 1 Libra 2010 Papel Moneda Unc;22000;1;1;buy_it_now;gold_special;True;;MCO9356;Antigüedades y Colecciones
MCO556321575;15 Pin Metálico Personalizado Cómic, Rock, Publicitarios;105000;1;2;buy_it_now;gold_special;True;;MCO1885;Antigüedades y Colecciones
MCO502382433;Pulceras/manilla/the Legend Of Zelda/majora/trifuerza/hyrule;11900;1;3;buy_it_now;gold_special;True;;MCO172914;Antigüedades y Colecciones
MCO583580364;Llavero De Lujo Carro Marca Logo Mercedes Benz Trenza Cuero;26900;1;1;buy_it_now;gold_special;True;;MCO172914;Antigüedades y Colecciones
MCO461670258;Llavero Carro Lujo Suzuki Nissan Mercedes Benz Volkswagen;22900;100;5;buy_it_now;gold_special;True;;MCO172914;Antigüedades y Colecciones
MCO492747582;Cocacola Botella 425 Ml Mundial Futbol Alemania Balon Dorado;18000;1;1;buy_it_now;gold_special;True;;MCO1885;Antigüedades y Colecciones
MCO499229237;Billete De Rusia 100 Rublos Conmemorativo Papel Moneda Unc;17500;1;2;buy_it_now;gold_special;True;;MCO9356;Antigüedades y Colecciones
MCO488152643;Llavero Lujo Carro Bmw Serie 1 2 3 4 Z X 5 6 Moto Logo Emble;22900;1;5;buy_it_now;gold_special;True;;MCO172914;Antigüedades y Colecciones
MCO497691003;Llavero Lujo Carro Marca Peugeot 306 206 307 5008 Logo Emble;21900;1;1;buy_it_now;gold_special;True;;MCO172914;Antigüedades y Colecciones
MCO507921580;100 Tarjetas Regalo,tags, Etiquetas Cartón Kraft De 7x4,5 Cm;38000;1;5;buy_it_now;gold_pro;True;;MCO1885;Antigüedades y Colecciones
MCO518984811;Cuerda Colgante Cuello Marc Nissan Porta Llave Cordon Logo;19900;1;2;buy_it_now;gold_special;True;;MCO442102;Antigüedades y Colecciones
MCO592544876;Llavero Carro Lujo Toyota Prado Hilux Fortuner Land Souvenir;22900;1;1;buy_it_now;gold_special;True;;MCO172914;Antigüedades y Colecciones
MCO551649254;Telar Para Mostacilla En Madera, Expansible A 2 Metros;140000;1;2;buy_it_now;gold_pro;True;;MCO1885;Antigüedades y Colecciones
MCO524172347;Billete De Georgia 5 Lari 2011 Papel Moneda Unc;28000;1;1;buy_it_now;gold_special;True;;MCO9356;Antigüedades y Colecciones
MCO531856671;Cuerda Colgante Cuello Porta Llave Tira Logo Marca Ford Stra;19900;1;3;buy_it_now;gold_special;True;;MCO442102;Antigüedades y Colecciones
MCO556749756;Aviso Retro Antiguo Vintage Metal Pintado Usa Precio X C/u ;70000;1;1;buy_it_now;gold_special;True;;MCO168946;Antigüedades y Colecciones
MCO548834730;Masa Porcelanicron X 18 Colores;99000;1;2;buy_it_now;gold_special;True;;MCO1885;Antigüedades y Colecciones
MCO509436487;Billete Qatar 10 Riales Papel Moneda Unc ;24000;1;1;buy_it_now;gold_special;True;;MCO9356;Antigüedades y Colecciones
MCO538569607;Llavero Carro Lujo Elegante Marca Logo Emblema Para Skoda;26900;1;1;buy_it_now;gold_special;True;;MCO172914;Antigüedades y Colecciones
MCO518984207;Cuerda Colgante Cuello Marca Audi A Strap Porta Llaves Cordo;21990;1;3;buy_it_now;gold_special;True;;MCO172914;Antigüedades y Colecciones
MCO562251220;Mascaras Tapabocas 3d Stl ;6000;50;5;buy_it_now;gold_pro;True;;MCO1885;Antigüedades y Colecciones
MCO475835572;Álbum Libro Para Guardar 120 Billetes Antiguos Colombianos;92000;1;25;buy_it_now;gold_special;True;;MCO9356;Antigüedades y Colecciones
MCO496821127;Billete Venezuela 200 Bolivares Soberanos Condicion: Unc;15000;1;3;buy_it_now;gold_special;True;;MCO9356;Antigüedades y Colecciones
MCO596698079;Llavero Carro Camioneta Lujo Marca Logo Peugeot Luxury Acce ;22900;1;1;buy_it_now;gold_special;True;;MCO172914;Antigüedades y Colecciones
MCO572202471;Máscaras En Impresión 3d;60000;50;1;buy_it_now;gold_special;True;;MCO1885;Antigüedades y Colecciones
MCO598350418;Llavero Lujo Nissan Xtrail Pathfinder Versa March Qashqai Ti;22900;1;1;buy_it_now;gold_special;True;;MCO172914;Antigüedades y Colecciones
MCO488696817;Whiskera Licorera Metálica  2 Copas Y Embudo Dia Del Padre;44000;1;5;buy_it_now;gold_special;True;;MCO413494;Antigüedades y Colecciones
MCO504298881;Billete Islas Bahamas 50 Centavos De 2001 Papel Moneda Unc;17500;1;2;buy_it_now;gold_special;True;;MCO9356;Antigüedades y Colecciones
MCO583495740;Martillo Decorativo De Juez - Regalo Ideal Para Abogados;127000;1;2;buy_it_now;gold_pro;True;;MCO1885;Antigüedades y Colecciones
MCO558895156;Llavero De Lujo Carro Logo Marca Mini Cooper Country Club  ;17900;1;1;buy_it_now;gold_special;True;;MCO172914;Antigüedades y Colecciones
MCO566417690;Licorera Whiskera Petaca 8oz  Acero Inox. Por: Banimported. ;110900;1;1;buy_it_now;gold_pro;True;;MCO413494;Antigüedades y Colecciones
MCO524171630;Billete De Georgia 1 Lari 1995 Papel Moneda Unc;16500;1;1;buy_it_now;gold_special;True;;MCO9356;Antigüedades y Colecciones
MCO448935752;Perdernal Respuesto;4000;1;3;buy_it_now;gold_pro;True;;MCO1885;Antigüedades y Colecciones
MCO504847851;Billete De Rwanda. 500 Francos 2013 Papel Moneda Unc;16000;1;1;buy_it_now;gold_special;True;;MCO9356;Antigüedades y Colecciones
MCO519366590;Llavero Carro Marca Logo Nissan Versa March Qashqai Kicks;9900;1;1;buy_it_now;gold_special;True;;MCO172914;Antigüedades y Colecciones
MCO565466670;Jack Daniel´s Botellita Colección Licor Miniatura 50cl;15000;1;5;buy_it_now;gold_special;True;;MCO172910;Antigüedades y Colecciones
MCO540510834;Kinder Happy Hippo - Avellana, Caja, 10x (20.7 G X 5) 50;166000;1;1;buy_it_now;gold_special;True;;MCO1885;Antigüedades y Colecciones
MCO578231390;Estrella China Cinco Puntas;12500;250;1;buy_it_now;gold_pro;True;;MCO416694;Antigüedades y Colecciones
MCO491079152;Billete Venezuela 100 Bolivares Soberanos Unc;10000;1;1;buy_it_now;gold_special;True;;MCO9356;Antigüedades y Colecciones
MCO499027605;Billete Bulgaria 2 Leiva 2005 Papel Moneda Unc;14000;1;1;buy_it_now;gold_special;True;;MCO9356;Antigüedades y Colecciones
MCO482867723;Pareja De Gatos Pintados A Mano Artesanal;79900;1;1;buy_it_now;gold_special;True;;MCO1885;Antigüedades y Colecciones
MCO548282506;Monedas De Colombia Réplicas-copias;250000;1;1;buy_it_now;gold_special;True;;MCO9355;Antigüedades y Colecciones
MCO488056124;Billete Paraguay 5000 Guaraníes 2016 Polímero Unc;14500;1;1;buy_it_now;gold_special;True;;MCO9356;Antigüedades y Colecciones
MCO555091018;Encendedor Candela Clipper X6;32000;250;3;buy_it_now;gold_special;True;;MCO1885;Antigüedades y Colecciones
MCO530486998;Billete De Mexico 5 Pesos 1963, Papel Moneda Au;17000;1;1;buy_it_now;gold_special;True;;MCO9356;Antigüedades y Colecciones
MCO584300936;Llavero De Lujo Mini Bola Y Palo De Golf Golfista Deporte Pe;12900;1;1;buy_it_now;gold_special;True;;MCO172914;Antigüedades y Colecciones
MCO504846745;Billete Guyana 20 Dolares, Papel Moneda Unc;12000;1;1;buy_it_now;gold_special;True;;MCO9356;Antigüedades y Colecciones
MCO571508142;Arca De La Alianza Pacto Resina 8 Cm;61000;1;1;buy_it_now;gold_special;True;;MCO1885;Antigüedades y Colecciones
MCO531234564;Billete De Argentina 10 Pesos Papel Moneda Unc;12000;1;1;buy_it_now;gold_special;True;;MCO9356;Antigüedades y Colecciones
MCO591840083;Llavero Harry Potter Mago Regalo Colección ;10990;1;1;buy_it_now;gold_pro;True;;MCO172914;Antigüedades y Colecciones
MCO559707336;Moto Batman Antigua 11 Cm Plastica Base  Metalica De Abajo;69900;1;1;buy_it_now;gold_special;True;;MCO439433;Antigüedades y Colecciones
MCO585407390;Picadura De Tabaco Mac Baren Virginia Blend 100 Grms;149900;1;1;buy_it_now;gold_pro;True;;MCO1885;Antigüedades y Colecciones
MCO465190368;Moneda Michael Jordan 23 Chicago Bulls Basketball Nike Nba;49990;1;5;buy_it_now;gold_pro;True;;MCO9355;Antigüedades y Colecciones
MCO461887328;Espejo Y/o Portaretrato  Bronce Arabe Precio X C/u ;70000;1;1;buy_it_now;gold_special;True;;MCO439433;Antigüedades y Colecciones
MCO503434146;Llavero/mass Effect/n7/video Juego/xbox 360 /ps3;4900;1;1;buy_it_now;gold_special;True;;MCO172914;Antigüedades y Colecciones
MCO554396142;Atrapasueños Colgante Multicolor ;70000;1;1;buy_it_now;gold_pro;True;;MCO1885;Antigüedades y Colecciones
MCO499024883;Billete Sudan Del Sur, 10 Libras Sudanesas 2016 Unc;10000;1;1;buy_it_now;gold_special;True;;MCO9356;Antigüedades y Colecciones
MCO488521431;Billete St. Tomé & Príncipe  5.000 Dobras 1996 Papel Moneda ;8000;1;1;buy_it_now;gold_special;True;;MCO9356;Antigüedades y Colecciones
MCO504297915;Billete Angola 100 Kwanzas 2012 Papel Moneda Unc;11000;1;1;buy_it_now;gold_special;True;;MCO9356;Antigüedades y Colecciones
MCO570642421;Porta Esferos Deadpool. Deadpool Fans ;50000;1;1;buy_it_now;gold_pro;True;;MCO1885;Antigüedades y Colecciones
MCO555969652;Billete Colombia 1 Peso 1947 Sin Circular;150000;1;1;buy_it_now;gold_special;True;;MCO9356;Antigüedades y Colecciones
MCO547928567;1 Moneda China Buena Suerte Llevar En Cartera;2000;1;5;buy_it_now;gold_special;True;;MCO9355;Antigüedades y Colecciones
MCO566415191;Licorera Whiskera Petaca 2.5 Oz En Acero Inox. ;74900;1;1;buy_it_now;gold_pro;True;;MCO413494;Antigüedades y Colecciones
MCO573698552;Marcador De Vinilo Para Globos  15 Mm Grafitin X Unidad;21000;1;0;buy_it_now;gold_pro;True;;MCO1885;Antigüedades y Colecciones
MCO530488865;Billete De Mexico 20 Pesos 1977, Papel Moneda Au;9500;1;1;buy_it_now;gold_special;True;;MCO9356;Antigüedades y Colecciones
MCO573002742;Set The Last Of Us - Collar + Llavero;23000;1;5;buy_it_now;gold_special;True;;MCO172914;Antigüedades y Colecciones
MCO589354097;Antigua Cámara Periodista Decorativa;80000;1;1;buy_it_now;gold_special;True;;MCO439433;Antigüedades y Colecciones
MCO568926515;Encendedor Candela Soplete 3 Llamas;34900;1;1;buy_it_now;gold_pro;True;;MCO1885;Antigüedades y Colecciones
MCO498870291;Billete 100 Manat 2005 Turkmenistan Unc;8000;1;1;buy_it_now;gold_special;True;;MCO9356;Antigüedades y Colecciones
MCO544639208;Billete Ucrania 10 Grivna 2015 Papel Moneda Unc;7000;1;1;buy_it_now;gold_special;True;;MCO9356;Antigüedades y Colecciones
