id;title;price;available_quantity;sold_quantity;buying_mode;listing_type_id;accepts_mercadopago;original_price;category_id;category_name
MCO478286595;Abanico Madera Natural Personalizado Recordatorio Matrimonio;2499;50000;500;buy_it_now;gold_pro;True;;MCO3530;Otras categorías
MCO563615881;Botella Empaque Envase Plastica Para Gel Crema Mucho Mas;120000;1;250;buy_it_now;gold_special;True;;MCO3530;Otras categorías
MCO575018889;Pin Tarjeta Netflix  De $20.000 Entrega Inmediata;23990;1;250;buy_it_now;gold_special;True;;MCO425038;Otras categorías
MCO454844305;Piedra Para Encendedor Zippo - Cod 2406n;4100;250;500;buy_it_now;gold_special;True;;MCO172908;Otras categorías
MCO577597625;Maleta De Agueros Regalo Empresarial Corporativo Anchetas;15000;50;150;buy_it_now;gold_pro;True;;MCO116987;Otras categorías
MCO573680920;Pin Tarjeta Netflix  De $30.000 Entrega Inmediata;35290;1;200;buy_it_now;gold_special;True;;MCO425038;Otras categorías
MCO451911428;Caucho Silicona Mold 25 Estaño Liquido Moldes X500gescultura;47500;50;500;buy_it_now;gold_special;True;;MCO3530;Otras categorías
MCO454844234;Combustible Para Encendedor Zippo 4oz - Cod 3141laex;11200;500;500;buy_it_now;gold_special;True;;MCO172908;Otras categorías
MCO550940163;Pipa De Vidrio  Tuvo  Surtido + Obsequio;4500;1;250;buy_it_now;gold_pro;True;;MCO442272;Otras categorías
MCO538042067;Abanico Madera Personalizado Boda, Matrimonio, 15 Años, Logo;4599;500;100;buy_it_now;gold_special;True;;MCO3530;Otras categorías
MCO583235351;Pin Virtual / Tarjeta De Regalo Netflix - Saldo $ 20.000;25000;1;150;buy_it_now;gold_special;True;;MCO425038;Otras categorías
MCO562433644;Caja De Incienso X 200 Varitas - Aromaterapia;24900;500;150;buy_it_now;gold_special;True;;MCO387586;Otras categorías
MCO532437392;Cartuchos Para Tatuar Spark Caja 20 Unidades;60000;1;250;buy_it_now;gold_pro;True;;MCO412100;Otras categorías
MCO499125782;Alcancia Cerdito Grande Incluye Caja Alcancía Publicitaria;3650;50;150;buy_it_now;gold_pro;True;;MCO3530;Otras categorías
MCO454844082;Mecha Para Encendedor Zippo - Cod 2425;4000;250;250;buy_it_now;gold_special;True;;MCO172908;Otras categorías
MCO592972579;Tarjeta De Regalo Netflix (pin-recarga) $20.000;24990;1;25;buy_it_now;gold_pro;True;;MCO425038;Otras categorías
MCO558908429;Filtros De Cañamo Paquete X50;1500;1;100;buy_it_now;gold_pro;True;;MCO413497;Otras categorías
MCO546567732;Accesorios Fiesta San Silvestre Cotillón Año Nuevo 2021;1000;500;50;buy_it_now;gold_pro;True;;MCO3530;Otras categorías
MCO549732944;Kit Tatuaje Tatuar Tattoo 2 Maquinas Profesionales;289900;1;250;buy_it_now;gold_special;True;;MCO412100;Otras categorías
MCO445617783;Kit Tatuaje Tatuar Tattoo 3 Maquinas 20 Tintas Profesional;324900;1;100;buy_it_now;gold_special;True;;MCO412100;Otras categorías
MCO469665290;Botella Recordatorios Personalizada Envase Plastica 16cm Lot;2500;1;500;buy_it_now;gold_special;True;;MCO3530;Otras categorías
MCO564317382;Tarjeta Itunes Apps Store 50 Usd Entrega Inmediata;210500;1;50;buy_it_now;gold_special;True;;MCO425038;Otras categorías
MCO565263185;Recarga Soplete Encendedores Flameadores;8500;1;50;buy_it_now;gold_special;True;;MCO172908;Otras categorías
MCO563615921;Raw #7 Papel De Fumar;3900;1;100;buy_it_now;gold_pro;True;;MCO417902;Otras categorías
MCO559360235;Botella Recordatorio Empaque Envase Plastica Crema Gel ;1500;1;50;buy_it_now;gold_special;True;;MCO3530;Otras categorías
MCO569275601;Caja De Agujas Para Tatuar X 50 Unds Con Sus Punteras Tatto;47499;500;100;buy_it_now;gold_special;True;;MCO412106;Otras categorías
MCO562858411;10 Parches Para La Curación Del Tatuaje Dermalize;24500;1;100;buy_it_now;gold_pro;True;;MCO412100;Otras categorías
MCO576114532;2 Piezas De Piel Sintética Para Tatuar;10000;1;100;buy_it_now;gold_pro;True;;MCO412100;Otras categorías
MCO582547994;Kit Tatuaje Profesional 1 Maquina Tatuar A14 W01;149990;1;25;buy_it_now;gold_special;True;;MCO412110;Otras categorías
MCO525417734;Corrector Postura Espalda Cojín Lumbar Espaldar Sillas Mnr;14990;1;150;buy_it_now;gold_special;True;;MCO3530;Otras categorías
MCO562931965;Pin Tarjeta Netflix De $30.000;35199;5000;150;buy_it_now;gold_special;True;;MCO425038;Otras categorías
MCO574839728;Esencia Picadura Narguile Alfakher Original Emiratos Árabes;9999;1;50;buy_it_now;gold_special;True;;MCO442271;Otras categorías
MCO473771018;Confeti Cañon Volcan Electrico Polvora Frio Pirotecnia Event;11999;500;250;buy_it_now;gold_pro;True;;MCO3530;Otras categorías
MCO572638682;Soplete Encendedor Mini Recargable ;10900;1;50;buy_it_now;gold_pro;True;;MCO172908;Otras categorías
MCO578352329;Pipa Pequeña Haojue Imitacion Madera;4900;200;50;buy_it_now;gold_pro;True;;MCO442272;Otras categorías
MCO478074888;Caja Cebadera Para Control De Roedores;16000;500;250;buy_it_now;gold_special;True;;MCO3530;Otras categorías
MCO558772322;Caja De Smoking X60 Papelillos, Papel Blanco Clásico;2000;1;100;buy_it_now;gold_pro;True;;MCO417902;Otras categorías
MCO579489946;Netflix Colombia - Tarjeta De Regalo Netflix $20000;22900;250;25;buy_it_now;gold_special;True;;MCO425038;Otras categorías
MCO525499394;Cartas De Tarot Del Fuego Fournier;78000;1;100;buy_it_now;gold_special;True;;MCO414133;Otras categorías
MCO452324159;Cojín Compresa Bolsa De Gel Térmica Frio-calor Rectangular;7500;5000;250;buy_it_now;gold_special;True;;MCO3530;Otras categorías
MCO579439204;Gif Card De Netflix O Bit Card;25500;500;50;buy_it_now;gold_special;True;;MCO425038;Otras categorías
MCO586835866;Oferta 1 Pantalla Ultra Hd ( 1 Dispositivo ) 1 Mes;10700;1;50;buy_it_now;gold_special;True;;MCO425038;Otras categorías
MCO564696256;Flautas Exhibir Ropa;7000;500;100;buy_it_now;gold_pro;True;;MCO3530;Otras categorías
MCO579960324;Wplay Envio Inmediato Recarga Desde 10.000;12300;1;50;buy_it_now;gold_special;True;;MCO425038;Otras categorías
MCO528877071;Pasacalles Baratos;4500;250;250;buy_it_now;gold_pro;True;;MCO3530;Otras categorías
MCO567870910;Palo Santo (esotérico) - 1 Libra;14400;1;50;buy_it_now;gold_special;True;;MCO387586;Otras categorías
MCO515473733;Salvia Blanca Californiana X 2;34000;1;150;buy_it_now;gold_special;True;;MCO116987;Otras categorías
MCO458320328;Polvo Neón Holly (run Color Fest)# Paquete 100 Gr;3599;1;200;buy_it_now;gold_pro;True;;MCO3530;Otras categorías
MCO561689750;Concertina De Seguridad ;48552;500;50;buy_it_now;gold_special;True;;MCO3530;Otras categorías
MCO451239884;Kit Para Tatuar Tatuaje Tattoo De 2 Maquinas Completo;329000;1;250;buy_it_now;gold_special;True;;MCO412100;Otras categorías
MCO490679939;Combustible Para Encendedor Zippo 12oz - Cod 3165s;21200;1;500;buy_it_now;gold_special;True;;MCO172908;Otras categorías
MCO542644136;Plántulas De Hortalizas X12, Aromáticas X2 Y Frutales X2;1200;500;250;buy_it_now;gold_special;True;;MCO3530;Otras categorías
MCO564035511;Kit Cordus Delux Y Sacrus 12 Cuotas 0% Envío Gratuito;588000;1;50;buy_it_now;gold_pro;True;;MCO3530;Otras categorías
MCO559288711;Ocb Organico #7 Papel De Fumar;3900;1;100;buy_it_now;gold_pro;True;;MCO417902;Otras categorías
MCO473765979;Cubo Hielo Luminoso Led Hora Loca La Gran13 + 3000 Artículos;1799;500;200;buy_it_now;gold_pro;True;;MCO3530;Otras categorías
MCO509481783;Burbujero Boda Recordatorio Siliconado Personalizado Niños;1500;1;250;buy_it_now;gold_special;True;;MCO3530;Otras categorías
MCO558233579;Caja De Agujas Para Tatuar X 25 Uds Con Sus Punteras Tattoo;29000;50;100;buy_it_now;gold_special;True;;MCO412106;Otras categorías
MCO532195243;Bacitracina 30gr Tattoo;15000;1;50;buy_it_now;gold_pro;True;;MCO412113;Otras categorías
MCO571804252;Mallas Metálicas Repuesto X5;1500;1;50;buy_it_now;gold_pro;True;;MCO442266;Otras categorías
MCO568501239;Caja De Hornet X50 Papelillos Celulosos ;3000;1;100;buy_it_now;gold_pro;True;;MCO417902;Otras categorías
MCO501766848;Bengala De Humo De Colores Grandes;19999;1;150;buy_it_now;gold_pro;True;;MCO3530;Otras categorías
MCO488317527;Abanico Madera Personalizado Boda,  Matrimonio, Shower 15 Añ;2700;1;250;buy_it_now;gold_special;True;;MCO3530;Otras categorías
MCO520852422;Tarjeta Regalo Spotify 1 Mes Región Colombia;17999;250;150;buy_it_now;gold_special;True;;MCO425038;Otras categorías
MCO564317394;Tarjeta Google Play 50 Usd Original Entrega En Minutos;209000;50;25;buy_it_now;gold_special;True;;MCO425038;Otras categorías
MCO553825619;Resina Poliester Acelerada X500gr + Fibra + Cataliz Oferta!;18000;1;100;buy_it_now;gold_special;True;;MCO3530;Otras categorías
MCO562061032;Pin Tarjeta Netflix De $40.000;45999;5000;50;buy_it_now;gold_special;True;;MCO425038;Otras categorías
MCO564201487;Caja X25unds Old Tattoo Mini Cicatrizante Tatuaje;30400;1;50;buy_it_now;gold_special;True;;MCO412113;Otras categorías
MCO564498236;Palo Santo Al Por Mayor $17.000 Libra;16900;1;100;buy_it_now;gold_pro;True;;MCO387586;Otras categorías
MCO563926074;Grinder Acrílico 4 Piezas + Maquina + Papers;16900;1;50;buy_it_now;gold_pro;True;;MCO413500;Otras categorías
MCO577176244;Tela Algodón Perchado Monaco X Metros 1.50 De Ancho.;15000;500;50;buy_it_now;gold_special;True;;MCO3530;Otras categorías
MCO455613052;Parches De Colageno Para Pedtañas Pelo A Pelo;1000;5000;500;buy_it_now;gold_special;True;;MCO3530;Otras categorías
MCO557258591;Pipa De Vidrio Espiral Mediana;12900;1;100;buy_it_now;gold_pro;True;;MCO442272;Otras categorías
MCO490098494;Kit Profesional Tatuaje Tattoo Tatuar 2 Maquinas Tintas New;269900;1;500;buy_it_now;gold_special;True;;MCO412100;Otras categorías
MCO595268240;Tarjetas De Regalo, Pin Virtual Netflix 30 Dias;10000;1;50;buy_it_now;gold_pro;True;;MCO425038;Otras categorías
MCO581973810;Una Pantalla;10000;1;50;buy_it_now;gold_special;True;;MCO3530;Otras categorías
MCO512019186;Incienso Cono Para Incienciario De Cascada. Paquete X 4 Unid;1500;100;250;buy_it_now;gold_special;True;;MCO116987;Otras categorías
MCO560438852;Inserto Encendedor Zippo Butano Llama Doble Cod 65827;75400;1;50;buy_it_now;gold_special;True;;MCO172908;Otras categorías
MCO512745029;Poliacrilato Sodio 1 Kg 100%  Original Hidroretenedor;22900;500;150;buy_it_now;gold_special;True;;MCO3530;Otras categorías
MCO453103794;Otostick Bebé, Corrección Definitiva De Orejas Separadas;79000;1;500;buy_it_now;gold_pro;True;;MCO3530;Otras categorías
MCO564317311;Tarjeta Itunes Apps Store 100 Usd Entrega Inmediata;410000;1;25;buy_it_now;gold_special;True;;MCO425038;Otras categorías
MCO577485114;Pin Tarjeta Regalo Netflix  De $40.000 Entrega Inmediata;46850;1;25;buy_it_now;gold_special;True;;MCO425038;Otras categorías
MCO573438029;Carbon Liturgico Caja  X 60 Pastillas;23300;1;50;buy_it_now;gold_pro;True;;MCO431853;Otras categorías
MCO557391939;Pelota Loca  Para Dispensador X 10 Pcs;3000;1;50;buy_it_now;gold_pro;True;;MCO3530;Otras categorías
MCO572638731;Soplete Encendedor Mini Recargable + Repuesto De Gas;14900;1;25;buy_it_now;gold_pro;True;;MCO172908;Otras categorías
MCO581171158;Encendedor De Gas Recargable;19000;150;25;buy_it_now;gold_special;True;;MCO172908;Otras categorías
MCO561814181;Ocb Premium #7 X3 Tres Cajas;9900;1;25;buy_it_now;gold_pro;True;;MCO417902;Otras categorías
MCO451318963;Kit Tatuaje Tatuar Tattoo Profesional 3 Maquinas 1 Rotativa;359000;1;25;buy_it_now;gold_special;True;;MCO412100;Otras categorías
MCO569166937;Sabiduría De Bruja Tarot (estuche) Deborah Blake ;100000;1;25;buy_it_now;gold_special;True;;MCO414133;Otras categorías
MCO561108301;Carbon Natural De Coco En Cubos Sin Humo Sin Olor;49000;1;50;buy_it_now;gold_special;True;;MCO431853;Otras categorías
MCO564020014;Cordus Delux 12 Cuotas 0% Envío Gratuito A Todo Colombia;339000;1;25;buy_it_now;gold_pro;True;;MCO3530;Otras categorías
MCO552742961;Pipa De Vidrio Espiral;7900;1;50;buy_it_now;gold_pro;True;;MCO442272;Otras categorías
MCO500410617;Kit Profesional Tatuaje Tattoo Tatuar 2 Maquinas 40 Pigmento;329900;1;150;buy_it_now;gold_special;True;;MCO412100;Otras categorías
MCO459432939;Tubo Cebadero Para Roedores 23 X 10 X 9 Con Llave;14000;500;250;buy_it_now;gold_pro;True;;MCO3530;Otras categorías
MCO563021695;Cubre Clip Cord X100 Unds Para Tatuar;11900;150;50;buy_it_now;gold_special;True;;MCO412100;Otras categorías
MCO499133325;Alcancia Miss Piggy Teen Cerdito Pvc Medidas 20x14 Cms;14900;1;25;buy_it_now;gold_pro;True;;MCO3530;Otras categorías
MCO575194133;Tarjeta De Regalo Spotify Región Colombia;4000;1;250;buy_it_now;gold_pro;True;;MCO425038;Otras categorías
MCO579942651;Cenicero Generico Cigarrillo  Cristar 0127  Capacidad 2.75o;9000;50;25;buy_it_now;gold_special;True;;MCO442277;Otras categorías
MCO554360383;Encendedor Recargable Usb Eléctrico Táctil Sin Llama;26500;1;25;buy_it_now;gold_pro;True;;MCO172908;Otras categorías
MCO595059524;Tarjeta Google Play 5 Usd Original Entrega En Minutos;25400;500;25;buy_it_now;gold_special;True;;MCO425038;Otras categorías
MCO573479037;Pipa Vidrio Cono Con Recubrimiento De Silicona ;13900;1;25;buy_it_now;gold_pro;True;;MCO442272;Otras categorías
MCO454970948;Caja Agujas Para Tatuar X 50 Und Tattoo Tatuaje Esterilizada;31900;500;250;buy_it_now;gold_special;True;;MCO412100;Otras categorías
MCO572294208;Plasticera Industrial Suave Profesional X 1 Kilo Esculturas;39000;50;25;buy_it_now;gold_special;True;;MCO3530;Otras categorías
MCO462337167;Kit Para Tatuar Tattoo Tatuaje Profesional ;149900;1;50;buy_it_now;gold_special;True;;MCO412100;Otras categorías
MCO569547587;Tarjeta Regalo Netflix $20.000 Región Colombia;24900;1;50;buy_it_now;gold_special;True;;MCO425038;Otras categorías
MCO569787698;Caucho De Silicona Para Moldes Y Reproducción De Modelos;1000;5000;500;buy_it_now;gold_special;True;;MCO3530;Otras categorías
MCO563656171;Tarot Rider Waite (original-ingles);120000;1;25;buy_it_now;gold_special;True;;MCO414133;Otras categorías
MCO577075561;Paquete De Bluntwrap X2 Unidades;3000;1;25;buy_it_now;gold_pro;True;;MCO417902;Otras categorías
MCO532391608;Porta Licencias Tipo Witz, Portacarnet Impermeable, Original;25000;250;100;buy_it_now;gold_special;True;;MCO3530;Otras categorías
MCO547875292;Tarot Fournier Magic;78000;1;50;buy_it_now;gold_special;True;;MCO414133;Otras categorías
MCO565335677;Maquina De Liar Automatica #7;15000;1;50;buy_it_now;gold_special;True;;MCO417903;Otras categorías
MCO452495755;Marquillas Personalizadas Sublimadas - Todo Tipo De Textiles;9500;1;200;buy_it_now;gold_special;True;;MCO3530;Otras categorías
MCO562837620;Caja De Agujas Tatuar X 50 Unds Con Punteras Tattoo Surtidas;45800;1;50;buy_it_now;gold_special;True;;MCO412106;Otras categorías
MCO520848102;Tarjeta Regalo Netflix $50.000 Región Colombia;58499;250;150;buy_it_now;gold_special;True;;MCO425038;Otras categorías
MCO458142884;Varillas Para Radiestesia;30000;1;200;buy_it_now;gold_pro;True;;MCO116987;Otras categorías
MCO467666454;Caja De Agujas Tatuar  X 50 Unds Mas Sus Punteras Tattoo;47500;500;250;buy_it_now;gold_special;True;;MCO412106;Otras categorías
MCO564595407;Tarot Astral: Mas Avanzado Que Tarot Rider Y Marsella;86000;1;50;buy_it_now;gold_special;True;;MCO414133;Otras categorías
MCO502943988;Pen Tattoo Tatuaje Maquina Para Tatuar Dragon Hawk;279900;1;50;buy_it_now;gold_special;True;;MCO412100;Otras categorías
MCO486877980;Caucho Silicona Mold Liquido Moldes X500g Molduras Yeso 3d;54000;1;100;buy_it_now;gold_special;True;;MCO3530;Otras categorías
MCO551837245;Piel Sintética Para Tatuar 14 X 20 Cms;5800;1;50;buy_it_now;gold_pro;True;;MCO412100;Otras categorías
MCO532577455;Cartuchos Para Tatuar Spark  M Caja 20 Unidades;60000;1;50;buy_it_now;gold_pro;True;;MCO412100;Otras categorías
MCO571876674;Super Lectura Jim Kwik Completo Original;25000;1;50;buy_it_now;gold_pro;True;;MCO3530;Otras categorías
MCO560133029;Caja Agujas Y Punteras Para Tatuar X 50 Und Esterilizada;53900;250;50;buy_it_now;gold_special;True;;MCO412104;Otras categorías
MCO578352614;Caja De Filtros X10 Vauen Para Pipa ;5900;500;25;buy_it_now;gold_pro;True;;MCO442272;Otras categorías
MCO476660422; Extensión De Pestañas Optivisor Luz Led Gafa Lupa;39000;50;200;buy_it_now;gold_special;True;;MCO3530;Otras categorías
MCO558853259;Pipa Botella Cerveza Colores Surtidos;9900;1;25;buy_it_now;gold_pro;True;;MCO442272;Otras categorías
MCO573891335;Espada De San Miguel Arcangel - Aleacion - 11cm;9900;1;25;buy_it_now;gold_special;True;;MCO116987;Otras categorías
MCO497321714;Set 6 Pigmentos Tatuaje Colores Primarios Tattoo Perpetual;147500;1;50;buy_it_now;gold_pro;True;;MCO412100;Otras categorías
MCO452293502;Burbujero Boda Matrimonio Recordatorio Bombas De Jabon;1399;1;500;buy_it_now;gold_special;True;;MCO3530;Otras categorías
MCO491524237;Minifiltros Xra Cigarrillos 6mmx10 David Ross. -60% Nicotina;4490;1;50;buy_it_now;gold_pro;True;;MCO172908;Otras categorías
MCO473124660;Kit Tatuaje Tatuar 3 Maquinas Con Rotativa Y Maleta Tattoo;379900;1;250;buy_it_now;gold_special;True;;MCO412100;Otras categorías
MCO562318554;Tela Ovejero Cariñosito 1.60 Cm De Ancho X Metros.;12500;500;150;buy_it_now;gold_pro;True;;MCO3530;Otras categorías
MCO565672856;Pin Tarjeta Netflix  De $40.000 Entrega Inmediata;46610;1;50;buy_it_now;gold_special;True;;MCO425038;Otras categorías
MCO571806530;Grinder Trillador Acero Mini Recolector Discreto;13900;1;25;buy_it_now;gold_pro;True;;MCO413500;Otras categorías
MCO499125814;Alcancia Cerdito Pequeña Incluye Caja Alcancía Publicitaria;3100;1;50;buy_it_now;gold_pro;True;;MCO3530;Otras categorías
MCO576400989;Grinder Acero 4 Piezas Con Manivela Rascador, Trillador ;35800;1;50;buy_it_now;gold_pro;True;;MCO413500;Otras categorías
MCO578725348;Incienso, Mirra Y Estoraque (esoterico) - 150gr ;12900;1;25;buy_it_now;gold_special;True;;MCO387586;Otras categorías
MCO486419868;Vareta Plastica 4x9x195cm;13500;1;200;buy_it_now;gold_special;True;;MCO3530;Otras categorías
MCO502835633;Kit Tatuaje Tatuar Tattoo Con 2 Maquinas Pigmentoprofesional;309900;1;50;buy_it_now;gold_special;True;;MCO412100;Otras categorías
MCO483537923;Trampa De Pegamento Para Roedores,ratas, Ratones;3500;150;250;buy_it_now;gold_special;True;;MCO3530;Otras categorías
MCO558298881;Tela Antifluido Estampado Para Uniformes, Repelente Al Agua.;12500;500;250;buy_it_now;gold_pro;True;;MCO3530;Otras categorías
MCO567398685;Pipa De Vidrio Negra De Alta Resistencia;15900;1;25;buy_it_now;gold_pro;True;;MCO442272;Otras categorías
MCO561293611;Cups Copas X 50 Unidades Para Tintas De Tatuar;3600;1;50;buy_it_now;gold_pro;True;;MCO412100;Otras categorías
MCO526166441;Cartas De Tarot Los Angeles;78000;1;50;buy_it_now;gold_special;True;;MCO414133;Otras categorías
MCO524650475;Grip Corrector De Escritura Para Niños Set X2 Unidades;15900;250;100;buy_it_now;gold_pro;True;;MCO3530;Otras categorías
MCO465669267;Conos Pequeños, Conos Viales, Señalizadores Viales;3200;250;250;buy_it_now;gold_special;True;;MCO3530;Otras categorías
MCO545909765;Cartas Tarot Seres Fantasticos + Manual De Instrucciones ;29800;1;50;buy_it_now;gold_special;True;;MCO414133;Otras categorías
MCO578216318;Hacks De Super Afiliados + Bonos;4000;1;25;buy_it_now;gold_pro;True;;MCO3530;Otras categorías
MCO473865155;Bacitracina 30 Gr Cicatrizacion Tattoo;18000;1;50;buy_it_now;gold_special;True;;MCO412100;Otras categorías
MCO457312253;Condecoraciones Militares Y De Policía;12500;50;100;buy_it_now;gold_pro;True;;MCO3530;Otras categorías
MCO563153800;Stencil Proton 1.5 Oz Tattoo & Tatuaje Plantilla Transfer;15300;1;25;buy_it_now;gold_pro;True;;MCO412100;Otras categorías
MCO545749327;Salvia Blanca Incienso 125 Grs;13900;1;50;buy_it_now;gold_special;True;;MCO116987;Otras categorías
MCO579490037;Netflix Colombia - Tarjeta De Regalo Netflix $35000;39900;250;5;buy_it_now;gold_special;True;;MCO425038;Otras categorías
MCO568112605;Tarjeta De Regalo Netflix $20.000 - Entrega Inmediata;23899;1;50;buy_it_now;gold_special;True;;MCO425038;Otras categorías
MCO511156979;Kit Tatuaje Tattoo Tatuar  2 Maquinas Dragonhawk;259900;1;25;buy_it_now;gold_special;True;;MCO412100;Otras categorías
MCO564277075;Filtros Tips Hornet De Algodón Para Fumar [3 Display X 50];6000;1;25;buy_it_now;gold_pro;True;;MCO413497;Otras categorías
MCO576132756;Soplete Butano Encendedor Recargable;12990;1;25;buy_it_now;gold_pro;True;;MCO172908;Otras categorías
MCO568998954;Tinta Para Tatuaje Dynamic Black 1onz;40500;1;25;buy_it_now;gold_special;True;;MCO412105;Otras categorías
MCO455579205;Estuche De Disección 9 Piezas, Estuche, Sutura Para Practica;49900;1;50;buy_it_now;gold_special;True;;MCO3530;Otras categorías
MCO571004897;Mecha Para Tejo Blanca Y Roja, Corriente, Campeonato Y Pony;15000;500;25;buy_it_now;gold_pro;True;;MCO3530;Otras categorías
MCO592625053;Cohiba Club 10 Cubanos;56000;1;25;buy_it_now;gold_pro;True;;MCO442266;Otras categorías
MCO565803554;Maquina De Liar O Armador Automático Metálico  #7;14600;1;25;buy_it_now;gold_pro;True;;MCO417903;Otras categorías
MCO565549310;Grinder Rascador Trillador De Lujo 4 Partes;39900;1;25;buy_it_now;gold_pro;True;;MCO413500;Otras categorías
MCO568329935;Caja De Lion Rolling Circus Premiun #9;5400;1;5;buy_it_now;gold_pro;True;;MCO417902;Otras categorías
MCO453784404;Caucho Silicona Moldes Mold 25 Estaño X 250gr  Estampado;27000;1;150;buy_it_now;gold_special;True;;MCO3530;Otras categorías
MCO558719633;Pipa De Vidrio Mediana;17900;1;50;buy_it_now;gold_pro;True;;MCO442272;Otras categorías
MCO525474438;Cartas De Tarot Marsella Fournier;78000;1;50;buy_it_now;gold_special;True;;MCO414133;Otras categorías
MCO582710822;Filtros De Espuma Ocb Organico Slim;12000;1;5;buy_it_now;gold_pro;True;;MCO417902;Otras categorías
MCO594878635;Salvia Blanca Californiana;15800;1;25;buy_it_now;gold_special;True;;MCO387586;Otras categorías
MCO575129485;Cajita De Rolling Papers, Cueros Hornet Celulosos #9;3500;1;5;buy_it_now;gold_pro;True;;MCO417902;Otras categorías
MCO578419202;Tela Anti Fluido Un Solo Fondo ;11000;1;5;buy_it_now;gold_special;True;;MCO3530;Otras categorías
MCO550214426;Combo Original Zippo Combustible 12 Oz + 6 Piedras + Mecha;38990;1;50;buy_it_now;gold_pro;True;;MCO172908;Otras categorías
MCO577241305;Ocb Orgánico #7 X3 Tres Cajas;9900;1;5;buy_it_now;gold_pro;True;;MCO417902;Otras categorías
MCO523542962;Matacucaracha Veneno En Cebo Para Cucarachas Hormigas ;2990;1;50;buy_it_now;gold_special;True;;MCO3530;Otras categorías
MCO455664283;Encendedor Zippo Cromo Cepillado - Cod 200;76500;1;100;buy_it_now;gold_special;True;;MCO172908;Otras categorías
MCO595543484;Kit De Tatuar Profesional Oferta Flash Pocas Unidades;205990;1;5;buy_it_now;gold_special;True;;MCO412110;Otras categorías
MCO538932463;Bengalas De Humo Magia Supervivencia Niebla Pirotecnia;10000;100;50;buy_it_now;gold_special;True;;MCO3530;Otras categorías
MCO459151536;Encendedor Zippo Negro Mate Con Logo  -  Cod 218zl;93500;1;50;buy_it_now;gold_special;True;;MCO172908;Otras categorías
MCO561814211;Papel Hectografico Unidad Kores Para Tatuajes;3890;500;150;buy_it_now;gold_special;True;;MCO412108;Otras categorías
MCO584163295;Kit Para Tatuar Tattoo Tatuaje Profesional;149000;1;5;buy_it_now;gold_special;True;;MCO412110;Otras categorías
MCO473770046;Festón Pasacalle Banderín Plástico Ferias Fiestas 10 Metros;3999;500;200;buy_it_now;gold_pro;True;;MCO3530;Otras categorías
MCO551836654;Agujas Para Tatuar Con Puntera Marca Blackbird ;54000;1;100;buy_it_now;gold_pro;True;;MCO412104;Otras categorías
MCO496295024;Salvia Blanca De California 23cm;40000;1;50;buy_it_now;gold_pro;True;;MCO116987;Otras categorías
MCO454045671;Caucho Silicona Moldes Liquido Mold 15 X 225g Estatuas;39900;1;50;buy_it_now;gold_special;True;;MCO3530;Otras categorías
MCO572197245;5 Paqueticos Filtros De Mallas Para Pipas;5000;1;25;buy_it_now;gold_special;True;;MCO442272;Otras categorías
MCO560507868;Kit De 5 Tintas Para Tatuar, 15ml Media Onza Perpetual;79900;1;25;buy_it_now;gold_special;True;;MCO412105;Otras categorías
MCO578135640;Vetalog;88000;50;5;buy_it_now;gold_special;True;;MCO3530;Otras categorías
MCO587997492;Grinder Moledor Trillador Metal Plateado 4 Piezas;37900;1;5;buy_it_now;gold_pro;True;;MCO413500;Otras categorías
MCO544436244;Vela Sensual Para Masajes Con Feromonas ;22000;1;5;buy_it_now;gold_pro;True;;MCO387587;Otras categorías
MCO572293968;Plasticera Industrial Dura Profesional X 1 Kilo Esculturas;39999;50;5;buy_it_now;gold_special;True;;MCO3530;Otras categorías
MCO562251150;Traje De Moto O Bicicleta Calibre 2 Metalizado Antifluidos.;9900;500;25;buy_it_now;gold_special;True;;MCO413190;Otras categorías
MCO567655378;Cups Para Tinta 100und Tatto Tatuaje ;5925;250;5;buy_it_now;gold_pro;True;;MCO412105;Otras categorías
MCO564535668;Tarjeta Google Play 25 Usd Original Entrega En Minutos;107000;50;5;buy_it_now;gold_special;True;;MCO425038;Otras categorías
MCO569521272;Juego De Reglas Universal Para Modisteria;31000;1;50;buy_it_now;gold_special;True;;MCO3530;Otras categorías
MCO562050148;Papel De Fumar Ocb Premium #9 (1 1/4) 50 Hojas | Pack X 25;38000;250;50;buy_it_now;gold_pro;True;;MCO417902;Otras categorías
MCO579110314;Boquilla Para Narguile Larga Desechable X5 Unidades;4998;150;5;buy_it_now;gold_pro;True;;MCO442266;Otras categorías
MCO470684134;Botella Recordatorios Personalizadas Envase Plastica 12cm;2400;1;500;buy_it_now;gold_special;True;;MCO3530;Otras categorías
MCO574885250;Recarga Directv Prepago $10.000;12250;1;25;buy_it_now;gold_special;True;;MCO425038;Otras categorías
MCO563495642;Pendulo Radiestesia Grande;65000;1;25;buy_it_now;gold_pro;True;;MCO409091;Otras categorías
MCO571253666;Tela Antigatos O Antirasguños Para Tapizar Muebles X 1 Metro;49000;50;25;buy_it_now;gold_pro;True;;MCO3530;Otras categorías
MCO523859199;Tarjeta De Regalo Netflix, $23990. Entrega Inmediata.;24900;50;150;buy_it_now;gold_special;True;;MCO425038;Otras categorías
MCO577171041;Chimo Apureñito (azul) X Docenas  Productor Venezolano;23000;1;5;buy_it_now;gold_pro;True;;MCO442266;Otras categorías
MCO562437586;Chimo Venezolano - Docena - El Apuñerito;22000;50;25;buy_it_now;gold_pro;True;;MCO3530;Otras categorías
