id;title;price;available_quantity;sold_quantity;buying_mode;listing_type_id;accepts_mercadopago;original_price;category_id;category_name
MCO576284057;Tarjeta Regalo Netflix  De $20.000 Entrega Inmediata;23990;1;5;buy_it_now;gold_special;True;;MCO425038;Otras categorías
MCO451775746;Pack 50 Hoja Papel Hectografico Transfer Spirit Tatuajes W01;87649;1;25;buy_it_now;gold_pro;True;;MCO412100;Otras categorías
MCO595828265;Código Netflix 4 Pantallas De $ 20.000;25000;1;5;buy_it_now;gold_special;True;;MCO425038;Otras categorías
MCO451999486;Alcancia Cerdo  Signo Pesos Personalizadas Regalo;3200;1;150;buy_it_now;gold_special;True;;MCO3530;Otras categorías
MCO582717170;Mini Bong En Vidrio Estampado;10900;1;5;buy_it_now;gold_pro;True;;MCO417908;Otras categorías
MCO575097457;Grinder Trillador Esfera Del Dragon - Pokebola - Darth Vader;18999;1;5;buy_it_now;gold_special;True;;MCO412100;Otras categorías
MCO572752778;Curso Hacer Embutidos Chorizo Salchicha Mortadela + Bonos;5400;1;25;buy_it_now;gold_pro;True;;MCO3530;Otras categorías
MCO573002544;Caja De Carbones Para Narguile O Hookah X80unds;22900;1;50;buy_it_now;gold_pro;True;;MCO431853;Otras categorías
MCO541290689;Pipa Metal Caucho Surtido;8800;1;50;buy_it_now;gold_pro;True;;MCO442272;Otras categorías
MCO581694183; Satisfyer Pro 2: Proxima Generación  - Nueva Presentación ;216900;1;5;buy_it_now;gold_special;True;;MCO3530;Otras categorías
MCO573340184;Ocb Organico #9 Papel De Fumar;2980;1;25;buy_it_now;gold_pro;True;;MCO417902;Otras categorías
MCO582747866;Filtros De Espuma Ocb Slim;10500;1;5;buy_it_now;gold_pro;True;;MCO417903;Otras categorías
MCO586721635;Maestro Del Orgasmo;12900;1;25;buy_it_now;gold_pro;True;;MCO3530;Otras categorías
MCO578727765;Tarot De Marselle (esoterico) - 78 Cartas;34900;1;5;buy_it_now;gold_special;True;;MCO414133;Otras categorías
MCO565567975;Tarot Libro Osho Zen ;168000;1;5;buy_it_now;gold_special;True;;MCO414133;Otras categorías
MCO571506795;Pipa Bate Para Fumar En Forma De Bujía | Pipa Discreta;9800;1;5;buy_it_now;gold_pro;True;;MCO442272;Otras categorías
MCO573017326;Pata Elefante;3000;1;5;buy_it_now;gold_special;True;;MCO3530;Otras categorías
MCO451956188;Nag Champa Incienso Original De La India Por Unidad;15000;50;200;buy_it_now;gold_pro;True;;MCO116987;Otras categorías
MCO573058638;Tarjeta Pin Netflix - $20.000;29950;250;50;buy_it_now;gold_special;True;;MCO425038;Otras categorías
MCO451588209;2 Anillos Silicona Magnéticos Adelgazar Originales;6900;1;50;buy_it_now;gold_special;True;;MCO3530;Otras categorías
MCO578223105;Encendedor Mini Soplete Metalizado Recargable Gas Butan;19500;250;5;buy_it_now;gold_pro;True;;MCO172908;Otras categorías
MCO549758261;Grinder Trillador Esfera Del Dragon - Pokebola - Darth Vader;19900;1;50;buy_it_now;gold_special;True;;MCO412100;Otras categorías
MCO451769998;Sujetador De Sabanas;7999;500;50;buy_it_now;gold_pro;True;;MCO3530;Otras categorías
MCO564317317;Tarjeta Itunes Apps Store 25 Usd Original Entrega Inmediata;112500;50;5;buy_it_now;gold_special;True;;MCO425038;Otras categorías
MCO529790595;5 Cajas De Incienso En Varitas X 8 Unidades Marca Hem;8000;1;150;buy_it_now;gold_special;True;;MCO116987;Otras categorías
MCO591701609;Targeta De Regalo Spotify 2 Meses Región Colombia;5900;1;50;buy_it_now;gold_pro;True;;MCO425038;Otras categorías
MCO473444760;Fibra De Vidrio Woven Roving Resina Poliester X 500gr Yates ;9000;1;25;buy_it_now;gold_special;True;;MCO3530;Otras categorías
MCO558057138;Maquina De Liar Ocb Metálica Regular #7;12000;1;25;buy_it_now;gold_special;True;;MCO417903;Otras categorías
MCO494037729;Stencil Stuff 4oz Original Garantizado!!!;40000;1;25;buy_it_now;gold_pro;True;;MCO412100;Otras categorías
MCO452267940;Soporte Adaptador De Celular Para Tripode / Monopods;16990;1;50;buy_it_now;gold_special;True;;MCO3530;Otras categorías
MCO579431532;Incienso Litúrgico Libra + Caja De Carbon;55500;1;5;buy_it_now;gold_pro;True;;MCO116987;Otras categorías
MCO563530801;6 Cajas De Incienso En Varitas X 8uni + Tabla Portaincienso ;11900;500;50;buy_it_now;gold_pro;True;;MCO116987;Otras categorías
MCO452842769;Bolsas+barreras Colostomia Convatec70-57-45 Entregainmediata;27000;1;250;buy_it_now;gold_pro;True;;MCO3530;Otras categorías
MCO574205096;Pipa De Silicona Con Boquilla En Vidrio;24900;1;5;buy_it_now;gold_pro;True;;MCO442272;Otras categorías
MCO572210995;Raw Classic #9 Cuero Para Armar [1 1/4] Papel De Fumar;4900;1;5;buy_it_now;gold_pro;True;;MCO417902;Otras categorías
MCO492151094;Burbujeros Boda Matrimonios Recordatorio Años-fiestas Pompa ;1500;50;500;buy_it_now;gold_pro;True;;MCO3530;Otras categorías
MCO563623468;Pipa De Vidrio, Hitter De Colores;7900;50;25;buy_it_now;gold_pro;True;;MCO442272;Otras categorías
MCO471644547;Papel Hectografico Kores Plantilla De Tatuar X 1 Hoj Tatuaje;2499;1;100;buy_it_now;gold_special;True;;MCO412100;Otras categorías
MCO459872458;Bolsa Organza Recordatorio Regalo 100 Unidades Fiesta Boda;44000;500;50;buy_it_now;gold_special;True;;MCO3530;Otras categorías
MCO582646999;Clorito Activado + 3000ppm 520ml;70000;50;5;buy_it_now;gold_pro;True;;MCO3530;Otras categorías
MCO570448607;Tarjeta Google Play 100 Usd Original Entrega En Minutos;410000;50;5;buy_it_now;gold_special;True;;MCO425038;Otras categorías
MCO481204195;Pilas Varta Super Aaa;4000;500;25;buy_it_now;gold_special;True;;MCO3530;Otras categorías
MCO569716828;Tabla Portaincienso De Madera - 26cm;2900;1;5;buy_it_now;gold_special;True;;MCO116987;Otras categorías
MCO590731515;Pipa Clásica De Polímero Resistente Para Fumar;1900;1;5;buy_it_now;gold_pro;True;;MCO442272;Otras categorías
MCO557850869;Combo De 5 Cajitas De Rolling Papers, Cueros Ocb Virgin #7;12500;1;5;buy_it_now;gold_special;True;;MCO417902;Otras categorías
MCO479513573;10 Parches Para La Curación Del Tatuaje Dermalize;31900;1;50;buy_it_now;gold_pro;True;;MCO412100;Otras categorías
MCO559660843;Sacramentales - Incluye: Agua, Sal Y Aceite;12000;1;5;buy_it_now;gold_special;True;;MCO116987;Otras categorías
MCO568843074;Animalitos Amigurumis Mas De 120 Patrones En Español;25000;250;25;buy_it_now;gold_pro;True;;MCO3530;Otras categorías
MCO563238438;Stencil Proton 4.3oz Para Tatuar;32900;1;5;buy_it_now;gold_pro;True;;MCO412100;Otras categorías
MCO564536505;Tarjeta Google Play 20 Usd Original Entrega En Minutos;87000;1;5;buy_it_now;gold_special;True;;MCO425038;Otras categorías
MCO513152137;Cinta Cohesiva Coban ;7000;1;50;buy_it_now;gold_special;True;;MCO412100;Otras categorías
MCO558049494;Tela Lino Flex 1.50 Cm De Ancho Unicolor X Metros.;8000;500;100;buy_it_now;gold_special;True;;MCO3530;Otras categorías
MCO526172259;Carta De Tarot Alchemy Fournier;78000;1;25;buy_it_now;gold_special;True;;MCO414133;Otras categorías
MCO562875611;Incienso 7 Arcangeles  Varitas Div - Unidad A $32;9900;1;50;buy_it_now;gold_pro;True;;MCO387586;Otras categorías
MCO451951197;Caucho Silicona Liquida Transparente Moldes Alimentos X250g;54000;1;25;buy_it_now;gold_special;True;;MCO3530;Otras categorías
MCO565561108;Cajas Meltan Pokemon Go;3500;50;25;buy_it_now;gold_pro;True;;MCO3530;Otras categorías
MCO567452717;Dynamic Negro Black 8oz Para Tatuar Tinta Tatuaje Pigmento ;133900;1;5;buy_it_now;gold_special;True;;MCO412100;Otras categorías
MCO574130030;Curso Completo Hacer Embutidos Jamón Salchicha Mortadela;4666;1;25;buy_it_now;gold_pro;True;;MCO3530;Otras categorías
MCO558079580;Esquineros Para Fijar Fotos (pack X 150) Al  Estilo Antigüo;7000;500;50;buy_it_now;gold_special;True;;MCO3530;Otras categorías
MCO453473634;Cordus 12 Cuotas 0% Envío Gratuito A Todo Colombia;335000;1;500;buy_it_now;gold_pro;True;;MCO3530;Otras categorías
MCO453009206;Canguros Infantiles Fiesta Arlequin Piñateria Hora Loca;5500;5000;50;buy_it_now;gold_special;True;;MCO3530;Otras categorías
MCO537605119;Gas Butano David Ross Extrapuro, Recargar, Flameador  90 Ml;17900;150;25;buy_it_now;gold_pro;True;;MCO172908;Otras categorías
MCO574153554;Tarjetas De Regalo Pin Virtual De Netflix - Saldo $20.000;26000;1;5;buy_it_now;gold_pro;True;;MCO425038;Otras categorías
MCO561260237; Combustible Zippo  Butano Premiun Para Encendedores Zipo;24200;1;5;buy_it_now;gold_pro;True;;MCO172908;Otras categorías
MCO597577775;Original D-isney Plus / 1 Mes ;15000;1;5;buy_it_now;gold_pro;True;;MCO425038;Otras categorías
MCO566407730;Escapularios De La Virgen Del Carmen En Paño;3000;150;25;buy_it_now;gold_pro;True;;MCO116987;Otras categorías
MCO452378397;Caja De Agujas Tatuar X 50 Unds Mas Sus Punteras Tattoo R5;44900;1;50;buy_it_now;gold_special;True;;MCO412106;Otras categorías
MCO576850040;Caja De Rolling Paper Ocb Premium Flat #7 X 300 Papelitos;10000;1;5;buy_it_now;gold_pro;True;;MCO417902;Otras categorías
MCO558608669;Seminarios Online - Mauricio Duque;29900;500;25;buy_it_now;gold_pro;True;;MCO3530;Otras categorías
MCO589093552;Tarot De Osho Zen ( 78 Cartas Y Un Manual) Nuevo/ Original;55000;1;5;buy_it_now;gold_special;True;;MCO414133;Otras categorías
MCO462311677;Venda Triangular En Tela Bomlam Calibre 70;3000;250;25;buy_it_now;gold_pro;True;;MCO3530;Otras categorías
MCO542292366;Tiquete Para Turnos Rolllo X 3000 Tiquetes ;30000;1;50;buy_it_now;gold_pro;True;;MCO3530;Otras categorías
MCO453821819;Canguro Infantil Escuadron Canino Fiesta Arlequin Piñateria;5500;5000;100;buy_it_now;gold_special;True;;MCO3530;Otras categorías
MCO464582715;Manillas De Silicona Sin Marcacion;1200;500;500;buy_it_now;gold_pro;True;;MCO3530;Otras categorías
MCO558601702;Supercerebro Jim Kwik Completo Original;19000;50;25;buy_it_now;gold_pro;True;;MCO3530;Otras categorías
MCO581728770;Salvia Blanca Californiana;18000;1;5;buy_it_now;gold_pro;True;;MCO387586;Otras categorías
MCO458837012;Amasadora De Pan 20l;2937000;1;25;buy_it_now;gold_special;True;;MCO3530;Otras categorías
MCO568025973;Kit Cuarzos 7 Chakras.vídeo/ Instructivo Armoniza Tu Energía;25000;1;25;buy_it_now;gold_pro;True;;MCO442293;Otras categorías
MCO566452824;Papel Para Armar + Armador Plástico + Filtros Tips -combo #9;12900;1;5;buy_it_now;gold_pro;True;;MCO413497;Otras categorías
MCO573064343;Grinder Contenedor Grande | Rascador De Hierba | Airtainer;14900;1;5;buy_it_now;gold_pro;True;;MCO413500;Otras categorías
MCO532584775;Vela Cumpleaños- Fiesta - Regalo Flor Giratoria;4800;250;5;buy_it_now;gold_pro;True;;MCO387587;Otras categorías
MCO544343915;Kit Tatuaje Maquina Rotativa Fuente Pedal Accesorios Agujas;179000;100;25;buy_it_now;gold_special;True;;MCO412100;Otras categorías
MCO576604537;Hacks Super Afiliados - Estrategias Reveladas Erick R.;12850;500;25;buy_it_now;gold_pro;True;;MCO3530;Otras categorías
MCO579146921;Soporte Pollo Acero Inox  Cilindro Peruano, Horno, Ahumador;30000;500;5;buy_it_now;gold_pro;True;;MCO3530;Otras categorías
MCO567652116;Cups Para Tinta 1000 Und Tatto Tatuajes ;38900;250;5;buy_it_now;gold_special;True;;MCO412105;Otras categorías
MCO576848165;Combo De 5 Cajitas De Rolling Papers Cueros Ocb Organico #7;12500;1;5;buy_it_now;gold_pro;True;;MCO417902;Otras categorías
MCO579908551;Discord Nitro Classic Gift 1 Mes;26990;250;5;buy_it_now;gold_special;True;;MCO425038;Otras categorías
MCO565453039;Grinder Rascador Trillador Tambor Metal Recolector;14900;50;25;buy_it_now;gold_pro;True;;MCO413500;Otras categorías
MCO562862484;Maquina Para Tatuar Tattoo Tatuaje;59900;50;25;buy_it_now;gold_special;True;;MCO417336;Otras categorías
MCO458153490;Hidrorretenedor Para Cultivos;30000;5000;50;buy_it_now;gold_pro;True;;MCO3530;Otras categorías
MCO542169901;Silla Plástica Sin Brazos, Especiales Toda Clase De Eventos.;19999;50;5;buy_it_now;gold_pro;True;;MCO3530;Otras categorías
MCO446212537;Encendedor Plasma Eléctrico Recargable Doble Arco + Envio;50000;1;50;buy_it_now;gold_pro;True;;MCO172908;Otras categorías
MCO551836996;Papel Hectografico 100 Hojas ;140000;1;5;buy_it_now;gold_pro;True;;MCO412108;Otras categorías
MCO564909281;Gas Butano 300ml Recarga Sopletes Y Clippers;17900;1;5;buy_it_now;gold_pro;True;;MCO172908;Otras categorías
MCO581466266;Tela Fleece Ovejero X Metros 1.50 De Ancho;9000;500;5;buy_it_now;gold_pro;True;;MCO3530;Otras categorías
MCO561275801;Porta Incienso En Madera;4000;1;25;buy_it_now;gold_pro;True;;MCO413742;Otras categorías
MCO577243070;Grinder Trillador O Rascador Sphero Star Wars;34900;1;5;buy_it_now;gold_pro;True;;MCO413500;Otras categorías
MCO579363726;Medidor De Suelos Hidroponia Ph Sensor De Humedad Para Suelo;38000;1;5;buy_it_now;gold_pro;True;;MCO3530;Otras categorías
MCO559348302;Inserto Encendedor Zippo Butano Llama Sencilla Cod 65826;67300;1;25;buy_it_now;gold_special;True;;MCO172908;Otras categorías
MCO557790801;Pipa De Vidrio Alta Resistencia;17900;1;5;buy_it_now;gold_pro;True;;MCO442272;Otras categorías
MCO563404781;Incienso 6 Cajas De Incienso En Varitas X 8 ;7900;5000;50;buy_it_now;gold_pro;True;;MCO387586;Otras categorías
MCO566012269;Combo Narguile Doble Mangueras Con Carbon Y Picadura ;55000;1;5;buy_it_now;gold_special;True;;MCO442271;Otras categorías
MCO454045681;Caucho Silicona Liquido Uretano 60 X450g Concreto Piedra;59000;1;50;buy_it_now;gold_special;True;;MCO3530;Otras categorías
MCO578956086;Kit Pen Maquina Tatuaje Profesional Dragon Hawk;409900;1;5;buy_it_now;gold_special;True;;MCO412100;Otras categorías
MCO565179525;Filtros Para Cigarrillo David Ross: Por Banimported.;7000;50;5;buy_it_now;gold_pro;True;;MCO413497;Otras categorías
MCO463596528;Pipa De Madera Funcional Decorativa O Coleccionable Medellin;33990;1;25;buy_it_now;gold_special;True;;MCO442272;Otras categorías
MCO577815926;Vela Esperma Velita Lampara Pebetero Decorativa Veladora X3;1290;1;5;buy_it_now;gold_special;True;;MCO387587;Otras categorías
MCO561394710;Caja Hornet Papel Blanco  #12 X 32 Papelillos;3000;1;5;buy_it_now;gold_pro;True;;MCO417902;Otras categorías
MCO565964891;Set De Bowls Recipientes En Acero Inoxidable Para Cocina;53900;1;5;buy_it_now;gold_special;True;;MCO116987;Otras categorías
MCO469698445;Kit Tatuaje Tattoo Tatuar Profesional 2 Maquina;359900;1;25;buy_it_now;gold_special;True;;MCO412100;Otras categorías
MCO563414094;Giftcard Tarjeta Regalo Compras Mcktoys Varios Productos;5000;50;25;buy_it_now;gold_special;True;;MCO425038;Otras categorías
MCO577397868;5 Hojas De Papel Hectografico Para Tatuar;12500;1;5;buy_it_now;gold_pro;True;;MCO412108;Otras categorías
MCO569193633;Dynamic Pigmento Tatuar Tattoo 8oz Etiqueta Original;134500;1;5;buy_it_now;gold_special;True;;MCO412105;Otras categorías
MCO570820190;Clip Labial Para Localizador Apical De Endodoncia;12000;50;5;buy_it_now;gold_special;True;;MCO3530;Otras categorías
MCO453631806;Lluvia Cosmica 50 Barras Neon 20 Cm Hora Loca Fiesta Manilla;9990;1;150;buy_it_now;gold_special;True;;MCO3530;Otras categorías
MCO454844131;236 Encendedor Zippo Negro Craquelado;76500;1;5;buy_it_now;gold_special;True;;MCO172908;Otras categorías
MCO539376203;Ea Access Xbox One 1 Mes Codigo Original Envio En Minutos;27900;500;25;buy_it_now;gold_special;True;;MCO425038;Otras categorías
MCO444998153;Piedras Encendedores De Chispa David Ross. Envía Banimported;6700;50;25;buy_it_now;gold_pro;True;;MCO172908;Otras categorías
MCO558946495;Bong Vidrio + Boquilla + Limpiador;27900;1;5;buy_it_now;gold_pro;True;;MCO417908;Otras categorías
MCO513680369;Pote De Crema Ayd 300grm Para Tatuajes;29500;1;25;buy_it_now;gold_special;True;;MCO412113;Otras categorías
MCO575206794;Cortina Para Decoracion Tornasol ;8000;1;5;buy_it_now;gold_special;True;;MCO3530;Otras categorías
MCO456209204;Falda Hawaiana Para Fiestas Temáticas 40 Cm Fiesta Arlequin;8000;500;100;buy_it_now;gold_pro;True;;MCO3530;Otras categorías
MCO563238676;Vaselina Blanca 1 Libra Para Tatuar;9300;1;5;buy_it_now;gold_pro;True;;MCO412113;Otras categorías
MCO575050680;Dermalize Dermaplus Parche Curación Tattoo Tatuaje;24990;1;5;buy_it_now;gold_pro;True;;MCO412100;Otras categorías
MCO555357672;Hojas De Almendra Para Acuarios;5000;100;25;buy_it_now;gold_special;True;;MCO3530;Otras categorías
MCO557189845;Chimo Apureñito (azul) Productor Venezolano;4000;1;5;buy_it_now;gold_pro;True;;MCO442266;Otras categorías
MCO554730070;Bacitram Crema Tattoo Tatuaje;15990;1;5;buy_it_now;gold_pro;True;;MCO412113;Otras categorías
MCO520802373;Recolectores De Cortopunzantes Soportes Redondos   ;12500;50;25;buy_it_now;gold_pro;True;;MCO3530;Otras categorías
MCO560936679;Caja De Bluntwrap X25 Paquetes;54900;1;5;buy_it_now;gold_pro;True;;MCO417902;Otras categorías
MCO567754245;Caja De Agujas Para Tatto Con Punteras X 25 Unidades;27000;50;5;buy_it_now;gold_pro;True;;MCO412106;Otras categorías
MCO571196275;Hoja Polarizadora Lineal Filtro Optico Media Carta Para Luz;106200;1;5;buy_it_now;gold_special;True;;MCO412100;Otras categorías
MCO577410081;Kit De Tatuaje Tutuar Maquina Pen Tattoo Dragonhawk;469900;1;5;buy_it_now;gold_special;True;;MCO412100;Otras categorías
MCO577893585;Cortador De Puros, Habano, Tabaco === En Acero Inoxidable===;54900;1;5;buy_it_now;gold_special;True;;MCO417008;Otras categorías
MCO545873713;Gel Stencil Para Plantilla Tatuaje 1,5 Onz;15300;1;25;buy_it_now;gold_special;True;;MCO412108;Otras categorías
MCO558852557;Grinder Rascador Armador Tambor Metal Recolector;24900;1;5;buy_it_now;gold_pro;True;;MCO413500;Otras categorías
MCO562499778;Combo De 5 Cajitas De Rolling Papers Cueros De Sabores #9;10000;1;25;buy_it_now;gold_pro;True;;MCO417902;Otras categorías
MCO580893668;Veneno Para Hormigas;15000;1;5;buy_it_now;gold_special;True;;MCO3530;Otras categorías
MCO582364151;Copal Resina Incienso Natural;25900;1;5;buy_it_now;gold_pro;True;;MCO387586;Otras categorías
MCO512284022;Palo Santo,  Sahumerio  Limpiar Energias;20000;1;100;buy_it_now;gold_pro;True;;MCO387586;Otras categorías
MCO483797553;Encendedor Eléctrico Recargable Usb Metálico iPhone Rf 410;33990;50;5;buy_it_now;gold_pro;True;;MCO172908;Otras categorías
MCO474985199;Caucho Silicona Moldes Liquido Brochable 25 X 225g Estatuas;39000;1;5;buy_it_now;gold_special;True;;MCO3530;Otras categorías
MCO580823260;Papel Hectografico X5 Kores Rollo Para Tatuar;18500;50;5;buy_it_now;gold_special;True;;MCO412108;Otras categorías
MCO578230894;Pendulo En Bronce - Radiestesia;45000;1;5;buy_it_now;gold_pro;True;;MCO409091;Otras categorías
MCO584951531;Crema A&d Sobre Cuidado De Tatuajes;3500;50;5;buy_it_now;gold_pro;True;;MCO412113;Otras categorías
MCO570448705;Tarjeta Itunes Apple Store 20 Usd Entrega Inmediata;89000;1;5;buy_it_now;gold_special;True;;MCO425038;Otras categorías
MCO566184642;Rape Tabaco Medicina Indígena Cofan + Aplicador;48000;1;5;buy_it_now;gold_special;True;;MCO387586;Otras categorías
MCO454377480;Elevador Sanitario+ Agarradera Pos Operatorio Cirugía Cadera;164900;1;5;buy_it_now;gold_special;True;;MCO3530;Otras categorías
MCO563242106;Maquina De Liar Automatica Ocb 1 1/4;35000;1;5;buy_it_now;gold_special;True;;MCO417903;Otras categorías
MCO576284139;Tarjeta Regalo Netflix  De $30.000 Entrega Inmediata;35290;1;5;buy_it_now;gold_special;True;;MCO425038;Otras categorías
MCO561992726;Amonio Cuaternario 5ta Generación X Galón ;45900;1;25;buy_it_now;gold_pro;True;;MCO3530;Otras categorías
MCO572628327;Grinder Moledor Trillador Metal Grande Traslucido 4 Piezas;37900;1;5;buy_it_now;gold_pro;True;;MCO413500;Otras categorías
MCO509876031;Campos Esteriles X 50 Unds ;20000;1;25;buy_it_now;gold_special;True;;MCO412100;Otras categorías
MCO563932977;Incienso Chandan Tipo Exportación Cajita X Varias Varitas;15000;1;5;buy_it_now;gold_pro;True;;MCO116987;Otras categorías
MCO571876712;Dualidad Jeffrey Allen Completo Original;19000;50;5;buy_it_now;gold_pro;True;;MCO3530;Otras categorías
MCO561238332;Caja Mantra Sabor  X50 Papelillos;6900;1;25;buy_it_now;gold_pro;True;;MCO417902;Otras categorías
MCO499126044;Alcancia Signo Pesos Personalizada Publicitaria Regalo ;4200;1;25;buy_it_now;gold_pro;True;;MCO3530;Otras categorías
MCO523723979;Burbujeros Bodas Matrimonios Recordatorio Años-fiestas Pompa;1500;250;50;buy_it_now;gold_pro;True;;MCO3530;Otras categorías
MCO575382020;Itunes Tarjeta De Regalo Appstore 5$ Usd Envio En Minutos.;28800;50;5;buy_it_now;gold_pro;True;;MCO425038;Otras categorías
MCO473764538;Accesorios Hora Loca Cotillón Sombreros + 3000 Artículos;1000;500;50;buy_it_now;gold_pro;True;;MCO3530;Otras categorías
MCO580278233;Incienso Ananda Sai Darshan X Caja Individual;7490;1;5;buy_it_now;gold_pro;True;;MCO116987;Otras categorías
MCO593080308;Encendedor Recargable Usb Eléctrico Táctil Sin Llama De Lujo;18900;50;5;buy_it_now;gold_pro;True;;MCO172908;Otras categorías
MCO491524576;Puntas Para Filtro De Cigarrillos 8 Mm. 100/unid David Ross ;7000;500;100;buy_it_now;gold_pro;True;;MCO3530;Otras categorías
MCO563237691;Incienso Nag Champa Caja X 12;110000;1;25;buy_it_now;gold_special;True;;MCO116987;Otras categorías
MCO563933124;Incienso Rose Tipo Exportación Cajita X Varias Varitas;15000;1;5;buy_it_now;gold_pro;True;;MCO116987;Otras categorías
MCO560477226;Incienso Original Indu Sac X 25 Cajitas;25000;1;5;buy_it_now;gold_pro;True;;MCO387586;Otras categorías
MCO563587359;Producto Veterinario Limpia Ganado Garrapatas Para El Campo;55000;1;5;buy_it_now;gold_special;True;;MCO3530;Otras categorías
MCO483666257;Fuente Hurricane Hp2 Para Tatuar Tattoo + Envio Gratis;239990;1;25;buy_it_now;gold_special;True;;MCO412100;Otras categorías
MCO447206771;Péndulos Y Varillas Para  Guacas ,radiestesia, Sanación;75000;1;500;buy_it_now;gold_pro;True;;MCO116987;Otras categorías
MCO564945998;Algodón Siliconado Para Relleno Multiusos Bolsa De 1 Kilo .;12000;250;50;buy_it_now;gold_special;True;;MCO3530;Otras categorías
MCO535763901;Falda Hawaiana Para Fiestas Temáticas 40cm Fiesta Arlequin 3;8000;500;5;buy_it_now;gold_pro;True;;MCO3530;Otras categorías
MCO582593813;Mini Pipa Giratoria  Twisty Glass Blunt + Cepillo;22900;1;5;buy_it_now;gold_pro;True;;MCO442272;Otras categorías
MCO561801918;Caja De Hornet Sabor #9  X50 Papelillos ;2500;1;5;buy_it_now;gold_pro;True;;MCO417902;Otras categorías
MCO575637636;Curso Hacer Embutidos Chorizo Salchicha Mortadela + Bonos;3800;1;5;buy_it_now;gold_pro;True;;MCO3530;Otras categorías
MCO591440032;Tarot De Marseille - Jodorowsky   ;174000;1;5;buy_it_now;gold_special;True;;MCO414133;Otras categorías
MCO478919235;Agujas Para Tatuaje 3rl Tipo Cartuchos X20 Ez Revolution;88000;1;25;buy_it_now;gold_special;True;;MCO412100;Otras categorías
MCO572999874;Angel De La Guarda Madera Para Niño/nniña ;4000;250;50;buy_it_now;gold_pro;True;;MCO3530;Otras categorías
MCO558558130;Cenicero En Vidrio Redondo ;12900;1;5;buy_it_now;gold_pro;True;;MCO442277;Otras categorías
MCO583811054;Repuesto Zippo 7 Piedras Y 1 Mecha;10900;1;5;buy_it_now;gold_pro;True;;MCO172908;Otras categorías
MCO576402677;Grinder Rascador Trillado Darth Vader Star Wars;34900;1;5;buy_it_now;gold_pro;True;;MCO413500;Otras categorías
MCO518080860;Recolector De Cortopunzantes Dee 1.0 Litro;2990;50;5;buy_it_now;gold_pro;True;;MCO3530;Otras categorías
MCO537589065;Caja De Agujas Para Tatuar X 50 Uds Con Sus Punteras Tattoo;58000;1;50;buy_it_now;gold_special;True;;MCO412106;Otras categorías
MCO574733285;Yeso Piedra Tipo Iii  Para Usos Varios;6199;1;5;buy_it_now;gold_special;True;;MCO3530;Otras categorías
MCO536522725;Tarot Egipcio - 78 Cartas;55000;1;50;buy_it_now;gold_pro;True;;MCO414133;Otras categorías
MCO593200572;Curso Completo De Carpinteria Y Ebanisteria;25000;50;5;buy_it_now;gold_pro;True;;MCO3530;Otras categorías
MCO586591823;Puffbar Plus 800 Puffs;35000;100;5;buy_it_now;gold_pro;True;;MCO442272;Otras categorías
MCO563932394;Incienso Ganesh Fluxo Tipo Exportación Cajita X 9;13000;1;5;buy_it_now;gold_pro;True;;MCO116987;Otras categorías
MCO446662201;Recordatorio Bautizo Primera Comunión Hostias En Chocolate;2500;1;25;buy_it_now;gold_pro;True;;MCO3530;Otras categorías
MCO502186111;Rodillo Entintador Monarch 1110;10000;1;25;buy_it_now;gold_pro;True;;MCO3530;Otras categorías
MCO458368289;50 Agujas Para Microblanding 7,12 ,14 Y 18 U Precio C/u 1500;60000;500;25;buy_it_now;gold_special;True;;MCO412100;Otras categorías
MCO579667904;Mallas Metálicas Filtros 5 Und;1400;1;5;buy_it_now;gold_special;True;;MCO442266;Otras categorías
MCO569409987;Tinta Para Tatuar, Pigmento Negro Perpetual;29900;1;5;buy_it_now;gold_special;True;;MCO412105;Otras categorías
MCO544795093;Amazon Giftcard Tarjeta Regalo 20 Dolar Usd Envioinstantaneo;99990;1;5;buy_it_now;gold_special;True;;MCO3530;Otras categorías
MCO535934227;Escapulario En Acero Dorado De La Virgen Del Carmen;28000;1;25;buy_it_now;gold_pro;True;;MCO116987;Otras categorías
MCO579490699;Netflix Colombia - Tarjeta De Regalo Netflix $50000;60900;50;5;buy_it_now;gold_special;True;;MCO425038;Otras categorías
MCO571967053;Cuarzos - Pendulo;10000;500;5;buy_it_now;gold_special;True;;MCO409091;Otras categorías
MCO524252723;Encendedor Electrico Usb;10000;500;50;buy_it_now;gold_pro;True;;MCO172908;Otras categorías
MCO583010370;Soplete Una Llama Aomai;29900;1;5;buy_it_now;gold_pro;True;;MCO172908;Otras categorías
MCO455599811;Pulcera Tarro Manilla Neón X50 Piñateria Fiesta Hora Loca 2;10000;500;50;buy_it_now;gold_pro;True;;MCO3530;Otras categorías
MCO457826490;Fluido Combustible Gasolina Zippo 4 Oz Original;12990;1;100;buy_it_now;gold_pro;True;;MCO172908;Otras categorías
MCO513641487;Torre Old Tattoo Mini X 25unds /2gr Cicatrizante Tatuaje;29900;1;25;buy_it_now;gold_special;True;;MCO412100;Otras categorías
MCO476746352;Crema Para Tatuaje Old Tattoo;13900;1;25;buy_it_now;gold_pro;True;;MCO412113;Otras categorías
MCO487093281;Resina Poliester Pre-acelerada X250gr Fibra De Vidrio Bomper;6000;1;5;buy_it_now;gold_special;True;;MCO3530;Otras categorías
MCO571283264;Papel De Fumar Ocb Premium Slim King Size 32 Hojas X 3 Cajas;9900;1;5;buy_it_now;gold_pro;True;;MCO417902;Otras categorías
MCO452910997;Caps Para Tatuar  X 100 Unds Tattoo Caps Tatuaje;12000;500;150;buy_it_now;gold_special;True;;MCO412100;Otras categorías
