id;title;price;available_quantity;sold_quantity;buying_mode;listing_type_id;accepts_mercadopago;original_price;category_id;category_name
MCO576607226;Bong Pipa De Agua Mini Narguila;9000;1;5;buy_it_now;gold_special;True;;MCO417908;Otras categorías
MCO560504540;Combo De 5 Cajitas De Rolling Papers Cueros Smoking Maiz #9;17500;1;5;buy_it_now;gold_special;True;;MCO417902;Otras categorías
MCO561690434;Encendedor Zippo Gris Polvo- Cod 28378;99900;1;5;buy_it_now;gold_special;True;;MCO172908;Otras categorías
MCO455605700;Totumas Para Fiestas;18000;500;25;buy_it_now;gold_special;True;;MCO3530;Otras categorías
MCO590386051;Oferta 4 Pantalla Ultra Hd ( 4 Dispositivo ) 1 Mes;29500;1;5;buy_it_now;gold_special;True;;MCO425038;Otras categorías
MCO585099403;Grip De Aluminio Para Maquina De Tattoo X1;15000;1;5;buy_it_now;gold_pro;True;;MCO412100;Otras categorías
MCO581341395;Blunt Hemp Zone 2xl;52900;50;5;buy_it_now;gold_pro;True;;MCO417902;Otras categorías
MCO562807312;Tela Chalis Rayon Estampado X Metros 1.50 Mts De Ancho .;15000;250;25;buy_it_now;gold_special;True;;MCO3530;Otras categorías
MCO559802651;Adaptadores Lápiz Escritura X3 Uni Ayuda A Niños ;35000;1;5;buy_it_now;gold_special;True;;MCO3530;Otras categorías
MCO564377370;Pipa Bate Bala Estampado;7900;1;5;buy_it_now;gold_pro;True;;MCO442272;Otras categorías
MCO452424795;Dynamic 8 Oz Pigmento Negro Para Tatuaje, Alta Calidad;145000;50;5;buy_it_now;gold_special;True;;MCO412100;Otras categorías
MCO571807568;Bong Pipa De Agua Botella De Gaseosa;18000;1;5;buy_it_now;gold_pro;True;;MCO417908;Otras categorías
MCO581707604;Ese Interne Securit 1pc;30000;50;5;buy_it_now;gold_pro;True;;MCO3530;Otras categorías
MCO593538037;Cuenco Tibetano Nepal;269000;1;4;buy_it_now;gold_pro;True;;MCO409153;Otras categorías
MCO573032562;Cerámica Cabeza Narguile Repuesto;10900;1;5;buy_it_now;gold_pro;True;;MCO442266;Otras categorías
MCO569259245;Maquina De Liar (maquina Para Armar) Acrílica [king Size];10000;1;5;buy_it_now;gold_pro;True;;MCO417903;Otras categorías
MCO550617080;Super Pack De 18 Archivos Y Practicas De Hidroponia;9000;1;5;buy_it_now;gold_special;True;;MCO3530;Otras categorías
MCO557024273;Vitamina A Y D Dinarex 4oz 113gr ;28000;1;5;buy_it_now;gold_pro;True;;MCO412113;Otras categorías
MCO564547100;Pipa Bate Metal Chupo De Caucho Estampado;9000;1;5;buy_it_now;gold_pro;True;;MCO442272;Otras categorías
MCO560122719;Toallas Desinfectantes Eliminadoras De Bacterias  Familia ;9990;1;5;buy_it_now;gold_special;True;;MCO3530;Otras categorías
MCO454699756;Cups Deposito De Tinta De Tatuar X 50 Und Tattoo & Tatuaje;7000;1;50;buy_it_now;gold_special;True;;MCO412100;Otras categorías
MCO582614162;Grinder Rascador Trilladora 3 Pisos De Madera ;15000;1;5;buy_it_now;gold_pro;True;;MCO417903;Otras categorías
MCO564646696;Campos Estériles Euronda Monoart® Towel Up! Zona Segura;25000;1;5;buy_it_now;gold_special;True;;MCO412100;Otras categorías
MCO538650607;Novena De La Virgen Del Carmen Con Escapulario;7500;1;5;buy_it_now;gold_pro;True;;MCO116987;Otras categorías
MCO562862189;Karaoke 2020 Profesional 7700 Canciones - Usb O Digital.;18000;1;5;buy_it_now;gold_special;True;;MCO3530;Otras categorías
MCO571196817;Hoja Polarizadora Lineal Filtro Optico A4 Carta Para Luz;165200;1;3;buy_it_now;gold_special;True;;MCO412100;Otras categorías
MCO595359629;Puntas Filtro Cigarrillos Sin Envoltura 6 Mm X120 David Ross;7500;50;5;buy_it_now;gold_pro;True;;MCO413497;Otras categorías
MCO571285415;Cuero Para Fumar Ocb Premium Slim X32 Hojas | Caja X 50 ;99000;1;5;buy_it_now;gold_pro;True;;MCO417902;Otras categorías
MCO575930565;Eficient Filtros Desechables Para Cigarrillos Paquete X 300;97900;1;4;buy_it_now;gold_special;True;;MCO413497;Otras categorías
MCO520848616;Tarjeta Regalo Netflix $100.000 Región Colombia;116999;5000;25;buy_it_now;gold_special;True;;MCO425038;Otras categorías
MCO588694581;Boquilla Desechable Para Narguile X10 Unidades;6900;50;5;buy_it_now;gold_pro;True;;MCO442266;Otras categorías
MCO596114846;Taller Bienes Raices Basico Y Avanzados - Carlos Devis;29990;1;5;buy_it_now;gold_special;True;;MCO3530;Otras categorías
MCO578885643;Lampara Inhalambrica Fotocurado Luz Led;220000;1;4;buy_it_now;gold_pro;True;;MCO3530;Otras categorías
MCO530379416;Gran Jefe 9268 Cortar Un Roo Rojo;182990;1;4;buy_it_now;gold_special;True;;MCO3530;Otras categorías
MCO565768002;Escapulario De La Virgen Del Carmen En Cuero 4 Imágenes 4cm;3000;1;5;buy_it_now;gold_pro;True;;MCO387588;Otras categorías
MCO454276913;Tensor De Alambre  Agrofacil;189900;1;100;buy_it_now;gold_pro;True;;MCO3530;Otras categorías
MCO451857595;Electronica Pdf Pc Kit Full Aprende Repara Curs Computadora;15000;1;50;buy_it_now;gold_pro;True;;MCO3530;Otras categorías
MCO460928694;Maquina Tatuar Rotativa Profesional Gama Alta Aleacion W01;149869;1;5;buy_it_now;gold_special;True;;MCO412100;Otras categorías
MCO530264428;Mini Pipa Silicon Multicolor Fumar Tabaco Fumador ;14900;1;5;buy_it_now;gold_special;True;;MCO442272;Otras categorías
MCO580662133;Iman Ceramico En Ferrita 21mm X 4mm;3000;1;5;buy_it_now;gold_special;True;;MCO3530;Otras categorías
MCO506443773;Itunes Gift Card 5 Dolares Appstore Envio Digital Inmediato;21780;1;50;buy_it_now;gold_special;True;;MCO3530;Otras categorías
MCO501030628;Artículos Accesorios Fiesta Neón Decoración Neón Hora Loca;1099;500;200;buy_it_now;gold_pro;True;;MCO3530;Otras categorías
MCO568548883;Pipa De Fumar De Madera Para Tabaco;134900;1;5;buy_it_now;gold_special;True;;MCO442272;Otras categorías
MCO472389220;Apoyabrazos Tattoo & Tatuaje ;175000;1;5;buy_it_now;gold_special;True;;MCO412112;Otras categorías
MCO573194613;Curso Trading Opciones Binarias  Kings Of Binary ;12000;500;5;buy_it_now;gold_pro;True;;MCO3530;Otras categorías
MCO565940191;Sujetador Para Tapabocas ;1800;500;25;buy_it_now;gold_special;True;;MCO3530;Otras categorías
MCO577891623;Curso Video Seminario Online ;10990;1;5;buy_it_now;gold_pro;True;;MCO3530;Otras categorías
MCO565562657;Incensiario + 1/4 De Sahumerio ;26000;1;5;buy_it_now;gold_pro;True;;MCO387586;Otras categorías
MCO481097459;Soporte De Pared / Techo Para Bose Ub-20 Serie Ii;95900;1;25;buy_it_now;gold_special;True;;MCO3530;Otras categorías
MCO526171687;Cartas De Tarot Nekro;78000;1;5;buy_it_now;gold_special;True;;MCO414133;Otras categorías
MCO457825814;3165s Combustible Para Encendedor Zippo 12oz;24990;1;25;buy_it_now;gold_pro;True;;MCO172908;Otras categorías
MCO581726448;Velas Para Pebetero, Velas De Te * 500 Unidades;149900;500;3;buy_it_now;gold_pro;True;;MCO387587;Otras categorías
MCO560302398;Promoción Piercing Banana Bcr Nipple Labret 10 Por  9990;9990;50;5;buy_it_now;gold_special;True;;MCO412100;Otras categorías
MCO581477233;Curso Hacking Wifi Profesional Video Y Pdf;8990;1;5;buy_it_now;gold_pro;True;;MCO3530;Otras categorías
MCO460925139;Maquina Tatuar Rotativa Alta Gama Tatto Shader Liner W01;150869;1;5;buy_it_now;gold_pro;True;;MCO412107;Otras categorías
MCO595934900;Yo Soy El Diego + México 86, Mi Mundial, Mi Verdad, Maradona;10000;1;5;buy_it_now;gold_pro;True;;MCO3530;Otras categorías
MCO462249409;Decoración Flores Gigantes Papel Toda Ocasión;3000;1;50;buy_it_now;gold_special;True;;MCO3530;Otras categorías
MCO593707106;Maquina Para Tatuar Dragon Hawk. Pen Tatto. Envío Gratis.;199900;1;5;buy_it_now;gold_pro;True;;MCO412107;Otras categorías
MCO582145835;Combo Varillas + Pendulo Radiestesia En Bronce;149900;1;5;buy_it_now;gold_pro;True;;MCO409091;Otras categorías
MCO527959163;Kit  Analizador De Cloro Y Ph Para Piscina;17000;50;200;buy_it_now;gold_special;True;;MCO3530;Otras categorías
MCO572768631;Curso Reposteria Pasteleria Panaderia Completo;5520;1;5;buy_it_now;gold_pro;True;;MCO3530;Otras categorías
MCO454824037;Incienso Hindú Darshan De La India;6500;1;5;buy_it_now;gold_pro;True;;MCO116987;Otras categorías
MCO594551779;Maestro Del Orgasmo;7200;1;5;buy_it_now;gold_pro;True;;MCO3530;Otras categorías
MCO563530278;6 Cajas De Incienso En Varitas X 8 Unidades ;7900;500;5;buy_it_now;gold_pro;True;;MCO116987;Otras categorías
MCO470834744;Stickers Tatuaje Temporal Larga Duracion 200 Motivos Tattoo;6000;1;25;buy_it_now;gold_pro;True;;MCO412100;Otras categorías
MCO590825401;Ayuno Intermitente - Dr Dan Foss D1g1t4l;6000;1;5;buy_it_now;gold_special;True;;MCO3530;Otras categorías
MCO569306837;5 Cajas De Incienso En Varitas X 8 Unidades ;7500;500;5;buy_it_now;gold_pro;True;;MCO116987;Otras categorías
MCO564595238;I Ching  - Tarot De El Libro De Las Mutaciones ;84000;50;5;buy_it_now;gold_special;True;;MCO414133;Otras categorías
MCO543686952;Cubetas  Para Huevo;3500;500;50;buy_it_now;gold_pro;True;;MCO3530;Otras categorías
MCO572768688;El Más Completo Curso De Barista Profesional Y Latte Cafe;5600;1;5;buy_it_now;gold_pro;True;;MCO3530;Otras categorías
MCO547722915;Tatuajes Temporales Para Hombre;14000;1;5;buy_it_now;gold_special;True;;MCO412101;Otras categorías
MCO570994557;Palo Santo Sahumerio;14000;1;5;buy_it_now;gold_pro;True;;MCO387586;Otras categorías
MCO491591063;Vela Magica  Cumpleaños 15 Años ;8000;1;25;buy_it_now;gold_special;True;;MCO387587;Otras categorías
MCO585178201;Curso Mega Paquete Valley 7 Cursos ;50000;1;5;buy_it_now;gold_pro;True;;MCO3530;Otras categorías
MCO576114474;Pipa De Vidrio  Tubo  Grueso ;6500;1;5;buy_it_now;gold_pro;True;;MCO442272;Otras categorías
MCO555300526;Pizarra O Regleta Para La Escritura De Sistema Braille;55000;1;5;buy_it_now;gold_special;True;;MCO3530;Otras categorías
MCO593154869;Apoya Brazos;129900;1;5;buy_it_now;gold_special;True;;MCO412112;Otras categorías
MCO568136691;Set De Velas De Soya Aromatizadas Y Cuarzos Chakras/ Ángeles;75000;1;5;buy_it_now;gold_pro;True;;MCO116987;Otras categorías
MCO584775136;Papel Hectografico Spirit Para Tatuajes;3200;50;5;buy_it_now;gold_pro;True;;MCO412108;Otras categorías
MCO596093810;Vela De Los Enamorados Para Ritual;39900;500;5;buy_it_now;gold_pro;True;;MCO387587;Otras categorías
MCO572768237;Curso Granja Avicola De Cria De Pollos & Gallinas Ponedoras;3000;1;5;buy_it_now;gold_pro;True;;MCO3530;Otras categorías
MCO579111313;Máquina Liar Eléctrica + 400 Tubos Para Rellenar Tabaco Liar;169900;1;5;buy_it_now;gold_special;True;;MCO417902;Otras categorías
MCO577240817;Papel Ocb Cáñamo Orgánico #9 1 1/4 Cuero Para Armar Caja X25;69990;1;3;buy_it_now;gold_pro;True;;MCO417902;Otras categorías
MCO594860039;Tvxinternet;15000;50;5;buy_it_now;gold_pro;True;;MCO3530;Otras categorías
MCO572170451;Crema Vitamina A & D X 50 Unid Cuidado Del Tatuaje Tatto;63400;1;4;buy_it_now;gold_special;True;;MCO412113;Otras categorías
MCO569350600;Caucho Silicona Liquido Mold Eco 20 X225g Mascaras Latex ;50000;1;4;buy_it_now;gold_special;True;;MCO3530;Otras categorías
MCO499182070;Alcancia Cerdito Pequeña Incluye Caja Color Transparente ;3100;50;5;buy_it_now;gold_pro;True;;MCO3530;Otras categorías
MCO577889080;Wisc V Con Perfil Automatizado Para 1 Pc;243000;1;4;buy_it_now;gold_special;True;;MCO3530;Otras categorías
MCO566033143;Papel Para Fumar Hornet Celuloso #9 X48 Display;66900;1;5;buy_it_now;gold_pro;True;;MCO417902;Otras categorías
MCO592515506;Tarjeta Amazon 25 Usd Original Entrega En Minutos;116900;500;2;buy_it_now;gold_special;True;;MCO425038;Otras categorías
MCO554206775;Pipa En Madera, Tagua.;2500;1;50;buy_it_now;gold_special;True;;MCO442272;Otras categorías
MCO561690633;Encendedor Zippo Calavera Montaña Black Ice- Cod 49141;124900;1;4;buy_it_now;gold_special;True;;MCO172908;Otras categorías
MCO488689880;Resina Epoxica Americana 690 X108gr Encapsulados Insectos;26000;1;25;buy_it_now;gold_special;True;;MCO3530;Otras categorías
MCO527500787;Papel Cicatrizante Dermalplus+ 10 Unds Tattoo & Tatuaje;44900;1;5;buy_it_now;gold_special;True;;MCO412100;Otras categorías
MCO564014114;Set De Tintas Para Tatuar 6onzas.;146000;1;4;buy_it_now;gold_pro;True;;MCO412105;Otras categorías
MCO565549340;Grinder Rascador Trillador De Lujo 4 Partes;52900;1;4;buy_it_now;gold_pro;True;;MCO413500;Otras categorías
MCO464595606;Tarot De Los Gatos Paganos, Edición Especial. Entrega Ya!;111000;1;5;buy_it_now;gold_special;True;;MCO414133;Otras categorías
MCO580677846;Tarjeta Pubg Mobile Uc 600+60 Original Envio Inmediato;46900;500;5;buy_it_now;gold_special;True;;MCO425038;Otras categorías
MCO568491300;Encendedor Electrico De Bateria;35000;1;5;buy_it_now;gold_pro;True;;MCO172908;Otras categorías
MCO567972875;Máquina Rotativa De Tatuaje  Pen Mast Tattoo Dragonhawk;299900;1;5;buy_it_now;gold_special;True;;MCO412107;Otras categorías
MCO498030566;Cinta Autoadhesiva Para Grip De Tatuaje 4,5mts;5400;1;50;buy_it_now;gold_special;True;;MCO412100;Otras categorías
MCO564170942;Kit De Abundancia Y Prosperidad (feng-shui) - 21 Elementos;48900;1;4;buy_it_now;gold_special;True;;MCO116987;Otras categorías
MCO569276640;Caja De Incienso Bharath Darshan X 25 Cajitas Individuales;37900;1;5;buy_it_now;gold_pro;True;;MCO116987;Otras categorías
MCO488890829;Cinta Flex Tape Impermeable De Goma 4 X 5 Gris;92426;1;5;buy_it_now;gold_pro;True;;MCO3530;Otras categorías
MCO566034618;Caja De Blunt Master X2 Paquete X25 [surtido En Sabores];48900;1;5;buy_it_now;gold_pro;True;;MCO417902;Otras categorías
MCO475894784;Crema Para Tatuaje Skink 90ml;34900;1;5;buy_it_now;gold_pro;True;;MCO412113;Otras categorías
MCO572768698;Tecnica Alarga Agranda Tu Pene En 10 Semanas;7999;1;5;buy_it_now;gold_pro;True;;MCO3530;Otras categorías
MCO452721460;Caucho Silicona Estaño Mold 60 X250g Zamak Joyeria Fundicion;40900;1;25;buy_it_now;gold_special;True;;MCO3530;Otras categorías
MCO487735540;Estigma Completo Kit De Tatuaje Pro Kit De Máquina De Tatuaj;329990;1;5;buy_it_now;gold_special;True;;MCO412100;Otras categorías
MCO520512150;Imágenes De Alta Calidad Del Banco De Imágenes Shutterstock;7000;250;25;buy_it_now;gold_pro;True;;MCO3530;Otras categorías
MCO573304353;Tarjeta Riot Access 10 Usd Original Envio En Minutos;46900;500;5;buy_it_now;gold_special;True;;MCO425038;Otras categorías
MCO529626303;Encendedor Remo Original, Acero Inoxidable. Por Banimported;25900;250;5;buy_it_now;gold_pro;True;;MCO172908;Otras categorías
MCO560637331;Crema Cicatrizante Tattoo Pride 30g;21000;1;5;buy_it_now;gold_special;True;;MCO412113;Otras categorías
MCO545388770;Líquido Gel Stencil Transfer Para Tatuaje Tattoo Proton;31800;1;5;buy_it_now;gold_special;True;;MCO412100;Otras categorías
MCO487594487;Encendedor Eléctrico Recargable.;22900;1;5;buy_it_now;gold_pro;True;;MCO172908;Otras categorías
MCO452594765;Caja Agujas Para Tatuar X 25 Uds Tattoo Esterilizada Tatuaje;24900;500;100;buy_it_now;gold_special;True;;MCO412100;Otras categorías
MCO468437905;Encendedor Zippo Blanco Spazuk Máscara De Gas  Cod 29646;101100;1;5;buy_it_now;gold_special;True;;MCO172908;Otras categorías
MCO520854389;Tarjeta Regalo Spotify 2 Meses Región Colombia;36999;50;5;buy_it_now;gold_special;True;;MCO425038;Otras categorías
MCO478286141;Palo Bomba X 100 Unidades Más Mariposas;9999;50000;25;buy_it_now;gold_pro;True;;MCO3530;Otras categorías
MCO454638805;Pigmento Dynamic Negro Para Tatuar X 8oz Tattoo & Tatuaje;135000;1;5;buy_it_now;gold_special;True;;MCO412100;Otras categorías
MCO549256038;Sellante Para Pisos 3d Primer Epoxico X 400 Gr Porcelanato ;36000;1;5;buy_it_now;gold_special;True;;MCO3530;Otras categorías
MCO574131465;Sutura  De Seda Need Brailed Caja X 12 Sobres;29999;1;5;buy_it_now;gold_special;True;;MCO3530;Otras categorías
MCO579464047;Pin Virtual / Tarjeta De Regalo Netflix - Saldo $ 30.000;36500;1;5;buy_it_now;gold_special;True;;MCO425038;Otras categorías
MCO483245153;Cuenco Tibetano Establecido Por Dharma Store- Envío Gratis;154900;1;5;buy_it_now;gold_special;True;;MCO409153;Otras categorías
MCO455285420;Aislador Poste De Acero Agrofacil Bolsa X 50 Und;39900;50;5;buy_it_now;gold_pro;True;;MCO3530;Otras categorías
MCO582154014;Grip De Aluminio Para Maquina De Tattoo Tatuaje Tatuar;19900;1;5;buy_it_now;gold_special;True;;MCO412100;Otras categorías
MCO578865873;Grinder Rascador Trilladora Barril Oil;20000;1;5;buy_it_now;gold_pro;True;;MCO417903;Otras categorías
MCO577188636;Media Caja (25) De Agujas Con Puntera Para Tatuajes;24800;50;5;buy_it_now;gold_special;True;;MCO412104;Otras categorías
MCO571528676;Agujas Para Tatuar X 25 Con Punteras;27900;150;5;buy_it_now;gold_special;True;;MCO412104;Otras categorías
MCO562468478;Xbox Live Gold + Xbox Game Pass = 30 Días ;10780;1;5;buy_it_now;gold_special;True;;MCO3530;Otras categorías
MCO565253058;Baraja Del Tarot Centenario Smith-waite En Una Lata;93900;1;4;buy_it_now;gold_special;True;;MCO414133;Otras categorías
MCO557900753;Espuma Antibacterial Truelove 200 Ml;21900;1;5;buy_it_now;gold_special;True;;MCO412100;Otras categorías
MCO562430122;Incienso Caja 200 Baritas Diversas Fragancias;22000;1;25;buy_it_now;gold_pro;True;;MCO116987;Otras categorías
MCO570079022;Juego Combo Set 7 Chakras Piedras Naturales Energía;36999;1;5;buy_it_now;gold_pro;True;;MCO442293;Otras categorías
MCO459544915;Bolsas Con Cierre Hermetico Empaque Al Vacio 70x50 12 Unid;95990;250;4;buy_it_now;gold_pro;True;;MCO3530;Otras categorías
MCO566677390;Tarjeta Google Play 5 Usd Original Entrega En Rapida;24900;500;5;buy_it_now;gold_special;True;;MCO425038;Otras categorías
MCO506545375;Amazon Gift Card 5 Dolares Envio Digital Inmediato;24090;50;5;buy_it_now;gold_special;True;;MCO3530;Otras categorías
MCO548269448;Manual Diagramas Sistema Electrico Chevrolet Optra Original;24985;100;5;buy_it_now;gold_special;True;;MCO3530;Otras categorías
MCO467001176;Wdupload Premium 30 Dias 1 Mes Garantia Envio Rapido;49900;500;5;buy_it_now;gold_pro;True;;MCO425038;Otras categorías
MCO544677108;Queso Vegetal Trituradora De Disco Rallador De Hobart Univex;306700;1;2;buy_it_now;gold_special;True;;MCO3530;Otras categorías
MCO573372602;Incienso Litúrgico Natural Libra ;29100;1;4;buy_it_now;gold_pro;True;;MCO116987;Otras categorías
MCO568140016;Combustible Para Encendedor, De 4.5oz /133ml+ Piedras/5unid.;16900;150;5;buy_it_now;gold_pro;True;;MCO172908;Otras categorías
MCO571784825;Turnero Digital Teclado;420000;1;2;buy_it_now;gold_special;True;;MCO3530;Otras categorías
MCO570745792;Papel Hectografico 5 Unidades Kores Para Tatuajes;15000;1;5;buy_it_now;gold_pro;True;;MCO412108;Otras categorías
MCO595346783;Salud Prohibida+ Colección Salud 2020. 30l;25000;1;5;buy_it_now;gold_pro;True;;MCO3530;Otras categorías
MCO579314597;Tarot Alchemy 1977 England;40000;1;5;buy_it_now;gold_pro;True;;MCO414133;Otras categorías
MCO584963788;Bitcoin Curso Completo Desde Cero +2 Cursos Gratis!!;19900;1;5;buy_it_now;gold_pro;True;;MCO3530;Otras categorías
MCO589630657;Navidad Amigurumis Más De 100 Patrones En Español;25000;250;5;buy_it_now;gold_pro;True;;MCO3530;Otras categorías
MCO577176579;Cartas De Tarot Del Fuego Fournier;78000;1;3;buy_it_now;gold_special;True;;MCO414133;Otras categorías
MCO570532943;Pigmentos Perpetual X 6;146900;50;5;buy_it_now;gold_special;True;;MCO412105;Otras categorías
MCO570457753;Grinder Rascador Trilladora Moledora De Acrílico Tanque.;7500;1;5;buy_it_now;gold_pro;True;;MCO413500;Otras categorías
MCO488220543;Mix Sl Balanzas De Mesa Trumax;278000;1;4;buy_it_now;gold_pro;True;;MCO3530;Otras categorías
MCO461309142;Gancho Galvanizado Para Teja Con Perforacion Pack X 100 Und.;19500;1;5;buy_it_now;gold_special;True;;MCO3530;Otras categorías
MCO578733140;Virgen Del Carmen Mini Para Carro;13000;1;5;buy_it_now;gold_pro;True;;MCO116987;Otras categorías
MCO567008471;Curso Abra Sus Ojos;20000;1;5;buy_it_now;gold_pro;True;;MCO3530;Otras categorías
MCO533008606;Encendedor Zippo Nirvana 29713;83300;1;5;buy_it_now;gold_special;True;;MCO172908;Otras categorías
MCO590202754;Wondershare Data Recovery 2019 Permanente Ilimitado;20000;150;5;buy_it_now;gold_pro;True;;MCO3530;Otras categorías
MCO560502905;Combo De 3 Cajitas De Rolling Paper Cueros Ocb Orgánico Slim;13500;1;5;buy_it_now;gold_special;True;;MCO417902;Otras categorías
MCO505765343;Corte Infantil Celestial Arcángeles X3 En Marmolina 7.6 Cm ;56900;1;4;buy_it_now;gold_pro;True;;MCO116987;Otras categorías
MCO583010427;Péndulo Espiral Radiestesia;38000;1;5;buy_it_now;gold_pro;True;;MCO409091;Otras categorías
MCO566777375;Cuentas Premium Mega 2 Meses Oficial 600gb Envió Inmediato ;9500;500;5;buy_it_now;gold_pro;True;;MCO3530;Otras categorías
MCO590910808;Pase One;20000;50;5;buy_it_now;gold_special;True;;MCO3530;Otras categorías
MCO454784676;Collares Hawaianos En Neón X 12 Und: Accesorio Para Fiesta 2;7000;500;200;buy_it_now;gold_pro;True;;MCO3530;Otras categorías
MCO576283891;Grip Aluminio Esterilizable Para Maquina De Tattoo Tatuaje;18550;250;4;buy_it_now;gold_special;True;;MCO412100;Otras categorías
MCO562393289;Stencil Stuff 4 Oz (120ml) Original Americano;40000;1;100;buy_it_now;gold_special;True;;MCO412100;Otras categorías
MCO588620659;Los Secretos De La Longevidad Biohack Ben Greenfield Curso ;17;1;5;buy_it_now;gold_special;True;;MCO3530;Otras categorías
MCO579905341;Discord Nitro Original Gift 1 Mes;49990;250;5;buy_it_now;gold_special;True;;MCO425038;Otras categorías
MCO458409380;Máquina Copiadora Impresora Plantilla Tatuajes Tatuar W01;865999;1;4;buy_it_now;gold_pro;True;;MCO412100;Otras categorías
MCO487733791;Wormhole Tattoo Kit Completo De Tatuaje Para Principiantes K;286990;1;3;buy_it_now;gold_special;True;;MCO412100;Otras categorías
MCO551159153;Fluido Combustible Gasolina Dr 4.5oz  Recarga Encendedores;10900;150;5;buy_it_now;gold_pro;True;;MCO172908;Otras categorías
MCO594629197;Mini Soplete Encendedor A Gas Recargable Intensidad Colores ;14990;1;5;buy_it_now;gold_pro;True;;MCO172908;Otras categorías
MCO569768449;Pebetero Artesanal - Matera Olla - 17cm;13900;1;5;buy_it_now;gold_special;True;;MCO387586;Otras categorías
MCO453869976;Bolsa Organza Recordatorio Regalo Personalizada Fiesta Boda;44000;50;500;buy_it_now;gold_special;True;;MCO3530;Otras categorías
MCO571556698;Recordatorios Primera Comunión Chocolates!;2200;1;25;buy_it_now;gold_pro;True;;MCO3530;Otras categorías
MCO588598454;Grinder Trillador Pequeño Rick Metal 3 Piezas;18900;1;4;buy_it_now;gold_pro;True;;MCO413500;Otras categorías
MCO558810965;Carbon Instantáneo Bambú Paquete De 10 Unds;7000;50;5;buy_it_now;gold_special;True;;MCO442266;Otras categorías
MCO526400889;Invitacion Digital Baby Shark Video Digital Baby Shark;10000;1;5;buy_it_now;gold_pro;True;;MCO3530;Otras categorías
MCO503732417;Planos Diseño De Galpón Para Pollos De Engorde Cap 1500 Aves;200000;1;4;buy_it_now;gold_pro;True;;MCO3530;Otras categorías
MCO587867399;Xilol 1 Litro;8600;1;5;buy_it_now;gold_special;True;;MCO3530;Otras categorías
MCO566547099;Trilogia 365 Dias Dni;10000;1;5;buy_it_now;gold_special;True;;MCO3530;Otras categorías
MCO595587862;Papel Hectografico Para Tatuajes Kores X 10 Unidades;28000;1;4;buy_it_now;gold_special;True;;MCO412108;Otras categorías
MCO463595656;Filtros De Nicotina Para Cigarrillos En Colores Medellin;15000;1;5;buy_it_now;gold_special;True;;MCO172908;Otras categorías
MCO594228637;Imvu 10k;19000;1;5;buy_it_now;gold_special;True;;MCO425038;Otras categorías
MCO577321124;Vídeo Curso Superaprendizaje  Escuela De La Memoria;9990;1;5;buy_it_now;gold_pro;True;;MCO3530;Otras categorías
MCO514005452;Kit De Tatuaje Maquina Pen Essence Tattoo Dragong Hawk ;549900;1;5;buy_it_now;gold_special;True;;MCO412100;Otras categorías
MCO582324551;Mezclador De Pigmentos Tattoo Tatuajes;28900;1;5;buy_it_now;gold_pro;True;;MCO412100;Otras categorías
MCO570900939;Dta Trading Academy Completo  ;7000;1;5;buy_it_now;gold_pro;True;;MCO3530;Otras categorías
MCO483813737;1000g / 0,1g Balanza Pesa Bascula Bolsillo, Joyeria ;68000;1;5;buy_it_now;gold_pro;True;;MCO3530;Otras categorías
MCO523401610;Manual Taller Profesional Renault Duster Original Apb;18000;1;5;buy_it_now;gold_pro;True;;MCO3530;Otras categorías
MCO577511834;Curso Video Certifícate En Excel, Macros Y Power Bi;5000;1;5;buy_it_now;gold_pro;True;;MCO3530;Otras categorías
MCO596369162;Free Fire - Recarga 420 Diamantes - Tarjeta Semanal;9900;50;5;buy_it_now;gold_pro;True;;MCO425038;Otras categorías
MCO584963685;Excel Avanzado Curso Completo +2 Cursos Gratis!!!;19900;1;5;buy_it_now;gold_pro;True;;MCO3530;Otras categorías
MCO592995369;The Umbrella Academy Comics Digital ;5000;1;5;buy_it_now;gold_pro;True;;MCO3530;Otras categorías
MCO526507552;Desplumadora De Pollos En Acero Inoxidable;2200000;1;3;buy_it_now;gold_special;True;;MCO3530;Otras categorías
MCO571283542;Papel De Fumar Ocb Premium Slim King Size 32 Hojas X 5 Cajas;15900;1;5;buy_it_now;gold_pro;True;;MCO417902;Otras categorías
MCO566759933;Velas De Incienso Sandalo - Caja Por 200 Varitas Incienso;24900;150;5;buy_it_now;gold_pro;True;;MCO387587;Otras categorías
MCO589368873;Fosforera, Candela, Encendedor X 25 Und;14990;1;4;buy_it_now;gold_special;True;;MCO172908;Otras categorías
MCO458409284;Máquina Copiadora Impresora Plantilla Tatuajes Tatuar W01;871899;1;2;buy_it_now;gold_pro;True;;MCO412100;Otras categorías
MCO572796610;El Mas Completo Curso De Costura Corte Confección Patronaje;6900;1;5;buy_it_now;gold_pro;True;;MCO3530;Otras categorías
MCO489289009;Caucho Silicona Liquido Uretano 60 X900g Estampas Pisos Grc;118000;1;5;buy_it_now;gold_special;True;;MCO3530;Otras categorías
MCO594098481;Vendaje Parche Cicatrizante  Tattoo Tatuaje Stilo Saniderm ;129900;1;4;buy_it_now;gold_special;True;;MCO412113;Otras categorías
MCO558907783;Balinera Rodamiento Ref. 6001  2rs;3000;1;5;buy_it_now;gold_special;True;;MCO3530;Otras categorías
MCO569602673;Tatuajes Temporales Stickers Tattoo ;13900;1;3;buy_it_now;gold_pro;True;;MCO412101;Otras categorías
MCO586721891;El Libro Negro De La Persuasión - Alejandro Llantada;5999;1;5;buy_it_now;gold_special;True;;MCO3530;Otras categorías
MCO536147309;Cloruro De Metileno 1/2 Litro;10000;50;25;buy_it_now;gold_pro;True;;MCO3530;Otras categorías
MCO591652959;Dakimakura Megumin  Konosuba  Lino Con Relleno;105000;50;3;buy_it_now;gold_pro;True;;MCO3530;Otras categorías
