id;title;price;available_quantity;sold_quantity;buying_mode;listing_type_id;accepts_mercadopago;original_price;category_id;category_name
MCO527720813;Llavero Lujo Carro Logo Kia Cerato Sportage Rio Sorent Elega;22900;1;5;buy_it_now;gold_special;True;;MCO172914;Antigüedades y Colecciones
MCO594994078; Caja Musical Maquina De Coser Antigua A Escala ;37000;1;5;buy_it_now;gold_pro;True;;MCO1885;Antigüedades y Colecciones
MCO554807831;Myanmar 1000 Kyats Nd2019 ;12000;1;3;buy_it_now;gold_special;True;;MCO9356;Antigüedades y Colecciones
MCO506727572;Llavero De Lujo Elegante Marca Bmw Logo Emblema Serie 1 2 3 ;22900;1;5;buy_it_now;gold_special;True;;MCO172914;Antigüedades y Colecciones
MCO586338796;Banderas Tibetanas Con Plegarias Positivas Para Decoración;28000;1;5;buy_it_now;gold_pro;True;;MCO1885;Antigüedades y Colecciones
MCO500696152;Llavero Lujo Carro Marca Seat Leon Arona Ateca Cupra Emblema;22900;1;25;buy_it_now;gold_special;True;;MCO172914;Antigüedades y Colecciones
MCO495174526;Llavero Casco Moto Cafe Racer Tipo Jet Mini Azul Scooter Esc;13500;1;25;buy_it_now;gold_special;True;;MCO172914;Antigüedades y Colecciones
MCO506726564;Llavero Guayo Y Balón Futbol Souvenir Regalo Plata Deporte;11900;1;5;buy_it_now;gold_special;True;;MCO172914;Antigüedades y Colecciones
MCO568925608;Bong Pipa De Vidrio Pequeño 16 Cm + Malla;42900;1;5;buy_it_now;gold_pro;True;;MCO1885;Antigüedades y Colecciones
MCO465291996;Billete Madagascar 100 Ariary Unc;7000;1;5;buy_it_now;gold_special;True;;MCO9356;Antigüedades y Colecciones
MCO462255486;Alcancía Cabina Telefónica Roja Londres 14cm Metal Excelente;29990;1;50;buy_it_now;gold_pro;True;;MCO9355;Antigüedades y Colecciones
MCO499475165;Llavero De Lujo De Carro Elegante Marca Ford Accesorio Regal;24000;1;5;buy_it_now;gold_special;True;;MCO172914;Antigüedades y Colecciones
MCO571658074;Sailor Moon Caja Musical Cuerda;52500;1;4;buy_it_now;gold_special;True;;MCO1885;Antigüedades y Colecciones
MCO510395873;Billete 100 Trillion Dollars Zimbabwe Gold;40000;500;100;buy_it_now;gold_pro;True;;MCO9356;Antigüedades y Colecciones
MCO454762597;Colombia 20 Centavos 1965 Jer393.01 Gaitan;6000;1;5;buy_it_now;gold_special;True;;MCO9355;Antigüedades y Colecciones
MCO480732280;Llavero Lujo Carro Mini Cooper 3d Porta Metal Negro Souvenir;17900;1;5;buy_it_now;gold_special;True;;MCO172914;Antigüedades y Colecciones
MCO453892741;Moldes Cortadores Navidad, Para Masas, Galletas, Fondant;5500;1;5;buy_it_now;gold_special;True;;MCO1885;Antigüedades y Colecciones
MCO454965654;Lámpara Turca Para Colgar #2;130000;1;5;buy_it_now;gold_special;True;;MCO439433;Antigüedades y Colecciones
MCO575940104;Moneda 5.000 Pesos Colombia, Antonio Nariño, Cundinamarca;15000;1;5;buy_it_now;gold_special;True;;MCO9355;Antigüedades y Colecciones
MCO581395876;Hermoso Billete Original 10 Dolares Estadosunidos Unc+regalo;76065;1;5;buy_it_now;gold_pro;True;;MCO9356;Antigüedades y Colecciones
MCO510644425;Collar Naruto;10000;50;5;buy_it_now;gold_special;True;;MCO1885;Antigüedades y Colecciones
MCO501515236;Llavero Casco Constructor Ideal Ingeniero Recordatorio ;2000;100;500;buy_it_now;gold_pro;True;;MCO172914;Antigüedades y Colecciones
MCO576521240;Petaca - Cantimplora Licor Harley-davidson 8 Onz Kit Acero;48800;1;5;buy_it_now;gold_pro;True;;MCO413494;Antigüedades y Colecciones
MCO595907141;Billete Decorativo U$ 100 Dorado, Billete De La Buena Suerte;4000;1;25;buy_it_now;gold_special;True;;MCO9356;Antigüedades y Colecciones
MCO570999788;El Castillo En El Cielo Caja Musical Castle In The Sky ;34000;1;3;buy_it_now;gold_special;True;;MCO1885;Antigüedades y Colecciones
MCO493366646;Llavero Elegante Luxury Carro Exclusivo Lujo Marca Toyota;27990;1;5;buy_it_now;gold_special;True;;MCO172914;Antigüedades y Colecciones
MCO463076671;Cristal De Repuesto Para Lampara Aceite Pequeño Precio X C/u;25000;1;5;buy_it_now;gold_special;True;;MCO439433;Antigüedades y Colecciones
MCO556410971;Estampillas De Colombia  - Paquete De 25 Diferentes;5990;50;25;buy_it_now;gold_pro;True;;MCO442066;Antigüedades y Colecciones
MCO571618985;Pink Panther Caja Musical Pantera Rosa;34500;1;3;buy_it_now;gold_special;True;;MCO1885;Antigüedades y Colecciones
MCO570821172;Soportes De Cartón Monedas / Colección / 18/24/27 Y 31 Mm;5300;50;25;buy_it_now;gold_special;True;;MCO9355;Antigüedades y Colecciones
MCO563497750;Bloque 1000 Billetes 5 Bolívares Nuevos Y Consecutivos ;71000;1;5;buy_it_now;gold_pro;True;;MCO9356;Antigüedades y Colecciones
MCO598196848;Colombia Lazareto 2 Centavos 1921 Jer355.01;15000;1;5;buy_it_now;gold_special;True;;MCO9355;Antigüedades y Colecciones
MCO452105606;Pipas  Importadas En Madera Con Soporte Y Funda;60000;50;100;buy_it_now;gold_special;True;;MCO1885;Antigüedades y Colecciones
MCO471835773;Medallon  Collar  Moneda Azteca Piratas Del Caribe;19900;1;5;buy_it_now;gold_special;True;;MCO9355;Antigüedades y Colecciones
MCO574225479;Llavero Lujo Carro Marca Logo Emblema Volkswage Trenza Cuero;26900;1;4;buy_it_now;gold_special;True;;MCO172914;Antigüedades y Colecciones
MCO457964198;Yoyo  Coca Cola 125 Años;50000;1;5;buy_it_now;gold_special;True;;MCO1885;Antigüedades y Colecciones
MCO569785939;Billetes Conmemorativos Dorados Colección Euros;24900;1;4;buy_it_now;gold_pro;True;;MCO9356;Antigüedades y Colecciones
MCO501738012;Llavero Lujo Marca Logo Emblema Audi A1 A3 A4 Q3 Q5 Q7 Tt ;27990;1;5;buy_it_now;gold_special;True;;MCO172914;Antigüedades y Colecciones
MCO546449634;Llavero Lujo Carro Elegante Mitsubishi Montero Lancer Asx Ec;22900;1;5;buy_it_now;gold_special;True;;MCO172914;Antigüedades y Colecciones
MCO466060083;Oleo Grande Blanco Titanio 170ml Marca Maries;26000;1;25;buy_it_now;gold_special;True;;MCO1885;Antigüedades y Colecciones
MCO575549307;Llavero Lujo Moto Logo Marca Emblema Cuerda Para Suzuki  ;19990;1;4;buy_it_now;gold_special;True;;MCO172914;Antigüedades y Colecciones
MCO578364207;Llavero Lujo Exclusivo Elegante Carro Marca Logo Mini Cooper;27900;1;4;buy_it_now;gold_special;True;;MCO172914;Antigüedades y Colecciones
MCO562198663;Fajó 100 Billetes 2 Bolívares ;9900;1;3;buy_it_now;gold_pro;True;;MCO9356;Antigüedades y Colecciones
MCO451601460;Cautin  Repuesto  Para Estacion Soldadura Conector Macho;38000;1;25;buy_it_now;gold_special;True;;MCO1885;Antigüedades y Colecciones
MCO571615606;Llavero Lujo Marca Logo Chevrolet  Trenza Cuerda Cuero Elega;26900;1;4;buy_it_now;gold_special;True;;MCO172914;Antigüedades y Colecciones
MCO572994222;Llavero Lujo Carro Marca Logo Honda Cuerda Trenza Cuero Ele ;26900;1;4;buy_it_now;gold_special;True;;MCO172914;Antigüedades y Colecciones
MCO567455827;Llavero Lujo Carro Suzuki Trenza Cuero Vitara Cross Swift ;26900;1;5;buy_it_now;gold_special;True;;MCO172914;Antigüedades y Colecciones
MCO578012288;Alicate Gerber Multifuncion Práctica Herramienta Multiusos ;59900;1;3;buy_it_now;gold_pro;True;;MCO1885;Antigüedades y Colecciones
MCO554807679;Yemen 100 Rials Nd2018;12000;1;3;buy_it_now;gold_special;True;;MCO9356;Antigüedades y Colecciones
MCO484338275;Llavero Carro Lujo Toyota Luxury Prado Land Corolla Hilux Fo;22900;1;5;buy_it_now;gold_special;True;;MCO172914;Antigüedades y Colecciones
MCO524023414;Llavero Lujo Carro Marca Volkswagen Vw Logo Jetta Golf Voyag;23900;1;5;buy_it_now;gold_special;True;;MCO172914;Antigüedades y Colecciones
MCO517181844;Bong Vidrio Pequeño 16 Cm + Boquilla+malla;44990;1;25;buy_it_now;gold_special;True;;MCO1885;Antigüedades y Colecciones
MCO470452204;Llavero Carro Lujo Hyundai Souvenir I25 I35 Veloster Tucson;22900;1;5;buy_it_now;gold_special;True;;MCO172914;Antigüedades y Colecciones
MCO477640677;Polonia 50 Zlotych 1 Dic 1988 P142c;6000;1;5;buy_it_now;gold_special;True;;MCO9356;Antigüedades y Colecciones
MCO481798193;Llavero Carro Lujo Bmw I Serie M 1 2 3 Moto Gs F Souv Acc Sp;22900;1;5;buy_it_now;gold_special;True;;MCO172914;Antigüedades y Colecciones
MCO452374842;Anilinas En Polvo Para Porcelanicron;10000;50;50;buy_it_now;gold_special;True;;MCO1885;Antigüedades y Colecciones
MCO492924253;Llavero Casco Moto Cafe Racer Tipo Jet Negro Mini Escala Mil;13900;1;5;buy_it_now;gold_special;True;;MCO172914;Antigüedades y Colecciones
MCO478785453;Torre Eiffel X Docena (12);19900;1;50;buy_it_now;gold_pro;True;;MCO172914;Antigüedades y Colecciones
MCO569167598;Tapa Cubre Válvula Perno Y Llavero Elegante Logo Mazda Exclu;26900;1;5;buy_it_now;gold_special;True;;MCO172914;Antigüedades y Colecciones
MCO447677769;Piramide Orgonita;50000;1;25;buy_it_now;gold_pro;True;;MCO1885;Antigüedades y Colecciones
MCO532803645;Japon, 5 Sen Nd1944 P52a;15000;1;5;buy_it_now;gold_special;True;;MCO9356;Antigüedades y Colecciones
MCO593461783;Llavero 3d Marvel ;16000;1;5;buy_it_now;gold_pro;True;;MCO172914;Antigüedades y Colecciones
MCO545106378;Alcancias Personalizadas;25000;5000;5;buy_it_now;gold_pro;True;;MCO9355;Antigüedades y Colecciones
MCO495401929;Boveda Pack 72% Fuente De Humedad Humidor Habanos Puros 8gr;11000;1;5;buy_it_now;gold_special;True;;MCO1885;Antigüedades y Colecciones
MCO501604239;Llavero Bujía Carro Moto Miniatura Escala Luz Linterna Bosch;12900;1;5;buy_it_now;gold_special;True;;MCO172914;Antigüedades y Colecciones
MCO472261294;Cuba, 3 Pesos 2004 P123;9000;1;25;buy_it_now;gold_special;True;;MCO9356;Antigüedades y Colecciones
MCO455968266;Set 3 Mini Cráneos Decorativas Calaveras Gestos Dark;24900;1;5;buy_it_now;gold_pro;True;;MCO1885;Antigüedades y Colecciones
MCO518985674;Cuerda Colgante Cuello Marca Toyota Strap Porta Llaves Tira;24000;1;5;buy_it_now;gold_special;True;;MCO172914;Antigüedades y Colecciones
MCO543053325;Llavero Casco Constructor Ideal Ingeniero X 30 Unidades;33400;1;2;buy_it_now;gold_special;True;;MCO172914;Antigüedades y Colecciones
MCO493193361;Llavero Calavera En Moto D Coleccion Creativo Promo Hallowen;6960;1;5;buy_it_now;gold_special;True;;MCO172914;Antigüedades y Colecciones
MCO455290378;Moldes Cortadores Plásticos;3900;1;5;buy_it_now;gold_special;True;;MCO1885;Antigüedades y Colecciones
MCO488277961;Islas Maldivas 5 Rufiyaa 10 May 2017 Pa26 Plastico;11000;1;5;buy_it_now;gold_special;True;;MCO9356;Antigüedades y Colecciones
MCO447306589;Estampillas Antiguas De Todo El Mundo - Paquetes De 50 Dif.;12990;1;150;buy_it_now;gold_pro;True;;MCO442066;Antigüedades y Colecciones
MCO577817750;Moneda China (feng-shui) - 2.5cm X 2.5cm - 3 Und (bronce).;5900;1;5;buy_it_now;gold_special;True;;MCO9355;Antigüedades y Colecciones
MCO532524216;Agua Sagrada Del Río Jordan Tierra Santa Bautismo Jesus ;24000;1;5;buy_it_now;gold_special;True;;MCO1885;Antigüedades y Colecciones
MCO509647508;Llavero Coleccionable  Guante Thanos - 5 Cm Aprox -  ;18900;1;5;buy_it_now;gold_special;True;;MCO172914;Antigüedades y Colecciones
MCO471823839;Billete Rumanía En Polímero 1 Leu Año 2005 Unc;8500;1;5;buy_it_now;gold_special;True;;MCO9356;Antigüedades y Colecciones
MCO553037729;Llavero Metal Batman Vs Superman Dc Comics;4990;1;4;buy_it_now;gold_special;True;;MCO172914;Antigüedades y Colecciones
MCO515345758;Tela Tull Escarchada Por Metros De 150 De Ancho ;10000;1;2;buy_it_now;gold_special;True;;MCO1885;Antigüedades y Colecciones
MCO567107783;Llavero Elegante Exclusivo Logo Emblema Mazda 3 6 Cx Cuero ;26990;1;5;buy_it_now;gold_special;True;;MCO172914;Antigüedades y Colecciones
MCO556543722;Afiches De Videojuegos Olografiados;5790;1;5;buy_it_now;gold_special;True;;MCO168946;Antigüedades y Colecciones
MCO564316586;Duendes Mágicos Que Cambiarán Tu Vida En Segundos;85000;1;5;buy_it_now;gold_pro;True;;MCO442201;Antigüedades y Colecciones
MCO508622975;Harry Potter Caja Musical ;34000;1;5;buy_it_now;gold_special;True;;MCO1885;Antigüedades y Colecciones
MCO544614918;Billete De Rusia 1 Rublo 1961 Papel Moneda Unc;8000;1;4;buy_it_now;gold_special;True;;MCO9356;Antigüedades y Colecciones
MCO574225319;Llavero De Lujo Carro Marca Logo Emblema Nissan Trenza Cuero;26900;1;5;buy_it_now;gold_special;True;;MCO172914;Antigüedades y Colecciones
MCO509629745;Moneda De  Bicentenario De La Independencia De Cund . ( L27;22000;1;5;buy_it_now;gold_special;True;;MCO9355;Antigüedades y Colecciones
MCO583251866;El Extraño Mundo De Jack Caja Musical Negra Oogie Boogie;40000;1;2;buy_it_now;gold_pro;True;;MCO1885;Antigüedades y Colecciones
MCO496282164;Billete Uzbekistan 3 Sum 1994 Papel Moneda Unc;8000;1;3;buy_it_now;gold_special;True;;MCO9356;Antigüedades y Colecciones
MCO503916058;Mini Mundialistas Botellitas Coca Cola Mundial Brazil 2014;45000;1;5;buy_it_now;gold_special;True;;MCO172910;Antigüedades y Colecciones
MCO519358874;Llavero Casco Moto Mini A Escala Metálico Regalo Colecc Cros;9990;100;25;buy_it_now;gold_special;True;;MCO172914;Antigüedades y Colecciones
MCO552135719;Pin Metálico Fotográfico Personalizado Geek, Cómic, Anime;4700;1;5;buy_it_now;gold_special;True;;MCO1885;Antigüedades y Colecciones
MCO541926235;Disco Vinilo 7 Pulgadas 1950 Ep-lp Originales Precio X C/u ;12000;1;5;buy_it_now;gold_special;True;;MCO442107;Antigüedades y Colecciones
MCO585025348;Victrolas Rca Victor;198000;50;4;buy_it_now;gold_pro;True;;MCO442106;Antigüedades y Colecciones
MCO555318757;Coleccion De 8 Billetes Antiguos De Colombia Originales ;29900;1;5;buy_it_now;gold_special;True;;MCO9356;Antigüedades y Colecciones
MCO547187359;La Bella Y La Bestia Caja Musical;40000;1;5;buy_it_now;gold_special;True;;MCO1885;Antigüedades y Colecciones
MCO580106751;Calculadora Sumadora Casio Hr-100 Rc De Escritorio Original;159900;1;3;buy_it_now;gold_special;True;;MCO442097;Antigüedades y Colecciones
MCO557218584;Cubre Tapa Valvula Rin Llanta Carro + Llavero Lujo Suzuki;27900;1;5;buy_it_now;gold_special;True;;MCO172914;Antigüedades y Colecciones
MCO455290377;Cortadores Pequeños Porcelanicron,arcilla Polimerica;8000;1;25;buy_it_now;gold_special;True;;MCO1885;Antigüedades y Colecciones
MCO580097954;Llavero Lujo Tipo Trenza Cuero Elegante Marca Logo Renault  ;24900;1;3;buy_it_now;gold_special;True;;MCO172914;Antigüedades y Colecciones
MCO567960357;Billete 500 Euros Dorado;7000;1;4;buy_it_now;gold_special;True;;MCO9356;Antigüedades y Colecciones
MCO557991617;Llavero Carro Lujo Marca Logo Renault Sander Duste Koleo Ste;28500;1;3;buy_it_now;gold_special;True;;MCO172914;Antigüedades y Colecciones
MCO571646338;Naruto Caja Musical ;40000;1;2;buy_it_now;gold_pro;True;;MCO1885;Antigüedades y Colecciones
MCO484338281;Llavero Carro Lujo Suzuki Luxury Vitara Swift Moto Gs X Gixx;22900;1;5;buy_it_now;gold_special;True;;MCO172914;Antigüedades y Colecciones
MCO575549476;Llavero Lujo Moto Marca Logo Emblema Ktm Duke Cuerda Gancho;19990;1;4;buy_it_now;gold_special;True;;MCO172914;Antigüedades y Colecciones
MCO517845584;Billetes De 1000 Pesos Colombianos  Setx2;16900;1;5;buy_it_now;gold_special;True;;MCO9356;Antigüedades y Colecciones
MCO453497747;Patineta Tablas Dedos Games X Original Sakte Shoes Etnies;29900;1;5;buy_it_now;gold_special;True;;MCO1885;Antigüedades y Colecciones
MCO575558925;Llavero Lujo Para Moto Marca Logo Emblema Honda Cuerda Hrc ;19990;1;5;buy_it_now;gold_special;True;;MCO172914;Antigüedades y Colecciones
MCO586046034;Moneda Coleccionable Usmc Armada Marina Ee.uu Militar Usaf;41999;1;3;buy_it_now;gold_pro;True;;MCO9355;Antigüedades y Colecciones
MCO501738124;Llavero Lujo Carro Logo Volkswagen Emblema Regalo Accesorio;28500;1;3;buy_it_now;gold_special;True;;MCO172914;Antigüedades y Colecciones
MCO583237119;Avengers Dad I Love You 3000 Caja Musical Youare My Sunshine;40000;1;2;buy_it_now;gold_pro;True;;MCO1885;Antigüedades y Colecciones
MCO504012784;Billete 1.000 Pesos Radar 2 De Agosto De 2016 Gaitan Unc;19500;1;5;buy_it_now;gold_special;True;;MCO9356;Antigüedades y Colecciones
MCO467965283;Llavero Carro Lujo Toyota Hyundai Volkswagen Audi Honda Bmw;26900;100;5;buy_it_now;gold_special;True;;MCO172914;Antigüedades y Colecciones
MCO480731982;Llavero Carro Lujo Suzuki Souvenir Moto Regalo Gsx R Vitara ;22900;1;5;buy_it_now;gold_special;True;;MCO172914;Antigüedades y Colecciones
MCO571657014;Dragon Ball Z Caja Musical ;34500;1;3;buy_it_now;gold_special;True;;MCO1885;Antigüedades y Colecciones
MCO474038357;Llavero Lujo Carro Chevrolet Volkswagen Peugeot Suzuki Nissa;22900;50;5;buy_it_now;gold_special;True;;MCO172914;Antigüedades y Colecciones
MCO484871779;Llavero Carro Lujo Kia Rio Cerato Picanto Sportage Sorento L;22900;1;5;buy_it_now;gold_special;True;;MCO172914;Antigüedades y Colecciones
MCO593279712;Colombia Colección De 58 Billetes Con Álbum 1953 - 1995;300000;1;5;buy_it_now;gold_special;True;;MCO9356;Antigüedades y Colecciones
MCO569603230;Cierre De Beso Para Monederos Crochet Pachwork;9400;1;5;buy_it_now;gold_pro;True;;MCO1885;Antigüedades y Colecciones
MCO594227985;Alcancía Electrónica De Monedas Animalitos Roba Monedas Caja;36000;1;3;buy_it_now;gold_pro;True;;MCO9355;Antigüedades y Colecciones
MCO470956891;Llavero Carro Lujo Ford Souvenir Accesorio Titanium Eco Edge;22900;1;5;buy_it_now;gold_special;True;;MCO172914;Antigüedades y Colecciones
MCO501738090;Llavero Lujo Carro Marca Toyota Emblema Regalo Accesorio Sou;28400;1;4;buy_it_now;gold_special;True;;MCO172914;Antigüedades y Colecciones
MCO502793415;Cautin  Repuesto Para Estacion De Soldadura  Conector Hembra;38000;1;4;buy_it_now;gold_special;True;;MCO1885;Antigüedades y Colecciones
MCO455152665;Colombia   100 Pesos Oro 1 Enero 1980;10000;1;5;buy_it_now;gold_special;True;;MCO9356;Antigüedades y Colecciones
MCO594240473;Hojas Para Guardar Monedas Colombianas Division 20 ;1700;150;5;buy_it_now;gold_special;True;;MCO9355;Antigüedades y Colecciones
MCO499239961;Llavero/dark Souls 3 Espada De Artorias/cosplay;16900;1;5;buy_it_now;gold_pro;True;;MCO172914;Antigüedades y Colecciones
MCO571619746;Amelie Caja Musical ;34500;1;2;buy_it_now;gold_special;True;;MCO1885;Antigüedades y Colecciones
MCO518985410;Cuerda Colgante Cuello Marca Suzuki Strap Porta Llaves Tira;19990;1;5;buy_it_now;gold_special;True;;MCO172914;Antigüedades y Colecciones
MCO499243264;Billete De Congo 500 Francos 2010 Conmemorativo Unc;24000;1;2;buy_it_now;gold_special;True;;MCO9356;Antigüedades y Colecciones
MCO508622723;Game Of Thrones Caja Musical ;30000;1;5;buy_it_now;gold_special;True;;MCO1885;Antigüedades y Colecciones
MCO501016219;Llavero Lujo Carro Nissan March Sentra Versa Qashqai Pathfin;22900;1;5;buy_it_now;gold_special;True;;MCO172914;Antigüedades y Colecciones
MCO469459071;Mapa Colombia Para Raspar Explora Colombia Scratch Map;49999;1;50;buy_it_now;gold_pro;True;;MCO168946;Antigüedades y Colecciones
MCO552023202;Llavero Chevrolet De Lujo Metalico;16000;1;5;buy_it_now;gold_special;True;;MCO172914;Antigüedades y Colecciones
MCO531457577;Figuras Fluorescentes Alumbra Oscuridad Brilla Techo Luna X1;12000;50;5;buy_it_now;gold_special;True;;MCO1885;Antigüedades y Colecciones
MCO573369449;Mil Pesos 1995 Colombia.;5000;1;3;buy_it_now;gold_special;True;;MCO9356;Antigüedades y Colecciones
MCO493010496;Llavero Casco Y Destapador Arquitecto Ingeniero Constructor;1990;50;500;buy_it_now;gold_special;True;;MCO172914;Antigüedades y Colecciones
MCO586072019;Moneda Conmemorativa Boina Verde Militar De Estados Unidos;41999;1;3;buy_it_now;gold_pro;True;;MCO9355;Antigüedades y Colecciones
MCO481939336;100 Tarjetas Regalo,tags, Etiquetas Cartón Kraft De 7x8 Cm;38000;1;5;buy_it_now;gold_special;True;;MCO1885;Antigüedades y Colecciones
MCO485521699;Hojas De Billetes Antiguos Colombianos Con  3 Divisiones;1750;50;25;buy_it_now;gold_special;True;;MCO9356;Antigüedades y Colecciones
MCO585409477;12 Llavero Resorte En Espiral Flexible Universal Motos/carro;37000;1;3;buy_it_now;gold_pro;True;;MCO172914;Antigüedades y Colecciones
MCO499475322;Llavero Lujo Carro Elegante Marca Toyota Accesorio Souvenir ;24000;1;5;buy_it_now;gold_special;True;;MCO172914;Antigüedades y Colecciones
MCO497575396;Banner Game Of Thrones- Banderin Juego De Tronos;25000;1;3;buy_it_now;gold_special;True;;MCO1885;Antigüedades y Colecciones
MCO451470617;Money Clip - Porta Billetes Black, Disponible Banimported;53900;50;5;buy_it_now;gold_pro;True;;MCO30107;Antigüedades y Colecciones
MCO557586516;Chimuelo 31 Minutos Llavero ;10000;1;4;buy_it_now;gold_pro;True;;MCO172914;Antigüedades y Colecciones
MCO452373073;Colombia 5 Centavos 1901 Lazareto Jer364.01;40000;1;3;buy_it_now;gold_special;True;;MCO9355;Antigüedades y Colecciones
MCO540916747;100 Puntas De Filtro Cigarrillos Sin Envoltura 8mm David Ros;7000;50;5;buy_it_now;gold_pro;True;;MCO1885;Antigüedades y Colecciones
MCO493728934;Egipto 1 Pound 2016;6000;1;3;buy_it_now;gold_special;True;;MCO9356;Antigüedades y Colecciones
MCO504798613;Llavero Caja De Cambios Carro Dorado;8900;1;5;buy_it_now;gold_special;True;;MCO172914;Antigüedades y Colecciones
MCO592975259;Colombia Lazareto 5 Centavos 1921 Jer369.01;15000;1;5;buy_it_now;gold_special;True;;MCO9355;Antigüedades y Colecciones
MCO576850492;Vaso Coca Cola Coleccionable;19000;1;3;buy_it_now;gold_special;True;;MCO1885;Antigüedades y Colecciones
MCO575559391;Llavero Carro Lujo Yamaha Accesorio Porta Llaves;20000;1;4;buy_it_now;gold_pro;True;;MCO172914;Antigüedades y Colecciones
MCO457815266;Billete De 100 Riel Camboya Unc Sin Circular;3000;1;5;buy_it_now;gold_special;True;;MCO9356;Antigüedades y Colecciones
MCO517376132;Alcancía Electrónica Gato Roba Monedas Con Sonidos Ahorro;34990;1;50;buy_it_now;gold_special;True;;MCO30107;Antigüedades y Colecciones
MCO508568912;Hilo Encerado Redondo De 0.8mm Y 0.55mm Costura Cuero A Mano;42000;1;3;buy_it_now;gold_special;True;;MCO1885;Antigüedades y Colecciones
MCO573323030;Llavero Metálico Escudo Zelda - Link - Bow - Ocarina Of Time;17900;1;3;buy_it_now;gold_special;True;;MCO172914;Antigüedades y Colecciones
MCO452964254;Llavero Metálico  The Walking Dead;9500;1;5;buy_it_now;gold_pro;True;;MCO172914;Antigüedades y Colecciones
MCO499025099;Billete Korea Del Norte 100 Won 1978 Unc Sin Circular;15000;1;2;buy_it_now;gold_special;True;;MCO9356;Antigüedades y Colecciones
MCO598467207;Habanos Cohiba Siglo Vi Cubanos;115000;1;2;buy_it_now;gold_special;True;;MCO1885;Antigüedades y Colecciones
MCO578115363;Llavero Carro Lujo International Trucks Accesorio Port Llave;20000;1;4;buy_it_now;gold_pro;True;;MCO172914;Antigüedades y Colecciones
MCO566547481;Alcancía Electrónica Panda Roba Monedas Divertida ! ;45000;1;3;buy_it_now;gold_pro;True;;MCO30107;Antigüedades y Colecciones
MCO519778340;Calaveras Mexicanas;15000;1;5;buy_it_now;gold_special;True;;MCO1885;Antigüedades y Colecciones
MCO536144903;Alcancía Electrónica Panda Roba Monedas Con Sonidos Ahorro;36550;1;5;buy_it_now;gold_special;True;;MCO30107;Antigüedades y Colecciones
MCO488040945;Billete Del Líbano 25 Libras  Papel Moneda Unc;14000;1;2;buy_it_now;gold_special;True;;MCO9356;Antigüedades y Colecciones
MCO502029034;Vaso Candelabro O Matera En Vidrio Mini Precio X C/u ;5000;1;4;buy_it_now;gold_special;True;;MCO439433;Antigüedades y Colecciones
MCO454482582;Bomba De Succión Multiusos Para Reballing,  Tipo Lapiz;25000;1;5;buy_it_now;gold_special;True;;MCO1885;Antigüedades y Colecciones
MCO475893053;Álbum Catalogo Para Guardar 300 Monedas Antiguas Colombianas;55000;1;5;buy_it_now;gold_special;True;;MCO9355;Antigüedades y Colecciones
MCO542483300;Cruz De Hierro Segunda Clase;90000;1;5;buy_it_now;gold_special;True;;MCO30107;Antigüedades y Colecciones
MCO578012399;Bicicleta De Colección A Escala 1/10;42900;1;3;buy_it_now;gold_pro;True;;MCO442200;Antigüedades y Colecciones
MCO578051309;Duya;8000;1;5;buy_it_now;gold_special;True;;MCO1885;Antigüedades y Colecciones
MCO581395429;Hermoso Billete Colección 5 Dolares Estadosunidos Unc+regalo;41249;1;5;buy_it_now;gold_pro;True;;MCO9356;Antigüedades y Colecciones
MCO562323507;Herramienta Reparador De Puntas Tornillos;50000;1;3;buy_it_now;gold_special;True;;MCO442201;Antigüedades y Colecciones
MCO578052735;100 Cápsulas Plásticas Para Almacenar Monedas.;129900;1;3;buy_it_now;gold_pro;True;;MCO9355;Antigüedades y Colecciones
MCO486914228;Caja Musica Musical Got Juego De Tronos Game Of Thrones;39900;1;5;buy_it_now;gold_special;True;;MCO1885;Antigüedades y Colecciones
MCO474742842;Billete Uruguay 50 Nuevos Pesos Unc;10500;1;2;buy_it_now;gold_special;True;;MCO9356;Antigüedades y Colecciones
MCO526434791;Gancho Llavero Nylon Colgante Clip De Bloqueo Seguridad ;13900;1;5;buy_it_now;gold_special;True;;MCO172914;Antigüedades y Colecciones
MCO555294678;Pesa Para 300 Kilos Digital;150000;1;3;buy_it_now;gold_pro;True;;MCO442120;Antigüedades y Colecciones
MCO511425970;Camandula Rosario Aromático Rosas En Olivo De Tierra Santa;36000;1;5;buy_it_now;gold_special;True;;MCO1885;Antigüedades y Colecciones
MCO498834811;Llavero Casco Destapador Ideal Tenderos Marcamos Con El Logo;2500;1;250;buy_it_now;gold_pro;True;;MCO172914;Antigüedades y Colecciones
MCO479561300;Llavero Game Of Thrones Stark Targaryen  Juego De Tronos;10000;1;5;buy_it_now;gold_special;True;;MCO172914;Antigüedades y Colecciones
MCO488411429;Billete Zambia 20 Kwacha 1992 Papel Moneda Unc;7000;1;4;buy_it_now;gold_special;True;;MCO9356;Antigüedades y Colecciones
MCO564316249;Duendes Magicos Protectores Salud Sabiduria Amor Dinero;85000;1;4;buy_it_now;gold_pro;True;;MCO1885;Antigüedades y Colecciones
MCO557739932;Game Of Thrones Casa Targaryen Llavero Metálico;12000;1;2;buy_it_now;gold_special;True;;MCO172914;Antigüedades y Colecciones
MCO567389171;Trofeos De Futbol Segundo Puesto;134000;1;1;buy_it_now;gold_pro;True;;MCO413508;Antigüedades y Colecciones
MCO569744585;Moneda Amuleto Calendario Azteca Gold;59900;1;4;buy_it_now;gold_pro;True;;MCO9355;Antigüedades y Colecciones
MCO469790432;Tarjeta De Licencia Del Anime Hunter X Hunter - 2 Cartas;19990;1;5;buy_it_now;gold_pro;True;;MCO1885;Antigüedades y Colecciones
MCO487842936;Billete 1 Cedi Ghana Unc Sin Circular;8500;1;2;buy_it_now;gold_special;True;;MCO9356;Antigüedades y Colecciones
MCO550216170;Alcancía Cerdito Miss Piggy Publicitaria Marca Logo;5800;1;5;buy_it_now;gold_pro;True;;MCO9355;Antigüedades y Colecciones
