id;title;price;available_quantity;sold_quantity;buying_mode;listing_type_id;accepts_mercadopago;original_price;category_id;category_name
MCO491852383;Hojas 3 Divisiones Para Billetes Antiguos Colombianos Tiene ;1900;250;500;buy_it_now;gold_pro;True;;MCO9356;Antigüedades y Colecciones
MCO474373565;Caja Músical Harry Potter, Colección;33000;1;150;buy_it_now;gold_special;True;;MCO1885;Antigüedades y Colecciones
MCO455745238;Llaveros Mini Biblia Recordatorio Sagrada Escrituras Español;4900;50;500;buy_it_now;gold_special;True;;MCO172914;Antigüedades y Colecciones
MCO587283589;Hoja Para Monedas Antiguas Colombianas;1700;100;150;buy_it_now;gold_special;True;;MCO9355;Antigüedades y Colecciones
MCO563235331;Pipa Giratoria, Twisty Glass Blunt + Repuestos;28900;250;100;buy_it_now;gold_pro;True;;MCO1885;Antigüedades y Colecciones
MCO467965295;Llavero Carro Lujo Mercedes Benz Toyota Jeep Honda Bmw Ford;27900;250;250;buy_it_now;gold_pro;True;;MCO172914;Antigüedades y Colecciones
MCO575152610; Hojas De Billetes Antiguos Colombianos Division 3;1700;150;250;buy_it_now;gold_special;True;;MCO9356;Antigüedades y Colecciones
MCO588328017;Varitas Harry Potter, Precio Por Unidad, Variadas.;29999;1;50;buy_it_now;gold_special;True;;MCO1885;Antigüedades y Colecciones
MCO595599172;Platos;29000;500;500;buy_it_now;gold_special;True;;MCO442250;Antigüedades y Colecciones
MCO458675995;Bitcoin Moneda Conmemorativa Coleccionable Física Regalo Btc;12900;1;150;buy_it_now;gold_pro;True;;MCO9355;Antigüedades y Colecciones
MCO500169044;Aceite Mct Oil 32oz Sports Research Entrega Inmediata;165000;1;100;buy_it_now;gold_special;True;;MCO172910;Antigüedades y Colecciones
MCO464828207;Telar Mostacilla Telar Bisutería Graduable;59000;1;250;buy_it_now;gold_pro;True;;MCO1885;Antigüedades y Colecciones
MCO564182733;Billete De Feng-shui Dorado - Incluye Sobre ;7499;100;50;buy_it_now;gold_special;True;;MCO9356;Antigüedades y Colecciones
MCO554824172; Botellas De Licor Miniatura ;10000;100;50;buy_it_now;gold_pro;True;;MCO172910;Antigüedades y Colecciones
MCO538192504;Porcelanicron Por 500 Gramos ;6000;1;250;buy_it_now;gold_special;True;;MCO1885;Antigüedades y Colecciones
MCO535582647;Billetes De 100 Dólares Dorado;7000;500;150;buy_it_now;gold_pro;True;;MCO9356;Antigüedades y Colecciones
MCO562276048;Catalogo Monedas Y Billetes De Colombia Ultima Edicion Actua;39000;1;50;buy_it_now;gold_special;True;;MCO30107;Antigüedades y Colecciones
MCO567148706;Alcancía Electrónica De Monedas Animalitos Roba Monedas Caja;34600;1;25;buy_it_now;gold_pro;True;;MCO9355;Antigüedades y Colecciones
MCO571616448;El Viaje De Chihiro Caja Musical Spirited Away ;40000;1;5;buy_it_now;gold_special;True;;MCO1885;Antigüedades y Colecciones
MCO515061080;Llavero Lujo Carro Logo Ford Titanium Souvenir Cuerda Access;26900;1;25;buy_it_now;gold_special;True;;MCO172914;Antigüedades y Colecciones
MCO472486810;Láminas De Cartón Panal Honey Comb 115x91x2 (cm);7500;1;250;buy_it_now;gold_special;True;;MCO9356;Antigüedades y Colecciones
MCO564760299;Moneda China (feng-shui) - 2.5cm X 2.5cm - 3 Und Enlazadas.;2900;1;50;buy_it_now;gold_special;True;;MCO9355;Antigüedades y Colecciones
MCO596138099;Habanos Cohiba Club 10 Cubanos;56000;1;5;buy_it_now;gold_special;True;;MCO1885;Antigüedades y Colecciones
MCO507535547;Army Bomb Version 3 Bluetooth Version Oficial;249900;1;5;buy_it_now;gold_special;True;;MCO172914;Antigüedades y Colecciones
MCO517450210;Replica Estatua Libertad Nueva York Coleccion Souvenir 18mnr;21900;1;25;buy_it_now;gold_special;True;;MCO442201;Antigüedades y Colecciones
MCO579011424;Unidad De Botella De Vidrio 250 Ml - Entrega Inmediata;1750;1;25;buy_it_now;gold_special;True;;MCO172910;Antigüedades y Colecciones
MCO558557851;Porcelanicrón Masa Blanca 500g ;5800;1;100;buy_it_now;gold_special;True;;MCO1885;Antigüedades y Colecciones
MCO472123435;Hojas Para Billetes Antiguos Colombianos Tiene 3 Divisiones;1800;50;250;buy_it_now;gold_special;True;;MCO9356;Antigüedades y Colecciones
MCO495415041;Álbum Libro Para Guardar 120 Billetes Antiguos Colombianos;92000;1;25;buy_it_now;gold_special;True;;MCO9356;Antigüedades y Colecciones
MCO493913314;Mini Botellas Frascos Vidrio Con Corcho Empaque × 3 Unidades;8950;1;100;buy_it_now;gold_special;True;;MCO172910;Antigüedades y Colecciones
MCO571629745;La Vie En Rose Caja Musical ;40000;1;25;buy_it_now;gold_special;True;;MCO1885;Antigüedades y Colecciones
MCO467965448;Llavero Lujo Marca Mazda 3 2 6 Cx 3 Cx 5 Metal Carro Logo Em;26900;50;50;buy_it_now;gold_special;True;;MCO172914;Antigüedades y Colecciones
MCO565597884;Mini Botellas Frascos Vidrio Con Corcho Empaque × 6 Unidades;8950;1;25;buy_it_now;gold_special;True;;MCO172910;Antigüedades y Colecciones
MCO530521573;Bandana Naruto Konoha Aldea De La Hoja ;18000;1;50;buy_it_now;gold_special;True;;MCO1885;Antigüedades y Colecciones
MCO522431625;Army Bomb Kpop Bts Bluetooth G1;249900;1;5;buy_it_now;gold_special;True;;MCO172914;Antigüedades y Colecciones
MCO567098601;Llavero Lujo Carro Moto Tipo Trenza Elegant Logo Marca Cuero;26900;500;5;buy_it_now;gold_special;True;;MCO172914;Antigüedades y Colecciones
MCO495132333;Álbum Catalogo Para Guardar 200 Monedas Antiguas Colombianas;48000;50;25;buy_it_now;gold_special;True;;MCO9355;Antigüedades y Colecciones
MCO454737242;2 Unidades Pequeñas Vinilo Discos Lps Acetato Decoracion ;1500;250;500;buy_it_now;gold_pro;True;;MCO1885;Antigüedades y Colecciones
MCO468163806;Raspar Mapa Mundi Scratch  Map 82*59 Cm Poster;55900;1;50;buy_it_now;gold_pro;True;;MCO168946;Antigüedades y Colecciones
MCO540076437;Rejilla Piso 10x10 Para Cobre Antiguo;52100;1;5;buy_it_now;gold_pro;True;;MCO439433;Antigüedades y Colecciones
MCO506573445;Estilo Maquina De Coser Tipo Antigua A Escala D Caja Musical;49900;1;25;buy_it_now;gold_pro;True;;MCO442139;Antigüedades y Colecciones
MCO571646570;Beatles Caja Musical ;40000;1;5;buy_it_now;gold_pro;True;;MCO1885;Antigüedades y Colecciones
MCO517814251;Llavero Carro Lujo Kia Sportage Cerato Rio Marca Regalo Logo;27900;1;5;buy_it_now;gold_special;True;;MCO172914;Antigüedades y Colecciones
MCO569793470;Llavero Lujo Moto Marca Logo Emblema Kawasaki Cuerda Gancho;19990;1;5;buy_it_now;gold_special;True;;MCO172914;Antigüedades y Colecciones
MCO585179148;Coleccion Billetes Colombianos;36900;1;50;buy_it_now;gold_special;True;;MCO9356;Antigüedades y Colecciones
MCO571615410;Harry Potter Caja Musical ;40000;1;1;buy_it_now;gold_pro;True;;MCO1885;Antigüedades y Colecciones
MCO463170490;Alcancia Cerdo Marranito Cerdito Recordatorio Publicidad;3300;1;50;buy_it_now;gold_special;True;;MCO9355;Antigüedades y Colecciones
MCO501738055;Llavero Lujo Carro Ford Souvenir Emblema Logo Regalo Gancho;27900;1;25;buy_it_now;gold_special;True;;MCO172914;Antigüedades y Colecciones
MCO521064239;Llavero Antiestrés En Forma De Corazón;2500;250;5;buy_it_now;gold_pro;True;;MCO172914;Antigüedades y Colecciones
MCO571615786;Sailor Moon Caja Musical ;40000;1;1;buy_it_now;gold_pro;True;;MCO1885;Antigüedades y Colecciones
MCO570889778;Hojas Para Monedas Antiguas Colombianas;2300;500;250;buy_it_now;gold_special;True;;MCO9356;Antigüedades y Colecciones
MCO508489988;Catalogo Monedas Y Billetes De Colombia 1616-2019 P P Hernan;45000;1;50;buy_it_now;gold_special;True;;MCO9356;Antigüedades y Colecciones
MCO487328580;Hojas Para Billetes Antiguos  Tiene 3 Divisiones ;1700;50;100;buy_it_now;gold_special;True;;MCO9356;Antigüedades y Colecciones
MCO578219480;Llavero Metálico Mini Casco De Moto ;4500;500;5;buy_it_now;gold_pro;True;;MCO172914;Antigüedades y Colecciones
MCO483556802;Agujas De Felting Vellon 7 Agujas Mango Practico Herramienta;23900;1;5;buy_it_now;gold_special;True;;MCO1885;Antigüedades y Colecciones
MCO577510466;Alcancía Electrónica  Roba Monedas Con Sonidos Ahorro ! ;39000;1;25;buy_it_now;gold_special;True;;MCO30107;Antigüedades y Colecciones
MCO465247759;Moneda Ethereum Cryptomoneda Alta Calidad Blockchain Bitcoin;19990;50;5;buy_it_now;gold_special;True;;MCO9355;Antigüedades y Colecciones
MCO563811430;Mapamundi Premium Deluxe Edition - Mapa Para Raspar;55900;1;5;buy_it_now;gold_special;True;;MCO168946;Antigüedades y Colecciones
MCO558983505;Porcelanicron X 12 Libras De 500 Gramos;66000;1;25;buy_it_now;gold_special;True;;MCO1885;Antigüedades y Colecciones
MCO452121217;Llavero Varita Harry Potter;8000;1;250;buy_it_now;gold_pro;True;;MCO172914;Antigüedades y Colecciones
MCO469896572;Alcancía Coca Cola Plástica Vintage Grande;3990;1;50;buy_it_now;gold_special;True;;MCO30107;Antigüedades y Colecciones
MCO484338292;Llavero Carro Lujo Marca Volkswagen Golf Jetta Beetle Voyage;22900;1;25;buy_it_now;gold_special;True;;MCO172914;Antigüedades y Colecciones
MCO452969797;Alcancía Gato Cósmico (doraemon);48000;1;5;buy_it_now;gold_pro;True;;MCO1885;Antigüedades y Colecciones
MCO551633827;Billete De 500 Euros Dorada Plastificado Suerte;7000;500;25;buy_it_now;gold_pro;True;;MCO9356;Antigüedades y Colecciones
MCO501404336;Candelas Encendedor Granada Recargable Hobie Coleccion;19000;1;50;buy_it_now;gold_special;True;;MCO172914;Antigüedades y Colecciones
MCO552699760;Viejitos Músicos Abuelos Decorativos Poliresina Porcelanas ;23900;1;5;buy_it_now;gold_special;True;;MCO1885;Antigüedades y Colecciones
MCO569743939;Moneda Seals Usa ;59900;1;5;buy_it_now;gold_pro;True;;MCO9355;Antigüedades y Colecciones
MCO463250554;Llavero Victorinox Original Ref:4.1858 Acero Inoxidable;39990;1;25;buy_it_now;gold_special;True;;MCO172914;Antigüedades y Colecciones
MCO580936119;Álbum Para 60 Billetes Y 200 Monedas Antiguas Colombianas;98000;1;5;buy_it_now;gold_special;True;;MCO9356;Antigüedades y Colecciones
MCO454609760;3ra Mano,lupa Vidrio 5x,2brazos, Metalica,escualiza;26000;1;25;buy_it_now;gold_special;True;;MCO1885;Antigüedades y Colecciones
MCO465246560;Moneda Bitcoin Alta Calidad Blockhain Dorado Plateado Lujo;19990;50;25;buy_it_now;gold_special;True;;MCO9355;Antigüedades y Colecciones
MCO567241352;Whiskera O Cantimplora De Lujo Con Copas Y Navaja De 18oz ;70000;1;5;buy_it_now;gold_pro;True;;MCO413494;Antigüedades y Colecciones
MCO569799669;Llavero Lujo Moto Marca Logo Emblema Yamaha R Cuerda Gancho;19990;1;5;buy_it_now;gold_special;True;;MCO172914;Antigüedades y Colecciones
MCO571676237;Harry Potter Caja Musical Cuerda;52500;1;5;buy_it_now;gold_special;True;;MCO1885;Antigüedades y Colecciones
MCO572515760;Sobres Simbolo Doble Felicidad - Relieve - 25und;9900;1;5;buy_it_now;gold_special;True;;MCO9356;Antigüedades y Colecciones
MCO481800301;Llavero Carro Lujo Suzuki Accesorio Moto Vitara Swift Gsx R;22900;1;25;buy_it_now;gold_special;True;;MCO172914;Antigüedades y Colecciones
MCO522431128;Army Bomb Versión 3 Bluetooth;249900;1;5;buy_it_now;gold_special;True;;MCO172914;Antigüedades y Colecciones
MCO547187564;Queen Bohemian Rhapsody Caja Musical ;40000;1;25;buy_it_now;gold_special;True;;MCO1885;Antigüedades y Colecciones
MCO583580197;Llavero Carro De Lujo Marca Logo Volkswagen Trenza Cuero Vw;26900;1;5;buy_it_now;gold_special;True;;MCO172914;Antigüedades y Colecciones
MCO495426368;Álbum Folder Para Guardar 60 Billetes Antiguos Colombianos;55200;1;25;buy_it_now;gold_special;True;;MCO9356;Antigüedades y Colecciones
MCO597691915;Army Bomb Edición Especial Bluetooth;269900;1;5;buy_it_now;gold_special;True;;MCO172914;Antigüedades y Colecciones
MCO547187614;Piratas Del Caribe (davy Jones) Caja Musical ;34000;1;5;buy_it_now;gold_special;True;;MCO1885;Antigüedades y Colecciones
MCO567108853;Llavero Elegante Exclusivo Logo Marca Toyota Cuero Trenza;24990;1;5;buy_it_now;gold_special;True;;MCO172914;Antigüedades y Colecciones
MCO567148769;Alcancía Electrónica De Moneda Animalitos Traga Monedas Caja;34500;1;5;buy_it_now;gold_special;True;;MCO9355;Antigüedades y Colecciones
MCO519820253;Pelicula View Master Clasicas De Colección Precio X C/u ;10000;1;5;buy_it_now;gold_special;True;;MCO439433;Antigüedades y Colecciones
MCO508620301;Zelda Caja Musical ;34000;1;5;buy_it_now;gold_special;True;;MCO1885;Antigüedades y Colecciones
MCO562201643;Fajó 100 Billetes De 10 Soberanos Venezuela ;9900;1;5;buy_it_now;gold_pro;True;;MCO9356;Antigüedades y Colecciones
MCO578348532;Navaja Llavero Fashion Accessory;1900;500;5;buy_it_now;gold_pro;True;;MCO416694;Antigüedades y Colecciones
MCO514581633;Alcancía Electrónica Gato Roba Monedas Con Sonidos Ahorro ! ;38990;1;100;buy_it_now;gold_special;True;;MCO30107;Antigüedades y Colecciones
MCO535529557;Combo Original Zippo Combustible 12 Oz+6 Piedras+mecha Env I;33500;1;5;buy_it_now;gold_pro;True;;MCO1885;Antigüedades y Colecciones
MCO562198899;Fajó 100 Billetes 5 Bolívares Nuevos;9000;1;5;buy_it_now;gold_pro;True;;MCO9356;Antigüedades y Colecciones
MCO513569540;Masa Blanca Porcelanicrón De 500 Gr Doña Patty Buller;6400;1;200;buy_it_now;gold_special;True;8000.0;MCO1885;Antigüedades y Colecciones
MCO502527095;Protector Moneda Carton Importado Usa;38000;1;25;buy_it_now;gold_special;True;;MCO9355;Antigüedades y Colecciones
MCO535181366;Llavero Peluche Animales Juguete Accesorio Juguetería;5800;1;5;buy_it_now;gold_pro;True;;MCO172914;Antigüedades y Colecciones
MCO550379587;Alcancía Cabina Telefónica Roja Londres 14cm Metal Excelente;29990;1;5;buy_it_now;gold_pro;True;;MCO9355;Antigüedades y Colecciones
MCO550843741;Llavero Lujo Carro Cuero Trenza Elegante Mazda 3 2 Cx 5 3 R ;26900;1;5;buy_it_now;gold_special;True;;MCO172914;Antigüedades y Colecciones
MCO563186384;Pano Lency Metro;19500;1;25;buy_it_now;gold_special;True;;MCO1885;Antigüedades y Colecciones
MCO579352420;500 Billetes 5 Fajos Nuevos De Soberanos ;70000;1;5;buy_it_now;gold_special;True;;MCO9356;Antigüedades y Colecciones
MCO484871810;Llavero Carro Lujo Marca Bmw Serie 1 2 3 X 5 Sport Logo Eleg;26900;1;5;buy_it_now;gold_special;True;;MCO172914;Antigüedades y Colecciones
MCO506727553;Cuerda Colgante Cuello Porta Llave Tira Bmw Motorrad Sport C;21900;1;5;buy_it_now;gold_special;True;;MCO442102;Antigüedades y Colecciones
MCO571647168;Piratas Del Caribe (davy Jones) Caja Musical ;40000;1;5;buy_it_now;gold_pro;True;;MCO1885;Antigüedades y Colecciones
MCO493018409;Llavero Metro Flexometro Cinta Metrica Ferreteria Herramient;2900;1;25;buy_it_now;gold_special;True;;MCO172914;Antigüedades y Colecciones
MCO577036048;Fajó 100 Billetes 1000 Bolívares ;15000;1;5;buy_it_now;gold_special;True;;MCO9356;Antigüedades y Colecciones
MCO509252950;Alcancía Ganadera Toro Plástica Grande;7990;1;5;buy_it_now;gold_special;True;;MCO30107;Antigüedades y Colecciones
MCO481633995;Mapamundi Para Raspar Premium ;59900;250;500;buy_it_now;gold_pro;True;;MCO1885;Antigüedades y Colecciones
MCO573461419;Campana  Tibetana De Nepal En Bronce 17cm De Altura;89000;1;5;buy_it_now;gold_special;True;;MCO392531;Antigüedades y Colecciones
MCO526693920;3 Monedas Chinas Buena Suerte Amuleto;24990;5000;50;buy_it_now;gold_pro;True;;MCO9355;Antigüedades y Colecciones
MCO472944817;Lamina De Cartón Panal Honeycomb 110x84x1 (cm);5900;50;150;buy_it_now;gold_special;True;;MCO9356;Antigüedades y Colecciones
MCO454482588;Boquilla De Repuesto Completa Para Estacion  Calor-soldadura;38000;1;50;buy_it_now;gold_special;True;;MCO1885;Antigüedades y Colecciones
MCO467965310;Llavero Carro Lujo Mazda Nissan Bmw Volkswagen Chevrolet Log;27900;100;25;buy_it_now;gold_special;True;;MCO172914;Antigüedades y Colecciones
MCO484902963;Llavero Carro Lujo Mercedes Benz Clase Amg Cla A20 G Mb Logo;26900;1;25;buy_it_now;gold_special;True;;MCO172914;Antigüedades y Colecciones
MCO569793357;Llavero Lujo Moto Marca Logo Emblema Bmw Motorrad Cuerda Gs ;19990;1;5;buy_it_now;gold_special;True;;MCO172914;Antigüedades y Colecciones
MCO571619715;Fly Me To The Moon Caja Musical Frank Sinatra - Evangelion;40000;1;5;buy_it_now;gold_special;True;;MCO1885;Antigüedades y Colecciones
MCO495128678;Hojas Para Billetes Antiguos Colombianos Tiene 3 Divisiones;1900;500;250;buy_it_now;gold_special;True;;MCO9356;Antigüedades y Colecciones
MCO497690974;Llavero Lujo Carro Moto Honda Civic Fit Cr Cb Cbr Logo Marca;23900;1;5;buy_it_now;gold_special;True;;MCO172914;Antigüedades y Colecciones
MCO553035675;Llavero Metalico Martillo Thor Dorado Marvel Vengadores;4990;1;25;buy_it_now;gold_special;True;;MCO172914;Antigüedades y Colecciones
MCO477257227;Baraja Bicycle Guardians Playing Cards;28000;1;5;buy_it_now;gold_special;True;;MCO1885;Antigüedades y Colecciones
MCO570745842;Collar Kindred  League Of Legends Colombia;25000;1;25;buy_it_now;gold_pro;True;;MCO172914;Antigüedades y Colecciones
MCO547605848;Moneda 1 Dollar Eisenhower 1971, Certificada En Plata .400;80000;1;5;buy_it_now;gold_pro;True;;MCO9355;Antigüedades y Colecciones
MCO513865421;Set Bolivar Fuerte Y Soberano 21 Billetes;60000;50;5;buy_it_now;gold_pro;True;;MCO9356;Antigüedades y Colecciones
MCO550851326;Estilográfica Tipo Lamy, Negra Yiren ;36500;1;5;buy_it_now;gold_pro;True;;MCO1885;Antigüedades y Colecciones
MCO471206019;Llaveros Super Heroes Y Villanos Marvel Dc Comics Metálicos;8900;50000;100;buy_it_now;gold_pro;True;;MCO172914;Antigüedades y Colecciones
MCO573436879;Imán Tipo Moneda 30mm*5mm 30x5mm;2124;1;5;buy_it_now;gold_special;True;;MCO9355;Antigüedades y Colecciones
MCO522430451;Army Bomb Bts Bluetooth Oficial;239900;1;5;buy_it_now;gold_special;True;;MCO172914;Antigüedades y Colecciones
MCO548764751;Pipa Giratoria, Twisty Glass Blunt + Repuestos;32900;1;150;buy_it_now;gold_pro;True;;MCO1885;Antigüedades y Colecciones
MCO468961736;Coleccion De Billetes Colombianos Como Nuevos;25900;1;50;buy_it_now;gold_special;True;;MCO9356;Antigüedades y Colecciones
MCO593503680;Llavero Mini Raqueta Pelota De Tenis Deportes Plateado Metal;12500;1;5;buy_it_now;gold_special;True;;MCO172914;Antigüedades y Colecciones
MCO596481058;Habanos Romeo Y Julieta Club 20 Cubanos;73000;1;5;buy_it_now;gold_special;True;;MCO1885;Antigüedades y Colecciones
MCO571002053;Llavero Rastreador Trackr Pixel Mascotas Llaves Billetera ;36990;1;50;buy_it_now;gold_pro;True;;MCO172914;Antigüedades y Colecciones
MCO570359703;Hermosas Vitrolas Antiguas Rca VictorFuncionales.;198000;1;5;buy_it_now;gold_pro;True;;MCO442106;Antigüedades y Colecciones
MCO507822898;Billete 100 Quintillion Dollars Zimbabwe Gold;50000;500;25;buy_it_now;gold_pro;True;;MCO9356;Antigüedades y Colecciones
MCO578200629;Alicate Gerber Herramientas Pinza Multiusos;59900;1;5;buy_it_now;gold_pro;True;;MCO1885;Antigüedades y Colecciones
MCO568825993;Llaveros Tipo Llama - Alpaca En Lana De Colores Perú ;3999;250;5;buy_it_now;gold_special;True;;MCO172914;Antigüedades y Colecciones
MCO558869957;Llave Antigua Retro Hierro Baño Bronce Variada Precio X C/u;25000;100;5;buy_it_now;gold_special;True;;MCO442102;Antigüedades y Colecciones
MCO506727534;Llavero De Lujo Marca Logo Emblema Yamaha Carro Moto Regalo;22900;1;5;buy_it_now;gold_special;True;;MCO172914;Antigüedades y Colecciones
MCO509526388;Láminas De Policarbonato Transparente;84000;50;5;buy_it_now;gold_special;True;;MCO1885;Antigüedades y Colecciones
MCO573462863;12 Billetes Completamente Nuevos , 100% Originales;24000;1;5;buy_it_now;gold_pro;True;;MCO9356;Antigüedades y Colecciones
MCO518070534;Llavero Carro Lujo Renault Souvenir Accesorio Porta Llaves;22900;1;5;buy_it_now;gold_special;True;;MCO172914;Antigüedades y Colecciones
MCO580097229;Llavero Lujo Elegante Carro Logo Marca Dodge Journey Durango;25000;1;5;buy_it_now;gold_special;True;;MCO172914;Antigüedades y Colecciones
MCO459641118;Boveda Pack 72% Fuente De Humedad Humidor Habanos Puros 60gr;34900;1;25;buy_it_now;gold_special;True;;MCO1885;Antigüedades y Colecciones
MCO470452269;Llavero Carro Lujo Marca Renault Souvenir Duster Logan Twing;22900;1;25;buy_it_now;gold_special;True;;MCO172914;Antigüedades y Colecciones
MCO552742690;Alcancia Didactica Ahorra 1 Millon;2990;1;5;buy_it_now;gold_special;True;;MCO9355;Antigüedades y Colecciones
MCO464245850;Hoja Para Billete Marca Beba 2 O 3 Bolsillos;68000;1;5;buy_it_now;gold_special;True;;MCO9356;Antigüedades y Colecciones
MCO564829168;Bong Vidrio 20 Cm;69900;1;5;buy_it_now;gold_special;True;;MCO1885;Antigüedades y Colecciones
MCO483941298;Llavero Carro Lujo Ford Caja Fiesta Explorer Eco Escape Focu;23900;1;5;buy_it_now;gold_special;True;;MCO172914;Antigüedades y Colecciones
MCO451614857;Licorera Whiskera Cantimplora Acero Inoxidable 8 Oz;14990;1;150;buy_it_now;gold_special;True;;MCO413494;Antigüedades y Colecciones
MCO474696051;Llavero Lujo Moto Carro Bmw Serie I X F 3 2 1 Souvenir Logo ;22900;1;5;buy_it_now;gold_special;True;;MCO172914;Antigüedades y Colecciones
MCO491401606;Minifiltros De Cigarrillos X25unid De 8mm.  -60% Nicotina;19900;50;5;buy_it_now;gold_pro;True;;MCO1885;Antigüedades y Colecciones
MCO569781425;Billetes Conmemorativos Dorados Colección Dólares;24900;1;5;buy_it_now;gold_pro;True;;MCO9356;Antigüedades y Colecciones
MCO479667100;Llavero Lujo Carro Mitsubishi Souvenir Montero Lancer Asx Ou;22900;1;5;buy_it_now;gold_special;True;;MCO172914;Antigüedades y Colecciones
MCO495415678;Álbum Catalogo Para Guardar 400 Monedas Antiguas Colombianas;62500;1;25;buy_it_now;gold_special;True;;MCO9355;Antigüedades y Colecciones
MCO508623089;Lord Of The Rings/el Señor De Los Anillos Caja Musical ;40000;1;5;buy_it_now;gold_special;True;;MCO1885;Antigüedades y Colecciones
MCO513178959;Llavero Casco Moto Cafe Racer Tipo Jet Mini Estrella Scooter;14990;1;5;buy_it_now;gold_special;True;;MCO172914;Antigüedades y Colecciones
MCO562198767;Fajó 100 Billetes De 2 Soberanos Nuevos;6990;1;5;buy_it_now;gold_pro;True;;MCO9356;Antigüedades y Colecciones
MCO570745835;Collar Rakan Y Xayah League Of Legends Colombia;25000;1;5;buy_it_now;gold_pro;True;;MCO172914;Antigüedades y Colecciones
MCO583298014;La La Land Caja Musical Color Madera;40000;1;4;buy_it_now;gold_pro;True;;MCO1885;Antigüedades y Colecciones
MCO548680579;Llaveros Super Heroes Y Villanos Marvel Dc Comics Metálicos;8900;50000;5;buy_it_now;gold_pro;True;;MCO172914;Antigüedades y Colecciones
MCO585409410;1 Llavero Resorte En Espiral Flexible Universal Motos/carros;3100;1;5;buy_it_now;gold_pro;True;;MCO172914;Antigüedades y Colecciones
MCO571619530;Cant Help Falling In Love Caja Musical ;40000;1;5;buy_it_now;gold_pro;True;;MCO1885;Antigüedades y Colecciones
MCO479142970;Iraq, 250 Dinares 1995 P85;6000;1;5;buy_it_now;gold_special;True;;MCO9356;Antigüedades y Colecciones
MCO454762813;Hoja Para 20 Monedas Marca Beba Con Traslapa;68000;1;25;buy_it_now;gold_special;True;;MCO9355;Antigüedades y Colecciones
MCO573496026;Llavero Ring For Sex Morph;9900;1;5;buy_it_now;gold_pro;True;;MCO172914;Antigüedades y Colecciones
MCO598038332;100 Tarjetas Regalo,tags, Etiquetas Cartón Kraft De 6x4 Cm;38000;1;5;buy_it_now;gold_special;True;;MCO1885;Antigüedades y Colecciones
MCO577479002;Moneda Conmemorativa Imperio Maya Color Oro Azteca;13900;1;5;buy_it_now;gold_pro;True;;MCO9355;Antigüedades y Colecciones
MCO581394690;Hermoso Billete Original 1 Dolar Estados Unidos Unc+regalo ;7434;50;25;buy_it_now;gold_pro;True;;MCO9356;Antigüedades y Colecciones
MCO459601541;Increíble Conjunto De 12 Trofeos De 4 Pulgadas Y 12 Medallas;143000;1;5;buy_it_now;gold_special;True;;MCO442064;Antigüedades y Colecciones
MCO571676430;The Simpsons Caja Musical Los Simpsons;34500;1;5;buy_it_now;gold_special;True;;MCO1885;Antigüedades y Colecciones
MCO474694768;Llavero Lujo Carro Chevrolet Kia Bmw Ford Jeep Land Rover ;27900;100;25;buy_it_now;gold_special;True;;MCO172914;Antigüedades y Colecciones
MCO569769146;Llaveros Lujo Moto Bmw Ducati Yamaha Suzuk Kawasak Ktm Honda;19990;150;5;buy_it_now;gold_special;True;;MCO172914;Antigüedades y Colecciones
MCO557991912;Llavero Lujo Carro Moto Marca Logo Suzuki Vitara Swift Alto ;27900;1;5;buy_it_now;gold_special;True;;MCO172914;Antigüedades y Colecciones
MCO508623460;Star Wars Caja Musical ;34000;1;5;buy_it_now;gold_special;True;;MCO1885;Antigüedades y Colecciones
MCO475892968;Álbum Folder Para Guardar 60 Billetes Antiguos Colombianos;45000;50;25;buy_it_now;gold_pro;True;;MCO9356;Antigüedades y Colecciones
MCO484871772;Llavero Carro Lujo Mercedes Benz A200 C200 Ca Amg Cla Logo G;22900;1;5;buy_it_now;gold_special;True;;MCO172914;Antigüedades y Colecciones
MCO475893038;Álbum Catalogo Para Guardar 200 Monedas Antiguas Colombianas;45000;1;50;buy_it_now;gold_special;True;;MCO9355;Antigüedades y Colecciones
MCO491522331;Minifiltros De Cigarrillos X10unid.  Slim 5 Mm -60% Nicotina;5700;50;5;buy_it_now;gold_pro;True;;MCO1885;Antigüedades y Colecciones
MCO513180124;Llavero Nitro Miniatura Nos Carro Moto Pipeta Escala Metálic;12990;1;5;buy_it_now;gold_special;True;;MCO172914;Antigüedades y Colecciones
MCO491079214;Zimbabwe 5 Billones Dollars 19 Dic 2008 P84;18000;1;5;buy_it_now;gold_special;True;;MCO9356;Antigüedades y Colecciones
MCO546438084;Feng Shui Monedas Chinas Abundancia Y Prosperidad;11800;1;5;buy_it_now;gold_special;True;;MCO9355;Antigüedades y Colecciones
MCO570994496;Sailor Moon Caja Musical ;34500;1;3;buy_it_now;gold_special;True;;MCO1885;Antigüedades y Colecciones
MCO589181603;Llavero The Umbrella Academy Personalizado;27000;50;5;buy_it_now;gold_special;True;;MCO172914;Antigüedades y Colecciones
MCO567455646;Llavero Moto Suzuki Tipo Trenza Cuero Gsxr Gixxer Gsx Vstrom;26900;1;5;buy_it_now;gold_special;True;;MCO172914;Antigüedades y Colecciones
MCO464070341;Rumania, 2000 Lei 2000 P111a Plastico;9000;1;5;buy_it_now;gold_special;True;;MCO9356;Antigüedades y Colecciones
MCO558079576;Pines Prendedores Grape Soda - Up! Carl Y Ellie;6000;200;100;buy_it_now;gold_pro;True;;MCO1885;Antigüedades y Colecciones
MCO470452554;Llavero Lujo Carro Marca Ford Souvenir Fiesta Titanium Eco S;22990;1;50;buy_it_now;gold_special;True;;MCO172914;Antigüedades y Colecciones
MCO586691270;Colombia Lazareto 50 Centavos 1921 Jer417.01;12000;1;25;buy_it_now;gold_special;True;;MCO9355;Antigüedades y Colecciones
