id;title;price;available_quantity;sold_quantity;buying_mode;listing_type_id;accepts_mercadopago;original_price;category_id;category_name
MCO448663459;Fluido Gasolina Zippo 12oz Kit+ Piedra Y Mecha;38900;50;100;buy_it_now;gold_pro;True;;MCO172908;Otras categorías
MCO571527411;Grip Aluminio Tatuar;21900;1;5;buy_it_now;gold_special;True;;MCO412100;Otras categorías
MCO558852181;Pipa De Vidrio Diseño En Ocho;17900;1;5;buy_it_now;gold_pro;True;;MCO442272;Otras categorías
MCO500185982;Caja De 20 Cartuchos Tattoo Surtida (spark-ez-stigma);95000;1;5;buy_it_now;gold_special;True;;MCO412100;Otras categorías
MCO532078902;5 Grip Desechable Puntera Y Tubo Tatuaje Tattoo  Tatuaje;10000;50;5;buy_it_now;gold_special;True;;MCO412100;Otras categorías
MCO595934051;Pasacalles Para Eventos;4500;150;5;buy_it_now;gold_special;True;;MCO3530;Otras categorías
MCO526172705;Cartas De Tarot Labyrinth Fournier;78000;1;5;buy_it_now;gold_special;True;;MCO414133;Otras categorías
MCO580988040;Gasolina Combustible Original Encendedores Zippo 125ml;17500;1;5;buy_it_now;gold_special;True;;MCO172908;Otras categorías
MCO557314706;Grinder Acrilico Grande 4 Piezas Recolector;8900;1;25;buy_it_now;gold_pro;True;;MCO413500;Otras categorías
MCO572342866;Perfume Pájaro Macua - Esotérico - 90ml;25900;1;5;buy_it_now;gold_special;True;;MCO116987;Otras categorías
MCO472688196;Groz Beckert 135x5 Dpx5 Agujas Maquina 10 Und;3999;1;5;buy_it_now;gold_pro;True;;MCO3530;Otras categorías
MCO574129908;Curso De Maestro Asador Parrillero El Más Completo;4666;1;5;buy_it_now;gold_pro;True;;MCO3530;Otras categorías
MCO466623320;Volcanes Eléctricos Fríos Tipo Bengala Para Fiestas Evento 1;15000;500;150;buy_it_now;gold_pro;True;;MCO3530;Otras categorías
MCO473444785;Fibra De Vidrio Volan 325gr/m 100x50cm Surf  Poliester;30000;1;5;buy_it_now;gold_special;True;;MCO3530;Otras categorías
MCO454844371;Encendedor Zippo Cromado Sello Jack Daniel's -  Cod 24779;96900;1;50;buy_it_now;gold_special;True;;MCO172908;Otras categorías
MCO572211383;Raw Hemp Organic #9 Cuero Para Armar [1 1/4] Papel De Fumar;4900;1;5;buy_it_now;gold_pro;True;;MCO417902;Otras categorías
MCO551836471;Agujas Para Tatuar Blackbird Caja X 50;35000;1;5;buy_it_now;gold_pro;True;;MCO412104;Otras categorías
MCO488667845;Caucho Silicona Mold 25 Liquido Moldes X 125g  Porcelana;16000;1;50;buy_it_now;gold_special;True;;MCO3530;Otras categorías
MCO571172782;Juego De Reglas Para Diseño Y Trazo En Alta Costura;44000;1;5;buy_it_now;gold_special;True;;MCO3530;Otras categorías
MCO556308528;Vectores De Corte. Mega Pack 2.000.000+1000 Vect Estampado;12000;50;5;buy_it_now;gold_pro;True;;MCO3530;Otras categorías
MCO576845061;Scrappers O Raspadores Para Reposteria En Acrilico;14500;1;5;buy_it_now;gold_pro;True;;MCO3530;Otras categorías
MCO590320822;Cortador De Puros Cigarro Tabaco Habano;20600;50;5;buy_it_now;gold_special;True;;MCO417008;Otras categorías
MCO575935235;Crema Old Tattoo 21gr Para Cuidado Tatuajes Tattoo;13900;100;5;buy_it_now;gold_pro;True;;MCO412113;Otras categorías
MCO568962370;1kg Caucho De Silicona Para Moldes;100000;50;5;buy_it_now;gold_special;True;;MCO3530;Otras categorías
MCO567443762;Car Bluetooth Adaptador Para Carro Y Audio En General;9990;1;5;buy_it_now;gold_special;True;;MCO3530;Otras categorías
MCO575380686;Itunes Tarjeta De Regalo Appstore 3$ Usd Envio En Minutos.;17500;50;5;buy_it_now;gold_pro;True;;MCO425038;Otras categorías
MCO561795165; Inserto De Plasma Arc Llama Cruzada Para Encendedor Zippo;95700;1;5;buy_it_now;gold_pro;True;;MCO172908;Otras categorías
MCO563630223;Combo 5 Sobres De Blones Rolling Papers Cueros Blunt Wrap X2;14900;1;5;buy_it_now;gold_pro;True;;MCO417902;Otras categorías
MCO589374794;Pase One;7900;50;5;buy_it_now;gold_special;True;;MCO3530;Otras categorías
MCO475894644;Caja De 50 Sobres Crema Ayd - Cuidado Del Tatuaje;61000;1;25;buy_it_now;gold_special;True;;MCO412113;Otras categorías
MCO486334380;Reta Tu Vida - Jose Fernandez + Salvando Vidas + Regalos Pdf;3000;1;50;buy_it_now;gold_pro;True;;MCO3530;Otras categorías
MCO595400444;Papel Raw King Size De Liar Ultra Delgado  Unrefined Sellado;6400;50;5;buy_it_now;gold_special;True;;MCO417902;Otras categorías
MCO532577464;Cartuchos Para Tatuar Spark  Cm Caja 20 Unidades;60000;1;25;buy_it_now;gold_pro;True;;MCO412100;Otras categorías
MCO578600808;Palo Santo;11000;1;5;buy_it_now;gold_special;True;;MCO387586;Otras categorías
MCO563628370;Encendedor Clipper De Varios Motivos;2900;1;5;buy_it_now;gold_pro;True;;MCO172908;Otras categorías
MCO453496416;Clic Antirronquido, Sin Roncar, Antialergico, Practihogartv;9900;50;100;buy_it_now;gold_pro;True;;MCO3530;Otras categorías
MCO451808671;Hoja Hectografica X 5 Unidades Plantilla Tatuaje Tattoo;15000;50;100;buy_it_now;gold_special;True;;MCO412100;Otras categorías
MCO454076798;Pigmento Para Tatuar Marca Perpetual 1 Oz Tattoo & Tatuaje;32000;1;50;buy_it_now;gold_special;True;;MCO412100;Otras categorías
MCO537793281;5 Piezas Piel Sintetica Para Tatuar Tatuaje Tattoo;39000;1;25;buy_it_now;gold_pro;True;;MCO412100;Otras categorías
MCO571036297;Plasticera Industrial Media Profesional X 1 Kilo Esculturas;39999;50;5;buy_it_now;gold_special;True;;MCO3530;Otras categorías
MCO474418415;Auricular Therapy Magnets Para Dejar De Fumar;9900;50;5;buy_it_now;gold_pro;True;;MCO3530;Otras categorías
MCO573434736;Software Diseño Photoshop, Illustrator Y Lightroom ;10000;1;5;buy_it_now;gold_special;True;;MCO3530;Otras categorías
MCO503623847;Kit De Tatuaje Tutuar Maquina Pen Tattoo Dragong Hawk;469900;1;5;buy_it_now;gold_special;True;;MCO412100;Otras categorías
MCO469485545;Manual Taller Mazda B Motor B2200 F2 2.2 B2600 G6 2.6 Bt50;10000;50;50;buy_it_now;gold_pro;True;;MCO3530;Otras categorías
MCO514439825;Bomba Agua Mini Acuario Dc 6-12 V;25800;1;50;buy_it_now;gold_pro;True;;MCO3530;Otras categorías
MCO580399236;Porta Insulina-incluye 2 Gel Refrigerante;35000;1;5;buy_it_now;gold_pro;True;;MCO3530;Otras categorías
MCO446708445;Clip Anti Ronquido Pare De Roncar Suave Antialergico;4990;500;250;buy_it_now;gold_special;True;9900.0;MCO3530;Otras categorías
MCO559360677;Botella Empaque Envase Plastica Crema Gel Con Dispensador;1600;1;150;buy_it_now;gold_special;True;;MCO3530;Otras categorías
MCO463136533;Cigarreras En Cuero Sintetico De Lujo Medellin;12000;1;5;buy_it_now;gold_special;True;;MCO172908;Otras categorías
MCO517199186;15 Minutos De Manifestación + Manifestación Mágica Original;29700;50;25;buy_it_now;gold_pro;True;;MCO3530;Otras categorías
MCO575637625;Curso Completo De Instalador De Paneles Solares + Obsequios;7999;1;5;buy_it_now;gold_pro;True;;MCO3530;Otras categorías
MCO564510393;Velones 7 Mechas De Todos Los Colores 13x6;7000;50;5;buy_it_now;gold_special;True;;MCO387587;Otras categorías
MCO473548077;Vales De Amor. Detalles Y Regalos Para Parejas;22000;50;50;buy_it_now;gold_pro;True;;MCO3530;Otras categorías
MCO581441937;Tarjeta Netflix $30.000 - Colombia ;34700;50;5;buy_it_now;gold_special;True;;MCO425038;Otras categorías
MCO563682096;Envase Plastico De 300 Ml;1000;150;25;buy_it_now;gold_special;True;;MCO3530;Otras categorías
MCO588915504;10 X Vitamina A + D Ointment Fougera Cicatrizante Tatuaje ;9990;1;5;buy_it_now;gold_special;True;;MCO412113;Otras categorías
MCO454223208;Adaptador Cargador Encendedor Vehículos, Cel, Aparatos 5v;2000;500;250;buy_it_now;gold_special;True;;MCO3530;Otras categorías
MCO564021514;Kit Marcadores Sharpie Punta Fina Cosmico X24 Colores;49899;1;5;buy_it_now;gold_special;True;;MCO412105;Otras categorías
MCO505765556;Corte Celestial Arcángeles X3 Material Marmolina 32 Cm;198900;1;5;buy_it_now;gold_special;True;;MCO116987;Otras categorías
MCO461842836;Combo Accesorios Tatuaje X 50 U Caps Groomets Bandas O´rings;18000;1;50;buy_it_now;gold_special;True;;MCO412100;Otras categorías
MCO585404701;Tabaco Artesanal Vencedor - 25 Unidades - 12x2cm ;13900;1;5;buy_it_now;gold_special;True;;MCO116987;Otras categorías
MCO557180648;Virgen De Guadalupe 20 Cm  Marmolina Diseño Italiano ;53900;1;5;buy_it_now;gold_pro;True;;MCO116987;Otras categorías
MCO567398938;Pipa De Vidrio De Alta Resistencia;16900;1;5;buy_it_now;gold_pro;True;;MCO442272;Otras categorías
MCO488690634;Resina Epoxica Americana Transparent 690 X215gr Madera Mesas;46000;1;25;buy_it_now;gold_special;True;;MCO3530;Otras categorías
MCO521690150;Montaje De Boca Para Gopro 7 Surf Kite Surf Buceo;45000;1;4;buy_it_now;gold_special;True;;MCO3530;Otras categorías
MCO573105229;Curso Teorico - Practico Trading Ideas (bolsa De Valores);9900;500;5;buy_it_now;gold_pro;True;;MCO3530;Otras categorías
MCO456219690;Resina Epoxica Americana 690 X215gr Joyeria Piedras Con Uv;46000;1;25;buy_it_now;gold_special;True;;MCO3530;Otras categorías
MCO566495117;Inhalador Sniffer Snuff Snorter Dosificador De Plástico;7800;1;5;buy_it_now;gold_pro;True;;MCO442266;Otras categorías
MCO572632000;Pin Netflix 20.000 Legal Y Sin Caidas;25000;1;5;buy_it_now;gold_special;True;;MCO425038;Otras categorías
MCO451773379;Pigmento Para Tatuar Eternal 1 Onza Tattoo 30 Ml Tatuaje;43500;1;200;buy_it_now;gold_special;True;;MCO412100;Otras categorías
MCO566130912;Cable Marca Rxe Premium Rca Para Maquina Tattoo  Clip Cord;39990;500;5;buy_it_now;gold_pro;True;;MCO412114;Otras categorías
MCO542586729;Estoperol Plástico Con Y Sin Espigo;1000;5000;50;buy_it_now;gold_special;True;;MCO3530;Otras categorías
MCO467646511;Botella Recordatorios Personalizadas Envase Plastica 16cm;2500;1;250;buy_it_now;gold_special;True;;MCO3530;Otras categorías
MCO463596615;Pipa De Madera Funcional Decorativa O Coleccionable Medellin;59900;1;5;buy_it_now;gold_special;True;;MCO442272;Otras categorías
MCO454269511;Alginato Liquido  X500gr Moldes Bebes Manos;80000;1;50;buy_it_now;gold_special;True;;MCO3530;Otras categorías
MCO554284537;Encendedor Eléctrico Táctil Recargable Usb Sin Llama ;23900;1;25;buy_it_now;gold_pro;True;;MCO172908;Otras categorías
MCO579908525;Discord Nitro Classic Gift 1 Mes;28990;250;5;buy_it_now;gold_pro;True;;MCO425038;Otras categorías
MCO573890898;Cruz De Caravaca Con Herradura - Aleacion Pintada - 8.5cm;11900;1;5;buy_it_now;gold_special;True;;MCO116987;Otras categorías
MCO535050852;Arcángeles De Protección San Miguel, S. Rafael Y S. Gabriel;55000;1;5;buy_it_now;gold_pro;True;;MCO116987;Otras categorías
MCO504384178;Combo De Caja Cebadera  Con Trampa De Golpe Y Afiche ;25000;500;25;buy_it_now;gold_special;True;;MCO3530;Otras categorías
MCO576594877;Alambre Ajuste Nasal Plastificado - Tapabocas - Rollo 610 M;62000;250;5;buy_it_now;gold_special;True;;MCO3530;Otras categorías
MCO568394815;Incienso Mirra.estoraque.colofonia ;80000;1;5;buy_it_now;gold_special;True;;MCO387586;Otras categorías
MCO567971688;Curso Posicionamiento Web Y Seo 2020;25000;1;5;buy_it_now;gold_pro;True;;MCO3530;Otras categorías
MCO454844281;Encendedor Zippo Gris Hielo Loto Laser - Cod 29431;115600;1;5;buy_it_now;gold_special;True;;MCO172908;Otras categorías
MCO582414383;Pin Tarjeta Netflix De $20.000 Entrega Inmediata;23799;5000;5;buy_it_now;gold_special;True;;MCO425038;Otras categorías
MCO454844283;Encendedor Zippo Cromo Cepillado Diagonal - Cod 24648;76500;1;5;buy_it_now;gold_special;True;;MCO172908;Otras categorías
MCO488521891;Marquillas Etiquetas Personalizadas Ropa Full Color 100 Und;25000;1;100;buy_it_now;gold_special;True;;MCO3530;Otras categorías
MCO456239267;Pigmento So-strong Traslucido Pisos Y Porcelanato X1color 3g;8000;50;50;buy_it_now;gold_special;True;;MCO3530;Otras categorías
MCO451852883;Marquillas Etiquetas Personalizadas Ropa Uniformes Fullcolor;30000;50;200;buy_it_now;gold_pro;True;;MCO3530;Otras categorías
MCO545428647;Burbujero  Recordatorio Bombas Jabon Matrinonio Bodas Invita;1500;1;50;buy_it_now;gold_special;True;;MCO3530;Otras categorías
MCO452393146;Caballetes Dobles Para Niños Para Pintar Oferta!;86000;1;100;buy_it_now;gold_pro;True;;MCO3530;Otras categorías
MCO452373922;Figuras Como Recordatorios De Boda-matrimonio;4500;50;250;buy_it_now;gold_pro;True;;MCO3530;Otras categorías
MCO500758187;Cava Hielera  Igloo;616990;1;5;buy_it_now;gold_special;True;;MCO3530;Otras categorías
MCO565895234;Juego De Pipas Para Fumar De Madera;139900;1;5;buy_it_now;gold_special;True;;MCO442272;Otras categorías
MCO571877044;Pin Virtual Netflix $20.000 Recarga Original ;24000;1;5;buy_it_now;gold_special;True;;MCO425038;Otras categorías
MCO578253070; Stencils Para Arte Y Manualidades Tipo P Modificada;2000;50;5;buy_it_now;gold_pro;True;;MCO3530;Otras categorías
MCO568139382;Combustible  Para Encendedor, 4.5oz + Piedras/5unid. + Mecha;24500;150;5;buy_it_now;gold_pro;True;;MCO172908;Otras categorías
MCO478690652;Caucho Silicona Liquida 250g Para Moldes - Rtv2 Poliuretano;29490;1;50;buy_it_now;gold_special;True;;MCO3530;Otras categorías
MCO577898224;Tarjeta De Regalo Amazon 10$ Usd - Amazon Giftcard,;41999;1;25;buy_it_now;gold_pro;True;;MCO425038;Otras categorías
MCO564696229;Ganchos Para Interline;24000;500;250;buy_it_now;gold_pro;True;;MCO3530;Otras categorías
MCO501902663; Aros Nariz O Labio Promoción 5 Und. Por 17900 Envío Gratis;17900;50;25;buy_it_now;gold_special;True;;MCO412100;Otras categorías
MCO488668061;Caucho Silicona Moldes Mold 15 X112g Esculpir Masilla Velas;21000;1;50;buy_it_now;gold_special;True;;MCO387587;Otras categorías
MCO520350379;Caucho Silicona Liquido Moldes Mold 15 X450g Escultura;76000;1;5;buy_it_now;gold_special;True;;MCO3530;Otras categorías
MCO454573463;Promoción Body Piercing Herraduras Y Bcr 10 Por  9990;9990;1;100;buy_it_now;gold_special;True;;MCO412100;Otras categorías
MCO522161298;Cinta Térmica Sublimación X 5 Unidades;26000;1;25;buy_it_now;gold_special;True;;MCO3530;Otras categorías
MCO555479366;Dynamic Pigmento Triple Black 1 Oz Tattoo ;44900;1;25;buy_it_now;gold_pro;True;;MCO412100;Otras categorías
MCO560777177;Agujas + Punteras X 10 Unds Tattoo & Tatuaje;17990;500;5;buy_it_now;gold_pro;True;;MCO412106;Otras categorías
MCO578816109;Aceite Soluble Para Corte Metales Soldelta - Galón;42500;1;5;buy_it_now;gold_pro;True;46900.0;MCO3530;Otras categorías
MCO523546143;Tatuajes Temporales Femeninos - Fácil Colocación;6000;250;25;buy_it_now;gold_pro;True;;MCO412100;Otras categorías
MCO564281227;Filtros Tips Hornet De Algodón Para Fumar Caja X 50;33900;1;5;buy_it_now;gold_pro;True;;MCO413497;Otras categorías
MCO595651153;D-isney Plus Gift Card 30 Dias;10000;500;5;buy_it_now;gold_pro;True;;MCO425038;Otras categorías
MCO572883333;Maquina Armadora Automática Acero Plateado #9;17900;1;5;buy_it_now;gold_pro;True;;MCO417903;Otras categorías
MCO569092413;Tarjeta De Regalo Netflix De 50000;49000;1;5;buy_it_now;gold_pro;True;;MCO425038;Otras categorías
MCO562890207;Cuentas Premium Mega Ilimitado 30 Dias, Envío Inmediato;8000;500;25;buy_it_now;gold_pro;True;;MCO3530;Otras categorías
MCO557658202;Bong En Vidrio + Boquilla + Limpiador ;27900;1;5;buy_it_now;gold_pro;True;;MCO417908;Otras categorías
MCO559418967;Arequipe Cafequipe Dulce Artesanía Café, Variedades Salento ;8000;50;5;buy_it_now;gold_pro;True;;MCO3530;Otras categorías
MCO565679517;Papeles Cueros Liar X3 Moon Red;7000;1;5;buy_it_now;gold_special;True;;MCO417902;Otras categorías
MCO578362315;Set De Pipas Por 5 Unidades ;31900;1;5;buy_it_now;gold_pro;True;;MCO442272;Otras categorías
MCO529477691;Bye Bye Celulitis / Recetas Y Secretos De Sascha Fitness;6000;1;50;buy_it_now;gold_pro;True;;MCO3530;Otras categorías
MCO562446011;5 Unidades Puntas Jeringa Triple + Envió Gratis A Nivel Nal.;36000;1;100;buy_it_now;gold_pro;True;;MCO3530;Otras categorías
MCO469652365;200 Varitas De Incienso Aromatizadas+obsequio Portaincienso;29500;250;50;buy_it_now;gold_special;True;;MCO116987;Otras categorías
MCO464365757;Radiant 1 Oz Negro Tattoo & Tatuaje 100% Original;36990;1;50;buy_it_now;gold_special;True;;MCO412100;Otras categorías
MCO568843050;Muñecas Amigurumis Mas De 150 Patrones En Español;20000;250;5;buy_it_now;gold_pro;True;;MCO3530;Otras categorías
MCO466834265;Tarot  Morgan Greer 100 % Original Entrega Inmediata;147000;1;5;buy_it_now;gold_pro;True;;MCO414133;Otras categorías
MCO581135555;Safal Incienso De La India Original Caja Hexagonal;5500;50;5;buy_it_now;gold_pro;True;;MCO116987;Otras categorías
MCO558503246;15 Minutos De Manifestación;9900;50;25;buy_it_now;gold_pro;True;;MCO3530;Otras categorías
MCO573195930;Tarjeta Fortnite 13500 Pavos Original Envio En Minutos;448900;500;2;buy_it_now;gold_special;True;;MCO425038;Otras categorías
MCO573057766;Palo Santo Molido;8900;500;5;buy_it_now;gold_pro;True;;MCO387586;Otras categorías
MCO576388668;Pipa De Vidrio Giratoria, Twisty Glass Blunt + Repuestos;27900;50;25;buy_it_now;gold_pro;True;;MCO442272;Otras categorías
MCO564053515;Termonebulizador Fogger Desinfeccion Humo Portatil Propano;499990;1;5;buy_it_now;gold_pro;True;;MCO3530;Otras categorías
MCO570644585;Caja De 80 Carbones Excelsior 8 Paquetes;38950;1;5;buy_it_now;gold_special;True;;MCO431853;Otras categorías
MCO592515149;Tarjeta Amazon 20 Usd Original Entrega En Minutos;92900;500;5;buy_it_now;gold_special;True;;MCO425038;Otras categorías
MCO594595540;Cuenco Tibetano En Bronce Martillado A Mano 8cm;128000;1;5;buy_it_now;gold_special;True;;MCO409153;Otras categorías
MCO456239011;Pigmento Cauchos Siliconas Silc X 1 Color 3gr Mascaras  ;7500;1;5;buy_it_now;gold_special;True;;MCO3530;Otras categorías
MCO574172902;Cartas Tarot De Marsella + Manual;65000;1;5;buy_it_now;gold_special;True;;MCO414133;Otras categorías
MCO563679202;Bong Cristal Grueso Medio 24 Cm + Mallas;70000;1;25;buy_it_now;gold_special;True;;MCO417908;Otras categorías
MCO578092686;Papel De Fumar Ocb Premium Slim King Size 32 Hojas;3500;1;5;buy_it_now;gold_pro;True;;MCO417902;Otras categorías
MCO597597434;Discord Nitro 3 Meses;20000;1;5;buy_it_now;gold_special;True;;MCO425038;Otras categorías
MCO559824493;Grinder Rascador Trillador Granada Metal Recolector;24900;1;5;buy_it_now;gold_pro;True;;MCO413500;Otras categorías
MCO561703520;Luz D Té Vela X 12 Und Flotante Led Decoración Impermeable 2;36000;500;5;buy_it_now;gold_special;True;;MCO387587;Otras categorías
MCO575410056;Amuleto Nido Pájaro Macua;50000;1;5;buy_it_now;gold_pro;True;;MCO116987;Otras categorías
MCO449985709;Colchoneta Antiescaras 90x190x 5-incluye Forro Antifluido;119900;1;100;buy_it_now;gold_pro;True;;MCO3530;Otras categorías
MCO581152007;Extracto De Pájaro Macua, Quereme Y Mandragora Ritualizado;60000;1;5;buy_it_now;gold_pro;True;;MCO116987;Otras categorías
MCO571420874;Baraja De Tarot Rider, Rider Waite, Smith-waite;70000;1;5;buy_it_now;gold_pro;True;;MCO414133;Otras categorías
MCO557906605;Maquina De Liar Ocb Metálica 1/4 #9;16000;1;25;buy_it_now;gold_special;True;;MCO417903;Otras categorías
MCO570448130;Tarjeta Google Play 10 Usd Original Entrega En Minutos;43500;50;5;buy_it_now;gold_special;True;;MCO425038;Otras categorías
MCO573202977;Juego De Reglas Para Modisteria A Cuarta De Escala ;10500;1;5;buy_it_now;gold_special;True;;MCO3530;Otras categorías
MCO568911035;Caucho Silicona Mold Max 25 X 1kilo Molduras Resina Gemelos;98000;50;5;buy_it_now;gold_pro;True;;MCO3530;Otras categorías
MCO540706133;Maquina De Tatuar Pen Mas Dos Agujas;240000;1;5;buy_it_now;gold_special;True;;MCO412107;Otras categorías
MCO574065960;Se Extraordinario Vishen Lakhiani Completo Original;15000;50;5;buy_it_now;gold_pro;True;;MCO3530;Otras categorías
MCO562885845;Incienso 7 Arcangeles  +  Porta Incienso;15900;1;5;buy_it_now;gold_pro;True;;MCO387586;Otras categorías
MCO535763640;Falda Hawaiana Para Adulto Fiestas Disfraces 60 Cm Alto 2;12000;500;5;buy_it_now;gold_pro;True;;MCO3530;Otras categorías
MCO571876687;Vida Sin Límites Marisa Peer Completo Original;19000;50;5;buy_it_now;gold_pro;True;;MCO3530;Otras categorías
MCO456277200;Guantes Para Moto Impermeables Termicos Pantalla Tactil;34900;50;100;buy_it_now;gold_special;True;;MCO3530;Otras categorías
MCO595421142;Venta De 1 Pantalla Ultra Hd 4k  ( 1 Dispositivo ) 1 Mes;8500;500;5;buy_it_now;gold_special;True;;MCO3530;Otras categorías
MCO476598091;Caja 19 Latas De Crema Para Tatuaje Old Tattoo Envio Gratis;119000;1;5;buy_it_now;gold_special;True;;MCO412113;Otras categorías
MCO558056519;Pipa Boquilla De Vidrio Entorcha;6000;1;5;buy_it_now;gold_special;True;;MCO442272;Otras categorías
MCO563151279;Desayuno Sorpresa A Domicilio / Enviamos Solo A Bogotá.;89500;1;5;buy_it_now;gold_pro;True;;MCO3530;Otras categorías
MCO561692502;Encendedor Zippo Cypress Hill Cromado - Cod 49010;112700;1;5;buy_it_now;gold_special;True;;MCO172908;Otras categorías
MCO452387348;Detector De Metales Deephunter 3d;18000000;1;3;buy_it_now;gold_special;True;;MCO3530;Otras categorías
MCO533577277;Archivos De Corte Letras Y Numeros 3d Silhouette Cameo Y Svg;6500;50;5;buy_it_now;gold_pro;True;;MCO3530;Otras categorías
MCO478236331;Adaptadores De Lápiz Tipo Trípode Unidad;16000;50;50;buy_it_now;gold_special;True;;MCO3530;Otras categorías
MCO527273733;Botones Personalizados Para Todo Tipo De Ocasión;1000;500;100;buy_it_now;gold_pro;True;;MCO3530;Otras categorías
MCO595059622;Tarjeta Google Play 25 Usd Original Entrega En Minutos;106400;500;5;buy_it_now;gold_special;True;;MCO425038;Otras categorías
MCO561288215;Nipples Grommets X100 Und Para Agujas De Tatuar;17900;1;25;buy_it_now;gold_special;True;;MCO412367;Otras categorías
MCO562621176;Paquete Exclusivo Jurgen Klaric (x8) + Regalo;5000;500;5;buy_it_now;gold_pro;True;;MCO3530;Otras categorías
MCO565568617;Incienso Balaji Chandan / Aroma Sagrado Caja X 12;115000;1;5;buy_it_now;gold_special;True;;MCO116987;Otras categorías
MCO565769801;1000 Tubos De Papel Para Rellenar Tabaco Liar + Máquina;99990;1;5;buy_it_now;gold_special;True;;MCO417902;Otras categorías
MCO566784166;Mallas De Seguridad Para Ventanas Y Balcones;12500;1;100;buy_it_now;gold_special;True;;MCO3530;Otras categorías
MCO527510251;Oliver Velez Combo Self Start + Live Trading Camp + Bonos;3700;150;50;buy_it_now;gold_pro;True;;MCO3530;Otras categorías
MCO560425910;Moledor Rascador Trillador Grinder Rayo Premium;69900;150;5;buy_it_now;gold_special;True;;MCO413500;Otras categorías
MCO559971406;Tapabocas 3 Capas Acolchados  Quirurgica Y Politex Lavables ;3700;50;25;buy_it_now;gold_pro;True;;MCO3530;Otras categorías
MCO565497912;Netflix Pin 20.000, Garantizado 100%;26000;500;5;buy_it_now;gold_special;True;;MCO425038;Otras categorías
MCO459133891;Encendedor Zippo Gris Hierro Classic Iron Stone - Cod 211;85000;1;25;buy_it_now;gold_special;True;;MCO172908;Otras categorías
MCO583222087;Encendedor Eléctrico, Plasma De Doble Arco, Waterproof;55500;1;5;buy_it_now;gold_special;True;;MCO172908;Otras categorías
MCO558236803;Caja Venda Elastica Autoadhesiva Para Grip X24 Unidades;127900;1;5;buy_it_now;gold_special;True;;MCO412100;Otras categorías
MCO576129069;Acrilico Auto Veracril Polvo + Liquido;54000;1;5;buy_it_now;gold_special;True;;MCO3530;Otras categorías
MCO463839327;Pigmento  Tatuar Triple Black Eternal 1 Oz Tattoo & Tatuaje;43500;1;150;buy_it_now;gold_special;True;;MCO412100;Otras categorías
MCO551510808;Vendaje Parche Cicatrizante Tattoo Sknpapers Stilo Saniderm;16000;1;5;buy_it_now;gold_pro;True;;MCO412100;Otras categorías
MCO567655543;Cups Para Tinta 500und Tatto Tatuaje ;26900;250;5;buy_it_now;gold_special;True;;MCO412105;Otras categorías
MCO540359046;Separador Vial;39500;1;25;buy_it_now;gold_special;True;;MCO3530;Otras categorías
MCO557013771;Vitamina A Y D Dinarex 15oz 425gr ;50000;1;5;buy_it_now;gold_pro;True;;MCO412113;Otras categorías
MCO572128687;Dmso 99.995% Gf - 250 Ml;69900;50;5;buy_it_now;gold_pro;True;;MCO3530;Otras categorías
MCO581171226;Encendedor De Gas Recargable;15000;1;5;buy_it_now;gold_pro;True;;MCO172908;Otras categorías
MCO565463250;Soplete Encendedor Recargable Tanque Metalizado Una Llama;15900;1;5;buy_it_now;gold_pro;True;;MCO442266;Otras categorías
MCO559880916;Stencil Tattoo Proton 4,3 Onzas;31800;1;5;buy_it_now;gold_special;True;;MCO412100;Otras categorías
MCO569226358;Maquina Rotativa Extreme V2 Dragon Hawk  Tattoo Tatuaje;279900;1;5;buy_it_now;gold_special;True;;MCO412100;Otras categorías
MCO554285287;Virgen María Auxiliadora Articulo Religioso ;8000;1;5;buy_it_now;gold_special;True;;MCO116987;Otras categorías
MCO563586611;Puntas De Filtro Para Cigarrillos, En Combo 2;36900;50;5;buy_it_now;gold_pro;True;;MCO413497;Otras categorías
MCO497318450;Tinta Para Tatuar - Pigmento Tatuaje Tribal Black Perpetual;29500;1;25;buy_it_now;gold_special;True;;MCO412100;Otras categorías
MCO595283847;Pipa Importada Ref. 5525 Madera Sintética Boquilla Desmontab;9990;1;5;buy_it_now;gold_pro;True;;MCO442272;Otras categorías
MCO571464283;Tarjeta Itunes Apps Store 2 Usd Original Entrega Inmediata;13900;1;5;buy_it_now;gold_pro;True;;MCO425038;Otras categorías
MCO569259097;Maquina De Liar (maquina Para Armar) Acrílica #9;7500;1;5;buy_it_now;gold_pro;True;;MCO417903;Otras categorías
MCO462960796;Pendulo Hebreo Etiquetas, Manual Electronico, ;55000;1;100;buy_it_now;gold_pro;True;;MCO409091;Otras categorías
MCO567240901;Vendaje Cicatrizante Stilo Saniderm Sknpapers!! Dermalize;30000;1;5;buy_it_now;gold_pro;True;;MCO412100;Otras categorías
MCO534013722;Colección Los Mejores 620 Libros De Emprendimiento Aprovecha;15000;500;25;buy_it_now;gold_pro;True;;MCO3530;Otras categorías
MCO564947461;Tela Reflectiva Con Base Impermedable 1.50 De Ancho.;23000;250;5;buy_it_now;gold_special;True;;MCO3530;Otras categorías
MCO569410200;Set 6 Pigmentos Tatuajes Colores Primarios Perpetual;149900;1;5;buy_it_now;gold_special;True;;MCO412105;Otras categorías
MCO561410279;Grips Desechables X20 Und Para Agujas De Tatuar;18900;250;5;buy_it_now;gold_special;True;;MCO412106;Otras categorías
MCO597466562;Tarjeta Netflix Pin Virtual Prepago Por $30.000;36000;1;5;buy_it_now;gold_special;True;;MCO425038;Otras categorías
MCO472282197;Cafe Especial Creador Grano Origen Jardin Antioquia Blend ;24900;1;5;buy_it_now;gold_special;True;;MCO3530;Otras categorías
