id;title;price;available_quantity;sold_quantity;buying_mode;listing_type_id;accepts_mercadopago;original_price;category_id;category_name
MCO501507251;Llavero Doctor O Medico Ideal Como  Recordatorio Regalo;2200;500;2;buy_it_now;gold_pro;True;;MCO172914;Antigüedades y Colecciones
MCO571017659;Copa Para Shots Calaveritas;15900;50;2;buy_it_now;gold_pro;True;;MCO1885;Antigüedades y Colecciones
MCO452957093;Llavero De Capitan América;10000;1;3;buy_it_now;gold_pro;True;;MCO172914;Antigüedades y Colecciones
MCO484338259;Llavero Carro Lujo Ford Luxury Fiesta Fusion Explorer Edge;22900;1;25;buy_it_now;gold_special;True;;MCO172914;Antigüedades y Colecciones
MCO564317835;!gnomo Mágico!;50000;1;3;buy_it_now;gold_pro;True;;MCO1885;Antigüedades y Colecciones
MCO523982901;Billete Kirguistan 1997 , 5 Som Papel Moneda Unc;6000;1;2;buy_it_now;gold_special;True;;MCO9356;Antigüedades y Colecciones
MCO470164612;Llavero Carro Citroen Honda Audi Bmw Chevrolet Ford Lujo Mer;22990;100;50;buy_it_now;gold_special;True;;MCO172914;Antigüedades y Colecciones
MCO470452378;Llavero Carro Lujo Marca Volkswagen Jetta Voyage Gol Souveni;22900;1;5;buy_it_now;gold_special;True;;MCO172914;Antigüedades y Colecciones
MCO567293012;Bong Vidrio 12 Cm + Malla ;39900;1;5;buy_it_now;gold_special;True;;MCO1885;Antigüedades y Colecciones
MCO515552528;Pantalones De Incontinencia Para Hombres Con Bolsa De O...;171999;1;4;buy_it_now;gold_special;True;;MCO9356;Antigüedades y Colecciones
MCO474697524;Llavero Lujo Carro Honda Suzuki Subaru Bmw Audi Renault Kia;22900;100;5;buy_it_now;gold_special;True;;MCO172914;Antigüedades y Colecciones
MCO484871783;Llavero Carro Lujo Chevrolet Luxury Sail Tracker Sonic Cruze;22900;1;5;buy_it_now;gold_special;True;;MCO172914;Antigüedades y Colecciones
MCO511381363;Copa En Madera De Olivo - Cena Del Señor De Tierra Santa;15000;1;3;buy_it_now;gold_special;True;;MCO1885;Antigüedades y Colecciones
MCO552012131;Llavero Lujo Carro Cuero Trenza Elegante Mazda Cx 5 3 2  Re ;26900;1;5;buy_it_now;gold_special;True;;MCO172914;Antigüedades y Colecciones
MCO547874236;Llavero Elegante Exclusivo Carro Marca Logo Emblem Chevrolet;24000;1;3;buy_it_now;gold_special;True;;MCO172914;Antigüedades y Colecciones
MCO564015441;Ferrari Super Agata Banco Capper;259900;1;1;buy_it_now;gold_special;True;;MCO9356;Antigüedades y Colecciones
MCO564318174;Gnomos Encantados Que Cambiarán Tu Vida;47000;1;4;buy_it_now;gold_pro;True;;MCO1885;Antigüedades y Colecciones
MCO586040577;Moneda Coleccionable Alemania 1889 Alemán Reichsban Direktor;41999;1;2;buy_it_now;gold_pro;True;;MCO9355;Antigüedades y Colecciones
MCO547874432;Llavero Elegante Exclusivo Carro Marca Logo Emblema Toyota;24000;1;3;buy_it_now;gold_special;True;;MCO172914;Antigüedades y Colecciones
MCO481798475;Llavero Carro Lujo Mercedes Benz Amg Clase Cl Ca Am A2 Souve;22900;1;5;buy_it_now;gold_special;True;;MCO172914;Antigüedades y Colecciones
MCO512372324;Day Trading Oliver Velez Negociación Intradia Español;6999;1;5;buy_it_now;gold_pro;True;;MCO1885;Antigüedades y Colecciones
MCO452304847;Colombia, 200 Pesos Oro 20 De Julio 1978;30000;1;5;buy_it_now;gold_special;True;;MCO9356;Antigüedades y Colecciones
MCO470167293;Llavero Carro Lujo Peugeot 5008 3008 208 301 Partner Emblema;23900;1;5;buy_it_now;gold_special;True;;MCO172914;Antigüedades y Colecciones
MCO501738000;Llavero Lujo Carro Bmw Serie Regalo Emblema Logo Accesorio;29900;1;4;buy_it_now;gold_special;True;;MCO172914;Antigüedades y Colecciones
MCO553059012;Carta Personalizada Aceptación Harry Potter Sellada En Cera;25000;1;25;buy_it_now;gold_pro;True;;MCO1885;Antigüedades y Colecciones
MCO577478868;Moneda Predicción Ojos Que Todo Lo Ven Angel ;12900;1;3;buy_it_now;gold_pro;True;;MCO9355;Antigüedades y Colecciones
MCO571593486;52 Billetes Del Mundo De 28 Países Distintos Con Funda Roja;180000;1;2;buy_it_now;gold_special;True;;MCO9356;Antigüedades y Colecciones
MCO514537899;Llavero Carro Lujo Marca Audi A4 A3 A5 A7 Q7 Q8 Tt Accesorio;22900;1;4;buy_it_now;gold_special;True;;MCO172914;Antigüedades y Colecciones
MCO452811388;Cortador De Foamy   E Icopor;50000;1;100;buy_it_now;gold_special;True;;MCO1885;Antigüedades y Colecciones
MCO514538043;Llavero Carro Lujo Marca Honda Cr Civic Fit Accord Hr Wr Cbr;22900;1;5;buy_it_now;gold_special;True;;MCO172914;Antigüedades y Colecciones
MCO470956790;Llavero Carro Lujo Volkswagen Jetta Cross Tiguan Golf Porta ;22900;1;5;buy_it_now;gold_special;True;;MCO172914;Antigüedades y Colecciones
MCO571615804;Llavero Lujo Carro Marca Logo Kia Trenza Cuerda Cuero Elegan;24900;1;3;buy_it_now;gold_special;True;;MCO172914;Antigüedades y Colecciones
MCO552199570;Atrapasueños ;20000;1;5;buy_it_now;gold_pro;True;;MCO1885;Antigüedades y Colecciones
MCO571747143;Billetes Antiguos De Colombia Originales Set De Colección ;1299000;1;1;buy_it_now;gold_special;True;;MCO9356;Antigüedades y Colecciones
MCO586757459;Moneda Conmemorativa Medalla Emblema Marina Us Navy Militar;41999;1;2;buy_it_now;gold_pro;True;;MCO9355;Antigüedades y Colecciones
MCO510144312;Caja Recordatorio En Mdf ;2800;1;50;buy_it_now;gold_pro;True;;MCO1885;Antigüedades y Colecciones
MCO507598389;Llavero Carro Lujo Nissan Qashqai Sentra March X Versa Regal;22900;1;3;buy_it_now;gold_special;True;;MCO172914;Antigüedades y Colecciones
MCO580097559;Llavero Lujo Carro Tipo Trenza Cuerda Cuero Logo Marc Ford  ;26900;1;2;buy_it_now;gold_special;True;;MCO172914;Antigüedades y Colecciones
MCO567962884;Billete 2 Dolar Dorado Certificado De Plata;12000;1;3;buy_it_now;gold_pro;True;;MCO9356;Antigüedades y Colecciones
MCO529325207;Masa Porcelanicron X 6 Colores;32100;1;5;buy_it_now;gold_special;True;;MCO1885;Antigüedades y Colecciones
MCO527870713;Cuerda Colgante Cuello Porta Llaver Tira Marca Logo Renault ;21900;1;5;buy_it_now;gold_special;True;;MCO172914;Antigüedades y Colecciones
MCO484888108;Llavero Lujo Carro Chevrolet Sail Cruze Sonic Tracker Acceso;22900;1;5;buy_it_now;gold_special;True;;MCO172914;Antigüedades y Colecciones
MCO580097752;Llavero De Lujo Carro Marca Logo Jeep Cherokee Compass Rene ;22900;1;2;buy_it_now;gold_special;True;;MCO172914;Antigüedades y Colecciones
MCO557178781;Telar Para Mostacilla O Miyuki En Madera De Pino Expansible;63900;50;5;buy_it_now;gold_pro;True;;MCO1885;Antigüedades y Colecciones
MCO548197679;Billete De 1000 Pesos 1995 Colombia.;5000;1;5;buy_it_now;gold_special;True;;MCO9356;Antigüedades y Colecciones
MCO586784860;Moneda Conmemorativa Emblema Calendario Azteca Maya Mexicana;41999;1;2;buy_it_now;gold_pro;True;;MCO9355;Antigüedades y Colecciones
MCO569793202;Llavero Lujo Moto Marca Logo Emblema Suzuki Gsxr Cuerda Ganc;19990;1;3;buy_it_now;gold_special;True;;MCO172914;Antigüedades y Colecciones
MCO454576626;Cortador De Icopor Con Transformador  110 V ;30000;1;100;buy_it_now;gold_special;True;;MCO1885;Antigüedades y Colecciones
MCO580097273;Llavero Lujo Camioneta Logo Marca Dodge Durango Journey Eleg;25000;1;2;buy_it_now;gold_special;True;;MCO172914;Antigüedades y Colecciones
MCO453762480;Cupón Espécimen Banco Hipotecario De Bogotá 19 (30);14000;1;5;buy_it_now;gold_special;True;;MCO9356;Antigüedades y Colecciones
MCO507599322;Llavero Carro Lujo Marca Jaguar Xf Xe Xj E-pace F-pace Logo;23900;1;3;buy_it_now;gold_special;True;;MCO172914;Antigüedades y Colecciones
MCO525775491;Gallina Pintadita Cojín Silueta Recuerdo Shower Cumpleaños ;4500;1;25;buy_it_now;gold_pro;True;;MCO1885;Antigüedades y Colecciones
MCO540229459;Llavero Lujo Elegante Carro Marca Subaru Emblema Logo Xv Wrx;22900;1;4;buy_it_now;gold_special;True;;MCO172914;Antigüedades y Colecciones
MCO451859914;Moneda Dos Caras - Villano Harvey Dent - Pelicula Batman;50000;1;25;buy_it_now;gold_special;True;;MCO9355;Antigüedades y Colecciones
MCO481799626;Llavero Carro Lujo Mistubishi Souvenir Accesorio Porta Llave;22900;1;4;buy_it_now;gold_special;True;;MCO172914;Antigüedades y Colecciones
MCO564154235;Atrapasueños ;30000;1;2;buy_it_now;gold_pro;True;;MCO1885;Antigüedades y Colecciones
MCO517330712;Mexico, 200 Pesos 13 May 2015 Serie Be P125l;66000;1;2;buy_it_now;gold_special;True;;MCO9356;Antigüedades y Colecciones
MCO515815702;Llavero Metálico Máscara Iron Man Avengers Marvel Original;9900;1;5;buy_it_now;gold_pro;True;;MCO172914;Antigüedades y Colecciones
MCO569793655;Llavero Lujo Moto Logo Ducati Corse Panigale Monster Cuerda;19990;1;2;buy_it_now;gold_special;True;;MCO172914;Antigüedades y Colecciones
MCO564591750;Reloj Collar Snitch Harry Potter;49900;1;5;buy_it_now;gold_pro;True;;MCO1885;Antigüedades y Colecciones
MCO453216276;Etiopia 5 Birr 2017;9000;1;3;buy_it_now;gold_special;True;;MCO9356;Antigüedades y Colecciones
MCO595190645;Llavero Lujo Marca Logo Car Honda Crv Civic Accord Wr Pilot ;23900;1;2;buy_it_now;gold_special;True;;MCO172914;Antigüedades y Colecciones
MCO548343838;Moneda Colección Departamento De Policía New York Blue Lives;16960;1;4;buy_it_now;gold_pro;True;;MCO9355;Antigüedades y Colecciones
MCO506064376;Silbato Artesanal Azteca;36000;1;5;buy_it_now;gold_special;True;;MCO1885;Antigüedades y Colecciones
MCO522430685;Bts Army Bomb Versión 3 Kpop Bluetooth;239900;1;5;buy_it_now;gold_special;True;;MCO172914;Antigüedades y Colecciones
MCO468074985;Llavero Carro Lujo Volvo Accesorio Regalo Souvenir Xc V S C;22900;1;4;buy_it_now;gold_special;True;;MCO172914;Antigüedades y Colecciones
MCO575350580;Tintilla Betún De Judea Para Madera Y Más.... La Original ;6000;1;5;buy_it_now;gold_special;True;;MCO1885;Antigüedades y Colecciones
MCO577461403;Somalia 1000 Shillings 2016;10000;1;3;buy_it_now;gold_special;True;;MCO9356;Antigüedades y Colecciones
MCO516696554;Llavero Casco Moto Cafe Racer Jet Mini Rojo Estrella Scooter;13990;1;3;buy_it_now;gold_special;True;;MCO172914;Antigüedades y Colecciones
MCO480560515;Llavero Lujo Mini Casco Motociclista Carro Metalico Regalo A;10000;50;5;buy_it_now;gold_special;True;;MCO172914;Antigüedades y Colecciones
MCO455449906;Cortador De Foamy Y Icopor Artomad;50000;1;50;buy_it_now;gold_special;True;;MCO1885;Antigüedades y Colecciones
MCO501115251;Llavero Carro Metalico Marca Bmw Serie 3 X3 Regal Accesor Sp;17000;1;5;buy_it_now;gold_special;True;;MCO172914;Antigüedades y Colecciones
MCO470112656;Eeuu, 2 Dollars 2009 P516a;19000;1;5;buy_it_now;gold_special;True;;MCO9356;Antigüedades y Colecciones
MCO566518265;1 Peso 1956,casa De La Moneda De Santa Fe, Llamado Pinilla. ;170000;1;2;buy_it_now;gold_pro;True;;MCO9355;Antigüedades y Colecciones
MCO561512918;Masa Porcelanicron 3 Libras;16500;50;5;buy_it_now;gold_special;True;;MCO1885;Antigüedades y Colecciones
MCO512230056;Llavero Lujo Carro Marca Toyota Logo Emblema Regalo Souvenir;15900;1;2;buy_it_now;gold_special;True;;MCO172914;Antigüedades y Colecciones
MCO452449731;Llavero Casco Moto Miniatura Escala Metálico Souvenir Carro;9990;50;50;buy_it_now;gold_pro;True;;MCO172914;Antigüedades y Colecciones
MCO552705059;Eeuu, 2 Dollars 2013 P538;20000;1;5;buy_it_now;gold_special;True;;MCO9356;Antigüedades y Colecciones
MCO548222803;Cuerdas Tratadas Para Shibari, Bondage, Kinbaku ;98990;50;5;buy_it_now;gold_special;True;;MCO1885;Antigüedades y Colecciones
MCO472325674;Llavero Mini Lujo Llanta Carro Rines Negro Plata Dorado Esca;9990;50;5;buy_it_now;gold_special;True;;MCO172914;Antigüedades y Colecciones
MCO507544239;Army Bomb Bts Bluetooh Version 3;249900;1;5;buy_it_now;gold_special;True;;MCO172914;Antigüedades y Colecciones
MCO467954923;Bitcoin Moneda Conmemorativa Coleccionable - Estuche;21500;1;5;buy_it_now;gold_special;True;;MCO9355;Antigüedades y Colecciones
MCO535176568;Principito En Origami - Producto Artesanal - Regalo;15000;1;5;buy_it_now;gold_special;True;;MCO1885;Antigüedades y Colecciones
MCO562202437;Fajó 100 Billetes De 20 Soberanos Nuevos;15000;1;2;buy_it_now;gold_pro;True;;MCO9356;Antigüedades y Colecciones
MCO587579879;Tractomulas Simex Carros Simex;12000;1;4;buy_it_now;gold_pro;True;;MCO439433;Antigüedades y Colecciones
MCO560901342;Escultura De Toro De Hierro (25cm) - Arte Y Decoración;125000;1;5;buy_it_now;gold_pro;True;;MCO442201;Antigüedades y Colecciones
MCO513521167;Album Para Fotos Personalizado;35000;1;5;buy_it_now;gold_pro;True;;MCO1885;Antigüedades y Colecciones
MCO566079798;Abridor De Tapas De Frascos;70900;1;2;buy_it_now;gold_special;True;;MCO172914;Antigüedades y Colecciones
MCO534088801;Mapamundi Premium Deluxe Para Raspar + Kit Para Raspar;70000;1;4;buy_it_now;gold_pro;True;;MCO168946;Antigüedades y Colecciones
MCO507519338;Yemen 200 Rials Nd2018 P38;17000;1;3;buy_it_now;gold_special;True;;MCO9356;Antigüedades y Colecciones
MCO553158458;Repisas Para Coleccionar Carritos!!!;110000;1;5;buy_it_now;gold_special;True;;MCO1885;Antigüedades y Colecciones
MCO481256931;Moneda Bitcoin Conmemorativa Dorara;22000;1;3;buy_it_now;gold_pro;True;;MCO9355;Antigüedades y Colecciones
MCO454965353;Lámpara Turca Para Colgar #3;170000;1;4;buy_it_now;gold_special;True;;MCO439433;Antigüedades y Colecciones
MCO584438049;100 Llavero Acrilico;75000;1;3;buy_it_now;gold_special;True;;MCO172914;Antigüedades y Colecciones
MCO452374845;Masa Porcelanicron X 5 Colores;27500;1;50;buy_it_now;gold_special;True;;MCO1885;Antigüedades y Colecciones
MCO569793539;Colombia 1000 Pesos 7 May 2002 Bgw439d;13000;1;2;buy_it_now;gold_special;True;;MCO9356;Antigüedades y Colecciones
MCO540724380;Alcancía Electrónica De Monedas Oso Panda Tipo Roba Monedas;36000;1;4;buy_it_now;gold_pro;True;;MCO30107;Antigüedades y Colecciones
MCO594092215;Cuerdas Tratadas Para Shibari, Bondage, Kinbaku Bdsm;50000;50;4;buy_it_now;gold_special;True;;MCO1885;Antigüedades y Colecciones
MCO476718302;8 Trompetas Para Decorar No Funcionan Precio X C/u;150000;1;3;buy_it_now;gold_pro;True;;MCO439433;Antigüedades y Colecciones
MCO553447228;Candela Granada Smoke;11000;1;5;buy_it_now;gold_special;True;;MCO172914;Antigüedades y Colecciones
MCO571771198;Colombia 1 Peso Oro 2 De Enero 1893;90000;1;4;buy_it_now;gold_special;True;;MCO9356;Antigüedades y Colecciones
MCO505966351;Mesa Auxiliar Redonda Decorativa Estilo Vintage ;119900;1;5;buy_it_now;gold_special;True;;MCO1885;Antigüedades y Colecciones
MCO475893020;Álbum Catalogo Para Guardar 400 Monedas Antiguas Colombianas;62500;1;50;buy_it_now;gold_special;True;;MCO9355;Antigüedades y Colecciones
MCO581039243;Mascotas Colección 4 Perros Decoración Poliresina ;17900;1;2;buy_it_now;gold_special;True;;MCO442201;Antigüedades y Colecciones
MCO590951113;Licorera 9oz + Embudo;38000;50;3;buy_it_now;gold_special;True;;MCO413494;Antigüedades y Colecciones
MCO577600978;Zurriago O Perrero Personalizado ;50000;1;3;buy_it_now;gold_pro;True;;MCO1885;Antigüedades y Colecciones
MCO558390942;Gambia 10 Dalasis 2019;13000;1;2;buy_it_now;gold_special;True;;MCO9356;Antigüedades y Colecciones
MCO591159068;Llavero Rastreador Bluetooth Mascotas Llaves;11000;50;2;buy_it_now;gold_pro;True;;MCO172914;Antigüedades y Colecciones
MCO595651437;Combo Mapa Mundo Y Colombia  Para Raspar Mapa Scratch Poster;69900;500;2;buy_it_now;gold_pro;True;;MCO168946;Antigüedades y Colecciones
MCO562029591;Dos Cuernos Vikingos Para Beber Cerveza Personalizados ;46000;1;5;buy_it_now;gold_special;True;;MCO1885;Antigüedades y Colecciones
MCO595628097;Colombia Moneda 2 Centavos 1959;5000;1;4;buy_it_now;gold_special;True;;MCO9355;Antigüedades y Colecciones
MCO562198976;Fajó 100 Billetes 5 Soberanos Nuevos;9000;1;2;buy_it_now;gold_pro;True;;MCO9356;Antigüedades y Colecciones
MCO585409629;1 Llavero Resorte En Espiral Largo Universal Motos/carro;4000;1;2;buy_it_now;gold_pro;True;;MCO172914;Antigüedades y Colecciones
MCO446095143;Novacan Black Patina Para Soldadura;137000;1;2;buy_it_now;gold_special;True;;MCO1885;Antigüedades y Colecciones
MCO554577307;Campana Aplique En Bronce ;140000;1;5;buy_it_now;gold_pro;True;;MCO392531;Antigüedades y Colecciones
MCO530118025;Pack 10 Muñecos Shopkins Juguetes Niñas Envió Al Azar Muñeca;17000;1;5;buy_it_now;gold_pro;True;;MCO1885;Antigüedades y Colecciones
MCO531175201;Barco Dentro De Botella Horizontal Mediano Decorativo Escala;7900;50;5;buy_it_now;gold_special;True;;MCO172910;Antigüedades y Colecciones
MCO459636635;Nicaragua 10 Cordobas 28 Mar 2014 P209 Plastico;9000;1;5;buy_it_now;gold_special;True;;MCO9356;Antigüedades y Colecciones
MCO480278760;Llaveros Plumas Y Atrapasueños;24997;1;2;buy_it_now;gold_special;True;;MCO172914;Antigüedades y Colecciones
MCO452304865;Sierra Leona 1000 Leones 2013;9500;1;3;buy_it_now;gold_special;True;;MCO9355;Antigüedades y Colecciones
MCO459104481;Bricero Antiguo Para Lampara En Cristal Precio X C/u;40000;1;2;buy_it_now;gold_special;True;;MCO439433;Antigüedades y Colecciones
MCO533086441;Deshumidificador Silencioso Y Portátil Hysure Eléctrico, Des;509000;1;1;buy_it_now;gold_special;True;;MCO1885;Antigüedades y Colecciones
MCO492359296;Llavero Metálico Manchester United;10000;250;5;buy_it_now;gold_special;True;;MCO172914;Antigüedades y Colecciones
MCO453488521;Venezuela 1 Bolivar 5 Oct 1989 Serie A 8 Dig P68;5000;1;4;buy_it_now;gold_special;True;;MCO9356;Antigüedades y Colecciones
MCO507616605;Figura Antigua En Cristal Y Laminilla Italy Precio X C/u ;40000;1;2;buy_it_now;gold_special;True;;MCO439433;Antigüedades y Colecciones
MCO448624740;Brookside Dark Chocolate Candy Y Sabor A Arándanos Dulces,;291000;1;1;buy_it_now;gold_special;True;;MCO1885;Antigüedades y Colecciones
MCO515371227;Afiches Posters Personalizados Con Las Imágenes Que Desees;6900;500;50;buy_it_now;gold_pro;True;;MCO168946;Antigüedades y Colecciones
MCO447229362;6 Afiches Posters Personalizados Con Las Imágenes Que Desees;29900;5000;500;buy_it_now;gold_pro;True;;MCO168946;Antigüedades y Colecciones
MCO592019334;Poster Retablo Stranger Things [40x60cms] [ref. Pst0401];44900;50;5;buy_it_now;gold_special;True;;MCO430305;Antigüedades y Colecciones
MCO556500365;Zooboo Hombre Algodón Kendo Aikido Hapkido Hakama Artes;281000;1;1;buy_it_now;gold_special;True;;MCO1885;Antigüedades y Colecciones
MCO453261633;Rumania 1 Leu 1 Jul 2005 P117a;9000;1;3;buy_it_now;gold_special;True;;MCO9356;Antigüedades y Colecciones
MCO465189790;Moneda Jordan 23 Chicago Bulls Basketball Nike Nba adidas;39990;1;4;buy_it_now;gold_pro;True;;MCO9355;Antigüedades y Colecciones
MCO451552312;Topper Novios Porcelanicron , Diseños Personalizados;40000;50;25;buy_it_now;gold_special;True;;MCO1885;Antigüedades y Colecciones
MCO578163607;Plancha En Acero 4340. 57*30 .. Asados;160000;1;3;buy_it_now;gold_special;True;;MCO442136;Antigüedades y Colecciones
MCO507517837;Tailandia 20 Bath Nd2018 P135;8000;1;2;buy_it_now;gold_special;True;;MCO9356;Antigüedades y Colecciones
MCO466746253;Mapamundi Vintage- Mapa;28000;1;5;buy_it_now;gold_special;True;;MCO168946;Antigüedades y Colecciones
MCO487416735;Garra Retirar Cat Scratch Spray Disuasivo 8oz;113990;1;2;buy_it_now;gold_special;True;;MCO1885;Antigüedades y Colecciones
MCO559949182;Escultura De Don Quijote De Hierro (50cm) - Decoración;125000;1;4;buy_it_now;gold_pro;True;;MCO442201;Antigüedades y Colecciones
MCO597589819;I-ching, Set Monedas De China Originales;40000;1;5;buy_it_now;gold_special;True;;MCO9355;Antigüedades y Colecciones
MCO592018968;Poster Retablo Naruto [40x60cms] [ref. Pot0440];44900;50;3;buy_it_now;gold_special;True;;MCO430305;Antigüedades y Colecciones
MCO578970324;Cuerno Para Beber Vikingo De Cuerno De Buey Genuino;257900;1;2;buy_it_now;gold_special;True;;MCO1885;Antigüedades y Colecciones
MCO472440882;Clip De Dinero Presidencial En Capas De Oro Monedas De Tesor;143990;1;5;buy_it_now;gold_special;True;;MCO9356;Antigüedades y Colecciones
MCO596908668;Poster Retablo Boku No Hero [40x24cms] [ref. Pot0414];25900;50;3;buy_it_now;gold_special;True;;MCO430305;Antigüedades y Colecciones
MCO580887034;Campana De Hierro Fundido Con Soporte Por Colonial Tin Works;247990;1;5;buy_it_now;gold_pro;True;;MCO392531;Antigüedades y Colecciones
MCO533080999;Bestpysanky Carrusel Con Figurita De Caja Musical De Caballo;278000;1;1;buy_it_now;gold_special;True;;MCO1885;Antigüedades y Colecciones
MCO455963218;Nemesis Mujer `s Frb925k Punk Rock Colección Sugar Cráneo;353000;1;0;buy_it_now;gold_special;True;;MCO439433;Antigüedades y Colecciones
MCO466453246;Colombia 5000 Pesos Oro 31 Eneo 1992;50000;1;5;buy_it_now;gold_special;True;;MCO9356;Antigüedades y Colecciones
MCO563994413;Colombia Lazareto 1 Centavo 1921 Jer348.01;15000;1;2;buy_it_now;gold_special;True;;MCO9355;Antigüedades y Colecciones
MCO513459356;Sombrero De Luffy Cosplay Playa Del Anime One Piece;59900;1;5;buy_it_now;gold_pro;True;;MCO1885;Antigüedades y Colecciones
MCO525400738;Brewdemon Fermentador Cónico - Ámbar;351000;1;1;buy_it_now;gold_special;True;;MCO172910;Antigüedades y Colecciones
MCO487638665;Vivaplex, 24, Cobalt Blue, 10 Ml Botellas Roll-on De Vidrio ;107990;1;5;buy_it_now;gold_special;True;;MCO172910;Antigüedades y Colecciones
MCO562275851;Catalogo Monedas Y Billetes De Colombia Ultima Edición;49990;1;3;buy_it_now;gold_pro;True;;MCO9356;Antigüedades y Colecciones
MCO577887122;Modelo 3d Stl Batman Dioramas Por Unidad;6300;150;5;buy_it_now;gold_special;True;;MCO1885;Antigüedades y Colecciones
MCO561301579;Dos Universal Cintas  Para Máquina De Escribir ;86900;1;5;buy_it_now;gold_special;True;;MCO442097;Antigüedades y Colecciones
MCO582006436;Escritorio De Cuero Protector De Oficina Pista Alfombri...;145496;1;2;buy_it_now;gold_special;True;;MCO442097;Antigüedades y Colecciones
MCO484352206;Akfal Side Mount Inodoro Palanca De Latón Manija Para Toto ;163990;1;3;buy_it_now;gold_special;True;;MCO439433;Antigüedades y Colecciones
MCO509181476;Corola Mi Primer Abrazo De La Muñeca - Pastel Con Encanto ;219990;1;1;buy_it_now;gold_special;True;;MCO1885;Antigüedades y Colecciones
MCO447444887;Johnson Level & Tool 1411-0600 4 Vial, Nivel De Torpedo De;221000;1;2;buy_it_now;gold_special;True;;MCO9356;Antigüedades y Colecciones
MCO458678625;Bitcoin X10 Monedas Oro .999 Conmemorativas Coleccionables;109900;1;5;buy_it_now;gold_special;True;;MCO9355;Antigüedades y Colecciones
MCO487638699;Vivaplex, 24, Frosted Amber, 10 Ml Botellas Roll-on De Vidri;120990;1;4;buy_it_now;gold_special;True;;MCO172910;Antigüedades y Colecciones
MCO559247541;Lampara Totoro Recargable Artefacto Store;58000;1;3;buy_it_now;gold_pro;True;;MCO1885;Antigüedades y Colecciones
MCO515110755;Vivaplex, 24, Cobalt Blue, 10 Ml Botellas Roll-on De Vidrio;132900;1;5;buy_it_now;gold_special;True;;MCO172910;Antigüedades y Colecciones
MCO585669350;Flexcut Cuchillo Carvin Jack Para Mano Derecho Plegable Con ;608990;1;1;buy_it_now;gold_pro;True;;MCO416694;Antigüedades y Colecciones
MCO497497369;Llavero Porta Billetes, Cashstash, Impermeable. True Utility;43900;1;3;buy_it_now;gold_pro;True;;MCO1885;Antigüedades y Colecciones
MCO517229417;Australia, 5 Dollars 2016 P62  Plastico;39000;1;5;buy_it_now;gold_special;True;;MCO9356;Antigüedades y Colecciones
MCO571295822;Telescopio  London 1920 - Esponja De Latón Macizo;321900;1;3;buy_it_now;gold_special;True;;MCO439433;Antigüedades y Colecciones
MCO465581365;1000 Pesos 1996 Nueva;25000;1;5;buy_it_now;gold_special;True;;MCO9355;Antigüedades y Colecciones
MCO555235304;Globo Terraqueo 15 Cms Luz Con Base Blanca;110000;1;5;buy_it_now;gold_pro;True;;MCO1885;Antigüedades y Colecciones
MCO595438018;Colombia 10000 Pesos  1993 Mujer Embera ;100000;1;5;buy_it_now;gold_special;True;;MCO9356;Antigüedades y Colecciones
MCO567571232;Kit De Escultura De Calabazas;117900;1;2;buy_it_now;gold_special;True;;MCO442201;Antigüedades y Colecciones
MCO581220489;Póster Del Mapa Del Mundo Para Raspar;95900;1;2;buy_it_now;gold_special;True;;MCO168946;Antigüedades y Colecciones
MCO513675087;Set X 5 De Manillas League Of Legends - Todos Los Roles;20000;50;4;buy_it_now;gold_pro;True;;MCO1885;Antigüedades y Colecciones
MCO566106775;Toca Discos De Maleta;379900;1;1;buy_it_now;gold_special;True;;MCO442107;Antigüedades y Colecciones
MCO549167297;Llavero Darth Vader  -star Wars Led;16900;1;3;buy_it_now;gold_special;True;;MCO172914;Antigüedades y Colecciones
MCO537322218;Availablegame 100 Dólares De Dinero De Juego Para Los Juegos;110000;1;1;buy_it_now;gold_special;True;;MCO9356;Antigüedades y Colecciones
MCO455468932;41 Sao Sword Art Online Kirito Kirigaya Kazuto Dark;180000;1;2;buy_it_now;gold_special;True;;MCO1885;Antigüedades y Colecciones
MCO456035218;Moneda 5000 Pesos 2017 Cundinamarca Antonio Nariño;30000;1;25;buy_it_now;gold_special;True;;MCO9355;Antigüedades y Colecciones
MCO593013119;Design Toscano - Estatua Conmemorativa Para Perro, Grande, L;217900;1;1;buy_it_now;gold_special;True;;MCO442201;Antigüedades y Colecciones
MCO493192977;Llavero Calavera Sentada Inodoro Creativo Promocion Hallowen;8960;1;5;buy_it_now;gold_pro;True;;MCO172914;Antigüedades y Colecciones
MCO485545850;Taito 7 Kantai Collection Kancolle Shimakaze Figure;245990;1;1;buy_it_now;gold_special;True;;MCO1885;Antigüedades y Colecciones
MCO562104478;Colombia 2000 Pesos  17 De Diciembre 1994;28000;1;4;buy_it_now;gold_special;True;;MCO9356;Antigüedades y Colecciones
MCO593549042;Poster Retablo Naruto [40x60cms] [ref. Pot0446];44900;50;2;buy_it_now;gold_special;True;;MCO430305;Antigüedades y Colecciones
MCO487860904;Álbum Folder Para Guardar 60 Billetes Antiguos ;49000;1;25;buy_it_now;gold_pro;True;;MCO9356;Antigüedades y Colecciones
MCO590868197;Productos Traídos De Cuba;73000;1;0;buy_it_now;gold_pro;True;;MCO1885;Antigüedades y Colecciones
MCO560712801;Mapa Mundi Gigante, Antiguo, Laminado, Encapsulado, De 77.5;192900;1;1;buy_it_now;gold_special;True;;MCO439433;Antigüedades y Colecciones
MCO560164909;Summit Designs - Juego De 4 Póster De Acuarela De Fútbol;123900;1;1;buy_it_now;gold_special;True;;MCO9355;Antigüedades y Colecciones
MCO567927300;Catalogo De Precios De Monedas Y Billetes De Colombia Pph;39000;1;5;buy_it_now;gold_special;True;;MCO441114;Antigüedades y Colecciones
