id;title;price;available_quantity;sold_quantity;buying_mode;listing_type_id;accepts_mercadopago;original_price;category_id;category_name
MCO550552532;Plancha Cabello Remington Keratina Argan  230 C Original;119990;50;500;buy_it_now;gold_pro;True;;MCO4598;Electrodomésticos
MCO554915369;Plancha Remington Macadamia Y Aguacate ;119990;50;200;buy_it_now;gold_pro;True;;MCO4598;Electrodomésticos
MCO567913224;Timer O Reloj Para Nevera Haceb O Mabe;45000;1;2;buy_it_now;gold_pro;True;;MCO438219;Electrodomésticos
MCO563527514;Freidora De Aire Oster Air Fryer Bioceramic 3.2lt;349900;1;50;buy_it_now;gold_pro;True;;MCO117975;Electrodomésticos
MCO585710488;Aspiradora Barredora 2 En 1 Electrolux Stk10;149900;50;100;buy_it_now;gold_special;True;;MCO115340;Electrodomésticos
MCO551307689;Samsung Da97  14474 C Assy Bandeja De Hielo;947990;1;1;buy_it_now;gold_pro;True;;MCO115336;Electrodomésticos
MCO501363460;Cepillo Secador Revlon Salon One-step Hair Dryer - Volumizer;274990;1;250;buy_it_now;gold_special;True;;MCO4597;Electrodomésticos
MCO568426731;Robot Aspiradora Trapeador 3000pa Mapa Wifi El Mejor;1699999;1;25;buy_it_now;gold_special;True;;MCO176770;Electrodomésticos
MCO530751267;Pure Enrichment Mistaire Studio Humidificador Ultrasónico De;225000;1;1;buy_it_now;gold_special;True;;MCO115335;Electrodomésticos
MCO554937669;Plancha Remington Y Aceite De Argán ;129990;50;150;buy_it_now;gold_pro;True;;MCO4598;Electrodomésticos
MCO573464779;Aspiradora Robot Barredora Automatica Gran Calidad;579999;1;5;buy_it_now;gold_special;True;;MCO176770;Electrodomésticos
MCO562461637;Termostato Para Neveras Convencionales;32000;1;5;buy_it_now;gold_special;True;;MCO398572;Electrodomésticos
MCO456810974;Arrocera Multiusos De 7 Tazas Negra;109900;50;150;buy_it_now;gold_special;True;135000.0;MCO117982;Electrodomésticos
MCO507509701;Nevera No Frost 300 Lts. Brutos Grafito Mabe - Rma300fbcg;1299900;1;250;buy_it_now;gold_special;True;1679900.0;MCO115334;Electrodomésticos
MCO581947258;Limpiador A Vapor Multiusos Para Desinfectar,cocina,baño Mas;149900;50;25;buy_it_now;gold_pro;True;;MCO117987;Electrodomésticos
MCO456811193;Plancha De Vapor Con Base Antiadherente Morado;51850;50;250;buy_it_now;gold_pro;True;61000.0;MCO115342;Electrodomésticos
MCO558601537;Licuadora Home Elements 2 Años De Garantía ;87400;1;500;buy_it_now;gold_pro;True;;MCO163045;Electrodomésticos
MCO562776035;Kit De Arranque  Para Neveras Multimarcas;47000;1;2;buy_it_now;gold_special;True;;MCO430650;Electrodomésticos
MCO478825440;Bascula Digital Personal Pesa Balanza Baño Pantalla Lcd 180k;44900;1;250;buy_it_now;gold_special;True;;MCO169104;Electrodomésticos
MCO558812429;Molino Corona Tradicional Maquina De Moler Granos ;98000;1;500;buy_it_now;gold_special;True;;MCO30109;Electrodomésticos
MCO568467486;Motor Ventilador Nevera Haceb Original 12v! Envío!;165000;1;1;buy_it_now;gold_pro;True;;MCO398574;Electrodomésticos
MCO568500103;Nebulizador Portatil Adultos Niños 2 Mascarillas Asma;79999;1;25;buy_it_now;gold_pro;True;;MCO166750;Electrodomésticos
MCO569816447;Maquina Peluqueria Corte Cabello Barberia Cuchillas;29990;100;50;buy_it_now;gold_pro;True;;MCO5411;Electrodomésticos
MCO564821724;Xiaomi Generador De Agua Desinfectante Portátil Hipocloritol;201900;1;2;buy_it_now;gold_special;True;;MCO433579;Electrodomésticos
MCO578606069;Plancha Mini Viajera Para Cabello Ceramica Nueva Garantia;7800;1;50;buy_it_now;gold_special;True;;MCO4598;Electrodomésticos
MCO577248172;Vicks Inhalador;18100;1;100;buy_it_now;gold_special;True;;MCO166750;Electrodomésticos
MCO497909825;LG Lt700p 469690 Adq36006101 Filtro De Agua Para Nevera, Com;197990;1;1;buy_it_now;gold_special;True;;MCO433579;Electrodomésticos
MCO453231859;Cafetera Oster Primalatte;598000;1;100;buy_it_now;gold_special;True;;MCO4340;Electrodomésticos
MCO579762883;Plancha De Cabello A Vapor Original Steam Styler Profesional;107250;1;25;buy_it_now;gold_special;True;;MCO4598;Electrodomésticos
MCO562775970;Kit De Arranque  Para Neveras Multimarcas;42000;1;3;buy_it_now;gold_special;True;;MCO430650;Electrodomésticos
MCO495152651;Gramera Pesa Bascula Digital 10k Garantía Sf-400 + Baterías ;17500;1;250;buy_it_now;gold_special;True;;MCO166181;Electrodomésticos
MCO532299173;Grill Asador Panini Copper ;96990;1;100;buy_it_now;gold_pro;True;;MCO163035;Electrodomésticos
MCO548356527;Bombillo Para Nevera-led;28000;50;5;buy_it_now;gold_pro;True;;MCO418498;Electrodomésticos
MCO551477950;Exprimidor De Naranjas Eléctrico Kalley · Garantía 2 Años;59900;1;100;buy_it_now;gold_special;True;;MCO163221;Electrodomésticos
MCO534865259;Estufa De Inducción 2 Puestos;490000;1;50;buy_it_now;gold_pro;True;;MCO115311;Electrodomésticos
MCO575612546;Timer De Descongelación 6 Horas 21min Referencia Supco 2143 ;27000;1;2;buy_it_now;gold_special;True;;MCO398572;Electrodomésticos
MCO565435536;Calentador Ambiente Portátil Handy Heater Calefacción ;49900;1;150;buy_it_now;gold_pro;True;;MCO438142;Electrodomésticos
MCO509410939;Bascula - Peso Balanza Digital Con Monitor De Grasa Corporal;100000;1;25;buy_it_now;gold_pro;True;;MCO169104;Electrodomésticos
MCO570636796;Bimetalico Con Termofusible Para Nevera Samsung Y Challenger;26800;1;2;buy_it_now;gold_pro;True;;MCO414221;Electrodomésticos
MCO574078976;Secador De Pelo Gama Diamond My Style - Gama My Style;98900;1;25;buy_it_now;gold_special;True;;MCO4597;Electrodomésticos
MCO583537496;Olla Freidora Dkasa 5 Litros Air Fryer 80% Menos Aceite;394000;1;25;buy_it_now;gold_special;True;;MCO117975;Electrodomésticos
MCO571804604;Resistencia De Descongelación De 51 Cm Para Neveras Mabe;26000;1;2;buy_it_now;gold_special;True;;MCO398578;Electrodomésticos
MCO456811265;Cuchilla Picahielo 4 Aspas;15600;1;150;buy_it_now;gold_special;True;;MCO441157;Electrodomésticos
MCO546609832;Bascula Con Monitor De Composicion Corporal Omron Hbf-514c;417900;1;50;buy_it_now;gold_special;True;;MCO169104;Electrodomésticos
MCO588417719;Membrana O Diafragma Doble Oreja 73 Mm Para Calentador ;26000;1;2;buy_it_now;gold_special;True;;MCO438219;Electrodomésticos
MCO592485155;Cepillo Secador Rizador 3 En 1 Electronico One Step;89900;1;50;buy_it_now;gold_special;True;;MCO180960;Electrodomésticos
MCO558445958;Cafetera Prensa Francesa 350 Ml;32900;1;150;buy_it_now;gold_special;True;;MCO4340;Electrodomésticos
MCO555658597;Repuesto Nevera Haceb Tarjeta N370/420 Original! Envío!!;139000;1;2;buy_it_now;gold_pro;True;;MCO398573;Electrodomésticos
MCO571522940;Limpiador A Vapor Multiusos - Envíos A Todo El País!!;149990;1;100;buy_it_now;gold_special;True;;MCO117987;Electrodomésticos
MCO477169194;Exprimidor De Naranjas Industrial Grande Aluminio ¡obsequio!;70000;1;200;buy_it_now;gold_special;True;;MCO163221;Electrodomésticos
MCO568912789;Estufa De Sobremesa En Acero Inoxidable Negro 4947;210000;1;50;buy_it_now;gold_special;True;;MCO115311;Electrodomésticos
MCO563435404;Bodega Para Vinos De Acero Inoxidable;170900;1;1;buy_it_now;gold_special;True;;MCO160451;Electrodomésticos
MCO592096023;Repelente Electrónico Ultrasónico Plagas E Insectos ;29900;200;50;buy_it_now;gold_special;True;;MCO176766;Electrodomésticos
MCO547919818;Juego De 4 Bases De Lujo Para Lavadora Ó Secadora + Malla ;17900;50;150;buy_it_now;gold_pro;True;;MCO413682;Electrodomésticos
MCO565964307;Mini Red Usb Nevera Refrigerador Bebidas Latas De Bebidas;165900;1;1;buy_it_now;gold_special;True;;MCO115336;Electrodomésticos
MCO445449950;Estuche Portátil Térmico Para Plancha De Cabello Negro;18800;500;100;buy_it_now;gold_special;True;39900.0;MCO4598;Electrodomésticos
MCO457910542;Batidora Licuadora De Mano Inmersion Manual Universal +jarra;79830;1;200;buy_it_now;gold_special;True;99990.0;MCO441143;Electrodomésticos
MCO593393448;Anaquel Original - Botellas Para Nevera Mabe.;29000;1;2;buy_it_now;gold_pro;True;;MCO398575;Electrodomésticos
MCO590872933;Repuesto Cuchilla  Para Maquina Wahl Profesional Inoxidable ;29990;1;50;buy_it_now;gold_pro;True;;MCO5411;Electrodomésticos
MCO509874369;Nevera Mabe No Frost 420 Litros Tipo Grafito - Rmp420flcg;1489900;1;250;buy_it_now;gold_special;True;2065900.0;MCO115334;Electrodomésticos
MCO548622485;Lonchera Eléctrica Portable / Home Elements;44800;1;250;buy_it_now;gold_special;True;;MCO163021;Electrodomésticos
MCO589364954;Klarstein Bella Rossa R Batidora De Pie Con Cabezal Inclinab;559990;1;5;buy_it_now;gold_special;True;;MCO4339;Electrodomésticos
MCO564940741;Gramera De Cocina Kalley 5kg;49900;1;150;buy_it_now;gold_special;True;;MCO118000;Electrodomésticos
MCO567992393;Motor Ventilador Keli Original 115v Nevera Haceb  Y Wirpool;48000;1;2;buy_it_now;gold_special;True;;MCO398574;Electrodomésticos
MCO583853976;Ondulador Negro Revlon Vidal Sassoon Pinza De Ondas Grandes;32900;1;50;buy_it_now;gold_pro;True;;MCO166643;Electrodomésticos
MCO457846261;Patillera Wahl Minit- Pro 17 Pcs;85000;1;200;buy_it_now;gold_special;True;;MCO5411;Electrodomésticos
MCO593284573;Válvula De Entrada Doble Para Fabricador De Hielo Whirlpool.;65000;1;2;buy_it_now;gold_pro;True;;MCO438219;Electrodomésticos
MCO449156251;Aspiradora Karcher Filtro De Agua Ds 5800;1849900;1;50;buy_it_now;gold_pro;True;2059900.0;MCO115340;Electrodomésticos
MCO452311196;Filtro Purificador Agua Acero+ozono+2obsequios+enviogratis;205900;1;250;buy_it_now;gold_pro;True;;MCO115562;Electrodomésticos
MCO555291309;Nevera Portatil  Para Vehiculos Frio/calor Cap 8 Litros;444000;1;4;buy_it_now;gold_special;True;;MCO160451;Electrodomésticos
MCO585412082;Freidora De Aire 4 Litros Sin Aceite Icm Extra Grande;239000;1;25;buy_it_now;gold_special;True;;MCO117975;Electrodomésticos
MCO577487245;Nebulizador  Portatil Pediatrico Y  Adulto;99800;50;50;buy_it_now;gold_special;True;;MCO166750;Electrodomésticos
MCO485037318;Xyhhydro 20 Gallon Bubble 220 Micron Bolsa De Cremallera Par;191990;1;1;buy_it_now;gold_special;True;;MCO115336;Electrodomésticos
MCO534829986;Freidora Easy Fry Imusa 4.2litros Ez201d Sin Aceite Plateada;469900;1;150;buy_it_now;gold_special;True;;MCO117975;Electrodomésticos
MCO572328030;Calentador Calefactor Y Ventilador Bajo Consumo;79900;1;50;buy_it_now;gold_special;True;;MCO438142;Electrodomésticos
MCO592653507;Compresor Para Nevera Marca Donper 1/6 Gas R134a 115v;250000;1;1;buy_it_now;gold_special;True;;MCO438219;Electrodomésticos
MCO579353989;Plancha Remington Keratina Y Aceite De Argán;109800;1;25;buy_it_now;gold_pro;True;;MCO4598;Electrodomésticos
MCO579942663;Procesador Black And Decker;179999;1;50;buy_it_now;gold_special;True;;MCO117365;Electrodomésticos
MCO457252672;Mod Podge Waterbase Sellador, Pegamento Y Acabado (32;131900;1;1;buy_it_now;gold_pro;True;;MCO160451;Electrodomésticos
MCO593889709;Bascula Digital Pesa Balanza 180 Kg Cuadrada;36300;1;50;buy_it_now;gold_special;True;;MCO169104;Electrodomésticos
MCO514635453;Prensa Francesa Cafetera De Embolo Piston Filtro 600 Ml;32500;1;50;buy_it_now;gold_special;True;;MCO4340;Electrodomésticos
MCO505575816;Pesa Bascula Gramera Digital Precisión 10000gr 10kg Balanza;21900;1;200;buy_it_now;gold_pro;True;;MCO118000;Electrodomésticos
MCO538714289;Cafetera Oster Programable 12 Tazas Bvstdc4401-013 Cromado;219900;1;100;buy_it_now;gold_special;True;;MCO4340;Electrodomésticos
MCO576075670;Bascula Pesa Personas Digital + Envió Gratis ;39900;1;25;buy_it_now;gold_pro;True;;MCO169104;Electrodomésticos
MCO506199617;Acople / Engranaje  Para Motor De Nutribullet 600w Y 900 W;18000;1;200;buy_it_now;gold_pro;True;;MCO441157;Electrodomésticos
MCO565558370;Cepillo Peine Alisador Electrico Hombres Cabello Barba ;19990;150;50;buy_it_now;gold_pro;True;;MCO180960;Electrodomésticos
MCO566636399;Freidora A Gas En Acero De 6 Litros Para Negocio;119800;1;50;buy_it_now;gold_special;True;;MCO117975;Electrodomésticos
MCO459566770;Batidor Electrico Personal Potente Espuma Mezclador Cafe;8990;1;250;buy_it_now;gold_special;True;;MCO4339;Electrodomésticos
MCO561702755;Sanduchera Home Elements ;52900;1;200;buy_it_now;gold_pro;True;;MCO163035;Electrodomésticos
MCO516056273;Nescafé® Dolce Gusto® Chai Tea Latte X 3 Unidades ;67200;1;100;buy_it_now;gold_special;True;;MCO4340;Electrodomésticos
MCO563929139;Batidora De Mano 5 Velocidades Oster / Original / 240 W ;139900;200;200;buy_it_now;gold_special;True;190000.0;MCO441143;Electrodomésticos
MCO565089976;Control Remoto Aire Acondicionado Samsung Inverter +obsequio;21550;1;50;buy_it_now;gold_special;True;;MCO385691;Electrodomésticos
MCO502077172;Ventilador Super Deluxe Pequeño De Escritorio 6;40000;50;150;buy_it_now;gold_special;True;;MCO115346;Electrodomésticos
MCO459087571;Cepillo Pinza Rizador Cabello Crespos Ondulado Perfectos!;14899;150;200;buy_it_now;gold_pro;True;;MCO166643;Electrodomésticos
MCO535390517;Gramera Digital Balanza Gramera Digital Gramera Digital 10kg;32990;5000;100;buy_it_now;gold_pro;True;;MCO118000;Electrodomésticos
MCO596716505;Crispetera Vintage Aire Caliente Para Palomitas;49900;1;25;buy_it_now;gold_special;True;;MCO117981;Electrodomésticos
MCO569589761;Freidora De Aire Bioceramic Oster - Oster;322900;1;50;buy_it_now;gold_special;True;;MCO117975;Electrodomésticos
MCO533654054;Plancha Original Remington Argan Oil Shine Ref. S8500a;119900;1;25;buy_it_now;gold_special;True;;MCO4598;Electrodomésticos
MCO556110749;Secador De Pelo Nova Caliente Frió 5000w Cabello Profesional;39990;1;50;buy_it_now;gold_special;True;;MCO4597;Electrodomésticos
MCO561864551;Maquina De Motilar Barbera Designer Professional Peluquera ;42900;1;100;buy_it_now;gold_pro;True;;MCO5411;Electrodomésticos
MCO548508684;Sanduchera Waflera Electrica Parrillera Oster Cg120 Nueva;195700;1;100;buy_it_now;gold_special;True;;MCO163035;Electrodomésticos
MCO593592963;Horno Oster Tostador Y Freidora De Aire 22lts Digital Oferta;688990;1;5;buy_it_now;gold_special;True;;MCO116383;Electrodomésticos
MCO529012140;Hélice Samurai Airprotec (4 Aspas) ;15000;1;200;buy_it_now;gold_special;True;;MCO115346;Electrodomésticos
MCO586222468;Vaso Genérico En Vidrio Para Licuadoras Oster Reversible ;30000;1;50;buy_it_now;gold_special;True;;MCO441158;Electrodomésticos
MCO547099512;Gramera Bascula Balanza Pesa Joyeria Bolsillo 500gr ;16800;1;150;buy_it_now;gold_special;True;;MCO118000;Electrodomésticos
MCO561850958;Cafetera Italiana Espresso Filtro De Aluminio 9 Tazas Home E;58900;1;50;buy_it_now;gold_special;True;;MCO4340;Electrodomésticos
MCO496455091;Amasadora, Mojadora De Pan 30l;3197000;1;25;buy_it_now;gold_special;True;;MCO4339;Electrodomésticos
MCO561993825;Horno Electrico Tostador Recco Asador Domestico ;109990;1;50;buy_it_now;gold_special;True;;MCO116383;Electrodomésticos
MCO556894114;Balanza Gramera Báscula Cocina Capacidad Hasta 10kg;22900;1;250;buy_it_now;gold_special;True;;MCO118000;Electrodomésticos
MCO497890684;Calentador Bosch 6lt Gas Natural Tiro Forzado Therm 1400f;699700;1;50;buy_it_now;gold_special;True;;MCO177043;Electrodomésticos
MCO561380372;Licuadora Oster® Con Vaso De Plástico Y Control De Perilla B;99900;50;100;buy_it_now;gold_special;True;;MCO441158;Electrodomésticos
MCO577055297;Maquina Limpieza Facil Hogar X5 A Vapor H2o Mop O X 12;179900;1;25;buy_it_now;gold_pro;True;;MCO117987;Electrodomésticos
MCO558650366;Olla Arrocera Universal 2 Libras Negra Con Vaporizador;134900;1;150;buy_it_now;gold_special;True;;MCO117982;Electrodomésticos
MCO577744699;Nescafé® Dolce Gusto® Americano X 1 Caja;19500;1;50;buy_it_now;gold_special;True;;MCO4340;Electrodomésticos
MCO551141444;Calentador Portatil De Ambiente Handy Heater ;62900;1;50;buy_it_now;gold_special;True;;MCO438142;Electrodomésticos
MCO563886981;Maquina Peluqueria Corte Cabello Motilar Barberia ;38900;50;100;buy_it_now;gold_pro;True;;MCO5411;Electrodomésticos
MCO580674960;Cepillo Alisador Babyliss Pro Eléctrico Nano Titanium ;148900;1;25;buy_it_now;gold_special;True;;MCO180960;Electrodomésticos
MCO472954839;Filtro Permanente Repuesto Cafetera Oster  Catetera 4 Tazas;20000;1;50;buy_it_now;gold_special;True;;MCO455144;Electrodomésticos
MCO533511937;Filtro Atrapamotas Lavadora Samsung Azul;27000;1;100;buy_it_now;gold_pro;True;;MCO413695;Electrodomésticos
MCO572310495;Rizador Ondulador Profesional Nova Cubierta En Cerámica ;13000;1;100;buy_it_now;gold_pro;True;;MCO166643;Electrodomésticos
MCO453539769;Maquina Para Raspados Granizados Triturador De Hielo;329700;1;250;buy_it_now;gold_special;True;;MCO117976;Electrodomésticos
MCO579218226;Batidora 5 Velocidades Eléctrica Home Elements 150w;77900;1;50;buy_it_now;gold_special;True;;MCO4339;Electrodomésticos
MCO483678852;Freidora Digital 4.2 L Air Fryer Sin Aceite Schaffhausen;349900;1;50;buy_it_now;gold_special;True;;MCO117975;Electrodomésticos
MCO558679983;Purificador De Agua Psa Senior3;1360000;50;25;buy_it_now;gold_pro;True;1613000.0;MCO115562;Electrodomésticos
MCO561885713;Hamilton Beach 80335r Molino De Cafe Automático ;149900;1;25;buy_it_now;gold_pro;True;;MCO4340;Electrodomésticos
MCO578607418;Plancha Vapor Viajera Tobi;44900;1;25;buy_it_now;gold_pro;True;;MCO115342;Electrodomésticos
MCO452239984;Rizador Ondulador En Ceramica Profesional Con Guia Morado;14900;5000;250;buy_it_now;gold_special;True;29900.0;MCO166643;Electrodomésticos
MCO517856622;Secador Profesional Alizz 3300 - Peluqueria  1 Año Garantia;119900;1;50;buy_it_now;gold_special;True;;MCO4597;Electrodomésticos
MCO531286214;Balanza Gramera Báscula Digital Cocina Capacidad Hasta 7kg;19900;1;150;buy_it_now;gold_pro;True;;MCO118000;Electrodomésticos
MCO558360982;Lonchera Eléctrica Portacomida Térmica Practica Y Elegante;29999;50;500;buy_it_now;gold_pro;True;;MCO163021;Electrodomésticos
MCO561872115;Cuchilla Para Licuadora Black & Decker Fusion;35900;50;100;buy_it_now;gold_special;True;;MCO441159;Electrodomésticos
MCO539371006;Licuadora Oster Tecnología Reversible Blend N Go Blstpyg1210;349900;1;50;buy_it_now;gold_special;True;;MCO163045;Electrodomésticos
MCO550352602;Arepas Pataconera O Prensa Masa 15 Cm Diametro.;23900;1;250;buy_it_now;gold_special;True;;MCO117978;Electrodomésticos
MCO512863345;Ventilador Alta Velocidad Casa Oficina Pie Pared Mesa 3en1  ;79900;1;200;buy_it_now;gold_pro;True;;MCO115346;Electrodomésticos
MCO497260382;Mini Plancha Cabello Placas Ceramica Viajera ;7900;1;100;buy_it_now;gold_pro;True;;MCO4598;Electrodomésticos
MCO456474866;Bascula Personal Balanza Baño Pesa Acero Inoxidable + Obseq;40000;50;250;buy_it_now;gold_pro;True;;MCO169104;Electrodomésticos
MCO543878895;Cepillo Masajeador Ionico Antifrizz;49999;1;50;buy_it_now;gold_special;True;;MCO180960;Electrodomésticos
MCO569484878;Filtro De Agua  Para Lavadoras;75000;1;25;buy_it_now;gold_pro;True;;MCO115562;Electrodomésticos
MCO512805959;Licuadora Portable Personal Recargable Jugos Compotas;29990;1;200;buy_it_now;gold_pro;True;;MCO163045;Electrodomésticos
MCO452868477;Exprimidor De Cítricos Oster Fpstju407w Rotación Bidireccion;79900;1;100;buy_it_now;gold_special;True;;MCO163221;Electrodomésticos
MCO540163076;Plancha Industrial Silver Star Vapor Nueva Con Garantía;258900;50;100;buy_it_now;gold_special;True;;MCO115342;Electrodomésticos
MCO461097332;Cafetera Roja De 4 Tazas;84900;50;250;buy_it_now;gold_pro;True;107000.0;MCO4340;Electrodomésticos
MCO544373609;Báscula Mecánica Gramera 1k Pretul;12400;1;50;buy_it_now;gold_special;True;15990.0;MCO118000;Electrodomésticos
MCO558121359;Combo Cuchilla Y Base Para Licuadora Oster ;16000;50;150;buy_it_now;gold_special;True;;MCO441159;Electrodomésticos
MCO575925916;Estufa De Induccion Praga Indurama Con Horno 100% Nueva;1899000;1;5;buy_it_now;gold_special;True;;MCO115311;Electrodomésticos
MCO563212355;Exprimidor Eléctrico De 1 Litro Y 2 Conos, Bajo Consumo ;54900;1;50;buy_it_now;gold_pro;True;;MCO163221;Electrodomésticos
MCO551420555;Ventilador Kalley De Torre K-tf60n;159900;1;250;buy_it_now;gold_special;True;199900.0;MCO115346;Electrodomésticos
MCO464685607;Lonchera Eléctrica Porta Comidas Portatil;33990;150;250;buy_it_now;gold_pro;True;;MCO163021;Electrodomésticos
MCO480088816;Sandwichera Oster Negra De 2 Puestos 2885;79900;1;150;buy_it_now;gold_special;True;;MCO163035;Electrodomésticos
MCO448884773;Freidora Profesional Cusinart Ameriana Acero Inoxidable 3.8l;429990;1;50;buy_it_now;gold_special;True;;MCO117975;Electrodomésticos
MCO465735507;Acople Original Oster;14900;1;200;buy_it_now;gold_special;True;;MCO441157;Electrodomésticos
MCO549581633;Nebulizador Portátil Pediátrico Y Para Adultos Con Mascara;139900;1;150;buy_it_now;gold_special;True;159900.0;MCO166750;Electrodomésticos
MCO511272919;Horno Microondas De Mesa Electrolux Emdn28g3mls 28l Gris;369900;1;25;buy_it_now;gold_special;True;599900.0;MCO117959;Electrodomésticos
MCO452735493;Patillera, Afeitadora, Depilador Nasal, Nueva Remington 3x1;114000;1;250;buy_it_now;gold_special;True;;MCO5411;Electrodomésticos
MCO563816620;Freidora De Aire Renahouse ;219900;1;50;buy_it_now;gold_special;True;;MCO117975;Electrodomésticos
MCO473750491;Plancha Para Viaje De Ropa Mini Plegable En Seco Y A Vapor;37999;1;250;buy_it_now;gold_pro;True;;MCO115342;Electrodomésticos
MCO532300587;Horno Tostador 21 Litros Acabados Copper;229900;1;50;buy_it_now;gold_special;True;;MCO116383;Electrodomésticos
MCO544320289;Ventilador Abanico Alta Velocidad 8 Pulgadas Silencioso 0417;59900;500;250;buy_it_now;gold_pro;True;;MCO115346;Electrodomésticos
MCO451264920;Pinza Rizador Ondulador En Espiral Ceramica Profesional Nova;29900;150;500;buy_it_now;gold_pro;True;;MCO166643;Electrodomésticos
MCO585443579;Extractor Tipo Isla Vidrio Curvo Challenger ;1379900;1;5;buy_it_now;gold_special;True;;MCO163020;Electrodomésticos
MCO456918119;Vaporera De Alimentos Digital;174900;50;500;buy_it_now;gold_pro;True;245000.0;MCO117977;Electrodomésticos
MCO456811062;Arrocera Multiusos Roja De 3 Tazas;84900;50;150;buy_it_now;gold_pro;True;95000.0;MCO117982;Electrodomésticos
MCO482658353;Ventilador Cyclonik Kalley K-vmcu7b;130316;1;250;buy_it_now;gold_special;True;;MCO115346;Electrodomésticos
MCO560788756;Ventilador Recargable Kalley K-vm6b Blanco;83043;1;250;buy_it_now;gold_special;True;99900.0;MCO115346;Electrodomésticos
MCO595913477;Calentador Ambiente K-ca18 De Kalley 900w 1500w Original Env;83900;1;25;buy_it_now;gold_special;True;;MCO438142;Electrodomésticos
MCO587633069;Horno De Convección Freidor Dkasa 32 Litros + Envío Gratis;289900;1;25;buy_it_now;gold_special;True;;MCO116383;Electrodomésticos
MCO513244486;Plancha Seca Ropa Universal Royal Iu-78 Negro Plateado;39900;1;150;buy_it_now;gold_special;True;;MCO115342;Electrodomésticos
MCO508729981;Molino Pulverizador Eléctrico Semillas Hierbas, Granos 2000g;1399990;1;25;buy_it_now;gold_pro;True;;MCO117978;Electrodomésticos
MCO558054350;Hamilton Beach 31612mx Raclette Parrilla Interiores Oferta ;395999;1;25;buy_it_now;gold_special;True;;MCO117961;Electrodomésticos
MCO583244866;Secador De Ropa Portatil Lavandería Secado Apartamento Casa;129900;1;25;buy_it_now;gold_pro;True;;MCO117232;Electrodomésticos
MCO484188743;Extractor De Jugos Oster 317w, Original, Nuevo.;199900;1;50;buy_it_now;gold_special;True;;MCO163042;Electrodomésticos
MCO463698965;Bascula Electronica Peso Digital Balanza Gramera  40 Kg;149990;500;250;buy_it_now;gold_special;True;;MCO118000;Electrodomésticos
MCO560488623;Peluquera Kit Maquina De Peluqueria Corte De Cabello Patille;77900;1;250;buy_it_now;gold_pro;True;;MCO5411;Electrodomésticos
MCO579450226;Chocotera En Acero Inoxidable Haceb 3 Tazas;142000;1;25;buy_it_now;gold_special;True;;MCO30109;Electrodomésticos
MCO563096406;Batidora Eléctrica Home Elements ;85000;1;150;buy_it_now;gold_pro;True;;MCO4339;Electrodomésticos
MCO573500675;Batidora Eléctrica Home Elements 150w De Potencia ;93000;1;100;buy_it_now;gold_special;True;;MCO4339;Electrodomésticos
MCO578736261;Cafetera Press Francesa 600ml French Press Primula Original;41500;1;50;buy_it_now;gold_pro;True;;MCO4340;Electrodomésticos
MCO561845002;Cuchilla Para Licuadora Hamilton Beach;42000;1;50;buy_it_now;gold_special;True;;MCO441159;Electrodomésticos
MCO448158251;Cafetera Espress Primula En Aluminio 12 Tasas Tipo Italiana;89900;1;50;buy_it_now;gold_special;True;;MCO4340;Electrodomésticos
MCO549511821;Horno Microondas Samsung Ms23j5133ag''n;318050;1;100;buy_it_now;gold_special;True;;MCO117959;Electrodomésticos
MCO568923976;Extractor Nutribullet 600 Jugos Nutricionales;170900;50;1;buy_it_now;gold_pro;True;;MCO163042;Electrodomésticos
MCO573503732;Batidor Electrico Manual Personal Potente Mezclador Cafe;7600;1;50;buy_it_now;gold_special;True;;MCO117978;Electrodomésticos
MCO466508788;Greca Cafetera Para 30 Tintos Eléctrica O Gas;289900;50;50;buy_it_now;gold_pro;True;;MCO4340;Electrodomésticos
MCO573326889;Waflera Mini Dash Waffle + Recetario Envío Inmediato ;109000;1;100;buy_it_now;gold_special;True;;MCO169112;Electrodomésticos
MCO563624406;Molino De Café;78800;1;50;buy_it_now;gold_pro;True;;MCO4340;Electrodomésticos
MCO456811167;Cartucho Para Jarra Purificadora De Agua;69000;50;100;buy_it_now;gold_pro;True;;MCO115562;Electrodomésticos
MCO550630378;Horno Microondas Digital Inverter 0.9 Cft 25l 900w Fulltech;287300;1;25;buy_it_now;gold_special;True;;MCO117959;Electrodomésticos
MCO559014793;Kit Vaso Oster Genérico Vidrio + Cuchilla + Empaque + Rosca;38500;50;200;buy_it_now;gold_special;True;;MCO441158;Electrodomésticos
MCO540246952;Combo Repuestos De 3 Vasos De 18 Oz,24oz , 32oz Nutribullet;88000;1;50;buy_it_now;gold_special;True;;MCO441157;Electrodomésticos
MCO570901462;Batidora De Pie Con Cabezal Inclinable Gancho Para Masa, Bat;606990;1;5;buy_it_now;gold_special;True;;MCO4339;Electrodomésticos
MCO538938052;Maquina Peluqueria Corte Cabello Motilar Barberia Con Acceso;49900;1;50;buy_it_now;gold_special;True;69900.0;MCO5411;Electrodomésticos
MCO501825072;Cápsulas Reutilizables Máquina Dolce Gusto X 2 Uds + Manual;24900;100;150;buy_it_now;gold_pro;True;;MCO4340;Electrodomésticos
MCO515919818;Empaque Para Cuchillas Y Tapas Nutribullet 600 Y 900 Watts ;9900;1;250;buy_it_now;gold_pro;True;;MCO441157;Electrodomésticos
