id;title;price;available_quantity;sold_quantity;buying_mode;listing_type_id;accepts_mercadopago;original_price;category_id;category_name
MCO559482219;Calienta Cama Manta Electrica Termica Calentador Enviorapido;128990;1;150;buy_it_now;gold_pro;True;;MCO438142;Electrodomésticos
MCO560473832;Bimetalico Nevera Mabe Céntrales Emicol L60 Gris Original!!;22000;1;5;buy_it_now;gold_pro;True;;MCO414221;Electrodomésticos
MCO469940676;Licuadora Oster Clasica 600 Watts Vaso De Vidrio Original;225000;1;250;buy_it_now;gold_special;True;;MCO163045;Electrodomésticos
MCO454087927;Gramera Pesa Bascula Digital 10 Kg + Baterias;17500;1;500;buy_it_now;gold_special;True;;MCO166181;Electrodomésticos
MCO555659145;Tarjeta Para Nevera Haceb N370/420 Original! Envío!;139000;1;5;buy_it_now;gold_pro;True;;MCO398573;Electrodomésticos
MCO456811314;Cafetera Automática Primalatte -19 Bares Negro Y Rojo;847500;50;200;buy_it_now;gold_pro;True;1130000.0;MCO4340;Electrodomésticos
MCO544019244;Secador Profesional Bopai Bp5510 4000w;58700;100;250;buy_it_now;gold_pro;True;;MCO4597;Electrodomésticos
MCO571568657;Cava Vinos  12 Botellas General Electric;668500;1;1;buy_it_now;gold_pro;True;;MCO160451;Electrodomésticos
MCO564824057;Aspiradora Truper 3 Galones;169900;1;50;buy_it_now;gold_pro;True;;MCO115340;Electrodomésticos
MCO462552712;Asador De Platano Maduro;55000;1;200;buy_it_now;gold_special;True;;MCO116383;Electrodomésticos
MCO556320221;Tarjeta Nevera Mabe 225d7291g005 Original! Reem G018. Envío!;125000;1;5;buy_it_now;gold_pro;True;;MCO398573;Electrodomésticos
MCO564943963;Freidora De Aire Sin Aceite Cero Grasa Saludable 3.6 L;209900;1;50;buy_it_now;gold_pro;True;;MCO117975;Electrodomésticos
MCO501823887;Aspiradora Einhell Alemana Inoxidable Soplador Húmedo Seco;314900;1;100;buy_it_now;gold_special;True;;MCO115340;Electrodomésticos
MCO556319297;Tarjeta Nevera Mabe 225d7291g004 Original! Reem G015. Envío!;120000;1;5;buy_it_now;gold_pro;True;;MCO398573;Electrodomésticos
MCO553010765;Cepillo Peine Alisador Electrico Hombres Cabello Barba ;21500;1;250;buy_it_now;gold_special;True;;MCO180960;Electrodomésticos
MCO531858980;Parrilla Estufa Haceb Repuesto Original!;40000;1;200;buy_it_now;gold_pro;True;;MCO455072;Electrodomésticos
MCO556004457;Filtro Nevera Haceb Original!;48000;1;5;buy_it_now;gold_pro;True;;MCO433579;Electrodomésticos
MCO459364846;Planchas De Pelo Cabello Remington Wet 2 Ancha + Obsequio;157990;250;150;buy_it_now;gold_pro;True;;MCO4598;Electrodomésticos
MCO469784081;Bascula Electronica Peso Digital 40kg Leer Descripcion;112900;1;250;buy_it_now;gold_special;True;;MCO118000;Electrodomésticos
MCO558038468;Repuesto Nevera Kit Relay Ptc Klixon Y Térmico 4 Tm. Envio!!;35000;50;5;buy_it_now;gold_pro;True;;MCO430650;Electrodomésticos
MCO491712679;Pod Capsula Recargable Cafetera Dolce Gusto X3 Ahorra Pods;29900;250;500;buy_it_now;gold_special;True;;MCO4340;Electrodomésticos
MCO572575077;Maquina Wahl Color Peluqueria Cortar Corte Cabello + Tijeras;156800;1;5;buy_it_now;gold_pro;True;;MCO5411;Electrodomésticos
MCO568335598;Mini Refrigerador Cooluli 20 Litros;1020000;1;1;buy_it_now;gold_special;True;;MCO115335;Electrodomésticos
MCO584760434;Cafetera Tipo Italiana Aluminio Cap. 6 Tazas;31900;1;100;buy_it_now;gold_special;True;;MCO4340;Electrodomésticos
MCO570895005;Licuadora Imusa Infinyforce 10 Velocidades Vaso En Vidrio.;139900;1;100;buy_it_now;gold_pro;True;;MCO163045;Electrodomésticos
MCO585377759;Filtro De Agua Para Nevecones LG, Adq74793501 - Lt1000.;78000;1;5;buy_it_now;gold_pro;True;;MCO433579;Electrodomésticos
MCO502072186;Lonchera Eléctrica Verde + Maletín + Obsequio Portasándwich;49900;1;250;buy_it_now;gold_pro;True;;MCO163021;Electrodomésticos
MCO570269513;Repuesto Cuchilla Tipo Nutribullet 600 Y 900 Watts;52000;50;150;buy_it_now;gold_special;True;;MCO441157;Electrodomésticos
MCO583812663;Cajón Grande Para Legumbres Nevera Mabe 55cmx32cmx25cm;100000;1;5;buy_it_now;gold_special;True;;MCO399140;Electrodomésticos
MCO562265598;Maquina Peluqueria Cortar Cabello Wahl + Tijeras + Patillera;195700;1;100;buy_it_now;gold_special;True;;MCO5411;Electrodomésticos
MCO575351391;Freidora Digital 4.2litros  Sin Aceite - Air Fryer + Envio;238990;1;50;buy_it_now;gold_special;True;;MCO117975;Electrodomésticos
MCO589221973;Filtro De Agua Para Nevera Samsung Da29-00020b;116000;1;5;buy_it_now;gold_pro;True;;MCO433579;Electrodomésticos
MCO456811059;Sandwichera  Superficie Plana;199900;50;200;buy_it_now;gold_pro;True;269000.0;MCO163035;Electrodomésticos
MCO541727798;Calentador De Cama Eléctrico /  Manta Térmica Calefactable;129900;1;150;buy_it_now;gold_special;True;220000.0;MCO163012;Electrodomésticos
MCO478883080;Maquina Para Hacer Hielo Con Encimera Igloo Ice103 Con Cubet;1258990;1;3;buy_it_now;gold_special;True;;MCO115335;Electrodomésticos
MCO570074405;Pinza Rizadora Delgada 9mm Ondas, Crespos Rizos;39900;50;100;buy_it_now;gold_pro;True;;MCO166643;Electrodomésticos
MCO516056297;Nescafé® Dolce Gusto® Americano X 3 Cajas;58500;50;200;buy_it_now;gold_special;True;;MCO4340;Electrodomésticos
MCO504536315;Nutrichef Nevera Mini Bar 132 Latas 18.69 Galones ;1948990;1;1;buy_it_now;gold_pro;True;;MCO160450;Electrodomésticos
MCO578963182;Tostador De Pan 2 Rebanadas Acero Inoxidable Eléctrico ;32900;1;100;buy_it_now;gold_pro;True;;MCO117366;Electrodomésticos
MCO566465331;Freidora Digital Sin Aceite Fit Fry Air Fryer 4.5 Litro ;299900;1;100;buy_it_now;gold_pro;True;;MCO117975;Electrodomésticos
MCO595394640;Kismile Negra Nevera Minibar Refrigerador Vinos 127 Lt;2000990;1;1;buy_it_now;gold_pro;True;;MCO115336;Electrodomésticos
MCO461097339;Mini Arrocera Multiusos - 1.5 Tazas Gris;64900;50;500;buy_it_now;gold_pro;True;84000.0;MCO117982;Electrodomésticos
MCO573059830;Plancha Anti Frizz Remington Professional 100% Original;146000;500;50;buy_it_now;gold_special;True;;MCO4598;Electrodomésticos
MCO532720644;Nevera Minibar Refrigerador Visivo 50l Blanca + Envio;533900;1;5;buy_it_now;gold_special;True;;MCO160450;Electrodomésticos
MCO485367802;Maquina Peluqueria Motilar Corte Cabello+4 Guias Peine Econo;38900;1;250;buy_it_now;gold_pro;True;;MCO5411;Electrodomésticos
MCO570896531;Combo Plancha Alisadora+secador De Cabello Rose G Remington;180000;1;100;buy_it_now;gold_pro;True;;MCO4598;Electrodomésticos
MCO579264235;Cava De Vinos 12 Botellas General Electric Nuevo Envio Ya;849990;1;1;buy_it_now;gold_special;True;;MCO160451;Electrodomésticos
MCO594257221;Licuadora Durapro 10 Velocidades Black+decker Plata;152910;50;5;buy_it_now;gold_special;True;169900.0;MCO163045;Electrodomésticos
MCO583661378;Cepillo Secador Original Revlon Hair Dry(caja Roja) Envio Ya;298000;50;100;buy_it_now;gold_special;True;;MCO4597;Electrodomésticos
MCO557178789;Sensor Termofusible Original Para Nevera Haceb 611-700!!;26000;1;5;buy_it_now;gold_pro;True;;MCO414221;Electrodomésticos
MCO564341066;Batidora Eléctrica Home Elements Multi-mixer | He504e;149000;50;250;buy_it_now;gold_special;True;;MCO4339;Electrodomésticos
MCO514843927;Licuadora Oster® Activesense Con Blend N Go;670500;1;100;buy_it_now;gold_pro;True;894000.0;MCO163045;Electrodomésticos
MCO592651888;Gas Refrigerante R134a Chemours Para Carros Aire Acondiciona;15800;1;5;buy_it_now;gold_special;True;;MCO398621;Electrodomésticos
MCO456811244;Arrocera Multiusos De 7 Tazas Roja;101250;50;250;buy_it_now;gold_pro;True;135000.0;MCO117982;Electrodomésticos
MCO594257219;Licuadora Durapro 10 Velocidades Black+decker Roja;161910;1;3;buy_it_now;gold_special;True;179900.0;MCO163045;Electrodomésticos
MCO595714417;Mini Nevera Para Maquillaje 4 Litros ;318000;50;3;buy_it_now;gold_pro;True;;MCO115336;Electrodomésticos
MCO575775863;Freidora De Aire  Icm Capacidad 4 Litros;240000;1;100;buy_it_now;gold_special;True;;MCO117975;Electrodomésticos
MCO551777496;Kalley 3en1: Sanduchera + Panini + Waflera, Garantía 2 Años;119900;1;250;buy_it_now;gold_special;True;159900.0;MCO163035;Electrodomésticos
MCO572518781;Calefactor Calentador De Ambiente Kalley K-ca18 Blanco;99900;1;250;buy_it_now;gold_special;True;;MCO438142;Electrodomésticos
MCO562048863;Kit De Relay Ptc + Termico Para Neveras Desde 1/12hp - 1/2hp;24000;1;5;buy_it_now;gold_special;True;;MCO430650;Electrodomésticos
MCO456811238;Arrocera Multiusos Negra De 3 Tazas;64900;50;250;buy_it_now;gold_pro;True;95000.0;MCO117982;Electrodomésticos
MCO456854349;Máquina De Cafe Breville 870, Entrega Inmediata Con Envió;3499990;1;50;buy_it_now;gold_special;True;;MCO4340;Electrodomésticos
MCO560132425;Timer Nevera Haceb 1432 Original 9 Horas - Repuesto Nevera;36000;1;5;buy_it_now;gold_special;True;;MCO438219;Electrodomésticos
MCO595270534;Máquina Para Hacer Pizza Hamilton Beach;269900;150;50;buy_it_now;gold_special;True;359900.0;MCO30109;Electrodomésticos
MCO511272927;Aspiradora Spin Electrolux Abs01;199900;1;500;buy_it_now;gold_special;True;269900.0;MCO115340;Electrodomésticos
MCO550703995;Pastelera Refrigerada Vitrina Refrigerada;3700000;1;1;buy_it_now;gold_special;True;;MCO160453;Electrodomésticos
MCO575542112;Freidora De Aire 4 Litros Sin Aceite Icm Extra Grande;217000;1;50;buy_it_now;gold_special;True;;MCO117975;Electrodomésticos
MCO533233788;Báscula Xiaomi My Body Escala De Composición Corporal;139900;1;100;buy_it_now;gold_special;True;;MCO169104;Electrodomésticos
MCO565154998;Tarjeta Para Nevera Haceb Athena Pdi Low Original! Envío!;128000;1;3;buy_it_now;gold_pro;True;;MCO398573;Electrodomésticos
MCO572633101;Extractor Nutribullet 600 Jugos Nutricionales;167900;1;50;buy_it_now;gold_pro;True;;MCO163042;Electrodomésticos
MCO558604422;Sanduchera Kalley 2 Puestos Antiadherente ;54800;250;250;buy_it_now;gold_pro;True;;MCO163035;Electrodomésticos
MCO507334886;Enfriador De Vino Y Bebidas Nutrichef Enfriador De Refrigera;1533990;1;1;buy_it_now;gold_pro;True;;MCO160451;Electrodomésticos
MCO513176953;Combo Peluquera Wahl Delux Groom Pro Original + Envio;169900;1;500;buy_it_now;gold_special;True;;MCO5411;Electrodomésticos
MCO537349793;Mezclador Personal Oster® Blstpb220;119900;50;100;buy_it_now;gold_special;True;169000.0;MCO163045;Electrodomésticos
MCO471639736;Filtro De Agua Nevera Samsung Compatible Da29-00003g +regalo;95000;1;5;buy_it_now;gold_pro;True;;MCO433579;Electrodomésticos
MCO453450459;Pinza Rizadora Nova Encrespador Nueva Garantia + Obsequio;16900;1;250;buy_it_now;gold_pro;True;;MCO166643;Electrodomésticos
MCO574099017;Kit 4 Repuestos Purificador Agua Filtro Guxto 14 Litros;55900;250;150;buy_it_now;gold_pro;True;;MCO115562;Electrodomésticos
MCO453327187;Filtro De Agua Interno Para Nevera LG 5231ja2006a- Lt600p;145000;1;25;buy_it_now;gold_pro;True;;MCO433579;Electrodomésticos
MCO573195104;Nebulizador Portatil Adultos Niños 2 Mascarillas Asma;99900;50;100;buy_it_now;gold_special;True;;MCO166750;Electrodomésticos
MCO561873364;Combo De Plancha+rizador+peine;70000;150;100;buy_it_now;gold_pro;True;;MCO4598;Electrodomésticos
MCO582061281;Unidad Compresor De 1/8 R134 Donper Haceb Original! Nueva!;230000;1;3;buy_it_now;gold_pro;True;;MCO398574;Electrodomésticos
MCO570270019;Waflera Black + Decker Giratoria Antiadherente Wm1000b;165000;1;50;buy_it_now;gold_special;True;;MCO169112;Electrodomésticos
MCO483178108;Maquina De Peluqueria Wahl Quick Cut 16 Piezas Original ;124900;1;200;buy_it_now;gold_pro;True;;MCO5411;Electrodomésticos
MCO572545268;Filtro Nevera Whirpool Con Kit Para Instalación;59000;1;5;buy_it_now;gold_special;True;;MCO433579;Electrodomésticos
MCO468484638;Plancha Cabello A Vapor Para Tratamientos 100% Original ;108900;1;250;buy_it_now;gold_pro;True;;MCO4598;Electrodomésticos
MCO545967601;Freidora Sin Aceite Air Fryer 3.5 Litros Renahouse Nueva ;211900;500;250;buy_it_now;gold_special;True;;MCO117975;Electrodomésticos
MCO574408740;Filtro De Agua Nevera Samsung Externo Original Acople Rapido;55000;1;5;buy_it_now;gold_pro;True;;MCO433579;Electrodomésticos
MCO573333299;Nutribullet Pro 900 W, Magic Bullet 15 Piezas Recetario Lujo;209500;1;50;buy_it_now;gold_special;True;;MCO163042;Electrodomésticos
MCO578778262;Maquina De Coser Portatil Mini Sewing Machine 4 En 1;69900;1;50;buy_it_now;gold_pro;True;;MCO117988;Electrodomésticos
MCO499092163;Minibar Kalley 45 Lt Kmb45 Gta Gris;499900;1;2;buy_it_now;gold_pro;True;;MCO160450;Electrodomésticos
MCO517690460;Plancha Babyliss  100% Original  Nano Titanium Baby Liss  ;229990;250;100;buy_it_now;gold_special;True;;MCO4598;Electrodomésticos
MCO446077235;Cafetera Tipo Italiana A Presión Repuestos Internos Y Partes;10000;1;250;buy_it_now;gold_special;True;;MCO4340;Electrodomésticos
MCO559812249;Timer 6 Horas Tmdj625rn9 Para Nevera Centrales, Mabe Y Haceb;23000;1;5;buy_it_now;gold_special;True;;MCO438219;Electrodomésticos
MCO456139370;Bascula Electronica Peso Digital Pesa De 0.006kg A 40 Kg;109900;150;500;buy_it_now;gold_special;True;;MCO118000;Electrodomésticos
MCO500764509;Peines Guias Cuchillas  Maquina Peluquera Wahl Barbería  ;18000;1;100;buy_it_now;gold_pro;True;;MCO5411;Electrodomésticos
MCO562050978;Timer O Rejoj De Deshielo Para Neveras No Frost 6h 21min ;23000;1;5;buy_it_now;gold_special;True;;MCO398572;Electrodomésticos
MCO522433295;Freidora Oster De Aire Bioceramic 3.2litros ® ;369900;1;150;buy_it_now;gold_pro;True;;MCO117975;Electrodomésticos
MCO558523115;Balanza Bascula Digital Personas 180kg Vidrio Templado 2003b;50000;1;150;buy_it_now;gold_special;True;;MCO169104;Electrodomésticos
MCO565230010;Termostato Control De Temperatura Para Nevera Haceb! R600!;34000;1;5;buy_it_now;gold_pro;True;;MCO398572;Electrodomésticos
MCO456811246;Exprimidor De Cítricos Blanco;66750;50;250;buy_it_now;gold_pro;True;89000.0;MCO163221;Electrodomésticos
MCO441805578;Nebulizador Adulto Pediatrico ® 2 Mascarillas + Termometro;149900;500;200;buy_it_now;gold_pro;True;;MCO166750;Electrodomésticos
MCO532842028;Repuesto Nevera Samsung Motor Evaporador 12v Original.;185000;1;5;buy_it_now;gold_special;True;;MCO398574;Electrodomésticos
MCO540768971;Plancha De Vapor Oster® Inalámbrica Gcstcc3000;126750;50;250;buy_it_now;gold_special;True;169000.0;MCO115342;Electrodomésticos
MCO459404372;Cafetera Capuchinera Oster Ref 4188 Con Hidropresion;219900;1;250;buy_it_now;gold_special;True;;MCO4340;Electrodomésticos
MCO596094298;Filtro De Agua Kenmore Nevera Whirpool Filtro 1 - W10295370a;98900;1;5;buy_it_now;gold_special;True;;MCO433579;Electrodomésticos
MCO560313452;Calentador Portátil  Calefacción Ambiente Fácil Y Ligero ;49900;1;250;buy_it_now;gold_pro;True;;MCO438142;Electrodomésticos
MCO560656971;Cono O Pera Negro Original Exprimidor Imusa Vitapress;18000;1;200;buy_it_now;gold_pro;True;;MCO441157;Electrodomésticos
MCO561266586;Resistencia Recta Nevera Mabe / Centrales 38 Cm 115v 280w;16500;1;5;buy_it_now;gold_pro;True;;MCO398578;Electrodomésticos
MCO456811174;Cafetera Gourmet Collection Térmica- 10 Tazas Plateada;299900;50;200;buy_it_now;gold_pro;True;425000.0;MCO4340;Electrodomésticos
MCO510666141;Mini Vaso / Compotero Con Tapa Para Licuadora  8 Oz Cristal;26000;1;150;buy_it_now;gold_pro;True;;MCO441158;Electrodomésticos
MCO558176666;Bimetalico Plástico L60 Para Nevera Nofrost;12000;1;5;buy_it_now;gold_special;True;;MCO398578;Electrodomésticos
MCO473301893;Bolsas Aspiradora Electrolux Trio, Sonic. Ingenio. Beatle;27000;1;250;buy_it_now;gold_special;True;;MCO115340;Electrodomésticos
MCO456811298;Licuadora Xpert Series Roja;374250;50;150;buy_it_now;gold_pro;True;499000.0;MCO163045;Electrodomésticos
MCO581915654;Topinera Refrigerada Barra Para 16 Topings ;2400000;1;1;buy_it_now;gold_special;True;;MCO160453;Electrodomésticos
MCO580482395;Repelente De Mosquitos Y Cucarachas Para Interior, Repelente;21800;1;50;buy_it_now;gold_special;True;;MCO176766;Electrodomésticos
MCO577232735;Maquina Whal T Pro Original Patillera Barberá Rasuradora;94900;1;50;buy_it_now;gold_special;True;;MCO5411;Electrodomésticos
MCO558057282;Repuesto Nevera Haceb Bimetalico Emicol L60 Azul Original!!;30000;1;5;buy_it_now;gold_pro;True;;MCO414221;Electrodomésticos
MCO592125254;Cepillo Secador Voluminizador Revlon Original En Caja Nuevos;255000;50;50;buy_it_now;gold_special;True;;MCO180960;Electrodomésticos
MCO445063286;Maquina Para Hacer Raspados Cholados Triturador De Hielo;349990;1;250;buy_it_now;gold_special;True;;MCO117976;Electrodomésticos
MCO511272935;Aspiradora Easybox-plus Electrolux Eas31;369900;1;250;buy_it_now;gold_special;True;469900.0;MCO115340;Electrodomésticos
MCO540916911;Congelador Portatil Alpicool C15 16quart15liter Para Automov;1396900;1;1;buy_it_now;gold_pro;True;;MCO115335;Electrodomésticos
MCO580822442;Freidora De Aire Oster Air Fryer Bioceramic 3.2 Litros;347900;1;50;buy_it_now;gold_special;True;;MCO117975;Electrodomésticos
MCO452311204;Agua Filtro Purificador Ozono Carbon+obsequios+ Envio Gratis;126900;1;500;buy_it_now;gold_pro;True;;MCO115562;Electrodomésticos
MCO566228593;Congelador Portatil Alpicool C20 21quart20liter Para Automov;1193990;1;1;buy_it_now;gold_special;True;;MCO115335;Electrodomésticos
MCO563384241;Batidora De Mano Oster De 5 Velocidades Blanca;119900;1;50;buy_it_now;gold_special;True;;MCO441143;Electrodomésticos
MCO495806438;Ventilador Torre Negro Con Control Remoto Nuevo Oster 9115r;299000;1;100;buy_it_now;gold_special;True;;MCO115346;Electrodomésticos
MCO511639184;Barra Topinera Refrigerada 16 Toppings;2400000;1;3;buy_it_now;gold_special;True;;MCO115336;Electrodomésticos
MCO568481046;Cafetera Prensa Francesa De 19 Cm X 9 Cm Capacidad 600 Ml;35000;1;150;buy_it_now;gold_special;True;;MCO4340;Electrodomésticos
MCO581923683;Bascula Balanza Pesa Digital Bluetooth;69999;150;50;buy_it_now;gold_special;True;;MCO169104;Electrodomésticos
MCO557699620;Sensor Original Para Nevera Haceb Conserv/congela. N700!;26000;1;5;buy_it_now;gold_pro;True;;MCO414221;Electrodomésticos
MCO546152854;Control Remoto Aire Acondicionado Olimpo Haceb Forro + Pilas;24900;1;100;buy_it_now;gold_special;True;;MCO385691;Electrodomésticos
MCO555791802;Laminadora Cilindradora De Masa 50 Cm En Acero Inoxidable;235900;1;100;buy_it_now;gold_special;True;;MCO1899;Electrodomésticos
MCO452763546;Filtro De Agua Para Nevera Frigidaire Wf2cb  (puresource2);165000;1;5;buy_it_now;gold_special;True;;MCO433579;Electrodomésticos
MCO490650016;Filtro Atrapamotas Grande Para Lavado LG  Valor X 1 Unidad;5000;1;250;buy_it_now;gold_special;True;;MCO413682;Electrodomésticos
MCO572327282;Extractor Nutribullet 600 Jugos Nutricionales;164900;50;50;buy_it_now;gold_special;True;;MCO163042;Electrodomésticos
MCO557091012;Bimetalico Nevera Haceb Original!!;25000;1;5;buy_it_now;gold_pro;True;;MCO414221;Electrodomésticos
MCO564014082;Báscula Digital Pesa Digital Control Peso Obesidad;49900;50;150;buy_it_now;gold_pro;True;;MCO169104;Electrodomésticos
MCO546309169;Control Remoto Aire Acondicionado LG Conv + Forro + Pilas;19900;1;100;buy_it_now;gold_special;True;;MCO385691;Electrodomésticos
MCO569205459;Filtro Para Nevera LG Premium  5231ja2002a;112000;1;5;buy_it_now;gold_special;True;;MCO433579;Electrodomésticos
MCO464541938;Tostadora 2 Puestos Kalley;69999;1;150;buy_it_now;gold_pro;True;;MCO117366;Electrodomésticos
MCO463420975;Filtro Purificador Agua Acero+ Ozono+2 Obsequios+enviogratis;205800;50;200;buy_it_now;gold_pro;True;;MCO115562;Electrodomésticos
MCO568880193;Tarjeta Nevera Mabe 225d9085g005 Original R600. Envío!;135000;1;5;buy_it_now;gold_special;True;;MCO398573;Electrodomésticos
MCO460801055;Extractor De Jugos Frutas Y Verduras 850 Watts Chef Master;299900;1;150;buy_it_now;gold_pro;True;399900.0;MCO163042;Electrodomésticos
MCO563541655;Protector De Voltaje 10a Lavadoras Lavomatic 120v 30 Libras;23000;1;50;buy_it_now;gold_special;True;;MCO1899;Electrodomésticos
MCO534474075;Barra Refrigerada, Sodas Helados Ceviches Toppings Ensalad  ;2400000;1;0;buy_it_now;gold_special;True;;MCO160453;Electrodomésticos
MCO552372745;Nebulizador Portátil Recargable Tratamiento + 2 Mascaras Lm;99900;1;50;buy_it_now;gold_special;True;;MCO166750;Electrodomésticos
MCO575616897;Plancha Triple Infusión Keratina Argán Y Macadamia Remington;168000;250;50;buy_it_now;gold_special;True;;MCO4598;Electrodomésticos
MCO595414748;Kuppet Nevera Minibar Doble Vidrio  Bebidas 62 Latas;1105990;1;1;buy_it_now;gold_pro;True;;MCO115336;Electrodomésticos
MCO577891512;Plancha De Pelo Elite Basic Rowenta;59900;200;50;buy_it_now;gold_special;True;119900.0;MCO4598;Electrodomésticos
MCO594247862;Limpiador A Vapor 15 En 1 Multiusos 1500w Nuevo;141800;1;50;buy_it_now;gold_special;True;;MCO117987;Electrodomésticos
MCO557513214;Motor Nevera Samsung Inverter Evaporador Original! Repuesto!;120000;1;2;buy_it_now;gold_pro;True;;MCO398574;Electrodomésticos
MCO487109295;Plancha Cabello Aguacate Cms Gratis Estuche Protector -50%;89900;1;50;buy_it_now;gold_pro;True;;MCO4598;Electrodomésticos
MCO585213817;Freidora De Aire De 5.5 Litros Oster;485000;1;25;buy_it_now;gold_special;True;;MCO117975;Electrodomésticos
MCO515225412; Mini Refrigerador Compacto 20 Litros Termostato Digital Coo;1064700;1;3;buy_it_now;gold_special;True;;MCO160450;Electrodomésticos
MCO556639489;Plancha A Vapor Universal Royal;84900;1;100;buy_it_now;gold_pro;True;;MCO115342;Electrodomésticos
MCO461936319;Combo Maquina Peluqueria, Peluqueras Wahl Delux  (21 Piezas);169900;1;500;buy_it_now;gold_pro;True;;MCO5411;Electrodomésticos
MCO489845330;Refrigerador Y Congelador Compacto Y Portátil De Una Puerta;925990;1;1;buy_it_now;gold_special;True;;MCO115335;Electrodomésticos
MCO552260884;Combo Peluquera Wahl Deluxe Groom Pro 100 % Original;155000;1;150;buy_it_now;gold_special;True;;MCO5411;Electrodomésticos
MCO558894035;Licuadora Con Pica Todo Home Elements 2 Litros ;82000;1;250;buy_it_now;gold_special;True;;MCO163045;Electrodomésticos
MCO592643337;Filtro De Agua Original Externo Para Refrigerador Whirlpool.;32000;1;5;buy_it_now;gold_pro;True;;MCO433579;Electrodomésticos
MCO585643965;Olla Freidora Sin Aceite Air Fryer  Ps Plus 2 Litros;187900;1;25;buy_it_now;gold_special;True;;MCO117975;Electrodomésticos
MCO564838699;Cepillo Secador Voluminizador Revlon Hair Dryer Entrega Ya;295000;50;150;buy_it_now;gold_special;True;;MCO4597;Electrodomésticos
MCO564695959;Unidad Compresor De 1/6 R134 Donper Haceb Original! Nueva!;265000;1;4;buy_it_now;gold_pro;True;;MCO398574;Electrodomésticos
MCO560408486;Fuente Chocolate Acero Kalley K-fch190s;96900;1;50;buy_it_now;gold_special;True;129900.0;MCO163034;Electrodomésticos
MCO471801625;Balanza Personal De Baño Bascula Digital Pesa Persona 180 Kg;44450;1;100;buy_it_now;gold_pro;True;;MCO169104;Electrodomésticos
MCO559811814;Timer 9 Horas Tmdjx35rb9 Para Nevera Centrales, Mabe Y Haceb;23000;1;5;buy_it_now;gold_special;True;;MCO438219;Electrodomésticos
MCO564035417;Molino De Grano Corona Tradicional ;91530;1;100;buy_it_now;gold_special;True;;MCO30109;Electrodomésticos
MCO456811164;Licuadora Reversible Roja;249781;50;100;buy_it_now;gold_special;True;325000.0;MCO163045;Electrodomésticos
MCO564697156;Unidad Compresor De 1/5 R134 Donper Haceb Original! Nueva!;275000;1;2;buy_it_now;gold_pro;True;;MCO398574;Electrodomésticos
MCO582133441;Aire Acondicionado 12.000btu/220v Hyundai;849900;1;50;buy_it_now;gold_special;True;1399900.0;MCO115344;Electrodomésticos
MCO562807650;Gallina Electrica Cocinador Hervidor De 7 Huevos A Vapor Fit;35900;1;150;buy_it_now;gold_special;True;;MCO117975;Electrodomésticos
MCO500487148;Máquina Para Fabricar Hielo Portátil Homelabs Para Encimera:;965000;1;1;buy_it_now;gold_special;True;;MCO115336;Electrodomésticos
MCO456811200;Licuadora De 10 Velocidades Blanca ;127500;1;250;buy_it_now;gold_special;True;170000.0;MCO163045;Electrodomésticos
MCO567241920;Nescafé® Dolce Gusto® Lungo Colombia;61740;1;50;buy_it_now;gold_special;True;;MCO4340;Electrodomésticos
MCO560932267;Bandeja Para Serpentin Original Nevera Haceb;24000;1;5;buy_it_now;gold_pro;True;;MCO438219;Electrodomésticos
MCO569608130;Freidora De Aire Oster Air Fryer Bioceramic 3.2lt;339900;1;50;buy_it_now;gold_special;True;;MCO117975;Electrodomésticos
MCO581236779;Escoba Manual Aspiradora Barredora 360° Spin Sweep. ;49900;1;50;buy_it_now;gold_pro;True;;MCO115340;Electrodomésticos
MCO592258347;Accesorio De La Puerta Nevera Mabe Original;29000;1;5;buy_it_now;gold_special;True;;MCO414221;Electrodomésticos
MCO551420540;Ventilador De Pared Kalley K-vap26w;288693;1;50;buy_it_now;gold_special;True;;MCO115346;Electrodomésticos
MCO466070842;Carafe Para Capuchinera Ref 4188;19397;50;200;buy_it_now;gold_special;True;;MCO163021;Electrodomésticos
MCO580631767;Climatizador Portatil De Vino Cuisinart Pc100;420900;1;2;buy_it_now;gold_special;True;;MCO160451;Electrodomésticos
MCO582128137;Gramera Báscula Kalley 5 Kilos K-mgc01 Digital Gramos Onzas;37900;1;50;buy_it_now;gold_special;True;;MCO118000;Electrodomésticos
MCO487634691;Kit 4 Repuestos Purificador De Agua Alizz 14 Litros;70000;250;250;buy_it_now;gold_special;True;;MCO115562;Electrodomésticos
MCO577248397;Cepillo Secador Salon One-step Hair Dryer Volumizer 360;99900;1;200;buy_it_now;gold_pro;True;;MCO4597;Electrodomésticos
MCO538872557;Enfriador De Bebidas Rca Capacidad Para 70 Latas O 17;906550;1;1;buy_it_now;gold_special;True;;MCO160453;Electrodomésticos
MCO489522611;Cuchilla Completa Tipo Nutribullet 600 Y 900 Watts Repuesto;49900;1;500;buy_it_now;gold_pro;True;;MCO1899;Electrodomésticos
MCO469179139;Super Molino De Carne Electrico Multifuncional + Boquillas;169999;1;50;buy_it_now;gold_pro;True;;MCO30109;Electrodomésticos
MCO468853616;Filtro De Agua Nevera Ge Compatible Mwf - Smart Water;77000;1;5;buy_it_now;gold_pro;True;;MCO433579;Electrodomésticos
MCO538930089;Nescafé® Dolce Gusto® Au Lait X 1 Cajas ;19200;1;100;buy_it_now;gold_special;True;;MCO4340;Electrodomésticos
MCO452122625;Plancha Remington Keratina Y Aceite De Argan + Obsequio ;159000;1;250;buy_it_now;gold_special;True;;MCO4598;Electrodomésticos
MCO526720339;Refrigerador Personal Coke Zero Cz04 Diet Coke, 12 Voltios Y;276000;1;2;buy_it_now;gold_special;True;;MCO115336;Electrodomésticos
