id;title;price;available_quantity;sold_quantity;buying_mode;listing_type_id;accepts_mercadopago;original_price;category_id;category_name
MCO586224020;Filtro Para Nevecon  LG Externo Adq73693901;75000;1;25;buy_it_now;gold_pro;True;;MCO433579;Electrodomésticos
MCO508079921;Bascula Digital Pesa Personas De Vidrio Ultraresistente;49900;150;500;buy_it_now;gold_pro;True;;MCO169104;Electrodomésticos
MCO451517394;Balanza Bascula Pesa Dinamometro Digital  50 Kg Maleta Mano;11990;50;500;buy_it_now;gold_special;True;;MCO169104;Electrodomésticos
MCO495089602;Filtro De Agua Para Nevera Whirpool 4378411rb Externo;32900;1;250;buy_it_now;gold_pro;True;;MCO433579;Electrodomésticos
MCO593391739;Lavadora Wa15t5260by/co Samsung 15 Kg Magic Inverter.;1354900;1;1;buy_it_now;gold_pro;True;1489900.0;MCO159881;Electrodomésticos
MCO452342181;Kit 4 Repuestos Filtro Purificador Agua Ecotrade 14 Litros;70000;1;500;buy_it_now;gold_pro;True;;MCO115562;Electrodomésticos
MCO539791868;Filtro De Agua Para Nevecones LG, Adq74793501  Lt1000;89800;1;100;buy_it_now;gold_pro;True;;MCO433579;Electrodomésticos
MCO569511216;Licuadora Oster Clásica, Ref: 4655;214500;1;200;buy_it_now;gold_special;True;;MCO163045;Electrodomésticos
MCO552394974;Wahl T-pro Patillera Barbera Rasuradora 100 % Original Nueva;92990;1;250;buy_it_now;gold_special;True;;MCO5411;Electrodomésticos
MCO579105808;Filtro Para Nevera Samsung (da29-10105j);64000;1;50;buy_it_now;gold_pro;True;;MCO433579;Electrodomésticos
MCO495629746;Peluquera Wahl Home Cut Cortadora 15 Piezas + Tijeras;89900;1;500;buy_it_now;gold_pro;True;;MCO5411;Electrodomésticos
MCO445990536;Whirlpool 285785 Kit De Embrague Para Lavadora;281000;1;1;buy_it_now;gold_special;True;;MCO159881;Electrodomésticos
MCO588120461;Filtro De Agua Lt1000p Nevecones LG Original;79900;1;5;buy_it_now;gold_pro;True;;MCO433579;Electrodomésticos
MCO459952255;Peluquera Patillera Wahl Combo Peluqueria Barba Barberia;124900;1;500;buy_it_now;gold_pro;True;;MCO5411;Electrodomésticos
MCO514671745;Rodillo Jade Tratamiento Facial Relajacion Kit Cara Natural;28000;1;500;buy_it_now;gold_special;True;;MCO1899;Electrodomésticos
MCO477089889;Filtro De Agua  Samsung Da29 00020b;125800;1;200;buy_it_now;gold_pro;True;;MCO433579;Electrodomésticos
MCO537345367;Sandwichera Oster® 2 Rebanadas Ckstsm2885k;51000;50;250;buy_it_now;gold_special;True;85000.0;MCO163035;Electrodomésticos
MCO474908324;Cápsulas Dolce Gusto X 2 Unidades | Recargable + Reusable;19980;50;250;buy_it_now;gold_special;True;;MCO4340;Electrodomésticos
MCO456126479;Filtro De Agua Nevera  General Electric  Gxrtdr;47000;1;150;buy_it_now;gold_pro;True;;MCO433579;Electrodomésticos
MCO491713272;Alternativa Imaginación Azul Salvia Varillas De 4 Pulgadas ;145990;1;1;buy_it_now;gold_special;True;;MCO159881;Electrodomésticos
MCO560614146;Secador De Pelo Profesional 5 En 1 Difusor 2 Boquillas Peine;74900;1;250;buy_it_now;gold_pro;True;;MCO4597;Electrodomésticos
MCO586223264;Filtro Para Nevera LG  Adq73613401 ( Filtro Nevecones LG );98000;1;5;buy_it_now;gold_pro;True;;MCO433579;Electrodomésticos
MCO594257223;Sandwichera De Placas Profundas Black+decker;98910;100;5;buy_it_now;gold_special;True;109900.0;MCO163035;Electrodomésticos
MCO487851346;Balanza Bascula Pesa Persona Digital De 180 Kilos;43900;50;500;buy_it_now;gold_pro;True;;MCO169104;Electrodomésticos
MCO567223489;Kit De Instalacion Para Neveras Para Toda Marca;40000;1;25;buy_it_now;gold_pro;True;;MCO433579;Electrodomésticos
MCO462804827;Eureka Mickey Teacher Tarjetas;125990;1;1;buy_it_now;gold_special;True;;MCO159881;Electrodomésticos
MCO546276764;Chocolatera Eléctrica Corona  Haceb, Envío Inmediato ;137000;1;500;buy_it_now;gold_special;True;;MCO163021;Electrodomésticos
MCO480596819;Filtro De Agua Para Nevera Samsung;110000;1;50;buy_it_now;gold_pro;True;;MCO433579;Electrodomésticos
MCO538874404;Control De Peso, Pesa Balanza Digital Exacta, Obesidad;39000;1;500;buy_it_now;gold_special;True;;MCO169104;Electrodomésticos
MCO570607178;Bascula Electrónica Balanza Digital Gramera 40 Kg+obsequio ;102000;250;150;buy_it_now;gold_special;True;;MCO118000;Electrodomésticos
MCO456806387;Filtro De Agua Para Nevera Externo -mas Kit De Instalación-;40000;1;100;buy_it_now;gold_pro;True;;MCO433579;Electrodomésticos
MCO560927230;Plancha Profesional El Cabello A Vapor Cerámica 450°f + Obse;109900;1;250;buy_it_now;gold_special;True;;MCO4598;Electrodomésticos
MCO456936203;Licuadora Portátil Shake'n Take Bebidas, + Obsequio;39900;1;250;buy_it_now;gold_special;True;;MCO163045;Electrodomésticos
MCO538081594;Filtro De Agua Nevera Whirlpool Kitchenaid W10295370a P4rfwb;146000;1;25;buy_it_now;gold_pro;True;;MCO433579;Electrodomésticos
MCO516123896;Calentador De Ambiente / Calefactor Kalley · Garantía 2 Años;79900;1;250;buy_it_now;gold_special;True;119900.0;MCO163012;Electrodomésticos
MCO576280330;Batidora De Pedestal Kalley K-mbme300;177940;1;200;buy_it_now;gold_special;True;;MCO4339;Electrodomésticos
MCO499089826;Mini Refrigerador Con Tablero Borrable Retro  Frigidaire;984550;1;5;buy_it_now;gold_special;True;;MCO160450;Electrodomésticos
MCO573562036;Horno De Convección Dkasa 32 Litros - Envío Gratis;289900;1;100;buy_it_now;gold_special;True;;MCO116383;Electrodomésticos
MCO556953233;Cafetera Prensa Francesa 350ml French Press;25900;1;200;buy_it_now;gold_special;True;;MCO4340;Electrodomésticos
MCO495089418;Filtro De Agua Para Nevera LG Premium 5231ja2002a Adq729109;109000;1;50;buy_it_now;gold_pro;True;;MCO433579;Electrodomésticos
MCO582628158;Cepillo Secador Voluminizador ;80900;1;200;buy_it_now;gold_special;True;;MCO4597;Electrodomésticos
MCO464988395;Lonchera Porta Comidas Electrica Practica Segura;26900;150;500;buy_it_now;gold_special;True;;MCO163021;Electrodomésticos
MCO452323638;Filtro De Agua Para Nevera LG M7251253fr-06 / Adq32617703;148000;1;100;buy_it_now;gold_pro;True;;MCO433579;Electrodomésticos
MCO446871588;Rizador Curl Perfect Para Rizos Perfectos Escoge Colores;14900;500;500;buy_it_now;gold_special;True;29900.0;MCO166643;Electrodomésticos
MCO476663498;Bascula Digital Balanza Pesa 180kg 9 Programas Bluetoot Masa;109900;200;500;buy_it_now;gold_pro;True;157000.0;MCO169104;Electrodomésticos
MCO581991587;Cajón Para Hielo Nevera Mabe Ref. 225d7996p001;18000;1;25;buy_it_now;gold_special;True;;MCO399140;Electrodomésticos
MCO586043403;Calefactor Calentador De Ambiente A Control Remoto Temporiza;65900;1;200;buy_it_now;gold_special;True;;MCO438142;Electrodomésticos
MCO593876781;Cafetera De 12 Tazas Black+decker  Negra ;148410;1;5;buy_it_now;gold_special;True;164900.0;MCO4340;Electrodomésticos
MCO537482302;Congelador Vertical  Electrolux Efup17p3hrg Gris 163 Litros;1299900;1;50;buy_it_now;gold_special;True;2149900.0;MCO115335;Electrodomésticos
MCO550697742;Filtro Purificador De Agua A Base De Ozono + 2 Regalos;126990;50;500;buy_it_now;gold_pro;True;;MCO115562;Electrodomésticos
MCO516318148;Plancha Remington Triple Infusión Keratina Argan Y Macadamia;155000;1;250;buy_it_now;gold_special;True;;MCO4598;Electrodomésticos
MCO452323672;Filtro De Aire Para Neveras LG  Hygiene Fresh / Air Fresh;35000;1;50;buy_it_now;gold_special;True;;MCO115336;Electrodomésticos
MCO535074235;Plancha   Baby Liss   Ancha 1  1/2   Babyliss  100% Original;249990;500;150;buy_it_now;gold_special;True;;MCO4598;Electrodomésticos
MCO572628137;Maquina Afeitadora Razuradora Profesional 3 En 1 Geemy;59000;1;100;buy_it_now;gold_pro;True;;MCO5411;Electrodomésticos
MCO572738511;Unidad Compresor De 1/8 Hp 110 Voltios Para Gas R600 ;110000;50;25;buy_it_now;gold_special;True;;MCO398574;Electrodomésticos
MCO550784600;Nebulizador Portatil Adulto Y Pediatrico Gmd Nube ;149800;50;250;buy_it_now;gold_special;True;;MCO166750;Electrodomésticos
MCO594257213;Sandwichera Black+decker Blanca;80910;150;5;buy_it_now;gold_special;True;89900.0;MCO163035;Electrodomésticos
MCO468853449;Filtro De Agua Nevera Samsung Compatible Da29-00003g -purity;75000;1;50;buy_it_now;gold_pro;True;;MCO433579;Electrodomésticos
MCO571783401;Freidora De Aire Oster Bioceramic Sin Aceite 3,2lt Air Fryer;349999;1;100;buy_it_now;gold_special;True;;MCO117975;Electrodomésticos
MCO596761473;Horno Microondas Visivo Negro Vmo-d07bl2;236000;500;2;buy_it_now;gold_special;True;384900.0;MCO117959;Electrodomésticos
MCO525517423;Grill Asador Panini Grill Asador Panini Copper     ;89900;1;200;buy_it_now;gold_special;True;;MCO163035;Electrodomésticos
MCO595989737;Filtro De Agua Nevecon Samsung Haf-cin/exp Da29-00020b Ya!!!;108900;1;5;buy_it_now;gold_special;True;;MCO433579;Electrodomésticos
MCO456811306;Cafetera Térmica Programable - 12 Tazas;159900;50;250;buy_it_now;gold_pro;True;225000.0;MCO4340;Electrodomésticos
MCO584446119;Licuadora Personal Portable Recargable Jugos Y Batidos Gym;28760;50;250;buy_it_now;gold_special;True;;MCO163045;Electrodomésticos
MCO560290278;Timer Nevera Haceb 1432 Original 9 Horas - Repuesto Nevera;26000;1;50;buy_it_now;gold_pro;True;;MCO438219;Electrodomésticos
MCO578167501;Calentador Portatil De Ambiente Handy Heater;49900;50;100;buy_it_now;gold_special;True;;MCO438142;Electrodomésticos
MCO569404082;Olla Freidora De Aire Oster Mini 1.5 Litros;255000;1;250;buy_it_now;gold_special;True;;MCO117975;Electrodomésticos
MCO555232315;Nevera Minibar 67 Lts Hyrf67s Hyundai;615739;1;5;buy_it_now;gold_special;True;;MCO160450;Electrodomésticos
MCO548508686;Plancha Ropa Vapor Oster 4801, Antiadherente 1200w;49700;1;250;buy_it_now;gold_special;True;;MCO115342;Electrodomésticos
MCO594045603;Aspiradora De Bolsa Black & Decker;269910;1;5;buy_it_now;gold_special;True;299900.0;MCO115340;Electrodomésticos
MCO467233870;Filtro De Agua Para Nevera Frigidaire Ultrawf;155000;1;25;buy_it_now;gold_pro;True;;MCO433579;Electrodomésticos
MCO552337806;Vaso Genérico En Vidrio Para  Licuadora Oster Clásica;24000;50;500;buy_it_now;gold_pro;True;;MCO441158;Electrodomésticos
MCO575523046;Secador De Pelo Nova Caliente Frió 5000w Cabello Profesional;43900;1;150;buy_it_now;gold_special;True;;MCO4597;Electrodomésticos
MCO564695858;Compresor Para Nevera De 1/5 R600 Donper Haceb Original!;280000;1;5;buy_it_now;gold_pro;True;;MCO398574;Electrodomésticos
MCO464543256;Bascula Balanza Sportfitness Pesa Digital 150 Kg Oferta Gym;71000;1;250;buy_it_now;gold_special;True;;MCO169104;Electrodomésticos
MCO560507730;Plancha Cabello Remington Antifrizz Digital Original, Alta.c;99900;100;150;buy_it_now;gold_pro;True;;MCO4598;Electrodomésticos
MCO595985288;Filtro De Agua Nevera LG Lt700p Adq36006101 Envío Muy Rápido;78900;1;5;buy_it_now;gold_special;True;;MCO433579;Electrodomésticos
MCO489933839;Brilladora Electrolux Domestica Bc10;545000;1;150;buy_it_now;gold_special;True;;MCO117985;Electrodomésticos
MCO578007543;Báscula Gramera Mecánica De Cocina Para 5kg - Pretul 29973;12400;1;150;buy_it_now;gold_special;True;;MCO118000;Electrodomésticos
MCO453327270;Filtro De Agua Para Nevera  Electrolux Ref 502417010002;145000;1;50;buy_it_now;gold_pro;True;;MCO433579;Electrodomésticos
MCO552997270;Airfryer Xxl Horno + Freidora Sin Aceite 9l + Libro 100 Rece;458900;500;200;buy_it_now;gold_special;True;899900.0;MCO117975;Electrodomésticos
MCO573392134;Batidora Oster 2499  240w Batidor Y Mezclador;119500;250;150;buy_it_now;gold_special;True;;MCO4339;Electrodomésticos
MCO509628446;Nevera Minibar Challenger 121 Lt Gris;799900;1;4;buy_it_now;gold_special;True;;MCO160450;Electrodomésticos
MCO565559234;Plancha Barba Cepillo Alisador Cabello Hombre 4 En 1 Peine;19990;150;250;buy_it_now;gold_pro;True;;MCO180960;Electrodomésticos
MCO558259050;Cafetera Prensa Francesa;25900;1;200;buy_it_now;gold_special;True;;MCO4340;Electrodomésticos
MCO453327181;Filtro De Agua Para Nevera Kitchenaid Ukf8001 - Edr4rxd1 - 4;149000;1;25;buy_it_now;gold_pro;True;;MCO433579;Electrodomésticos
MCO517407990;Ventilador 18puLG Turbo Silence Maxx 3en 1 Negro Samurai 6 A;184203;50;250;buy_it_now;gold_special;True;219579.0;MCO115346;Electrodomésticos
MCO502723324;Maquina Peluqueria Profesional Wahl Magic Clip 5 Estrellas ;268600;1;250;buy_it_now;gold_pro;True;;MCO5411;Electrodomésticos
MCO532292388;Maquina De Hielo Frigidaire, Con Capacidad De 40 Libras,;954550;1;5;buy_it_now;gold_special;True;;MCO115336;Electrodomésticos
MCO572112924;Maquina De Peluqueria Tipo Wahl Gris Profesional;58000;50;250;buy_it_now;gold_pro;True;;MCO5411;Electrodomésticos
MCO534354870;Combo Plancha Remington Aguacate Y Pinza Rizador Espiral;159000;1;500;buy_it_now;gold_special;True;;MCO4598;Electrodomésticos
MCO456645477;Filtro De Agua Nevera Samsung Compatible Da29-00020b -purity;81000;1;50;buy_it_now;gold_pro;True;;MCO433579;Electrodomésticos
MCO456811121;Mini Picadora De Alimentos 3 Tazas Negro;93750;50;250;buy_it_now;gold_pro;True;125000.0;MCO117365;Electrodomésticos
MCO566857463;Bascula Peso Balanza Gmd Digital Personas Peso Corporal Gris;70000;1;250;buy_it_now;gold_pro;True;;MCO169104;Electrodomésticos
MCO548006891;Tarjeta De Nevera Haceb 370/420;139000;50;25;buy_it_now;gold_pro;True;;MCO398573;Electrodomésticos
MCO540833856;Balanza Gramera Báscula Cocina Digital Capacidad Hasta 10kg;18900;1;500;buy_it_now;gold_special;True;;MCO118000;Electrodomésticos
MCO521914575;Freidora Sin Aceite Air Fryer 3.5 Litros Renahouse Nueva;214000;1;250;buy_it_now;gold_special;True;;MCO117975;Electrodomésticos
MCO578057906;Caucho Para Neveras ;30000;50;5;buy_it_now;gold_special;True;;MCO438219;Electrodomésticos
MCO566975439;Estufa De Empotrar Acero Inoxidable 5425 Gas Propano;180000;1;100;buy_it_now;gold_special;True;;MCO115311;Electrodomésticos
MCO467815575;¡ Set X2 Matt Láminas Antiadherentes Asados Parrilla Bbq !! ;34900;500;250;buy_it_now;gold_pro;True;;MCO117961;Electrodomésticos
MCO455340051;Vitrina Refrigerada- Nevera Exhibidor;3900000;1;5;buy_it_now;gold_special;True;;MCO160453;Electrodomésticos
MCO568915952;Extractor De Jugos Black & Decker ;199900;1;100;buy_it_now;gold_special;True;270000.0;MCO163042;Electrodomésticos
MCO548508748;Molino De Carne Electrico Universal Royal Reversible ;207400;1;150;buy_it_now;gold_special;True;;MCO30109;Electrodomésticos
MCO458202920;Filtro De Agua Para Nevera Whirpool 4378411rb Con Kit De Int;53000;1;50;buy_it_now;gold_pro;True;;MCO433579;Electrodomésticos
MCO546622851;Cepillo Secador Voluminizador Revlon Salon One-step Hair Dry;299000;50;250;buy_it_now;gold_special;True;;MCO4597;Electrodomésticos
MCO551422614;Freidora Air Fryer Kalley K-maf25;219900;1;200;buy_it_now;gold_special;True;389900.0;MCO117975;Electrodomésticos
MCO560816434;Bandeja Para Serpentin Original Nevera Mabe Y Centrales ;18000;1;5;buy_it_now;gold_pro;True;;MCO438219;Electrodomésticos
MCO594262522;Licuadora  Black+ Decker 550 Watts Sandia;116910;50;50;buy_it_now;gold_special;True;129900.0;MCO163045;Electrodomésticos
MCO533219054;Maquina Peluquear Pelo Cortadora Cabello Afeitadora Pro;70000;1;250;buy_it_now;gold_pro;True;;MCO5411;Electrodomésticos
MCO494236131;Maquina Fabricar Hielo (acero Inoxidable) Comercial 100 Lbs;4290000;1;3;buy_it_now;gold_special;True;;MCO115336;Electrodomésticos
MCO595466581;Nueva Plancha Remington Aguacate Y Macadamia S12a Shine ;119990;1;100;buy_it_now;gold_pro;True;;MCO4598;Electrodomésticos
MCO533543575;Freidora Sin Aceite Digital 4.2+ 100 Recetas Air Fryer + Obs;289900;50;100;buy_it_now;gold_special;True;;MCO117975;Electrodomésticos
MCO477090210;Filtro De Agua Para Nevera  Samsung  Da29 00020b Haf/cin;127900;1;50;buy_it_now;gold_special;True;;MCO433579;Electrodomésticos
MCO557591174;Licuadora Portátil Batidos Jugos 380ml Recargable+power Bank;39900;200;150;buy_it_now;gold_special;True;;MCO163045;Electrodomésticos
MCO561003962;Máquina Corte Peluquería Profesional Turbox Barber Cut;129990;1;500;buy_it_now;gold_pro;True;;MCO5411;Electrodomésticos
MCO481939047;Filtro De Agua Nevera Samsung Da29-10105j Hafex/exp;82000;1;100;buy_it_now;gold_pro;True;;MCO433579;Electrodomésticos
MCO533584336;Bascula Balanza Pesa Sportfitness Digital 150k Masa Corporal;59500;1;250;buy_it_now;gold_special;True;;MCO169104;Electrodomésticos
MCO594257220;Licuadora Silenciosa Black+decker;278910;1;25;buy_it_now;gold_special;True;309900.0;MCO163045;Electrodomésticos
MCO556116389;Tarjeta Nevera Mabe 225d7291g003 Original! Repuesto Nevera.;125000;1;5;buy_it_now;gold_pro;True;;MCO398573;Electrodomésticos
MCO587472264;Exprimidor Hamilton Beach De Citricos;59900;250;25;buy_it_now;gold_special;True;79900.0;MCO163221;Electrodomésticos
MCO564086653;Combo Plancha Remington Aguacate Y Macadamia Secador Cabello;199000;1;200;buy_it_now;gold_special;True;;MCO4598;Electrodomésticos
MCO561267744;Resistencia Recta Nevera Mabe / Centrales 40 Cm 115v 280w;16500;1;5;buy_it_now;gold_pro;True;;MCO398578;Electrodomésticos
MCO556097550;Batidora 3 En 1, Manual Pedestal E Inmersion Home Elements;149900;1;250;buy_it_now;gold_special;True;;MCO4339;Electrodomésticos
MCO563114312;Sanduchera Antihaderente Tipo Panini;49900;1;250;buy_it_now;gold_special;True;;MCO163035;Electrodomésticos
MCO550022805;Plancha Para La Barba Y Cabello Plancha Para Hombre + Envio;39900;1;250;buy_it_now;gold_pro;True;;MCO4598;Electrodomésticos
MCO558309558;Galanz Retro Minibar Nevera Refrigerador Comercial;1724990;1;2;buy_it_now;gold_pro;True;;MCO160450;Electrodomésticos
MCO582135352;Aire Acondicionado Inverter Wifi 12.000btu / 110v Hyundai;1249900;1;50;buy_it_now;gold_special;True;1999900.0;MCO115344;Electrodomésticos
MCO461000214;Cafetera Eléctrica Altezza 12 Tazas Negra;69990;1;250;buy_it_now;gold_special;True;;MCO4340;Electrodomésticos
MCO558057115;Bimetalico Nevera Haceb Emicol L60 Azul Original!!;22000;1;25;buy_it_now;gold_pro;True;;MCO414221;Electrodomésticos
MCO585665979;Báscula Balanza Digital Inteligente Personas Diagnostica;80000;100;100;buy_it_now;gold_pro;True;;MCO169104;Electrodomésticos
MCO574754683;Báscula Inteligente Huawei Body Fat Scale - Producto Nuevo;155000;1;100;buy_it_now;gold_special;True;;MCO169104;Electrodomésticos
MCO564697115;Compresor Para Nevera De 1/5 R134 Donper Haceb Original!;275000;1;5;buy_it_now;gold_pro;True;;MCO398574;Electrodomésticos
MCO502398774;Batidora 20l;2170000;1;50;buy_it_now;gold_special;True;;MCO4339;Electrodomésticos
MCO577891516;Cafetera Subito Timer Programable 15 Tazas Imusa;142425;1;50;buy_it_now;gold_special;True;189900.0;MCO4340;Electrodomésticos
MCO453327290;Filtro De Agua LG Externo 5231ja2010b;61000;1;25;buy_it_now;gold_pro;True;;MCO438219;Electrodomésticos
MCO537585388;Freidora Sin Aceite Digital 4.2+ Libro 100 Recetas Air Fryer;244900;150;50;buy_it_now;gold_special;True;;MCO117975;Electrodomésticos
MCO498140970;Maquina Wahl 5 Estrellas Magic Clip;236000;1;250;buy_it_now;gold_special;True;;MCO5411;Electrodomésticos
MCO477112245;Filtro De Agua Para Nevera Kitchenaid  W10790814 -w10413645a;149000;1;25;buy_it_now;gold_special;True;;MCO433579;Electrodomésticos
MCO595286029;Anti Mosquitos Repelente De Insectos, Rata Ratón, Cucaracha;36000;50;100;buy_it_now;gold_special;True;;MCO176766;Electrodomésticos
MCO479213246;Licuadora Oster Reversible Digital;245000;1;500;buy_it_now;gold_special;True;;MCO163045;Electrodomésticos
MCO563203538;Unidad Compresor De 1/5 R600 Donper Haceb Original! Nueva!;280000;1;5;buy_it_now;gold_pro;True;;MCO398574;Electrodomésticos
MCO580404782;Olla Freidora Sin Aceite Air Fryer  Ps Plus 2 Litros;189900;1;50;buy_it_now;gold_special;True;;MCO117975;Electrodomésticos
MCO593876784;Aspiradora Black & Decker Power Pro;356310;1;5;buy_it_now;gold_special;True;395900.0;MCO115340;Electrodomésticos
MCO557699761;Repuesto Nevera Haceb Mabe Centrales Timer 1432 Orig!;35000;1;25;buy_it_now;gold_pro;True;;MCO438219;Electrodomésticos
MCO580987292;Lonchera Eléctrica Portacomida Térmica Practica Y Elegante;29900;500;100;buy_it_now;gold_pro;True;;MCO163021;Electrodomésticos
MCO446218402;¡ Set X2 Matt Láminas Antiadherentes Asados Parrilla Bbq !!;30800;1;250;buy_it_now;gold_pro;True;;MCO117961;Electrodomésticos
MCO453762851;(dos) Filtro De Agua Para Nevera Whirpool 4378411rb Externo;80000;1;100;buy_it_now;gold_pro;True;;MCO433579;Electrodomésticos
MCO557182438;Balanza Gramera Bascula Digital 7kg Con Recipiente B09;28900;100;250;buy_it_now;gold_special;True;;MCO118000;Electrodomésticos
MCO453442329;Balanza Gramera Digital De Cocina 5000 Gramos 5 Kilos Tara;27900;1;500;buy_it_now;gold_special;True;;MCO118000;Electrodomésticos
MCO570148674;Sensor Para Nevera Samsung Amarillo!;25000;1;5;buy_it_now;gold_pro;True;;MCO414221;Electrodomésticos
MCO456819358;Arrocera Negra 10 Tazas Con Función Para Mantener Caliente;100000;50;250;buy_it_now;gold_pro;True;125000.0;MCO117982;Electrodomésticos
MCO496116643;Mezclador Personal;81750;50;500;buy_it_now;gold_special;True;109000.0;MCO163045;Electrodomésticos
MCO575795812;Bimetalico Termofusible Para Nevera Samsung Y Challenger!;28000;1;5;buy_it_now;gold_pro;True;;MCO414221;Electrodomésticos
MCO576079211;Nutribullet Pro 900 W, Magic Bullet 15 Piezas Recetario Lujo;209500;1;50;buy_it_now;gold_special;True;;MCO163045;Electrodomésticos
MCO543072797;Guantes Profesionales Para Planchar El Cabello;29999;1;200;buy_it_now;gold_special;True;;MCO4598;Electrodomésticos
MCO511894902;Filtro De Agua Para Nevecon-nevera Whirpool Original.;60000;500;25;buy_it_now;gold_pro;True;;MCO433579;Electrodomésticos
MCO581967914;Aire Acondicionado 12.000 Btu/110v Hyundai;849900;1;50;buy_it_now;gold_special;True;1428900.0;MCO115344;Electrodomésticos
MCO462307348;Licuadora Jugos Portatil Batidos 380ml Usb Exprimidor;29990;1;250;buy_it_now;gold_pro;True;;MCO163045;Electrodomésticos
MCO492573606;Filtro De Agua LG Interno Lt800p Nevecon Original;99900;1;25;buy_it_now;gold_pro;True;;MCO433579;Electrodomésticos
MCO552997016;Combo Plancha Remington Aguacate Macadamia Vitamina+ Rizador;157990;100;100;buy_it_now;gold_special;True;;MCO4598;Electrodomésticos
MCO537653402;Combo Peluquera Wahl Deluxe Groom Pro 3 En 1  100 % Original;159990;200;150;buy_it_now;gold_special;True;;MCO5411;Electrodomésticos
MCO569204772;Filtro Nevera LG;66500;1;5;buy_it_now;gold_pro;True;;MCO433579;Electrodomésticos
MCO581768127;Olla Freidora Dkasa 7.2 Litros Air Fryer 80% Menos Aceite;498900;1;50;buy_it_now;gold_special;True;;MCO117975;Electrodomésticos
MCO569405815;Sanduchera Waflera Parrillera Electrica Oster Cg120 4 Puesto;205000;1;100;buy_it_now;gold_special;True;;MCO163035;Electrodomésticos
MCO582716082;Filtro De Agua Para Nevera Whirpool 4378411rb Externo;33000;1;5;buy_it_now;gold_special;True;;MCO433579;Electrodomésticos
MCO570842052;Secador Remington Cerámica D3190 Boquilla+difusor Original;119900;1;100;buy_it_now;gold_special;True;;MCO4597;Electrodomésticos
MCO552998238;Freidora Sin Aceite Digital 4.2+ Libro 100 Recetas Air Fryer;239900;500;150;buy_it_now;gold_special;True;;MCO117975;Electrodomésticos
MCO456645484;Filtro De Agua Nevera Samsung Compatible Da29-00003g -purity;81000;1;100;buy_it_now;gold_pro;True;;MCO433579;Electrodomésticos
MCO560408475;Cafetera Digital Kalley K-mcd900n;66539;1;150;buy_it_now;gold_special;True;139900.0;MCO4340;Electrodomésticos
MCO531342692;Balanza Bascula Pesa Gramera Joyeria Bolsillo 0.01 A 200gm;17900;1;200;buy_it_now;gold_special;True;;MCO118000;Electrodomésticos
MCO485494128;Filtro De Agua Nevera Samsung  Da97-17376b Haf-qin /exp;143000;1;5;buy_it_now;gold_special;True;;MCO433579;Electrodomésticos
MCO453527355;Gramera Balanza Bascula Pesa Joyeria Bolsillo 0.01g A 200g;16900;100;500;buy_it_now;gold_pro;True;;MCO118000;Electrodomésticos
MCO559183591;Exprimidor Eléctrico Jugo Naranjas Con Brazo;192900;250;100;buy_it_now;gold_special;True;;MCO163045;Electrodomésticos
MCO575787033;Sensor Termofusible Para Nevera LG Largo O Corto!;33000;1;5;buy_it_now;gold_pro;True;;MCO414221;Electrodomésticos
MCO562849408;Batidor Portátil Eléctrico Mezclador Cafe Leche ;15000;1;250;buy_it_now;gold_pro;True;;MCO4339;Electrodomésticos
MCO562121780;Estufa Electrica Un Puesto 1000w;44980;1;150;buy_it_now;gold_special;True;;MCO115311;Electrodomésticos
MCO567620135;Filtro De Agua Samsung Nevecon Da29-00020b  Nevera;107900;1;5;buy_it_now;gold_pro;True;;MCO433579;Electrodomésticos
MCO573445984;Maquina Peluqueria Wahl Easy Cut 10 Piezas Corte Original;78900;1;100;buy_it_now;gold_special;True;;MCO5411;Electrodomésticos
MCO559327100;Licuadora Universal 2 Años De Garantía ;94900;1;250;buy_it_now;gold_pro;True;;MCO163045;Electrodomésticos
MCO581932257;Balcón Puerta, Anaquel Nevera Mabe Ref. 225d7664p001;30000;1;5;buy_it_now;gold_special;True;;MCO398575;Electrodomésticos
MCO572826356;Molino De Carne Manual Trituradora Picadora Acero Inoxidable;49900;50;100;buy_it_now;gold_special;True;;MCO30109;Electrodomésticos
MCO515295746;Secador Cabello 2200w Iónico Difusor Y Boquillas ;59990;1;250;buy_it_now;gold_pro;True;;MCO4597;Electrodomésticos
MCO566499106;Filtro De Aire Para Neveras Whirpool Fresh Flow W10311524;45000;1;5;buy_it_now;gold_special;True;;MCO115336;Electrodomésticos
MCO563505731;Wahl Easy Cut Peluquera 10 Piezas Original Casera Motilar;88990;1;150;buy_it_now;gold_special;True;;MCO5411;Electrodomésticos
MCO536397124;Freidora Sin Aceite 3.6 + Libro 100 Recetas Air Fryer;212500;50;150;buy_it_now;gold_special;True;;MCO117975;Electrodomésticos
MCO448661954;Gramera Pesa Bascula Digital 7kg Taza Garantía + Baterias;28800;1;500;buy_it_now;gold_special;True;;MCO166181;Electrodomésticos
MCO561828881;Sensor Doble Original Para Nevera Haceb N370/420!!;38000;1;5;buy_it_now;gold_pro;True;;MCO414221;Electrodomésticos
MCO580591754;Balanza Personal De Baño Bascula Digital Pesa Persona 150kg;39000;50;100;buy_it_now;gold_special;True;;MCO169104;Electrodomésticos
MCO544373780;Báscula Mecánica Gramera 5k Pretul;12370;1;100;buy_it_now;gold_special;True;15990.0;MCO118000;Electrodomésticos
MCO536148168;Repuesto Nevera Samsung Inverter Motor Evaporador Original!!;115000;1;5;buy_it_now;gold_pro;True;;MCO398574;Electrodomésticos
MCO533653964;Licuadora Oster Azul Personal 250 Watts;99900;1;250;buy_it_now;gold_special;True;;MCO163045;Electrodomésticos
