id;title;price;available_quantity;sold_quantity;buying_mode;listing_type_id;accepts_mercadopago;original_price;category_id;category_name
MLA834355084;Mesa De Ping Pong Piramydes Global Profesional Plegable Azul;19988.99;303;202;buy_it_now;gold_special;True;;MLA12218;Juegos y Juguetes
MLA855462190;Poopsie Sparkly Critters Coleccionable Slime Glitter ;990.0;50;500;buy_it_now;gold_special;True;1290.0;MLA418285;Juegos y Juguetes
MLA901011142;Juego De Mesa Preguntas De Cultura General Atenea De Maldón;2690.0;250;250;buy_it_now;gold_special;True;;MLA1161;Juegos y Juguetes
MLA862830870;Lego® Minecraft - La Aventura En La Taiga 21162;2999.0;150;500;buy_it_now;gold_special;True;;MLA1157;Juegos y Juguetes
MLA843408657;Marcadores Touch Doble Punta X36 Unidades ;1999.0;50;500;buy_it_now;gold_pro;True;;MLA69567;Juegos y Juguetes
MLA765719253;Playmobil Camioneta Aventura 3528 Full;1595.0;250;500;buy_it_now;gold_special;True;2190.0;MLA12400;Juegos y Juguetes
MLA773086522;Whan O Tobogán Deslizador Wo64120 Mercado Envíos Full;3495.0;100;500;buy_it_now;gold_special;True;4295.0;MLA433096;Juegos y Juguetes
MLA861892322;Furball Mascota Sorpresa Varios Modelos ;2999.0;100;250;buy_it_now;gold_special;True;3899.0;MLA3422;Juegos y Juguetes
MLA776965417;Strike 360 - Kit Oficial - Juego/deporte;5390.0;250;500;buy_it_now;gold_pro;True;;MLA432254;Juegos y Juguetes
MLA858040551;Naruto Bandana Vincha Todas Aldeas - Acero Inox. - Cosplay;852.25;250;500;buy_it_now;gold_special;True;;MLA3422;Juegos y Juguetes
MLA847047458;Atlantis Mapas - Proyecto Argentina - Sitio Original;1190.0;250;500;buy_it_now;gold_special;True;;MLA418303;Juegos y Juguetes
MLA885826306;Cochecito Cuna Bebe Bebote Muñeca Babymovil Cici 826;1599.0;1;250;buy_it_now;gold_special;True;1998.75;MLA413430;Juegos y Juguetes
MLA869866318;Juego De Mesa Pescadores De Maldon;1880.0;50;500;buy_it_now;gold_special;True;;MLA1161;Juegos y Juguetes
MLA860449449;Pista Luminosa Flexible Velocidad Sin Límites 220 Pieza Full;2299.0;100;500;buy_it_now;gold_special;True;2690.0;MLA37616;Juegos y Juguetes
MLA792356573;Monopatin Plegable Reforzado Premium Para Chicos Nenas;7199.0;200;500;buy_it_now;gold_special;True;9999.0;MLA12065;Juegos y Juguetes
MLA827410248;Pistolas Lanza Agua X 2 Accion Extrema El Duende Azul;999.0;50;500;buy_it_now;gold_special;True;1286.0;MLA90321;Juegos y Juguetes
MLA820214049;Mini Cry Babies Magic Tears - Bebe Lloron Mini Wabro Full;2500.0;100;500;buy_it_now;gold_special;True;;MLA2968;Juegos y Juguetes
MLA784104868;Juego Dardos Tiro Al Blanco Reversible 6 Dardos Lelab 7854;1024.9;50;500;buy_it_now;gold_special;True;;MLA47813;Juegos y Juguetes
MLA856876476;Pets Alive Coleccionable Llama 9515 Envio Full;2495.0;100;250;buy_it_now;gold_special;True;3990.0;MLA3422;Juegos y Juguetes
MLA799482293;Juego De Mesa El Ilustrado;2990.0;1;500;buy_it_now;gold_special;True;;MLA1161;Juegos y Juguetes
MLA758501238;Hot Wheels Pack X3 Vehiculos K5904 Envio Full;790.0;250;500;buy_it_now;gold_special;True;1050.0;MLA3398;Juegos y Juguetes
MLA843365480;Kit De Manualidades Para Niños - Caja We Art;2800.0;50;500;buy_it_now;gold_special;True;;MLA418303;Juegos y Juguetes
MLA875369810;Camión Recolector De Basura A Fricción Pull Back ;849.0;50;500;buy_it_now;gold_special;True;1104.0;MLA2965;Juegos y Juguetes
MLA896452073;Pulpo Reversible Pulpitos Grande Peluche Tik Tok 40 X 30 Cm;1349.77;500;500;buy_it_now;gold_special;True;1849.0;MLA1166;Juegos y Juguetes
MLA864176181;Pista Flexible Con 1 Auto Luminoso 135 Piezas;2799.0;1;250;buy_it_now;gold_special;True;3639.0;MLA37616;Juegos y Juguetes
MLA756493394;Andador Patrol Pata Pata Caminador Andarin 2 En 1 Kuma;2950.0;50;500;buy_it_now;gold_special;True;;MLA417753;Juegos y Juguetes
MLA849138393;Cubo Rubik 3x3 Qiyi Sail W De Velocidad 3x3x3;881.0;1;500;buy_it_now;gold_special;True;;MLA76129;Juegos y Juguetes
MLA853268953;Muñeca Lol Suprise Glitter Globe 561620 Original E. Full;2495.0;150;500;buy_it_now;gold_special;True;4580.0;MLA2968;Juegos y Juguetes
MLA793434289;Skate Patineta Mini Doble Cola Lija Completa ;1499.0;100;500;buy_it_now;gold_special;True;1949.0;MLA90334;Juegos y Juguetes
MLA712925486;Juego De Mesa El Erudito De Maldon;2990.0;100;500;buy_it_now;gold_special;True;;MLA1161;Juegos y Juguetes
MLA849139953;Cubo Rubik 3x3 Moyu Meilong 3x3x3 De Velocidad;884.0;1;500;buy_it_now;gold_special;True;;MLA76129;Juegos y Juguetes
MLA665561940;Iron Man Figura Muñeco Articulado 30 Cm Original Hasbro ;2899.0;1;500;buy_it_now;gold_special;True;3625.0;MLA3422;Juegos y Juguetes
MLA852808166;Arco De Futbol Para Armar Con Pelota Mas Red E Inflador;1299.0;100;500;buy_it_now;gold_special;True;1689.0;MLA454740;Juegos y Juguetes
MLA746741595;Juego De  Memoria Memo Disco Xl Simil Simon 6905 ;2899.0;1;500;buy_it_now;gold_special;True;3527.0;MLA1161;Juegos y Juguetes
MLA897019572;Pileta Inflable Agua Juegos Colgantes Para Bebes Intex 91x91;1544.99;1;500;buy_it_now;gold_special;True;;MLA11226;Juegos y Juguetes
MLA629408425;Castillo Magico Princesas Musica Luz Ascensor Orig. Ditoys;4689.0;1;500;buy_it_now;gold_special;True;;MLA433061;Juegos y Juguetes
MLA878875550;Frozen Muñecas Gigantes 55cm Anna Elsa Juego Disney Original;4690.0;1;250;buy_it_now;gold_special;True;5999.0;MLA2968;Juegos y Juguetes
MLA745492148;Pizarra Blanca 80x120cm+2 Marcadores Y Accesorios Gratis ;1999.0;50000;5000;buy_it_now;gold_special;True;;MLA352343;Juegos y Juguetes
MLA856445961;Rasti Kit Piezas Básicas 400 Pzs E. Full;2790.0;50;250;buy_it_now;gold_special;True;3620.0;MLA1157;Juegos y Juguetes
MLA844488385;Figuras Batman Mission 30cm Original Mattel Oferta!;1620.0;5000;250;buy_it_now;gold_special;True;1800.0;MLA3422;Juegos y Juguetes
MLA899853783;Peluche Pulpo Reversible Tik Tok Pulpito Triste Feliz 25cm;1490.0;50;500;buy_it_now;gold_special;True;;MLA1166;Juegos y Juguetes
MLA746338263;Juego De Mesa El Camarero De Maldon;1880.0;50;500;buy_it_now;gold_special;True;;MLA1161;Juegos y Juguetes
MLA799726524;Juego The Mind;1880.0;50;500;buy_it_now;gold_special;True;;MLA1161;Juegos y Juguetes
MLA808297497;Arenas Mágicas Postres Y Helados Kinetica Duende Azul 7219f ;1399.0;1;500;buy_it_now;gold_special;True;1749.0;MLA418285;Juegos y Juguetes
MLA713689947;Juego De Mesa El Memorioso De Maldon;2690.0;1;500;buy_it_now;gold_special;True;;MLA1161;Juegos y Juguetes
MLA676483085;Bloques Ladrillos Gigantes X 25 Unidades Oferta!! Babymovil;1499.0;50;500;buy_it_now;gold_special;True;1873.75;MLA1157;Juegos y Juguetes
MLA855107104;La Casa Del Árbol (¡la De La Publicidad!). Juguete Original;5099.0;100;500;buy_it_now;gold_pro;True;;MLA409417;Juegos y Juguetes
MLA748169425;Tomy Y Su Bebé En Cochecito Simil Ken El Mundo De Palomafull;2699.0;150;500;buy_it_now;gold_special;True;3239.0;MLA2968;Juegos y Juguetes
MLA762292470;Pistola De Agua Nerf Super Soaker Freezefire Lanza 11 Mts ;1879.0;1;500;buy_it_now;gold_special;True;;MLA433046;Juegos y Juguetes
MLA870028584;Playmobil Helicóptero Salvataje 3789 E.full;4190.0;100;500;buy_it_now;gold_special;True;4695.0;MLA12400;Juegos y Juguetes
MLA853083641;Vincha Bandana Konoha Negra Naruto;520.0;250;500;buy_it_now;gold_special;True;;MLA3422;Juegos y Juguetes
MLA878898077;Oonies Fabrica De Inflar Globos + Acc Int 19901 Envio Full;1195.0;50;250;buy_it_now;gold_special;True;1695.0;MLA418289;Juegos y Juguetes
MLA872755966;Atril Pizarra 3 En 1 Montessori Infantil Niños;4450.0;1;250;buy_it_now;gold_special;True;;MLA352343;Juegos y Juguetes
MLA787956465;Sound Moovz Pulsera Musical Para Bailar Rosa Soundmoovz Ef;2990.0;50;500;buy_it_now;gold_special;True;;MLA90314;Juegos y Juguetes
MLA857101665;Atlantis Mapas- Pack 4(argentina + Mapamundi) Sitio Original;2200.0;250;500;buy_it_now;gold_special;True;;MLA418303;Juegos y Juguetes
MLA627946057;Cubo Rubik 3x3 Qiyi Warrior W + Base + Lubricante Gan;1199.0;1;500;buy_it_now;gold_special;True;;MLA76129;Juegos y Juguetes
MLA792349324;Poopsie Slime Sorpresa 551461;875.0;50;500;buy_it_now;gold_special;True;1490.0;MLA3422;Juegos y Juguetes
MLA722509766;Juego De Mesa Twister Version Original De Hasbro;2490.0;100;500;buy_it_now;gold_special;True;2995.0;MLA1161;Juegos y Juguetes
MLA746865612;Pizarra Blanca 80x120 Borde Metálico + Combo De Regalo Envío;1962.36;5000;500;buy_it_now;gold_special;True;2133.0;MLA352343;Juegos y Juguetes
MLA864172651;Pista Flexible Con  1 Auto Luminoso 92 Piezas ;1690.0;1;250;buy_it_now;gold_special;True;2404.0;MLA37616;Juegos y Juguetes
MLA747901684;Pizarra Blanca 60x80cm +2 Marcadores Y Accesorios Gratis ;1100.0;5000;500;buy_it_now;gold_special;True;;MLA352343;Juegos y Juguetes
MLA877915580;24 Figuras De Pokemon 2-3 Cm Surtidos Sin Repetir;1350.0;100;250;buy_it_now;gold_special;True;;MLA3422;Juegos y Juguetes
MLA857029840;Atlantis Mapas- Proyecto Mapamundi- Sitio Original;1190.0;500;500;buy_it_now;gold_special;True;;MLA418303;Juegos y Juguetes
MLA849327961;Tren A Pila Clásico Con Luces Y Sonido El Duende Azul Full;2699.0;1;250;buy_it_now;gold_special;True;3158.0;MLA38493;Juegos y Juguetes
MLA898996360;Muñeco Sonic The Hedgehog Generación Dorada Para Chicos;990.0;1;250;buy_it_now;gold_special;True;;MLA3422;Juegos y Juguetes
MLA883187371;Juego De Mesa Hipopótamos Glotones El Duende Azul 7466 18cm;699.0;150;250;buy_it_now;gold_special;True;818.0;MLA1161;Juegos y Juguetes
MLA781276877;Banco De Herramientas 27 Piezas Mi Primer Taller Lionel`s;1799.0;50;250;buy_it_now;gold_special;True;2541.0;MLA432839;Juegos y Juguetes
MLA863297650;Auto R/c Azul Escala 1:16 1896418 E.full;1495.0;50;250;buy_it_now;gold_special;True;1890.0;MLA433684;Juegos y Juguetes
MLA631554225;Juguete Caja Registradora Accesorios Zippy Babymovil Cuotas;3324.0;200;250;buy_it_now;gold_special;True;4155.0;MLA413461;Juegos y Juguetes
MLA614577789;Pelotero Carpa Casita De Juegos Castillo Princesas Vs Modelo;3299.0;50;500;buy_it_now;gold_special;True;;MLA95005;Juegos y Juguetes
MLA772926665;Pista De Autos Dinosaurio Tipo Hot Wheel Velocidad Sin Limit;2499.0;150;500;buy_it_now;gold_special;True;2924.0;MLA37616;Juegos y Juguetes
MLA614882081;Auto Barbie Original Tv Con Accesorios Y Stickers Lelab;1199.9;150;500;buy_it_now;gold_special;True;;MLA413428;Juegos y Juguetes
MLA634416811;Crazy Gorila Juego De Mesa Original Ditoys Tv Tribunales;1435.0;50;500;buy_it_now;gold_special;True;;MLA1161;Juegos y Juguetes
MLA861819057;Escudo De Capitán América 45cm Doble Agarre Interior;1249.0;1;250;buy_it_now;gold_special;True;;MLA3422;Juegos y Juguetes
MLA861772565;Marcador Uni Posca Pc 5m X 10 Unidades Buenisimos !!!!!!;4299.0;5000;500;buy_it_now;gold_special;True;;MLA69567;Juegos y Juguetes
MLA869528985;Slime Glitter X 6 Unidades De 50 Grs Figuras De Unicornio ;999.0;1;500;buy_it_now;gold_special;True;1169.0;MLA418285;Juegos y Juguetes
MLA824075544;Peluche Sonic Y Amigos;999.0;150;500;buy_it_now;gold_special;True;;MLA1166;Juegos y Juguetes
MLA748515770;Unicornio Flotador Gigante Inflable Bestway Pileta Oferta!;2274.0;100;500;buy_it_now;gold_special;True;3500.0;MLA40387;Juegos y Juguetes
MLA896359284;Muñeca Sirena Brenda Dream Girl ;1899.0;1;150;buy_it_now;gold_special;True;2469.0;MLA2968;Juegos y Juguetes
MLA897794163;2 Rompecabezas (bifaz Mundi-universo + 1 Bifaz Dinosaurios);3090.0;1;200;buy_it_now;gold_special;True;;MLA1858;Juegos y Juguetes
MLA885847246;Juego De Mesa Robots De Maldón;1880.0;50;250;buy_it_now;gold_special;True;;MLA1161;Juegos y Juguetes
MLA869548604;Muñeco De Peluche Sonic 30 Cm Shadow Nudillos Silver Tails;1349.0;1;250;buy_it_now;gold_special;True;;MLA3422;Juegos y Juguetes
MLA844482959;Muñeco Batman Armadura De Poder Luz Sonido Mattel Original;3330.0;500;500;buy_it_now;gold_special;True;3700.0;MLA3422;Juegos y Juguetes
MLA772014806;Casa Mansion Mi Lugar De Ensueño Con Acces. El Duende Azul ;2699.0;50;250;buy_it_now;gold_special;True;3239.0;MLA433061;Juegos y Juguetes
MLA897459225;Rompecabezas Bifaz Sistema Solar- Mapamundi (pompeius);1690.0;1;200;buy_it_now;gold_special;True;;MLA1858;Juegos y Juguetes
MLA875362628;Maquina De Coser Con Luz A Pila El Duende Azul ;3599.0;1;250;buy_it_now;gold_special;True;4319.0;MLA429209;Juegos y Juguetes
MLA811783752;Monopoly Popular Familiar Hasbro Original Juego De Mesa;1890.0;1;250;buy_it_now;gold_special;True;3119.0;MLA1161;Juegos y Juguetes
MLA828931541;Juego De Construcción Metálica Remolque 143 Pzas Tipo Mecano;869.0;50;500;buy_it_now;gold_special;True;1086.0;MLA1157;Juegos y Juguetes
MLA796266628;Avion A Radio Control Multidireccional Con Luz Y Sonido ;1999.0;50;250;buy_it_now;gold_special;True;2599.0;MLA6748;Juegos y Juguetes
MLA646528932;Cubo Rubik Qiyi Warrior W - De Velocidad 3x3x3;999.0;1;500;buy_it_now;gold_special;True;;MLA76129;Juegos y Juguetes
MLA747715032;Juego De Tejo De Goma Para Cualquier Superficie Premium;1190.0;50;500;buy_it_now;gold_special;True;;MLA90312;Juegos y Juguetes
MLA782139550;Valija Y Mochila Para Construcción Con Autos 7798311753465;3549.0;1;250;buy_it_now;gold_special;True;4614.0;MLA37616;Juegos y Juguetes
MLA826722864;Playmobil Lancha Con Motor 3142  Full;2395.0;50;250;buy_it_now;gold_special;True;2990.0;MLA12400;Juegos y Juguetes
MLA759005749;Crocky Attack Juego Cuidado Cocodrilo Muerde Tv Orig. Ditoys;1239.0;1;250;buy_it_now;gold_special;True;;MLA1161;Juegos y Juguetes
MLA803544776;Transformers Muñeco Robot Transformable The Latest Series ;1549.0;200;250;buy_it_now;gold_special;True;2014.0;MLA3422;Juegos y Juguetes
MLA864194609;Pista Luminosa Con 2 Auto Luminoso 169 Piezas ;3299.0;1;250;buy_it_now;gold_special;True;4289.0;MLA37616;Juegos y Juguetes
MLA748138560;Avión Para Muñecas Con Accesorios;4299.0;50;500;buy_it_now;gold_special;True;5449.0;MLA413428;Juegos y Juguetes
MLA853268172;Muñeca Lol Suprise Glitter Globe 561620 Original ;2495.0;100;500;buy_it_now;gold_special;True;4580.0;MLA2968;Juegos y Juguetes
MLA746813487;Pizarra Blanca 60x80 Borde Metálico + Combo Mercadoenvio;1161.0;5000;500;buy_it_now;gold_special;True;1290.0;MLA352343;Juegos y Juguetes
MLA713687797;Juego De Mesa El Cinefilo De Maldon;2690.0;50;500;buy_it_now;gold_special;True;;MLA1161;Juegos y Juguetes
MLA869942550;Kit X 5 Rompecabezas Madera 4 Y 5 Ps Granja De Zenón Nuevo!!;999.0;1;250;buy_it_now;gold_pro;True;;MLA1858;Juegos y Juguetes
MLA855107741;Banco De Herramientas. Mi Primer Taller. Lionel's;2099.0;50;250;buy_it_now;gold_pro;True;;MLA432839;Juegos y Juguetes
MLA872429093;Roblox Set X 6 Personajes! 7cm + Armas!;1999.99;1;250;buy_it_now;gold_special;True;;MLA3422;Juegos y Juguetes
MLA758228534;Whan O Tobogán Deslizador Wo64120;3495.0;50;500;buy_it_now;gold_special;True;4285.0;MLA433096;Juegos y Juguetes
MLA897615437;Troter 360 - Kit Oficial - Juego/deporte Spikeball Cuotas;3599.0;50;50;buy_it_now;gold_special;True;;MLA432254;Juegos y Juguetes
MLA815958479;Autos De Metal X 20 Tipo Hotwheels, Velocidad Sin Limites;1099.0;50;500;buy_it_now;gold_special;True;1286.0;MLA2965;Juegos y Juguetes
MLA712930198;Juego De Mesa El Melomano De Maldon;2690.0;1;500;buy_it_now;gold_special;True;;MLA1161;Juegos y Juguetes
MLA616126339;Gimnasio Manta Didactica Bebe Pelotero 2en1 Kinder Ball Cici;5999.0;100;500;buy_it_now;gold_special;True;;MLA27814;Juegos y Juguetes
MLA826725306;Rompecabezas 16 Piezas 4  En 1 Didactico Animales Madera ;579.0;50;500;buy_it_now;gold_special;True;;MLA1858;Juegos y Juguetes
MLA882896377;Bebé Casi Real Muñeca Tipo Reborn . Nuevos !!!!!!!!!!!!!;3650.0;1;250;buy_it_now;gold_special;True;;MLA2968;Juegos y Juguetes
MLA816318246;Varita Harry Potter Original Ollivanders Hermione;1890.0;1;500;buy_it_now;gold_special;True;;MLA3422;Juegos y Juguetes
MLA610192713;Gimnasio Manta  Bebe Con Piano Musical Cici Babymovil ;4699.0;150;500;buy_it_now;gold_special;True;;MLA27814;Juegos y Juguetes
MLA735089678;Bebe En Con Bañera Musical Luz Melodias Dolce Bambino Ditoys;2899.0;1;150;buy_it_now;gold_special;True;;MLA432992;Juegos y Juguetes
MLA645541796;Bad Dog Cuidado Con El Perro Juego Tv Ditoys Tribunales;3799.0;1;250;buy_it_now;gold_special;True;;MLA1161;Juegos y Juguetes
MLA659812807;Tenis Orbital En Bolsa Paletas Pelota Original Serabot;4280.0;1;250;buy_it_now;gold_special;True;;MLA414003;Juegos y Juguetes
MLA870621363;Mesa Didactica Musical Interactiva Con Luz Y Sonido ;2499.0;1;500;buy_it_now;gold_special;True;;MLA417923;Juegos y Juguetes
MLA771259638;Neocube 12 Colores En Stock 5mm Caja Metal - 216 Bolitas;2399.0;1;500;buy_it_now;gold_special;True;;MLA76134;Juegos y Juguetes
MLA896601025;Mini Rainbocorns Peluche Sorpresa Huevo Coleccionable;1799.0;250;200;buy_it_now;gold_special;True;2069.0;MLA1166;Juegos y Juguetes
MLA698069560;Animatronic Five Nights At Freddy's Set X 6 Personajes Nuevo;3299.99;1;500;buy_it_now;gold_special;True;;MLA3422;Juegos y Juguetes
MLA855107116;Fast Food. Juguete De Cocina. Petit Gourmet;3190.0;50;200;buy_it_now;gold_pro;True;;MLA432827;Juegos y Juguetes
MLA634415071;Monky Loco Juego De Mesa Original Ditoys Tv Tribunales;1499.0;1;500;buy_it_now;gold_special;True;;MLA1161;Juegos y Juguetes
MLA858450885;Set De Los 20 Colores De Resaltador Filgo Fine Novedad 2020;560.0;1;500;buy_it_now;gold_special;True;;MLA69567;Juegos y Juguetes
MLA630764113;Silla Mecedora Bebe Deluxe 0 A 11 Kg Cici Babymovil;4199.0;1;250;buy_it_now;gold_special;True;5249.0;MLA127671;Juegos y Juguetes
MLA810015761;Bebote De Goma Con Sonido;1199.0;50;250;buy_it_now;gold_special;True;;MLA2968;Juegos y Juguetes
MLA775986253;Avión A Fricción Con Luz Y Sonido Mensaje De Voz Escala 1:20;1799.0;1;250;buy_it_now;gold_special;True;2311.0;MLA6748;Juegos y Juguetes
MLA745463352;Flotador Salvavidas Dona Donut Rosquilla Bestway;789.0;250;500;buy_it_now;gold_special;True;;MLA40387;Juegos y Juguetes
MLA739701662;Muñecos Articulados Avengers Infinity War Thanos Hulk Ironma;990.0;150;500;buy_it_now;gold_special;True;;MLA3422;Juegos y Juguetes
MLA815786077;Amigos De Mierda Juego Cartas Para Previa Bureau +18 Lelab;799.9;1;500;buy_it_now;gold_special;True;;MLA1161;Juegos y Juguetes
MLA688975063;Strike 360 - Kit Oficial - Juego/deporte;4990.0;250;500;buy_it_now;gold_special;True;;MLA432254;Juegos y Juguetes
MLA855107106;Parque Acuático. Con Agua. No Lleva Pilas. Juguete Original;3099.0;50;50;buy_it_now;gold_pro;True;;MLA12400;Juegos y Juguetes
MLA899869133;Peluche Interactivo Vagoneta El Perezoso Ppsl001 E. Full;4690.0;200;150;buy_it_now;gold_special;True;;MLA1166;Juegos y Juguetes
MLA866357426;Monopatín Cuatri Patín 4 Ruedas Plegable Forest Luz Infantil;5499.0;1;500;buy_it_now;gold_special;True;;MLA12065;Juegos y Juguetes
MLA790609361;Cocina Cocinita Chef Con Horno Y Lavavajillas . New Plast;3769.0;50;500;buy_it_now;gold_special;True;4711.0;MLA11239;Juegos y Juguetes
MLA862278192;Huevo De Dinosaurio Se Rompe Y Crece En El Agua - Alt 12cm;600.0;1;500;buy_it_now;gold_special;True;;MLA3422;Juegos y Juguetes
MLA897765798;Puzzle Ball Juego Habilidad E Ingenio Ditoys 2425;889.0;1;250;buy_it_now;gold_special;True;;MLA1161;Juegos y Juguetes
MLA865712813;Nueva Valija Grande Juliana Tatuajes Tattoo Sharif Express;2250.0;1;250;buy_it_now;gold_special;True;;MLA352340;Juegos y Juguetes
MLA704241522;Monopatines Quickly Infantiles Vegui 4 Ruedas Mipong;1779.0;100;500;buy_it_now;gold_special;True;;MLA12065;Juegos y Juguetes
MLA803872315;Muñeca Bebe De Goma;999.0;50;500;buy_it_now;gold_special;True;;MLA2968;Juegos y Juguetes
MLA898272558;Pulpo Reversible Peluche Tik Tok 15cm Púlpitos Premium;1195.0;50;500;buy_it_now;gold_special;True;;MLA1166;Juegos y Juguetes
MLA854535430;Neocube Buckyballs 216 Esferas 5mm Iman Neodimio Multicolor;2099.0;5000;500;buy_it_now;gold_special;True;;MLA76134;Juegos y Juguetes
MLA796092009;Monopatin Graffiti 4 Ruedas Luces Led Silicona Reforzado;6139.0;200;500;buy_it_now;gold_special;True;;MLA12065;Juegos y Juguetes
MLA818206205;Juego Ciencias Volcán Y Excavación Jurásica Galileo Italy;1985.0;1;500;buy_it_now;gold_special;True;;MLA1161;Juegos y Juguetes
MLA616027868;Deadpool Espectacular Figura 18cm Armas Acces Luz Blister;1249.99;1;250;buy_it_now;gold_special;True;;MLA3422;Juegos y Juguetes
MLA787955538;Caballito Saltarín De Goma;1999.0;1;500;buy_it_now;gold_special;True;;MLA94997;Juegos y Juguetes
MLA865129540;Juego De Ajedrez Profesional Staunton Original;2480.0;5000;500;buy_it_now;gold_special;True;;MLA412670;Juegos y Juguetes
MLA895934958;Cry Pets Perro Peluche Interactivo Llora Lágrimas Novedad !!;5250.0;1;250;buy_it_now;gold_special;True;;MLA1166;Juegos y Juguetes
MLA876932335;Moto Pampi Andarin Pata Pata Pvc Alto Impact Motito Infantil;3055.0;250;500;buy_it_now;gold_special;True;;MLA417753;Juegos y Juguetes
MLA765745407;Ajedrez Juego Con Piezas De Madera Y Tablero De 49 X 49 Cm;1899.0;100;500;buy_it_now;gold_special;True;;MLA412670;Juegos y Juguetes
MLA811707561;Juego De Ciencias Sistema Solar Galileo Italy Giro Didáctico;1700.0;1;500;buy_it_now;gold_special;True;;MLA1161;Juegos y Juguetes
MLA838504614;Peluches Pokemon Go 20 Cm Varios Modelos Pikachu Pokemones;1380.0;50;500;buy_it_now;gold_special;True;;MLA3422;Juegos y Juguetes
MLA725505846;Organo Musical Con 37 Teclas Teclado Lcd Microfono Nuevo;1799.0;500;500;buy_it_now;gold_special;True;2099.0;MLA90323;Juegos y Juguetes
MLA695384854;Lápices De Colores Faber-castell Eco X60;1790.0;150;500;buy_it_now;gold_special;True;;MLA429735;Juegos y Juguetes
MLA828738224;Tripatin Lol Surprise Monopatín Aluminio C/ Luces  - El Rey;4041.0;50;500;buy_it_now;gold_special;True;4490.0;MLA12065;Juegos y Juguetes
MLA865584422;Marcador Uni Posca Pc 3m X 10 Unidades Promo;4099.0;500;500;buy_it_now;gold_special;True;;MLA69567;Juegos y Juguetes
MLA686156394;Micrófono Karaoke Bluetooth Inalámbrico + Parlante + Estuche;1779.0;150;500;buy_it_now;gold_special;True;;MLA433151;Juegos y Juguetes
MLA752024960;Lol Surprise Under Wraps Original;2750.0;500;250;buy_it_now;gold_special;True;6270.0;MLA2968;Juegos y Juguetes
MLA757353344;Juego Bomb Game Bomba Que Explota Luz Sonidos Orig. Ditoys ;3599.0;1;250;buy_it_now;gold_special;True;;MLA1161;Juegos y Juguetes
MLA776383660;Patrulla Canina Paw Patrol Set X 6 Vehículos A Fricción!;2799.99;1;250;buy_it_now;gold_special;True;;MLA3422;Juegos y Juguetes
MLA898242533;Monopatin Infantil Con Luz Luces Led Y Musica Reforzado 30kg;4399.0;250;250;buy_it_now;gold_special;True;;MLA12065;Juegos y Juguetes
MLA856911011;The Mini Bellies Bebe 13 Cm Original - Sharif Express;2499.0;50;500;buy_it_now;gold_special;True;;MLA2968;Juegos y Juguetes
MLA765723167;Playmobil Lancha Con Motor 3142;2395.0;250;500;buy_it_now;gold_special;True;2990.0;MLA12400;Juegos y Juguetes
MLA614467223;Monopatin Scooter 4 Ruedas Plegable Infantil Estable Palermo;7498.0;1;500;buy_it_now;gold_special;True;;MLA12065;Juegos y Juguetes
MLA756783667;Juego De La Vida Life De Mesa Hasbro Tv Niño Adulto Original;3369.0;500;500;buy_it_now;gold_special;True;4043.0;MLA1161;Juegos y Juguetes
MLA857540066;Herramientas Constructor Motosierra 1849548 E.normal;2695.0;1;200;buy_it_now;gold_special;True;;MLA432838;Juegos y Juguetes
MLA765234077;Cortadora De Césped Pasto Infantil Hace Ruido Ploppy 611307;840.0;50;500;buy_it_now;gold_special;True;;MLA70156;Juegos y Juguetes
MLA836344130;Treasure X Descubri El Tesoro Escondido 1 Figura Y Acc Orig.;799.95;1;250;buy_it_now;gold_special;True;;MLA3422;Juegos y Juguetes
MLA897732580;Rompecabeza Puzzle Ball Cubo Ditoys Sharif Express;750.0;50;250;buy_it_now;gold_special;True;;MLA432992;Juegos y Juguetes
MLA871078558;Neocube Buckyballs 216 Esferas 5mm Iman Neodimio Multicolor;2700.0;1;500;buy_it_now;gold_special;True;;MLA76134;Juegos y Juguetes
MLA761626407;Auto Control Remoto Rc 4x4 Todo Terreno Para Chicos Navidad;6999.0;5000;500;buy_it_now;gold_special;True;9349.0;MLA433684;Juegos y Juguetes
MLA858120408;Lali - Muñeca Interactiva Con 5 Funciones Con Accesorios;3900.0;1;250;buy_it_now;gold_special;True;;MLA2968;Juegos y Juguetes
MLA822168054;Juego De Mesa Operación 1700887;2195.0;500;500;buy_it_now;gold_special;True;2495.0;MLA1161;Juegos y Juguetes
MLA612543212;Valija Juliana Doctora Con Accesorios Original;889.0;1;500;buy_it_now;gold_special;True;1099.0;MLA352340;Juegos y Juguetes
MLA759321996;Teen Titans Go Jovenes Titanes Set X 5 + Accesorios!;2699.99;1;250;buy_it_now;gold_special;True;;MLA3422;Juegos y Juguetes
MLA897548219;Muñeca Curli Girls Pelo Mágico Rizado Y Lacio 82082;3490.0;150;250;buy_it_now;gold_special;True;;MLA2968;Juegos y Juguetes
MLA896692167;Micrófono Karaoke Niños 5w Bluetooth Efectos De Voz Parlante;1699.0;500;250;buy_it_now;gold_special;True;;MLA433151;Juegos y Juguetes
MLA763348812;Tetris Portátil Brick Game Con 9999 Video Juegos Clásicos;790.0;50;500;buy_it_now;gold_special;True;;MLA90314;Juegos y Juguetes
MLA695467103;Castillo Fuerte Medieval Fibrofacil Mdf Incluye Adicionales;1953.0;1;500;buy_it_now;gold_special;True;2170.0;MLA433061;Juegos y Juguetes
MLA870779190;Juego De Mesa Monky Loco Habilidad Y Acción Ditoys Tv;1399.0;1;100;buy_it_now;gold_special;True;1979.0;MLA1161;Juegos y Juguetes
MLA749319389;Pistola De Agua Water Pump 40cm Arma Juguete Lanza Agua 9mts;310.0;500;500;buy_it_now;gold_special;True;;MLA90321;Juegos y Juguetes
MLA746812588;Pizarra Blanca 40x60 Borde Metálico + Combo De Regalo Envío;764.15;5000;500;buy_it_now;gold_special;True;899.0;MLA352343;Juegos y Juguetes
MLA719703989;Pompones Magicos 400 Piezas Encastres Tipo Bunchems;1250.0;200;500;buy_it_now;gold_special;True;;MLA3422;Juegos y Juguetes
MLA860123502;Triciclo C/manija Y Toldo,asiento Giratorio 360° Budada Tr49;12590.0;1;250;buy_it_now;gold_special;True;;MLA6557;Juegos y Juguetes
MLA704046908;Moto Pata Pata Ener Andarin Niños (sin Luz);4549.0;100;500;buy_it_now;gold_special;True;;MLA417753;Juegos y Juguetes
MLA615484618;Bolson Bolsa 100 Pelotas - Peloteros Niños Casita Piletas;898.0;500;500;buy_it_now;gold_special;True;;MLA417827;Juegos y Juguetes
MLA899081737;Rompecabeza Puzzle Ball Juego Habilidad E Ingenio Ditoys ;759.9;1;200;buy_it_now;gold_special;True;;MLA1161;Juegos y Juguetes
MLA666085342;Auto Jeep Barbie Original C/ Licencia Mattel Stickers Lelab;1199.9;150;500;buy_it_now;gold_special;True;;MLA413428;Juegos y Juguetes
