id;title;price;available_quantity;sold_quantity;buying_mode;listing_type_id;accepts_mercadopago;original_price;category_id;category_name
MLA787918508;Valija Grande Juliana Decora Tu Pelo Nueva Original Tv;2689.0;1;250;buy_it_now;gold_special;True;;MLA352340;Juegos y Juguetes
MLA855567493;Mini Bellies Bebe Con Ruido Chico 13 Cm Envio Gratis Caba ;2564.05;50;500;buy_it_now;gold_special;True;2699.0;MLA2968;Juegos y Juguetes
MLA728385444;Mansion Del Misterio Scooby Doo Con Personaje - 05569;3499.0;5000;150;buy_it_now;gold_special;True;;MLA3422;Juegos y Juguetes
MLA767955744;Nerf Pistola Mega Magnus Hasbro A4887 Original Oferta!;2490.0;500;500;buy_it_now;gold_special;True;;MLA433029;Juegos y Juguetes
MLA734086030;Ametralladora Luces Sonidos Y Laser. Tripode Con Movimiento!;2100.0;1;500;buy_it_now;gold_special;True;;MLA433029;Juegos y Juguetes
MLA603382481;Chanchito Glotón Come Hamburguesas Kinderland;3995.0;50;250;buy_it_now;gold_special;True;4990.0;MLA1161;Juegos y Juguetes
MLA861140833;Marcadores Sharpie Ruleta X 30 Colores - Nueva!!;3383.06;500;500;buy_it_now;gold_special;True;3599.0;MLA69567;Juegos y Juguetes
MLA844478596;Marcadortes Lettering Set + Estuche De Lata De Regalo;599.0;50;250;buy_it_now;gold_pro;True;;MLA69567;Juegos y Juguetes
MLA617551896;Tunel Pelotero Tubo Autoarmable Psicomotridad Animaciones;1799.0;5000;500;buy_it_now;gold_special;True;;MLA95005;Juegos y Juguetes
MLA886002920;Juguete Peluche Muñeco Con Lentejuela Reversible Unicornio;999.0;250;250;buy_it_now;gold_special;True;1730.0;MLA1166;Juegos y Juguetes
MLA758219127;Pocket Morphers Pack X7 + 3 De Regalo;5490.0;150;250;buy_it_now;gold_special;True;;MLA3422;Juegos y Juguetes
MLA898097236;Valija  Juliana Make Up Maquillaje Unicornio Chica ;1549.0;150;150;buy_it_now;gold_special;True;;MLA352340;Juegos y Juguetes
MLA756743597;Juego De Mesa Clue Quien Es El Culpable? Hasbro Niño Adulto ;2069.0;500;500;buy_it_now;gold_special;True;2379.0;MLA1161;Juegos y Juguetes
MLA809024324;Casa Casita De Muñecas Fibrofacil + 36 Muebles ;2900.0;1;500;buy_it_now;gold_pro;True;;MLA409417;Juegos y Juguetes
MLA886303131;Bebè Juguete 4 Sonidos Chupete Mamadera Lagrima Cyber Monday;2495.0;5000;500;buy_it_now;gold_special;True;;MLA2968;Juegos y Juguetes
MLA788134246;Organo Musical 49 Teclas Teclado Microfono Con Fuente;3099.0;500;500;buy_it_now;gold_special;True;3499.0;MLA90323;Juegos y Juguetes
MLA787548786;Organo Teclado Con 61 Teclas Musical Lcd Microfono Y Atril;6999.0;500;500;buy_it_now;gold_pro;True;7999.0;MLA90323;Juegos y Juguetes
MLA785496693;Indoraptor Indominus Jurassic Setx8 Minifiguras E-commerce07;3299.99;1;250;buy_it_now;gold_special;True;;MLA1157;Juegos y Juguetes
MLA901629628;Muñeco Among Us Set X2 + Hueso Tripulante Impostor Ladrillos;780.0;1;100;buy_it_now;gold_special;True;;MLA3422;Juegos y Juguetes
MLA857892807;Juego Twister Clasico;1999.0;1;50;buy_it_now;gold_special;True;;MLA1161;Juegos y Juguetes
MLA833125922;Pizarra Blanca 70x100 + Accesorios ;1650.0;5000;500;buy_it_now;gold_special;True;;MLA352343;Juegos y Juguetes
MLA701128695;Colchoneta Inflable Bestway 183x69cm Flotador Pileta Playa;340.0;150;500;buy_it_now;gold_special;True;499.0;MLA40387;Juegos y Juguetes
MLA834697196;Marcadores Touch Doble Punta X36 Unidades - Woopy;1990.0;1;250;buy_it_now;gold_special;True;;MLA69567;Juegos y Juguetes
MLA881348818;Casa Casita De Muñecas Lol En Fibrofácil + Muebles;3299.0;250;250;buy_it_now;gold_special;True;;MLA409417;Juegos y Juguetes
MLA618172258;50 Pelotas Atoxicas Precio Unidad Oferta Pelotero Casita ;449.0;5000;500;buy_it_now;gold_special;True;;MLA417827;Juegos y Juguetes
MLA782944416;Shopkins Happy Places Playset Establo Gde Int 56688 Original;2695.0;50;200;buy_it_now;gold_special;True;3850.0;MLA3422;Juegos y Juguetes
MLA899365333;Jumping Fries Juego De Mesa Papas Fritas Saltarinas Ditoys ;1135.0;1;100;buy_it_now;gold_special;True;;MLA1161;Juegos y Juguetes
MLA880160808;Microfono Parlante Inalambrico Bluetooth  Karaoke Estuche;1165.0;500;500;buy_it_now;gold_special;True;1599.0;MLA433151;Juegos y Juguetes
MLA897784604;Combo Marcadores Doble Punta Touch Star Urbano X72;4125.0;1;150;buy_it_now;gold_special;True;;MLA69567;Juegos y Juguetes
MLA762276346;Pelota Fresbee Fly Ball Con Luz 1725 Next Point;1790.0;1;200;buy_it_now;gold_special;True;;MLA432254;Juegos y Juguetes
MLA896236102;Peluches Pulpo Reversible Pulpito 20cm;1190.0;50;500;buy_it_now;gold_special;True;;MLA1166;Juegos y Juguetes
MLA695300412;Pileta Rigida 120 X 25 Cm 226 Litros Bebes Jl017126npf;1786.51;500;250;buy_it_now;gold_special;True;;MLA11226;Juegos y Juguetes
MLA735749528;Combo Auto Barbie Original +  Muñeca Articulada ;2450.0;1;250;buy_it_now;gold_special;True;;MLA2968;Juegos y Juguetes
MLA899221244;Juego De Mesa Ingenio Bloques Magicos Magic Block Game;1809.66;500;100;buy_it_now;gold_special;True;;MLA1161;Juegos y Juguetes
MLA900584631;Clarín Colección La Casa De Peppa Pig + 12 Muñecos Oficiales;8990.0;1;50;buy_it_now;gold_pro;True;;MLA3422;Juegos y Juguetes
MLA868838417; Rifle Pistola Laser 51 Cm  Luz  Sonido Movimiento Juguete ;1749.0;500;250;buy_it_now;gold_special;True;2390.0;MLA433029;Juegos y Juguetes
MLA796108031;Monopatin Plegable 4 Ruedas Luz Led Luces Reforzado H/ 50kg;6969.0;1;500;buy_it_now;gold_special;True;;MLA12065;Juegos y Juguetes
MLA605388949;Colchoneta Inflable Bestway Con Almohada Pileta Oferta!!;1590.0;500;500;buy_it_now;gold_special;True;1937.0;MLA40387;Juegos y Juguetes
MLA757902905;Pistola Mochila De Agua Personajes Para Niños;1552.68;200;500;buy_it_now;gold_special;True;;MLA90321;Juegos y Juguetes
MLA869237025;Valija De Juguete Juliana Doctora 18 Accesorios Tiendamibebe;975.0;50;500;buy_it_now;gold_special;True;;MLA352340;Juegos y Juguetes
MLA864905635;Juego De Mesa Mono Loco Monitos Los Monos Tumbling Monkeys;1699.0;1;250;buy_it_now;gold_special;True;;MLA1161;Juegos y Juguetes
MLA836365531;Treasure X Descubri El Tesoro Escondido Figura Y Accesorios ;799.95;1;250;buy_it_now;gold_special;True;;MLA3422;Juegos y Juguetes
MLA878824500;Hamaca Tabla Columpio Super Reforzada Exterior Para Niños ;1164.0;500;500;buy_it_now;gold_special;True;;MLA11236;Juegos y Juguetes
MLA606377591;Deslizador Tobogan De Agua Inflable Carril Bestway Rubenjuve;2390.0;500;500;buy_it_now;gold_special;True;3237.0;MLA433096;Juegos y Juguetes
MLA855878847;Masas Play Doh Kitchen Creations Fantasticos Helados Full;1710.0;100;200;buy_it_now;gold_special;True;;MLA418285;Juegos y Juguetes
MLA869242304;Valija De Juguete Juliana Veterinaria Con 1 Mascota;1349.0;1;500;buy_it_now;gold_special;True;;MLA352340;Juegos y Juguetes
MLA899961516;Fly Ball Pelota Con Luz Se Pliega Al Lanzar Orig Next Point;1699.0;1;250;buy_it_now;gold_special;True;1800.0;MLA454742;Juegos y Juguetes
MLA693221938;Juego De Mesa Dime Que Soy Yo ? Dime Quien Original Ditoys ;1549.0;1;500;buy_it_now;gold_special;True;;MLA1161;Juegos y Juguetes
MLA619597645;Barbie Auto Fashion Juguetería El Pehuén;1190.0;500;500;buy_it_now;gold_special;True;;MLA413428;Juegos y Juguetes
MLA864556173;Escudo De Capitán América 45cm Doble Agarre Interior;1450.0;1;250;buy_it_now;gold_special;True;;MLA3422;Juegos y Juguetes
MLA628244493;Andador Patrol Pata Pata Caminador Andarin 2 En 1 Tatetiparati;2975.0;50;500;buy_it_now;gold_special;True;;MLA417753;Juegos y Juguetes
MLA856541877;Walkie Talkie X 2 Radio Infantil Juguete Comunicacion Handy;2999.0;50;500;buy_it_now;gold_special;True;;MLA37617;Juegos y Juguetes
MLA796913196;Bolsito Lebebot De Tela Con Mamadera Magica Lb-790;1580.0;500;500;buy_it_now;gold_special;True;;MLA2968;Juegos y Juguetes
MLA873221138;Valija Juliana Make Up Maquillaje Unicornio Chica Original;1499.0;1;250;buy_it_now;gold_special;True;;MLA352340;Juegos y Juguetes
MLA864859129;Juego De Mesa Monopoly Argentina Fichas Metal Lic. Hasbro;2350.0;1;200;buy_it_now;gold_special;True;3515.0;MLA1161;Juegos y Juguetes
MLA753491339;Bebés Muñeco Tipo Reborn , Nuevos Ojos Abiertos !!!!!!;3650.0;1;500;buy_it_now;gold_special;True;;MLA2968;Juegos y Juguetes
MLA899996571;Mini Bebé Cry,llorón Con Lágrimas Y 4 Sonidos.Hermoso;2990.0;1;200;buy_it_now;gold_special;True;;MLA2968;Juegos y Juguetes
MLA901218132;Figura Among Us Muñeco Original  15 Cm Tripulante Impostor !;1984.78;1;150;buy_it_now;gold_special;True;;MLA3422;Juegos y Juguetes
MLA843419722;Marcador Tiza Liquida Chalk X8 Unidades.;899.0;1;500;buy_it_now;gold_pro;True;;MLA69567;Juegos y Juguetes
MLA605676363;Pileta Inflable Bebe Pelotero Selva Piso Inflable Techo;3099.0;500;500;buy_it_now;gold_special;True;;MLA95005;Juegos y Juguetes
MLA897501768;Pileta 3 Anillos Inflable Bebes 90 X 25 Cm Peces 17010-3;1191.81;1;250;buy_it_now;gold_special;True;;MLA11226;Juegos y Juguetes
MLA803161513;Juegos De Mesa Monky Loco Infantiles Niño Original Ditoys;1539.0;500;500;buy_it_now;gold_special;True;1724.0;MLA1161;Juegos y Juguetes
MLA835540583;Masas Play Doh Playdoh Torre De Cupcakes Hasbro Original!!;1080.0;500;500;buy_it_now;gold_special;True;1200.0;MLA418285;Juegos y Juguetes
MLA827981662;Muñeca Sirena Bebe Para Pileta Agua Baño A Cuerda 19 Cm;599.0;500;500;buy_it_now;gold_special;True;636.0;MLA2968;Juegos y Juguetes
MLA869731864;Valija Juliana Decora Tu Pelo Chica Original  Tiendamibebe;1389.0;1;500;buy_it_now;gold_special;True;;MLA352340;Juegos y Juguetes
MLA772205859;Varitas Harry Potter Original Ollivanders;1890.0;1;500;buy_it_now;gold_special;True;;MLA3422;Juegos y Juguetes
MLA879244569;Pin De Carga Ficha Joystick Ps4 Todos Modelos 12 Pines ;311.25;50;500;buy_it_now;gold_special;True;415.0;MLA414226;Juegos y Juguetes
MLA868839719;Pistola Laser Luz Y Sonido  Movimiento Juguete Niños Niñas;949.0;500;500;buy_it_now;gold_special;True;1090.0;MLA433029;Juegos y Juguetes
MLA806927433;Juego Crocky Attack Game Cocodrilo Muerde Original Ditoys;1295.0;100;500;buy_it_now;gold_special;True;;MLA1161;Juegos y Juguetes
MLA896897763;Pulpo Reversible Pulpitos Grande Peluche Tik Tok 40 X 30 Cm;1412.19;250;500;buy_it_now;gold_special;True;1989.0;MLA1166;Juegos y Juguetes
MLA851952213;Lego® Classic - Ladrillos Y Casas (11008);5999.0;100;250;buy_it_now;gold_special;True;;MLA1157;Juegos y Juguetes
MLA791181691;Pelotitas Pelotero X 100 Unidades No Toxicas Material Virgen;949.0;500;500;buy_it_now;gold_special;True;;MLA417827;Juegos y Juguetes
MLA794075508;Dinosaurio Grande X1 Caja A Elección Para Armar Velociraptor;450.0;250;500;buy_it_now;gold_special;True;;MLA3422;Juegos y Juguetes
MLA900195551;Patacleta Bebe Original Tiovivo Pata Pata Andador Triciclo;6507.5;1;150;buy_it_now;gold_special;True;6850.0;MLA417753;Juegos y Juguetes
MLA900846928;Colchoneta Inflable Bestway Sillon Cama C/ Apoya Vaso 1.6x84;2499.0;1;100;buy_it_now;gold_special;True;;MLA40387;Juegos y Juguetes
MLA870725094;Juego De Mesa Bad Dog Cuidado Con El Perro Ditoys Tv;3563.0;1;50;buy_it_now;gold_special;True;4398.9;MLA1161;Juegos y Juguetes
MLA780779506;Hamaca Bebe Infantil Reforzada Niños Kids Niñas Asiento;3799.0;1;500;buy_it_now;gold_special;True;5500.0;MLA11236;Juegos y Juguetes
MLA782946968;Lego® Classic - Bricks & Ideas (11001);3599.0;100;250;buy_it_now;gold_special;True;;MLA1157;Juegos y Juguetes
MLA882219016;Clarín Colección Completa Mundo Animal Nat Geo;5214.0;200;250;buy_it_now;gold_special;True;8690.0;MLA432889;Juegos y Juguetes
MLA713003603;Bebote Real , Muñeco , Muñeca Reales , Bebe. Nuevos !!!!;3650.0;1;500;buy_it_now;gold_special;True;;MLA2968;Juegos y Juguetes
MLA862285353;Martillo De Thor Ragnarok Avengers Excelentes Detalles;590.0;250;250;buy_it_now;gold_special;True;;MLA3422;Juegos y Juguetes
MLA841246137;Microfono Karaoke Con Parlante Recargable Inalambrico Gadnic;1999.0;500;500;buy_it_now;gold_special;True;2949.0;MLA433151;Juegos y Juguetes
MLA741661840;Kit Ciencia Quimica Divertida Ciencia Para Todos Experimento;2379.0;50;250;buy_it_now;gold_special;True;;MLA1161;Juegos y Juguetes
MLA862128287;Caja Registradora Rosa 1563496;1995.0;250;150;buy_it_now;gold_special;True;2495.0;MLA413461;Juegos y Juguetes
MLA802495407;Auto R/c (4canales ) 1715497;1595.0;250;250;buy_it_now;gold_special;True;1995.0;MLA433684;Juegos y Juguetes
MLA795742518;Bebote Muñeca Lebebot Chico (20 Cm) Boris C/ Gorro Lb-15;1440.0;500;500;buy_it_now;gold_special;True;;MLA2968;Juegos y Juguetes
MLA604480777;Pizarra Clap Magnética Imantada Números Letras Tienda Pepino;1330.0;100;500;buy_it_now;gold_special;True;;MLA352343;Juegos y Juguetes
MLA897023812;Valijta De Herramientas Taladro  De Juguete ;2500.0;1;50;buy_it_now;gold_special;True;;MLA352340;Juegos y Juguetes
MLA878715562;Avengers Hulk Muñeco Luz Y Sonido 30 Cm - Fair Play Toys;3298.0;1;100;buy_it_now;gold_special;True;;MLA3422;Juegos y Juguetes
MLA813280476;Casino Ruleta Shot X 16 Chupitos Drink Morph;2140.0;1;150;buy_it_now;gold_special;True;;MLA1161;Juegos y Juguetes
MLA858466979; Blokoco Balde 120 Piezas Rasti Bloques Grandes;1899.0;50;250;buy_it_now;gold_special;True;;MLA1157;Juegos y Juguetes
MLA759034285;Chichi Love Perrito Peluche C/ Bolso On Tour 3124;2295.0;500;250;buy_it_now;gold_special;True;3290.0;MLA1166;Juegos y Juguetes
MLA785340603;Combo Cars Truck Container + Autitos Pull Back X8 Unidades;2990.0;500;500;buy_it_now;gold_special;True;;MLA2965;Juegos y Juguetes
MLA843066931;Juego De Armas Ninja Katanas 70 Cm + Accesorios Duende Azul;1899.0;500;500;buy_it_now;gold_special;True;2399.0;MLA352391;Juegos y Juguetes
MLA897729035;Vip Pets Mascotas Sorpresas P/peinar Serie 01 95950;3995.0;250;100;buy_it_now;gold_special;True;6590.0;MLA2968;Juegos y Juguetes
MLA862087543;Laberinto De Bolitas Vuelta Mundo 3326 E. Normal;1695.0;1;150;buy_it_now;gold_special;True;1930.0;MLA437542;Juegos y Juguetes
MLA605249408;Crazy Gorilla Juego Gorila Con Espadas Ditoys Kinderland;1350.0;100;250;buy_it_now;gold_special;True;1975.0;MLA1161;Juegos y Juguetes
MLA816319717;Varita Harry Potter Sauco Ollivanders;1890.0;1;250;buy_it_now;gold_special;True;;MLA3422;Juegos y Juguetes
MLA899083814;Peluche Interactivo Vagoneta El Perezoso Ppsl001;4690.0;500;100;buy_it_now;gold_special;True;;MLA1166;Juegos y Juguetes
MLA879030897;Oonies Fabrica De Inflar Globos + Acc Int 19901;1195.0;250;150;buy_it_now;gold_special;True;1695.0;MLA418289;Juegos y Juguetes
MLA869165133;Valija De Juguete Juliana Veterinaria Grande 2 Mascotas;2740.0;1;250;buy_it_now;gold_special;True;;MLA352340;Juegos y Juguetes
MLA643723636;Bestway Aro De Basquet Inflable 52040;1350.0;1;200;buy_it_now;gold_special;True;1690.0;MLA40387;Juegos y Juguetes
MLA685788327;Valija Juliana Veterinaria Grande Con Accesorios Original Tv;2330.0;150;500;buy_it_now;gold_special;True;;MLA352340;Juegos y Juguetes
MLA899670144;Juego Fut Magic Tablero Futbol Flipper Original Ik0033 ;1899.0;50;50;buy_it_now;gold_special;True;2199.0;MLA1161;Juegos y Juguetes
MLA868141743;Ben 10 Muñecos 13cm Con Luz;1100.0;1;250;buy_it_now;gold_special;True;;MLA3422;Juegos y Juguetes
MLA825418288;Tabla Didactica Equilibrio Balanceo Laberinto Intercambiable;3499.0;50;250;buy_it_now;gold_special;True;;MLA433349;Juegos y Juguetes
MLA685422369;Lego® Classic - Ladrillos Creativos Lego® (10692);6699.0;1;500;buy_it_now;gold_special;True;;MLA1157;Juegos y Juguetes
MLA860191665;Funda Impermeable Para Metegol Covertor ;1099.0;1;100;buy_it_now;gold_special;True;;MLA76151;Juegos y Juguetes
MLA881562373;Arma Pistola Rifle  Con Mira De Juguete Para Niños Tipo Nerf;3899.0;1;200;buy_it_now;gold_special;True;;MLA433029;Juegos y Juguetes
MLA900061248;Pelota Frisbee Flatball Transformable Fd23f135a Faydi;1330.0;250;150;buy_it_now;gold_special;True;;MLA413991;Juegos y Juguetes
MLA759022045;Juegos De Mesa Infantiles Doggy Attack Cuidado Muerde Ditoys;1179.0;500;250;buy_it_now;gold_special;True;1391.0;MLA1161;Juegos y Juguetes
MLA901029472;Tremenda Figura Godzilla Mediana Articulada Loose;3999.99;1;25;buy_it_now;gold_special;True;;MLA3422;Juegos y Juguetes
MLA885298738;Scentos Marcadores C/aroma 24 Unid Int 40722 Original;1490.0;1;100;buy_it_now;gold_special;True;;MLA69567;Juegos y Juguetes
MLA861802829;Juego Imantado De Vestir Mod Nena Base + 30 Imanes Didáctico;999.0;1;500;buy_it_now;gold_special;True;;MLA22640;Juegos y Juguetes
MLA620002252;Sable Laser Star Wars Luz Sonido Original Hasbro ;3500.0;1;250;buy_it_now;gold_special;True;;MLA352391;Juegos y Juguetes
MLA828864830;Beyblade Burst Td Trompo A Elección P/ Armar Y Lanzador Tira;799.0;50;500;buy_it_now;gold_special;True;;MLA409389;Juegos y Juguetes
MLA864143282;Triciclos Infantiles Plastico Vegui Qrio Súper Resistente;2399.0;1;500;buy_it_now;gold_special;True;;MLA6557;Juegos y Juguetes
MLA843438633;Jenga Gigante 3en1 + Bolso+banco Y Mas De 300retos;4199.0;1;250;buy_it_now;gold_special;True;;MLA1161;Juegos y Juguetes
MLA603543700;Cocina Infantil De Juguete Gigante 88 Cm Nuevo Modelo !!!!;2275.0;50;500;buy_it_now;gold_special;True;;MLA11239;Juegos y Juguetes
MLA879340417;Avengers Muñecos Articulados Ironman Hulk Spiderman Thanos;890.0;100;250;buy_it_now;gold_special;True;;MLA3422;Juegos y Juguetes
MLA834842167;Mini Telescopio Refractor Explorador 300mm 30x Rex;1355.0;1;250;buy_it_now;gold_special;True;;MLA3659;Juegos y Juguetes
MLA897610130;Hot Wheels Valija Pista 3 En 1 Guarda 44 Autos Original;3198.0;50;150;buy_it_now;gold_special;True;3490.0;MLA417099;Juegos y Juguetes
MLA690293524;Gimnasio Piano Manta Con Sonajeros Para Bebe;4499.0;100;500;buy_it_now;gold_special;True;;MLA27814;Juegos y Juguetes
MLA859346871;Resorte Para Cama Elastica Original Reforzado 14cm X10unid.;825.0;1;150;buy_it_now;gold_special;True;;MLA431546;Juegos y Juguetes
MLA843043226;Catan - Juego De Mesa - Artesanal Y Original;2990.0;250;250;buy_it_now;gold_special;True;;MLA1161;Juegos y Juguetes
MLA882266487;Flex Carga Joystick Ps4 12 Pines Pin;135.59;100;250;buy_it_now;gold_special;True;149.0;MLA414226;Juegos y Juguetes
MLA882530468;Miraculus Lady Bug Muñeca ;999.0;1;150;buy_it_now;gold_special;True;;MLA409419;Juegos y Juguetes
MLA720910490;Five Nights At Freddy's Sister Location Set X 6 Personajes!;2799.99;1;250;buy_it_now;gold_special;True;;MLA3422;Juegos y Juguetes
MLA871099087;Muñeca Super Cute Little Babies Gabi 1796 ;5990.0;1;200;buy_it_now;gold_special;True;;MLA2968;Juegos y Juguetes
MLA744637255;Monopatín Infantil Andador 3 En 1 Con Luz Original Reforzado;6419.0;50;500;buy_it_now;gold_special;True;;MLA12065;Juegos y Juguetes
MLA695413769;Giro Ball Pelota Blanda Con Soga Y Luz Para Saltar Original;899.0;250;500;buy_it_now;gold_special;True;;MLA90314;Juegos y Juguetes
MLA682882491;Jenga Yenga Juego De Ingenio Y Habilidad De Madera 54 Piezas;200.76;50;500;buy_it_now;gold_special;True;239.0;MLA1161;Juegos y Juguetes
MLA827404340;Salvavidas Inflable Unicornio Para Niños 55 Cm. Pileta;638.1;1;250;buy_it_now;gold_special;True;;MLA40387;Juegos y Juguetes
MLA899375104;Valija Juliana Set Dentista Con Accesorios Original ;2649.0;1;100;buy_it_now;gold_special;True;;MLA352340;Juegos y Juguetes
MLA738055259;Clarín Colección Mi Ciudad Disney;1794.0;150;500;buy_it_now;gold_special;True;2990.0;MLA2965;Juegos y Juguetes
MLA814561334;Muñecos Articulados Avengers Infinity War Thanos Hulk Ironma;799.99;1;500;buy_it_now;gold_special;True;;MLA3422;Juegos y Juguetes
MLA869660644;Peluche Minecraft Enderman Creeper Lobo Araña Steve Zombie;1299.0;1;250;buy_it_now;gold_special;True;;MLA1166;Juegos y Juguetes
MLA876162662;Fidget Cube Cubo Dado Anti Estres Ansiedad Color A Elección;675.0;1;250;buy_it_now;gold_special;True;;MLA409389;Juegos y Juguetes
MLA827638493;Juego Flipper Flappin Atrapa Peces 18600 Shine;4190.0;5000;150;buy_it_now;gold_pro;True;;MLA1161;Juegos y Juguetes
MLA858345778;Pack X 16 Resaltador Filgo Resaltadores Pastel Fluo Soft;330.0;1;500;buy_it_now;gold_special;True;;MLA69567;Juegos y Juguetes
MLA896230077;Pulpo Peluche Reversible 20cm Excelente Calidad;1180.0;50;250;buy_it_now;gold_special;True;;MLA1166;Juegos y Juguetes
MLA749927186;Pizarra Blanca 80x120cm  +  Accesorios ;1990.0;5000;500;buy_it_now;gold_special;True;;MLA352343;Juegos y Juguetes
MLA748156912;Bebe Casi Real Muñeca Tipo Reborn . Nuevos !!!!!!!!!!!!!!!;3650.0;1;500;buy_it_now;gold_special;True;;MLA2968;Juegos y Juguetes
MLA851689266;Wizies Playset Nube Gigante Magica + 8 Fig Original (14292);1600.0;1;50;buy_it_now;gold_special;True;;MLA3422;Juegos y Juguetes
MLA778475431;Cry Babies Mini Muñeca Sorpresa Magic Tears Serie 1  97970;1995.0;100;500;buy_it_now;gold_special;True;3885.0;MLA2968;Juegos y Juguetes
MLA855700831;Juego Barril Pirata 1651678 E.normal;500.0;50;250;buy_it_now;gold_special;True;;MLA1161;Juegos y Juguetes
MLA855898062;Cohete Nave Transbordador Espacial Astro Venture 63112 Edu;3690.0;50;250;buy_it_now;gold_special;True;4445.0;MLA2965;Juegos y Juguetes
MLA792491366;Pack X 16 Resaltador Filgo Resaltadores Pastel Fluo Soft;326.0;50;500;buy_it_now;gold_special;True;;MLA69567;Juegos y Juguetes
MLA816920029;Pin Carga Jds030 + Flex 12 Pines Joystick Ps4 Jdm030 ;649.0;100;500;buy_it_now;gold_special;True;;MLA414226;Juegos y Juguetes
MLA870349376;Kit 18. Lebebot Boris 20 Cm + Bolsito De Paseo. Lb 25/790;2930.0;500;200;buy_it_now;gold_special;True;;MLA2968;Juegos y Juguetes
MLA831990193;Muñecos Articulados Avengers Infinity War Set X4 Personajes;3399.99;1;100;buy_it_now;gold_special;True;;MLA3422;Juegos y Juguetes
MLA851953552;Lego® Friends - Peluquería De Heartlake City (41391);5999.0;1;250;buy_it_now;gold_special;True;;MLA1157;Juegos y Juguetes
MLA760435203;Alfombra De Baile Tv Extreme Dance;3390.0;1;250;buy_it_now;gold_special;True;;MLA100780;Juegos y Juguetes
MLA898921219;Juego De Mesa Shiki ;598.0;50;200;buy_it_now;gold_special;True;;MLA1161;Juegos y Juguetes
MLA765970660;Tobogan 7 Nivel 6 Esc C/agua Vegui +regalo / Open-toys 34 Ea;16939.0;1;250;buy_it_now;gold_special;True;;MLA3659;Juegos y Juguetes
MLA860120256;Triciclo Con Manija Y Toldo Budada Tr48;11590.0;1;250;buy_it_now;gold_special;True;;MLA6557;Juegos y Juguetes
MLA899149712;Muñeca Lol Surprise Sparkle Glitter 559665 ;2795.0;100;200;buy_it_now;gold_special;True;4580.0;MLA2968;Juegos y Juguetes
MLA817992185;Flotador Para Pileta Unicornio / Flamenco, Pavo, Verano 2020;1199.0;100;250;buy_it_now;gold_special;True;;MLA40387;Juegos y Juguetes
MLA873088703;Set Blister Juguete Minecraft X 10 Figuras Dragon Steve;3298.0;500;200;buy_it_now;gold_special;True;;MLA3422;Juegos y Juguetes
MLA872455216;Tabla Equilibrio A Maze Board Niños Niveles Intercambiables;3499.0;1;50;buy_it_now;gold_special;True;;MLA433349;Juegos y Juguetes
MLA758648242;Doggy Attack Juego Cuidado Perro Muerde Tv Original Ditoys;1239.0;50;500;buy_it_now;gold_special;True;;MLA1161;Juegos y Juguetes
MLA897578529;Pulpo Reversible Triste /contento Varios Colores Calidad ;890.0;1;250;buy_it_now;gold_special;True;;MLA1166;Juegos y Juguetes
MLA612538814;Nueva Valija Juliana Doctora C/ Accesorios Y Luces;2141.0;1;250;buy_it_now;gold_special;True;2649.0;MLA352340;Juegos y Juguetes
MLA858169878;Pizarra Blanca 80x120cm + Accesorios + Embalaje + Cuotas;3199.0;500;250;buy_it_now;gold_pro;True;;MLA352343;Juegos y Juguetes
MLA884710277;Carolin Muñeca Scooter A Control Remoto Original Ditoys;6350.0;1;50;buy_it_now;gold_special;True;;MLA2968;Juegos y Juguetes
MLA843408518;Marcadores Touch Doble Punta X12 Unidades ;759.05;1;500;buy_it_now;gold_pro;True;799.0;MLA69567;Juegos y Juguetes
MLA687156702;Muñecos Fnaf Five Nights At Freddys Foxy Bonnie Articulados;1189.0;50;500;buy_it_now;gold_special;True;;MLA3422;Juegos y Juguetes
MLA847682562;Juego De Mesa ¿que Me Pasa Doctor? Duende Azul Operando Full;2499.0;1;250;buy_it_now;gold_special;True;3158.0;MLA1161;Juegos y Juguetes
MLA839149270;Deslizador Tobogan De Agua Inflable 549 Un Carril Bestway;2390.0;100;250;buy_it_now;gold_special;True;3107.0;MLA433096;Juegos y Juguetes
MLA863861654;Peluche Paw Patrol Marshall/chase/skye/rubble/everest 20cm;1099.0;1;250;buy_it_now;gold_special;True;;MLA1166;Juegos y Juguetes
MLA661132928;Cars Combo Camion Mack+8 Autitos Rayo Orig Ditoys Envio S/c;3499.0;1;500;buy_it_now;gold_special;True;;MLA2965;Juegos y Juguetes
MLA661302054;Bolso 50 Pelotas Atoxicas Pelotero Pileta Casita Juego Baño;449.0;250;500;buy_it_now;gold_special;True;;MLA417827;Juegos y Juguetes
MLA605736169;Casita De Juegos Carpa Pelotero Castillo Plegable Princesa 2;2490.0;500;500;buy_it_now;gold_special;True;;MLA90306;Juegos y Juguetes
MLA706876227;Pin De Carga Para Joystick Ps4 Todos Los Modelos;619.35;500;500;buy_it_now;gold_special;True;;MLA414226;Juegos y Juguetes
MLA687015391;Blow Up No Sabés Cuando El Globo Explotará! Tv Orig. Ditoys;1549.0;1;250;buy_it_now;gold_special;True;;MLA1161;Juegos y Juguetes
MLA838843384;Muñecos Como Entrenar A Tu Dragón Chimuelo Furia Luminosa ;2489.0;1;150;buy_it_now;gold_special;True;;MLA3422;Juegos y Juguetes
MLA744500202;Perro Mascota Interactivo Puppy Dog Ditoys Ladra Gruñe Suena;4999.0;500;250;buy_it_now;gold_special;True;5649.0;MLA1166;Juegos y Juguetes
MLA863583657;216 Buckyballs Neodimio 5mm + 36 Sticks 23mm + 27 Balls 8mm;3799.0;1;200;buy_it_now;gold_special;True;;MLA76134;Juegos y Juguetes
MLA763032645;Nikole Nada Tv Nicole Nadadora Lalelu / Open-toys 127 Ea;4899.0;1;250;buy_it_now;gold_special;True;;MLA2968;Juegos y Juguetes
MLA871076737;Rifle Sniper Francotirador Luz Sonido Led Simula Cargador;2799.0;1;150;buy_it_now;gold_special;True;;MLA433029;Juegos y Juguetes
MLA878690646;Cartas Salvajes Juego Cartas Para Previa Risas Casa Fight;959.0;500;100;buy_it_now;gold_special;True;1199.0;MLA432989;Juegos y Juguetes
MLA618457388;Juego De Mesa Ruibal Rummy Burako Clásico Lelab Microcentro;1949.95;50;500;buy_it_now;gold_special;True;;MLA1161;Juegos y Juguetes
MLA899604902;Set X 8 Muñecos Among Us Vivo Y Muerto Impresos En 3d;2099.0;500;250;buy_it_now;gold_special;True;;MLA3422;Juegos y Juguetes
MLA675144992;Cars Combo 8 Autitos + Camion Mack Rayo Macqueen Orig Ditoys;3499.0;1;500;buy_it_now;gold_special;True;;MLA2965;Juegos y Juguetes
MLA823464269;Sillita Mecedora Musical Barral Personajes Vibradora Bipo;6490.0;1;250;buy_it_now;gold_pro;True;;MLA127671;Juegos y Juguetes
