id;title;price;available_quantity;sold_quantity;buying_mode;listing_type_id;accepts_mercadopago;original_price;category_id;category_name
MLA855201876;Marcadores De Pintura Posca Pc-5m Pta Redonda 2,5mm X 5 Unid;2099.0;1;250;buy_it_now;gold_special;True;;MLA69567;Juegos y Juguetes
MLA897736904;Mapa Marta Minujin - Atlantis Mapas;1190.0;250;100;buy_it_now;gold_special;True;;MLA418303;Juegos y Juguetes
MLA784872957;Juego De Mesa Jumanji Toyco Original;1945.0;1;250;buy_it_now;gold_special;True;2431.0;MLA1161;Juegos y Juguetes
MLA879751108;Set Juego Basket Inflable Pileta Con Pelota Anillos Bestway;949.0;1;100;buy_it_now;gold_special;True;1281.0;MLA40387;Juegos y Juguetes
MLA822748357;Marcador Edding 790 Blanco Paint 2-4mm Para Neumaticos Goma;385.0;1;500;buy_it_now;gold_special;True;;MLA69567;Juegos y Juguetes
MLA885151389;Valija De Juguete Juliana Diseño De Uñas Chica;1190.0;1;50;buy_it_now;gold_special;True;;MLA352340;Juegos y Juguetes
MLA881304705;Spiderman Simil Funko Pop #220 Chango Store;1199.0;1;100;buy_it_now;gold_special;True;;MLA3422;Juegos y Juguetes
MLA655042782;Gimnasio Con Sonajeros Y Albombra Gym Para Bebes Antex;2058.0;1;200;buy_it_now;gold_special;True;;MLA27814;Juegos y Juguetes
MLA870566641;Poopsie Sparkly Critters Coleccionable Slime Glitter ;990.0;100;250;buy_it_now;gold_special;True;1290.0;MLA418285;Juegos y Juguetes
MLA782312510;Juego De Mesa Hay Pulguitas Huy Huy Huy;1990.0;1;200;buy_it_now;gold_special;True;2329.0;MLA1161;Juegos y Juguetes
MLA741608979;5 Surprise Nena Esfera Coleccionable 7703q Serie1 Shine;500.0;250;100;buy_it_now;gold_special;True;990.0;MLA2968;Juegos y Juguetes
MLA687995775;Pizarra Corcho 60x80 + Chinches De Regalo Mercado Envio;900.6;500;500;buy_it_now;gold_special;True;948.0;MLA352343;Juegos y Juguetes
MLA778640120;Neocube 216 Esferas De 5mm El Original Caja Metal Col: Mixed;2550.0;1;250;buy_it_now;gold_special;True;;MLA76134;Juegos y Juguetes
MLA741655032;Peluche Bendy, Boris Y Alice Angel And The Ink Machine X2;2300.0;1;200;buy_it_now;gold_special;True;;MLA3422;Juegos y Juguetes
MLA747718900;Pizarra Corcho 40x60 + Chinches De Regalo Envio;656.0;500;250;buy_it_now;gold_special;True;;MLA352343;Juegos y Juguetes
MLA780679916;Camión Portavehiculo Con 2 Motos A Friccion El Duende Azul ;1099.0;1;250;buy_it_now;gold_special;True;1374.0;MLA2965;Juegos y Juguetes
MLA779630201;Popo Game Tan Facil Como Ir Al Baño Juego Mesa Tv !! Ditoys ;1299.0;1;250;buy_it_now;gold_special;True;;MLA1161;Juegos y Juguetes
MLA869220080;Microfibras Filgo Liner 038 X30 Colores Clasico Pastel Fluo;920.0;1;250;buy_it_now;gold_special;True;;MLA69567;Juegos y Juguetes
MLA796994008;Muñeca Evi Con Coche De Paseo 105736241;995.0;250;200;buy_it_now;gold_special;True;1295.0;MLA2968;Juegos y Juguetes
MLA881377287;Monopatin Reforzado Plegable 4 Ruedas Con Luces - S925w;5280.0;1;50;buy_it_now;gold_special;True;;MLA12065;Juegos y Juguetes
MLA870401581;Marcador Sharpie Paint Blanco Oil Pintura Al Aceite Oleo ;396.0;5000;150;buy_it_now;gold_special;True;;MLA69567;Juegos y Juguetes
MLA642095259;Peluches Pokemon Go 20 Cm Varios Modelos Pikachu Pokemones;1289.0;150;500;buy_it_now;gold_special;True;;MLA3422;Juegos y Juguetes
MLA898846528;Valija Juliana Mama Con Accesorios ;840.0;1;100;buy_it_now;gold_pro;True;;MLA352340;Juegos y Juguetes
MLA668744707;Hay Pulgitas Pulguitas Huy Huy Huy Juego De Mesa Tv Top Toys;1994.9;1;150;buy_it_now;gold_special;True;;MLA1161;Juegos y Juguetes
MLA898105899;Puzzle Ball Habilidad Y Destreza Azul;750.0;1;100;buy_it_now;gold_special;True;880.0;MLA1858;Juegos y Juguetes
MLA876932249;Moto Pampi Andarin Pata Pata Pvc Alto Impact Infantil Motito;3013.0;50;150;buy_it_now;gold_special;True;;MLA417753;Juegos y Juguetes
MLA607275334;Muñeca Julieta Gigante Original De Cariñito 80 Cm;4299.0;1;500;buy_it_now;gold_special;True;;MLA2968;Juegos y Juguetes
MLA885095306;Marcadores Crayola Supertips Punta Cónica X 100 Colores;7869.0;1;50;buy_it_now;gold_pro;True;;MLA69567;Juegos y Juguetes
MLA828927940;Juego De Construcción Metálica Grua 139 Piezas Tipo Mecano;869.0;1;250;buy_it_now;gold_special;True;1086.0;MLA1157;Juegos y Juguetes
MLA900147427;Muñeco Monster Momia Frankenstein Luz, Sonido Graba Original;3799.0;1;25;buy_it_now;gold_special;True;;MLA3422;Juegos y Juguetes
MLA898105897;Jumping Fries Cuidado Que No Salten !!;1290.0;50;50;buy_it_now;gold_special;True;;MLA1161;Juegos y Juguetes
MLA614468851;Pileta De Lona Inflable Intex 305x76 + Bomba+cobertor+filtro;20499.0;1;500;buy_it_now;gold_special;True;;MLA11226;Juegos y Juguetes
MLA861404724;Kit De Arte Niños Valija Set Manualidades Regalo Infantil;2500.0;1;500;buy_it_now;gold_special;True;;MLA418303;Juegos y Juguetes
MLA858578667;Pista Tren Bala 225 Cm - Tren 42 Cm Luz Y Control Velocidad ;3793.0;1;100;buy_it_now;gold_special;True;;MLA38493;Juegos y Juguetes
MLA860791300;Combo Ping Pong Sensei 2 Estrellas Pack 2 Paletas + Pelotas;1899.99;1;150;buy_it_now;gold_special;True;;MLA12220;Juegos y Juguetes
MLA744475136;Casa De Muñecas Barbie+30 Muebles Mdf Fibrofacil Corte Laser;3300.0;1;150;buy_it_now;gold_special;True;;MLA409417;Juegos y Juguetes
MLA764928019;Pizarra Magica Tableta Lcd Escritura Digital Ewrite Ohmyshop;1319.0;1;250;buy_it_now;gold_special;True;;MLA434461;Juegos y Juguetes
MLA614882098;Que Ves 2 ? Juego De Mesa Cartas Yetem Microcentro Lelab;1039.9;1;250;buy_it_now;gold_special;True;;MLA1161;Juegos y Juguetes
MLA695882064;Revolver Cebitas Combo X2 Pistolas De 8 Disparos + 144 Tiros;750.0;1;250;buy_it_now;gold_special;True;;MLA3422;Juegos y Juguetes
MLA871849804;Walkie Talkie 1886243 E.full;950.0;1;200;buy_it_now;gold_special;True;1125.0;MLA37617;Juegos y Juguetes
MLA852673149;Toys Palace Andarin Mickey 2 En 1;4790.0;1;150;buy_it_now;gold_special;True;;MLA417753;Juegos y Juguetes
MLA862306576;Peluche Plants & Zombies Muñeco Todos Los Modelos Bellos ;1148.88;1;250;buy_it_now;gold_special;True;;MLA1166;Juegos y Juguetes
MLA816766098;Marcador Para Pizarra Blanca Trabi 151 X 11 Unidades;490.0;1;500;buy_it_now;gold_special;True;;MLA69567;Juegos y Juguetes
MLA780495629;Mascotas X 6 Familia De Mascotas Simil Pet Shop Duende Azul ;1349.0;1;250;buy_it_now;gold_special;True;1619.0;MLA432889;Juegos y Juguetes
MLA668744032;Jenga Orig. Top Toys El De La Tv Orig. Destreza Oferta!!!!!;1599.9;1;500;buy_it_now;gold_special;True;;MLA1161;Juegos y Juguetes
MLA864305372;Shopkins Shoppet Wild Style Fig C/acc Int 56696 Original;700.0;1;100;buy_it_now;gold_special;True;;MLA3422;Juegos y Juguetes
MLA872909577;Peluche Gatito Snowball Rescatame Adoptame Refugio Mascotas ;2667.0;1;50;buy_it_now;gold_special;True;3656.9;MLA1166;Juegos y Juguetes
MLA778985087;Perro Cachorro Correa  Control Remoto Cable Ladra Y Camina ;2953.0;1;200;buy_it_now;gold_special;True;;MLA1166;Juegos y Juguetes
MLA842050931;Kit De Manualidades Para Niños - Tarro We Art;1600.0;50;250;buy_it_now;gold_special;True;;MLA418303;Juegos y Juguetes
MLA880120558;Monopatin Reforzado - Plegable 4 Ruedas Con Luces S925;4839.0;50;50;buy_it_now;gold_special;True;;MLA12065;Juegos y Juguetes
MLA843049353;Canasta De Frutas Y Verduras Con Abrojo Y Acces Duende Azul;1749.0;50;250;buy_it_now;gold_special;True;2186.0;MLA11239;Juegos y Juguetes
MLA870353546;Kit 19. Lebebot Etienne 24 Cm + Bolsito De Paseo. Lb 55/790;3320.0;250;100;buy_it_now;gold_special;True;;MLA2968;Juegos y Juguetes
MLA794107287;Dobble Juego De Cartas Velocidad Top Toys Original Lelab;1794.9;1;250;buy_it_now;gold_special;True;;MLA1161;Juegos y Juguetes
MLA650113849;Shoppies Muñeca Shopkins Coco Cookie Fria Lemony O Makaella;1799.0;200;250;buy_it_now;gold_special;True;;MLA3422;Juegos y Juguetes
MLA858466902;Blokoco Rasti Bloques Grandes Balde 60 Piezas;1098.0;1;250;buy_it_now;gold_special;True;;MLA1157;Juegos y Juguetes
MLA628804555;Caja Registradora Princesas Disney Luz Sonidos Orig. Ditoys;4250.0;1;250;buy_it_now;gold_special;True;;MLA413461;Juegos y Juguetes
MLA620659193;Pelotas Pelotero X 100 Atoxicas No Se Aplastan Oferta!!;902.5;500;500;buy_it_now;gold_special;True;950.0;MLA417827;Juegos y Juguetes
MLA875553056;Kit Set 2 Tacos 12 Tizas 10 Punteras (envío Gratis);4150.0;1;25;buy_it_now;gold_special;True;;MLA431559;Juegos y Juguetes
MLA618457380;Batalla Naval Ruibal Juego De Mesa Microcentro Lelab;834.95;1;250;buy_it_now;gold_special;True;;MLA1161;Juegos y Juguetes
MLA871847845;Micrófono Infantil Juguete Musica Amplificador Voz Niña  ;1199.0;100;100;buy_it_now;gold_pro;True;;MLA90324;Juegos y Juguetes
MLA796117482;Señor Y Señora Cara De Papa Mr Potato Head Toy Story;1990.0;1;50;buy_it_now;gold_special;True;;MLA3422;Juegos y Juguetes
MLA871620433;Chimuelo O Furia Luminosa 23 Cm Hermoso Peluche;1290.0;1;100;buy_it_now;gold_special;True;;MLA1166;Juegos y Juguetes
MLA694747045;Dinosaurio Control Infrarojo  80041;4495.0;250;250;buy_it_now;gold_special;True;5995.0;MLA90314;Juegos y Juguetes
MLA780679516;Camión Mosquito A Friccion + 2 Vehiculos El Duende Azul ;1099.0;1;250;buy_it_now;gold_special;True;1374.0;MLA2965;Juegos y Juguetes
MLA614651042;Bebe Casi Real Muñeca Bebote !!!!!;3650.0;1;500;buy_it_now;gold_special;True;;MLA2968;Juegos y Juguetes
MLA801015599;Cubo Mágico Juego Laberinto De 6 Lados 3d Juego De Ingenio ;231.4;50;500;buy_it_now;gold_special;True;260.0;MLA1161;Juegos y Juguetes
MLA822772368;Lapiz De Madera Plantable Souvenir Publicidad X 100 Unidades;2800.0;250;250;buy_it_now;gold_special;True;;MLA429735;Juegos y Juguetes
MLA770020230;Cama Elastica 2,44 Metros Oferta Red Grande Niño Adulto Mts;24999.0;250;500;buy_it_now;gold_pro;True;;MLA90319;Juegos y Juguetes
MLA825385528;Toy Story 4 Buzz Lightyear Muñeco Articulado 13 Cm Original;1199.0;50;250;buy_it_now;gold_special;True;;MLA3422;Juegos y Juguetes
MLA773676535;Pokemon De Peluche Varios Modelos 22 Cm ;1148.88;1;500;buy_it_now;gold_special;True;;MLA1166;Juegos y Juguetes
MLA635598249;Pizarra Clap Doble Didáctico Caja Madera Abecedario Números;2495.0;1;500;buy_it_now;gold_special;True;;MLA352343;Juegos y Juguetes
MLA872700898;Beretta Px4 Storm Entrenamiento - Impresa En 3d;850.0;500;50;buy_it_now;gold_special;True;;MLA433029;Juegos y Juguetes
MLA832903501;Muñecos Frozen 2 Elsa Juego De Te Original Premium;4050.0;150;100;buy_it_now;gold_special;True;;MLA2968;Juegos y Juguetes
MLA901409602;Juego Del Pinguino - Rompe Hielo - Qing Yuang;1329.0;1;25;buy_it_now;gold_special;True;1399.0;MLA1161;Juegos y Juguetes
MLA876008002;Paw Patrol Muñecos Peluches ;1100.0;1;150;buy_it_now;gold_special;True;;MLA1166;Juegos y Juguetes
MLA758234296;Pistola Agua Typhoon Twister 322-10107;1495.0;500;250;buy_it_now;gold_special;True;1795.0;MLA90321;Juegos y Juguetes
MLA869679310;Varita Mágica Harry Potter;1915.0;1;100;buy_it_now;gold_special;True;;MLA3422;Juegos y Juguetes
MLA885649413;Mochila Pistola De Agua Vengadores Hulk Iron Man Spiderman;1590.0;50;250;buy_it_now;gold_special;True;;MLA90321;Juegos y Juguetes
MLA864057069;Cubo Rubik 2x2 Moyu Meilong Stickerless 2x2x2;839.0;1;100;buy_it_now;gold_special;True;;MLA76129;Juegos y Juguetes
MLA684271967;Pictionary Mattel Original Ruibal Tv Juego De Mesa Lelab;3549.9;1;250;buy_it_now;gold_special;True;;MLA1161;Juegos y Juguetes
MLA886333779;Crayola Marcadores Super Tips Lavables X20;1298.0;1;50;buy_it_now;gold_special;True;;MLA69567;Juegos y Juguetes
MLA866126374;Set De Muebles Para Muñecas - 30 Piezas En Fibrofácil Fl;1835.0;1;100;buy_it_now;gold_special;True;;MLA419783;Juegos y Juguetes
MLA769657588;Unicornio Inflable Bestway Colchoneta Pileta Juguete;3190.0;500;500;buy_it_now;gold_special;True;4147.0;MLA40387;Juegos y Juguetes
MLA878920299;Clarín Colección De 15 Autos Clásicos;5900.0;250;500;buy_it_now;gold_special;True;;MLA3398;Juegos y Juguetes
MLA851912730;Cocodrilo Verde Gigante 33 Cm Juguete Animal Goma Kokodino;605.0;1;200;buy_it_now;gold_special;True;;MLA3422;Juegos y Juguetes
MLA752216632;Masha Y El Oso Peluche Oso 45 Cm Enorme Y Suave;3799.0;1;150;buy_it_now;gold_special;True;7999.0;MLA1166;Juegos y Juguetes
MLA871378295;Dables Juego Mesa Cartas Redondas Memoria Visual Dobles;600.0;1;50;buy_it_now;gold_special;True;;MLA1161;Juegos y Juguetes
MLA853968468;Carpa Pelotero Casita Inflantil Castillo Autoarmable Plegabl;3050.0;1;150;buy_it_now;gold_special;True;;MLA95005;Juegos y Juguetes
MLA690470269;Peluche Cutetitos Sorpresa Coleccionables Tacos Ink Edu;999.5;1;250;buy_it_now;gold_special;True;1999.0;MLA1166;Juegos y Juguetes
MLA858347774;Na Na Na Surprise 564737 Cachavacha;5600.0;50;100;buy_it_now;gold_special;True;;MLA2968;Juegos y Juguetes
MLA749129921;Pileta Infantil Inflable Redonda Niño Bebe Jardin Bestway;2399.0;150;500;buy_it_now;gold_special;True;;MLA11226;Juegos y Juguetes
MLA878676036;Patrulla Canina Ryder + Cuatri - Robodog + Avion. A Friccion;1499.99;1;50;buy_it_now;gold_special;True;;MLA3422;Juegos y Juguetes
MLA852434267;Guitarra Ukelele Infantil Juguete 39cm Promo Niño Navidad;790.0;500;250;buy_it_now;gold_special;True;;MLA90325;Juegos y Juguetes
MLA696552612;Spiderman Auto A Fricciòn Original Ditoys;860.0;50;500;buy_it_now;gold_special;True;990.0;MLA2965;Juegos y Juguetes
MLA617041227;Teg Tradicional Tactica Estrategia Juego Mesa Guerra Yetem;3279.9;50;250;buy_it_now;gold_special;True;;MLA1161;Juegos y Juguetes
MLA851952207;Lego® Friends - Heladería Móvil (41389);2999.0;50;250;buy_it_now;gold_special;True;;MLA1157;Juegos y Juguetes
MLA886692178;Caja Exclusiva Woopy Filgo Pinto Box - Woopy;1800.0;1;50;buy_it_now;gold_pro;True;;MLA69567;Juegos y Juguetes
MLA883197515;Muñeca Bebote Muekitas Lalelu Expresion Facial Real Muecas;4250.0;1;50;buy_it_now;gold_special;True;;MLA2968;Juegos y Juguetes
MLA633287566;Valija De Julian Doctor Con Accesorios;801.0;50;250;buy_it_now;gold_special;True;1099.0;MLA352340;Juegos y Juguetes
MLA853966313;Ditoys Convertibles Collision Fighters Rojo;1469.0;1;200;buy_it_now;gold_special;True;1699.0;MLA3422;Juegos y Juguetes
MLA900002080;Marcadores Touch Doble Punta X 36 Unidades Nuwa ;1849.99;1;50;buy_it_now;gold_special;True;;MLA69567;Juegos y Juguetes
MLA811956184;Generala Premium Dados Cubilete De Cuero Bisonte Oficial;714.95;1;150;buy_it_now;gold_special;True;;MLA1161;Juegos y Juguetes
MLA793141019;Arco Y Flecha Lanzador Accion Extrema El Duende Azul;2499.0;1;250;buy_it_now;gold_special;True;3124.0;MLA431922;Juegos y Juguetes
MLA851685339;Moyu Meilong 2 X 2  Stickerless - Cubo Magico ;699.0;1;150;buy_it_now;gold_special;True;;MLA76129;Juegos y Juguetes
MLA828975718;Pin Carga Jds050 + Flex  12 Pines Joystick Ps4 V2 Jdm050/055;649.0;250;250;buy_it_now;gold_special;True;;MLA414226;Juegos y Juguetes
MLA803861318;Robot A Radio Control Interactivo Con Luz Y Sonido Wise Star;5699.0;1;50;buy_it_now;gold_special;True;7409.0;MLA90322;Juegos y Juguetes
MLA766493557;Tomy Look Casual Simil Ken El Mundo De Paloma 6839;1499.0;5000;100;buy_it_now;gold_special;True;1754.0;MLA2968;Juegos y Juguetes
MLA859091355;Peluche Bulbasaur De Pokemon - Excelente Calidad;1380.0;1;200;buy_it_now;gold_special;True;;MLA3422;Juegos y Juguetes
MLA800354486;Toman Todos Mix + Toman Todos Picante;1368.0;50;200;buy_it_now;gold_special;True;;MLA1161;Juegos y Juguetes
MLA872669037;Valija Juliana Maquillaje Artistico Chica Ma203 Original;1199.0;1;150;buy_it_now;gold_special;True;;MLA352340;Juegos y Juguetes
MLA766557252;Rescata Y Adopta A Este Gatito Rescue Runs Kreker;3050.0;1;150;buy_it_now;gold_special;True;;MLA1166;Juegos y Juguetes
MLA767125368;Juego De Pelota Lanzar Y Capturar Motricidad Diversión;1199.0;1;100;buy_it_now;gold_special;True;;MLA3659;Juegos y Juguetes
MLA781124121;Cama Elastica 2,44 Metros Oferta Red Grande Niño Adulto Mts;18999.0;250;100;buy_it_now;gold_special;True;30999.0;MLA90319;Juegos y Juguetes
MLA817192603;Koala De Peluche  Muy Tierno Importado !;1380.88;1;100;buy_it_now;gold_special;True;;MLA1166;Juegos y Juguetes
MLA855749633;El Baño. Muebles De Muñecas Gloria;2599.0;1;50;buy_it_now;gold_pro;True;;MLA419783;Juegos y Juguetes
MLA799727017;Juego Illusion;1880.0;50;500;buy_it_now;gold_special;True;;MLA1161;Juegos y Juguetes
MLA851852609;Tiburón Feroz Azul Juguete Goma Mar Gigante 33cm Tiburones;800.0;1;200;buy_it_now;gold_special;True;;MLA3422;Juegos y Juguetes
MLA896145852;Microfono Parlante Inalambrico Bluetooth Para Karaoke Dorado;1287.0;50;100;buy_it_now;gold_special;True;;MLA433151;Juegos y Juguetes
MLA851953540;Lego® City - Camión De Los Helados (60253);5999.0;100;250;buy_it_now;gold_special;True;;MLA1157;Juegos y Juguetes
MLA758226812;Whan O Aro Salvavidas Donuts Wo61480;895.0;50;200;buy_it_now;gold_special;True;1395.0;MLA40387;Juegos y Juguetes
MLA874151689;Arco De Futbol Grande Mega Soccer Goal Plegable Orig Ditoys;3799.0;1;50;buy_it_now;gold_special;True;;MLA454740;Juegos y Juguetes
MLA885117520;Tri Scooter Monopatin Infantil 3 Ruedas Ik0015;3799.0;50;100;buy_it_now;gold_special;True;6990.0;MLA12065;Juegos y Juguetes
MLA735307647;Ken Muñeco Simil C/accesorios +muñeca Musical C/luz . Nuevo!;2490.0;1;100;buy_it_now;gold_special;True;;MLA2968;Juegos y Juguetes
MLA874172137;Deadpoll Funko Pop Símil Premium Dragon Ball Spiderman Marve;1390.0;100;200;buy_it_now;gold_special;True;;MLA3422;Juegos y Juguetes
MLA791166435;Moto Pata Pata Ener G Andarin Niños C O N  L U Z - Vegui;5349.0;1;500;buy_it_now;gold_special;True;;MLA417753;Juegos y Juguetes
MLA856295047;Carpa Pelotero Casita Infantil Castillo Plegable ;3050.0;1;150;buy_it_now;gold_special;True;;MLA90306;Juegos y Juguetes
MLA885105951;Pista De Autos Circuito De Carreras A Pila Con 2 Vehículos;3399.0;1;50;buy_it_now;gold_special;True;4419.0;MLA37616;Juegos y Juguetes
MLA646300758;Dino Pelotero Con 40 Pelotitas+ Bolso Directo De Fabrica;2200.0;500;500;buy_it_now;gold_special;True;;MLA1887;Juegos y Juguetes
MLA883684620;Breton - Juego De Cartas - Similar Dixit - Pablo Bernasconi;400.0;1;100;buy_it_now;gold_special;True;;MLA1161;Juegos y Juguetes
MLA774299699;Hada Mágica Atrapando Estrellas 1058;2995.0;100;150;buy_it_now;gold_special;True;4490.0;MLA3659;Juegos y Juguetes
MLA748271331;Shopkins Happy Places Establo C/ Pony Completo En Toysmarket;3499.0;1;200;buy_it_now;gold_special;True;;MLA3422;Juegos y Juguetes
MLA881663002;Cartas Salvajes Juego Cartas Para Previa Risas Casa Fight;959.0;1;100;buy_it_now;gold_special;True;1199.0;MLA432989;Juegos y Juguetes
MLA787925184;Valija Juliana Maquillaje Artistico Con Accesorios Nueva;1190.0;1;250;buy_it_now;gold_special;True;;MLA352340;Juegos y Juguetes
MLA836742311;Slime Unicorn Poop Unicornio Galáctico Kawaii Y No Tóxico;299.0;1;500;buy_it_now;gold_special;True;;MLA418285;Juegos y Juguetes
MLA866906172;Muñeca Articulada Kiara Princesa + 12 Vestidos Y Accesorios;2975.07;1;50;buy_it_now;gold_special;True;3199.0;MLA2968;Juegos y Juguetes
MLA668617759;Juego De Mesa A Quien Elijo? Viaje  Top Toys Adivina Quien;864.9;1;250;buy_it_now;gold_special;True;;MLA1161;Juegos y Juguetes
MLA612544176;Valija Juliana Veterinaria Chica Con Accesorios Original;1315.0;100;250;buy_it_now;gold_special;True;1549.0;MLA352340;Juegos y Juguetes
MLA820248094;Fortnite Battle Autobus Combate C/2 Fig Y Acc Int 63512 Orig;3764.0;1;500;buy_it_now;gold_special;True;5790.0;MLA3422;Juegos y Juguetes
MLA827945544;Kit Ping Pong Portatil 2 Paletas + Pelotas + Red Retráctil ;3249.0;1;50;buy_it_now;gold_special;True;;MLA79322;Juegos y Juguetes
MLA901591535;Juego Paletas Playero Aloha Frescobol Playa Pelota ;750.0;250;25;buy_it_now;gold_special;True;;MLA414003;Juegos y Juguetes
MLA882091337;Marcadores Touch Doble Punta X36;1990.0;1;50;buy_it_now;gold_special;True;;MLA69567;Juegos y Juguetes
MLA746681496;Sonic Amy Silver De Peluche Importado Calidad Original Ofert;1080.88;1;250;buy_it_now;gold_special;True;;MLA1166;Juegos y Juguetes
MLA868900454;Muñecas Frozen 2- Princesa Anna O Elsa Articuladas Musicales;1490.0;1;100;buy_it_now;gold_special;True;;MLA2968;Juegos y Juguetes
MLA846176432;Juego De Mesa Katamino Maldon;6500.0;1;250;buy_it_now;gold_special;True;;MLA1161;Juegos y Juguetes
MLA857908535;Aro De Basquet Infantil  Base Y Pelota 94cm Rondi Tiendayh;1999.0;1;100;buy_it_now;gold_special;True;;MLA454741;Juegos y Juguetes
MLA874394611;Muñecos Plantas Vs Zombies Lanzador De Bolas Juguete ;1390.0;1;100;buy_it_now;gold_special;True;;MLA3422;Juegos y Juguetes
MLA612842474;Mi Primer Supermercado Con Registradora Lionels Mundo Manias;3299.0;1;250;buy_it_now;gold_special;True;;MLA432836;Juegos y Juguetes
MLA898716591;Flota Flota Varios Colores Bochatoys....;99.0;200;500;buy_it_now;gold_special;True;;MLA40387;Juegos y Juguetes
MLA871468440;Guante Lanza Y Atrapa Con Abrojo Catch Ball;919.0;1;200;buy_it_now;gold_special;True;1195.0;MLA414003;Juegos y Juguetes
MLA650139453;Elena La Abeja - El Duende Azul;1349.0;1;250;buy_it_now;gold_special;True;1686.0;MLA1161;Juegos y Juguetes
MLA858140251;Princesa P/peinar Ariel 1655047 E.normal;1650.0;50;150;buy_it_now;gold_special;True;;MLA2968;Juegos y Juguetes
MLA833811398;Pistola Mochila De Agua Personajes Para Niños;1473.17;50;200;buy_it_now;gold_special;True;;MLA90321;Juegos y Juguetes
MLA696553709;Computadora Mickey Club Hpuse Con Luces Y Sonidos Ditoys;1850.0;100;500;buy_it_now;gold_special;True;2699.0;MLA90331;Juegos y Juguetes
MLA795792854;Transformers Muñeco Robot Vehiculo Con Accesorios;2649.0;200;50;buy_it_now;gold_special;True;3444.0;MLA3422;Juegos y Juguetes
MLA870477369;Marcadores Sharpie Set 17 Piezas Permanentes Tropical ;1223.0;1;150;buy_it_now;gold_special;True;1677.0;MLA69567;Juegos y Juguetes
MLA870588658;Valija De Juguete Julian Doctor Set Juego Doctor Médico;990.0;1;200;buy_it_now;gold_special;True;;MLA352340;Juegos y Juguetes
MLA878740490;Jenga Gigante Xl + Bolso + Banquito - 18 Pisos 1m;4499.0;1;25;buy_it_now;gold_pro;True;;MLA1161;Juegos y Juguetes
MLA897620637;Moto Para Niños - R1 Team Rojo - Pata Pata - Rondi;3999.0;100;100;buy_it_now;gold_pro;True;4368.0;MLA12072;Juegos y Juguetes
MLA856747915;Walkie Talkie Radio Infantil Juguete Bateria Recargable Usb;3999.0;1;250;buy_it_now;gold_special;True;;MLA37617;Juegos y Juguetes
MLA795750746;Bebote Lebebot (27 Cm) Real C/ Sexo Femenino Emilia Lb-65  ;1900.0;1;250;buy_it_now;gold_special;True;;MLA2968;Juegos y Juguetes
MLA627389409;Triciclo Bebe  Plegable  Asiento Reclina Tiger Deluxe Promo;16289.0;1;250;buy_it_now;gold_special;True;;MLA6557;Juegos y Juguetes
MLA696551579;Pony Volador Chico Flying Pony Small Pegasus Original Ditoys;989.0;50;250;buy_it_now;gold_special;True;1299.0;MLA3422;Juegos y Juguetes
MLA792489488;Poopsie Coleccionable Slime Sorpresa Original!!;990.0;100;200;buy_it_now;gold_special;True;;MLA418285;Juegos y Juguetes
MLA871521425;Juego De Go - Set Super Completo! - Oferta!;3500.0;1;25;buy_it_now;gold_special;True;;MLA1161;Juegos y Juguetes
MLA791893364;Micrófono Karaoke Bluetooth Inalámbrico + Parlante;1799.0;1;200;buy_it_now;gold_pro;True;;MLA433151;Juegos y Juguetes
MLA660745916;Cars Camion + 6 Autos Rayo Mcqueen Jackson Storm Cruz Ditoys;2149.0;1;500;buy_it_now;gold_special;True;;MLA2965;Juegos y Juguetes
MLA837677606;Bonetes Sombrerito X 6 Para Cama Elastica Nuevos !!!;2000.0;500;150;buy_it_now;gold_special;True;;MLA431546;Juegos y Juguetes
MLA614628855;Bebes Reales Sexo Nena Gordita Básica 40 Cm!!;1750.0;1;500;buy_it_now;gold_special;True;;MLA2968;Juegos y Juguetes
MLA857444473;Marcadores Para Vidrio Pizzini Maxi X 9 Colores ;540.0;1;250;buy_it_now;gold_special;True;;MLA69567;Juegos y Juguetes
MLA851786080;Pack 12 Depredadores Del Mar Juguete Tiburón Orca Ballena ;2400.0;1;250;buy_it_now;gold_special;True;;MLA3422;Juegos y Juguetes
MLA867859733;Kinga Sling Puck Pucket Juego De Mesa Madera;2590.0;1;50;buy_it_now;gold_special;True;;MLA1161;Juegos y Juguetes
MLA810434151;Lego Speed Champions - Mclaren Senna (75892);5699.0;1;100;buy_it_now;gold_special;True;;MLA1157;Juegos y Juguetes
MLA781464314;Gimnasio Manta  Bebe Con Piano Musical Cici Cuotas;4699.0;150;250;buy_it_now;gold_special;True;;MLA27814;Juegos y Juguetes
MLA743762178;Perrito Saltarín Ladra Y Gira 360 Grados - El Duende Azul;1999.0;1;500;buy_it_now;gold_special;True;2399.0;MLA1166;Juegos y Juguetes
MLA857104350;Atlantis Mapas- Combo Xxxl (4 Mapas Surtidos)-sitio Original;4100.0;150;500;buy_it_now;gold_special;True;;MLA418303;Juegos y Juguetes
MLA701404600;Casita De Muñecas C/13 Muebles Fibro Facil Mdf 9mm P/ Pintar;3998.0;1;500;buy_it_now;gold_special;True;;MLA409417;Juegos y Juguetes
MLA797576077;Bananas Pack 3 Figuras Y Acc Int Bb35000 Original Vulcanita;1087.5;1;150;buy_it_now;gold_special;True;1450.0;MLA3422;Juegos y Juguetes
MLA670046565;Juego De Mesa Pulso Electrico Equilibrio - El Duende Azul;1249.0;1;250;buy_it_now;gold_special;True;1461.0;MLA1161;Juegos y Juguetes
MLA687948554;Cars Pista De Carreras 2 Controles Racing Ditoys;5349.0;1;250;buy_it_now;gold_special;True;;MLA37616;Juegos y Juguetes
MLA826368630;Trencity Pista Nº 5 - Tienda Oficial -;6840.0;1;250;buy_it_now;gold_pro;True;7291.5;MLA38493;Juegos y Juguetes
MLA758228005;Whan O Inflable Sandia Wo61527;1095.0;100;150;buy_it_now;gold_special;True;1895.0;MLA40387;Juegos y Juguetes
MLA898756186;Juliana Burbujas Burbujero Automático Con Luz Original;1860.0;50;50;buy_it_now;gold_special;True;;MLA388313;Juegos y Juguetes
MLA618326824;Barrilete Grande Cometa Gigante De Tela De 100 X 60 Cm;549.0;1;500;buy_it_now;gold_special;True;;MLA12046;Juegos y Juguetes
MLA782693734;Estacion De Servicio 3 Niveles Con Pista De 1 Metro New Plas;2290.0;1;250;buy_it_now;gold_special;True;2936.0;MLA37526;Juegos y Juguetes
MLA882290837;Muñeco Sonic Set X 4 Juguete Calidad;2890.0;50;50;buy_it_now;gold_special;True;;MLA3422;Juegos y Juguetes
MLA646338537;Soggy Doggy Juego De Mesa  Next Point;2299.0;1;100;buy_it_now;gold_special;True;;MLA1161;Juegos y Juguetes
MLA869163443;Valija De Juguete Juliana Mamá  10 Accesorios Tiendamibebe;895.0;1;100;buy_it_now;gold_special;True;;MLA352340;Juegos y Juguetes
MLA867283970;Pin De Carga Placa Para  Joytistick Ps4 12 Pines Jds-030;339.0;1;200;buy_it_now;gold_special;True;;MLA414226;Juegos y Juguetes
