id;title;price;available_quantity;sold_quantity;buying_mode;listing_type_id;accepts_mercadopago;original_price;category_id;category_name
MLA767951498;Peluche Stitch De Lilo&stitch 33 Cm Sentado Real Importado ;2998.88;1;250;buy_it_now;gold_special;True;;MLA1166;Juegos y Juguetes
MLA868006454;Glow Track Pista De Auto Luminosa 81 Piezas Fácil Encastre;1199.0;1;250;buy_it_now;gold_special;True;1299.0;MLA37616;Juegos y Juguetes
MLA605989548;Mi Primer Taller Banco De Herramientas Lionels Mundo Manias;1999.0;1;500;buy_it_now;gold_special;True;;MLA432839;Juegos y Juguetes
MLA857559403;Jenga Yenga 54 Piezas + Cartas Uno ;449.1;1;500;buy_it_now;gold_special;True;499.0;MLA1161;Juegos y Juguetes
MLA869745757;Funda Cubre Mesa De Ping Pong Impermeable Cobertor  ;1197.0;1;200;buy_it_now;gold_special;True;;MLA79321;Juegos y Juguetes
MLA808947936;Set Lote X2 Muñecos Dragon Ball Super Goku Black Broly Jiren;2599.0;1;150;buy_it_now;gold_special;True;;MLA3422;Juegos y Juguetes
MLA674534776;Jeep Auto Barbie Original Con Stickers Rosa Bebe Lelab;1099.99;1;500;buy_it_now;gold_special;True;;MLA3659;Juegos y Juguetes
MLA874502399;Muñeca Luly Gatea Mamadera Luz Y Sonido Rie Y Llora Ditoys;1339.0;1;200;buy_it_now;gold_special;True;;MLA2968;Juegos y Juguetes
MLA899967124;Dinosaurio Camina Luz Sonido Pone Huevos Juguete Niños;1999.0;1;250;buy_it_now;gold_special;True;;MLA90322;Juegos y Juguetes
MLA862100259;Stickers Fasito420;600.0;100;250;buy_it_now;gold_special;True;;MLA1965;Juegos y Juguetes
MLA896526082;Juego De Mesa Desafio Pastelazo Hasbro C0193 - Rex;1899.0;50;50;buy_it_now;gold_special;True;2115.0;MLA1161;Juegos y Juguetes
MLA762221653;Juego Fast Food Petit Gourmet Y Caja Registradora Lionels;2990.0;1;500;buy_it_now;gold_special;True;;MLA413461;Juegos y Juguetes
MLA872636737;Set X4 Muñecos Minecraft Con Accesorios Artículados Juguetes;2298.0;1;200;buy_it_now;gold_special;True;;MLA3422;Juegos y Juguetes
MLA612546375;Valija Juliana Cocinera Con Recetario Original;698.0;1;250;buy_it_now;gold_special;True;999.0;MLA352340;Juegos y Juguetes
MLA852441197;Lol Surprise Under Wraps Muñeca Original Wabro Serie Eye Spy;2999.0;1;200;buy_it_now;gold_special;True;;MLA2968;Juegos y Juguetes
MLA875983646;Teclado Musical Piano Juguete Organo Infantil Microfono;2399.0;50;250;buy_it_now;gold_special;True;;MLA90323;Juegos y Juguetes
MLA876008824;Teclado Musical Piano Juguete Organo Infantil 44 Teclas Mic;3799.0;1;250;buy_it_now;gold_special;True;;MLA90323;Juegos y Juguetes
MLA820549188;Crazy Gorilas Ditoys;1340.0;100;250;buy_it_now;gold_special;True;1890.0;MLA1161;Juegos y Juguetes
MLA899817791;Lego Harry Potter - Sala De Los Menesteres De Hogwarts 75966;5999.0;50;150;buy_it_now;gold_special;True;;MLA1157;Juegos y Juguetes
MLA858451312;Casita Casa De Muñeca Vuelta Al Mundo 32 Muebles Fibrofacil;2200.0;1;500;buy_it_now;gold_special;True;;MLA409417;Juegos y Juguetes
MLA899422550;Treasure X Descubri El Tesoro Escondido 3 Bloques Original;2690.0;1;25;buy_it_now;gold_special;True;;MLA3422;Juegos y Juguetes
MLA897916857;Water Ball, Rebota En El Agua!!  La Original !!;499.9;500;150;buy_it_now;gold_special;True;;MLA413991;Juegos y Juguetes
MLA628244683;Andador Patrol Pata Pata Caminador Andarin 2 En1 Nena Promo;2975.0;1;500;buy_it_now;gold_special;True;;MLA417753;Juegos y Juguetes
MLA776891442;Pizarra Blanca 40x60cm +2 Marcadores Y  Accesorios Gratis;720.0;5000;500;buy_it_now;gold_special;True;;MLA352343;Juegos y Juguetes
MLA675157064;Toman Todos Picante Juego De Cartas Para Previas;695.0;200;500;buy_it_now;gold_special;True;;MLA1161;Juegos y Juguetes
MLA883344483;Juguete Microfono Infantil Doble Musica Luces Babymovil;1699.0;1;100;buy_it_now;gold_special;True;2123.75;MLA90324;Juegos y Juguetes
MLA895948345;Bebote Kiki Habla Come Cokkies Y Rie Incluye Galletas Ditoys;3325.0;1;100;buy_it_now;gold_special;True;;MLA2968;Juegos y Juguetes
MLA800935781;Pin Carga Jds040 + Flex  12 Pines Joystick Ps4 V2 Jds-040;649.0;250;500;buy_it_now;gold_special;True;;MLA414226;Juegos y Juguetes
MLA863851402;Shopkins Happy Places Playset Establo Gde Int 56688 Original;2499.0;1;50;buy_it_now;gold_special;True;;MLA3422;Juegos y Juguetes
MLA796099639;Monopatin Flores Niñas 4 Ruedas Luces Led Silicona Reforzado;6139.0;200;500;buy_it_now;gold_special;True;;MLA12065;Juegos y Juguetes
MLA794949378;Colchoneta Inflable Pileta Intex Pocket Con Portavasos Azul;2425.0;250;250;buy_it_now;gold_special;True;;MLA40387;Juegos y Juguetes
MLA633688398;Teg Junior Juego De Estrategia Para Chicos Yetem Lelab;1414.9;1;250;buy_it_now;gold_special;True;;MLA1161;Juegos y Juguetes
MLA885299101;Scentos Marcadores C/aroma 10 Unid Int 40720 Original;590.0;1;100;buy_it_now;gold_special;True;;MLA69567;Juegos y Juguetes
MLA900984664;Arco De Futbol Para Pileta Water Polo Oferta Incluye Pelota;1799.0;250;100;buy_it_now;gold_special;True;;MLA40387;Juegos y Juguetes
MLA880687438; Combo Lettering 20 Marcadores Punta Pincel Filgo Brushpen ;998.0;50;200;buy_it_now;gold_special;True;;MLA69567;Juegos y Juguetes
MLA855307150;Almohadones Para Pintar Lavar Y Volver A Pintar + Marcadores;450.0;1;250;buy_it_now;gold_special;True;;MLA418303;Juegos y Juguetes
MLA777115826;Treasure X Descubri El Tesoro Escondido 3 Fig Int 41501 Orig;2699.1;1;250;buy_it_now;gold_special;True;2999.0;MLA3422;Juegos y Juguetes
MLA874388282;Faber-castell 27778 Lápices De Colores Eco Súpersoft X50;1990.0;500;150;buy_it_now;gold_special;True;;MLA429735;Juegos y Juguetes
MLA751802504;Juego De Cartas Uno Ruibal - Mattel Envío Full;650.0;100;500;buy_it_now;gold_special;True;770.0;MLA1161;Juegos y Juguetes
MLA879395615;Frisbee Ultimate Oficial Disco Deportivo Aerostyle 175gr;675.0;1;100;buy_it_now;gold_special;True;;MLA433106;Juegos y Juguetes
MLA885676976;Tenisol Original En Bolsa Con Paletas Juegosol E.normal;3390.0;50;150;buy_it_now;gold_special;True;4255.0;MLA414003;Juegos y Juguetes
MLA871099764;Muñeca Super Cute Little Babies Sisi 1796 ;5990.0;1;200;buy_it_now;gold_special;True;;MLA2968;Juegos y Juguetes
MLA881105493;Barrilete Grande De Unicornio Cometa Gigante De Tela 120 Cm;549.0;1;150;buy_it_now;gold_special;True;;MLA12046;Juegos y Juguetes
MLA829871436;Juguete Caja Registradora Accesorios Zippy Babymovil Full;3324.0;1;100;buy_it_now;gold_special;True;4155.0;MLA413461;Juegos y Juguetes
MLA683428570;Set X 6 Dinosaurios Manymals 10 Cm;1189.0;1;500;buy_it_now;gold_special;True;;MLA3422;Juegos y Juguetes
MLA846178050;Juego De Mesa Panic Lab Maldon;2020.0;1;500;buy_it_now;gold_special;True;;MLA1161;Juegos y Juguetes
MLA882657337;Pin De Carga Joystick Ps4 Todos Los Modelos 011 030 040 055 ;309.0;250;250;buy_it_now;gold_special;True;;MLA414226;Juegos y Juguetes
MLA789890373;Gimnasio Manta  Bebe Piano Musical Cici Babymovil ;4499.0;1;500;buy_it_now;gold_special;True;;MLA27814;Juegos y Juguetes
MLA871798332;Valija Juliana Diseño De Uñas Grande Original Tiendamibebe;2590.0;1;150;buy_it_now;gold_special;True;;MLA352340;Juegos y Juguetes
MLA643840441;Hamaca De Bebe Elefantito Rodacross Envio Gratis Todo Pais;3749.0;1;500;buy_it_now;gold_special;True;;MLA11236;Juegos y Juguetes
MLA900824780;Microfono Karaoke Bluetooth Inalambrico Parlante Efectos ;1099.0;50;150;buy_it_now;gold_special;True;1499.0;MLA433151;Juegos y Juguetes
MLA814555669;Martillo Mjolnir + Hacha Stormbreaker Thor Avengers;1499.99;1;250;buy_it_now;gold_special;True;;MLA3422;Juegos y Juguetes
MLA792286927;Life El Juego De La Vida. Juego De Mesa ;3090.0;1;50;buy_it_now;gold_special;True;;MLA1161;Juegos y Juguetes
MLA877689214;Avion Planeador Juguete De Polifan Alta Densidad 48cm;990.0;200;150;buy_it_now;gold_special;True;;MLA6748;Juegos y Juguetes
MLA795481503;Playmobil Camioneta Aventura 3528;1595.0;250;500;buy_it_now;gold_special;True;2190.0;MLA12400;Juegos y Juguetes
MLA787505520;Cargador De Baterias Lipo Imax B6 Balanceador De Carga;3499.0;250;250;buy_it_now;gold_special;True;;MLA1847;Juegos y Juguetes
MLA645555598;Five Nights At Freddy's Peluche Foxy 23cm!!!;1099.99;1;100;buy_it_now;gold_special;True;;MLA1166;Juegos y Juguetes
MLA802420622;Micrófono Mp3 Con Luz Y Sonido 1685596;1495.0;250;150;buy_it_now;gold_special;True;2050.0;MLA90324;Juegos y Juguetes
MLA874084543;Carolin Muñeca Con Scooter A Control Remoto Gira 360 Ditoys;6350.0;1;200;buy_it_now;gold_special;True;;MLA2968;Juegos y Juguetes
MLA795316114;Scrabble Escrable Palabras Cruzadas Original Sharif Express;2099.0;1;250;buy_it_now;gold_special;True;;MLA1161;Juegos y Juguetes
MLA856518005;Transbordador Nave Espacial Astro Venture - Sharif Express;3299.0;1;100;buy_it_now;gold_special;True;;MLA3422;Juegos y Juguetes
MLA861909067;Clarín Colección Los Simpsons;3843.0;200;250;buy_it_now;gold_special;True;5490.0;MLA432889;Juegos y Juguetes
MLA896711678;Fidget Cube Cubo Dado Anti Stress Ansiedad Nervios Tea Tgd;649.0;1;100;buy_it_now;gold_special;True;;MLA409389;Juegos y Juguetes
MLA864370776;Carta Hogwarts Personalizada Harry Potter Libro Mapa Varita ;795.0;500;250;buy_it_now;gold_pro;True;;MLA3390;Juegos y Juguetes
MLA872296545;Five Nights At Freddys Muñecos Peluches;1190.0;1;150;buy_it_now;gold_special;True;;MLA1166;Juegos y Juguetes
MLA870594403;Valija Juliana Doctora Grande Accesorios Con Luz Y Sonido ;2590.0;1;100;buy_it_now;gold_special;True;;MLA352340;Juegos y Juguetes
MLA869671717;Ni En Pedo, Bueno En Pedo Si Juego De Previa Para Tomar;900.0;1;200;buy_it_now;gold_special;True;;MLA1161;Juegos y Juguetes
MLA828590806;Juguete Planta Vs Zombies Lanza Guisante Carnivora Blister ;1185.0;100;100;buy_it_now;gold_special;True;;MLA3422;Juegos y Juguetes
MLA802498638;Frutas O Verduras Comidas Con Abrojo;1099.0;200;250;buy_it_now;gold_special;True;1429.0;MLA433029;Juegos y Juguetes
MLA856664785;Red Ping Pong Instant Profesional  Soporte Retráctil ;2390.0;1;100;buy_it_now;gold_special;True;;MLA76158;Juegos y Juguetes
MLA871687870;Bateria Musical Para Niños 3 Piezas Y Platillo Jazz Drum;1809.66;500;200;buy_it_now;gold_special;True;;MLA90315;Juegos y Juguetes
MLA781279661;Caja Registradora Canasto Con Accesorios Sonido Microfono Ck;3990.0;50;250;buy_it_now;gold_special;True;;MLA413461;Juegos y Juguetes
MLA828783846;Cubo Magico De Velocidad Mf3 3x3 Profesional Y Principiantes;524.94;500;250;buy_it_now;gold_special;True;;MLA76129;Juegos y Juguetes
MLA897446640;Cartas Salvajes + Digalo Con Memes Juego Cartas Casa Fight;2023.08;1;50;buy_it_now;gold_special;True;2199.0;MLA1161;Juegos y Juguetes
MLA873215716;Valija Juliana Make Up Maquillaje Unicornio Chica Original;1539.0;1;250;buy_it_now;gold_special;True;;MLA352340;Juegos y Juguetes
MLA858672784;Varita Harry Potter Ollivanders Original;1650.0;1;200;buy_it_now;gold_special;True;;MLA3422;Juegos y Juguetes
MLA856717762;Cocina Piccola Rondi Art. Ptcoc5006;3270.0;1;200;buy_it_now;gold_special;True;3759.0;MLA11239;Juegos y Juguetes
MLA858670945;Jumper Hamaca Saltarin Priori Sofia Rodados;3499.0;1;250;buy_it_now;gold_special;True;;MLA127674;Juegos y Juguetes
MLA897302605;Pulpito Reversible 15 Cm Calidad Premiun Plush Excelentes;890.0;1;250;buy_it_now;gold_special;True;;MLA1166;Juegos y Juguetes
MLA852674103;Toys Palace Andarin Minnie 2 En 1;4790.0;1;200;buy_it_now;gold_special;True;;MLA417753;Juegos y Juguetes
MLA830300736;Amigos De Mierda 1 Y 2 Juego Cartas Para Previa Nuevo Lelab;1499.9;1;250;buy_it_now;gold_special;True;;MLA1161;Juegos y Juguetes
MLA724734323;Muñeca Barbie Original Mattel Modelo T7439  Mundo Manias;1199.0;1;250;buy_it_now;gold_special;True;;MLA2968;Juegos y Juguetes
MLA785507819;Cry Babies Mini Muñeca Sorpresa Magic Tears Serie 1;1850.0;500;150;buy_it_now;gold_special;True;2959.0;MLA2968;Juegos y Juguetes
MLA701869138;Peluche My Little Pony Mi Pequeño Pony 30cm Hasbro Wabro;1499.0;50;250;buy_it_now;gold_special;True;;MLA3422;Juegos y Juguetes
MLA693387543;Spiderman Mega Water Ametralladora Pistola De Agua Ditoys;2079.0;1;250;buy_it_now;gold_special;True;;MLA90321;Juegos y Juguetes
MLA900269088;Mini Bellies Yumy  Bebe Con Ruido Chico 13 Cm Srj;2399.0;1;50;buy_it_now;gold_special;True;;MLA2968;Juegos y Juguetes
MLA830662205;Muñeca Frozen 2 Elsa Premium 40cm Original!!;3990.0;500;250;buy_it_now;gold_special;True;;MLA2968;Juegos y Juguetes
MLA759068126;Zkor Game Juego De Memoria Simil Simon Ditoys;1590.0;1;500;buy_it_now;gold_special;True;1895.0;MLA1161;Juegos y Juguetes
MLA870893306;Set Stick & Color Events Creativ Maped 880101 Mejor Precio;621.0;200;150;buy_it_now;gold_special;True;690.0;MLA105398;Juegos y Juguetes
MLA896077213;Rondi Play Table + Balde De Playa Jardin P/jugar Agua Arena ;3949.0;1;200;buy_it_now;gold_special;True;4780.0;MLA432255;Juegos y Juguetes
MLA870917588;Clarín Colección Toy Story 4 Woody, Forky Y Buzz;2312.0;250;200;buy_it_now;gold_special;True;2890.0;MLA3422;Juegos y Juguetes
MLA775620092;Cortadora De Césped Juguete Casa Valente;799.0;1;200;buy_it_now;gold_special;True;;MLA70156;Juegos y Juguetes
MLA843409610;Marcadores Touch Doble Punta X24 Unidades ;1499.0;1;500;buy_it_now;gold_pro;True;;MLA69567;Juegos y Juguetes
MLA899195387;Camión Valija Juguete C/rampa 12 Autitos De Colección Metal;3999.0;1;100;buy_it_now;gold_special;True;;MLA417099;Juegos y Juguetes
MLA899718979;Jumping Fries No Salten Las Papas Fritas Juego Mesa Ditoys ;1135.0;1;50;buy_it_now;gold_special;True;;MLA1161;Juegos y Juguetes
MLA754873491;Masa Potes Por 10 Unidades Duravit Juegos Juguetes Infantil;595.0;1;250;buy_it_now;gold_special;True;;MLA418285;Juegos y Juguetes
MLA691966123;Sillon Colchoneta Silla Reposera  Inflable Para  Pileta;1999.0;500;500;buy_it_now;gold_special;True;;MLA40387;Juegos y Juguetes
MLA735165426;Fisher Price Movil 3en1 Amigos De La Naturaleza Chr11;2495.0;250;200;buy_it_now;gold_special;True;7995.0;MLA45969;Juegos y Juguetes
MLA697706698;Kratos God Of War 4 Accesorios Loose Original Neca!;2999.99;1;50;buy_it_now;gold_special;True;;MLA3422;Juegos y Juguetes
MLA879746388;Arco De Futbol Para Pileta Water Polo Incluye Pelota Bestway;1804.0;1;150;buy_it_now;gold_special;True;2435.0;MLA40387;Juegos y Juguetes
MLA862275393;Espada Doble Filo De Thanos Avengers 110cm;1150.0;1;100;buy_it_now;gold_special;True;;MLA352391;Juegos y Juguetes
MLA822311564;Juego De Mesa Dime Quien Soy Yo Juguete Ditoys Niños ;1649.0;500;500;buy_it_now;gold_special;True;1896.0;MLA1161;Juegos y Juguetes
MLA825822776;Bolso 100 Pelotas Atoxicas Pelotero Casita Pileta Resistente;898.0;50;500;buy_it_now;gold_special;True;;MLA417827;Juegos y Juguetes
MLA845913012;Tablita/cuchillo/comiditas De Madera Con Abrojo - Didáctico;1399.0;1;500;buy_it_now;gold_special;True;;MLA22640;Juegos y Juguetes
MLA787071671;Armatrón Space Espacio 200 Piezas Mejor Precio!!;1750.5;50;100;buy_it_now;gold_special;True;1945.0;MLA1157;Juegos y Juguetes
MLA885484849;Valija Mesa De Herramientas Infantil 2en1 Juguete Con Sierra;1799.0;1;50;buy_it_now;gold_special;True;;MLA432838;Juegos y Juguetes
MLA867365689;Varitas Harry Potter 33cm Ollivanders Premium Artesanales;799.0;1;250;buy_it_now;gold_special;True;;MLA3422;Juegos y Juguetes
MLA824448707; Balancin Hamaca Montessori Mdf Fibrofacil 18mm;2890.0;250;500;buy_it_now;gold_special;True;;MLA11236;Juegos y Juguetes
MLA622796537;Juego De Mesa Ruibal Rummy Burako Viajero + 8 Años Lelab;1119.95;1;250;buy_it_now;gold_special;True;;MLA1161;Juegos y Juguetes
MLA621592510;Neocube 216 5mm!!! Neodimio Buckyballs  !! Precio Plata;1890.0;1;500;buy_it_now;gold_special;True;;MLA76134;Juegos y Juguetes
MLA755736555;Carpa Tipi Indios Montessori Completa! Piso Ventana Y Funda;3290.0;50;500;buy_it_now;gold_pro;True;;MLA90306;Juegos y Juguetes
MLA790574490;Carpa Tipi Indios Completa Súper Calidad;2990.0;50;500;buy_it_now;gold_special;True;;MLA90306;Juegos y Juguetes
MLA747739054;Colchoneta Inflable Agua Pileta Playa Bestway Kool Lounge;1549.0;500;500;buy_it_now;gold_special;True;;MLA40387;Juegos y Juguetes
MLA855838149;Cocinita Infantil De Madera Fibrofacil + Stickers Para Niños;3500.0;1;500;buy_it_now;gold_special;True;;MLA11239;Juegos y Juguetes
MLA884430104;Muñecos Pj Masks X 3 Héroes En Pijama Catboy Owlette Gekko;3390.0;1;50;buy_it_now;gold_special;True;;MLA3422;Juegos y Juguetes
MLA713692500;Juego De Mesa El Switcher De Maldon;2216.0;1;250;buy_it_now;gold_special;True;;MLA1161;Juegos y Juguetes
MLA895876596;Pulpos Reversibles Tik Tok Dpeluches Original;1795.0;100;250;buy_it_now;gold_special;True;;MLA1166;Juegos y Juguetes
MLA677253613;Carpa India Con Base Acolchonada, Tipi, Pijamada, Teepee ;5460.0;1;500;buy_it_now;gold_special;True;;MLA90306;Juegos y Juguetes
MLA759582897;Colchoneta Inflable Salvavida Pileta Dona Bestway 107cm;799.0;500;500;buy_it_now;gold_special;True;;MLA40387;Juegos y Juguetes
MLA836349317;Cama Elastica 1.85 M Saltarin Trampolin Con Red Protectora;13999.0;500;500;buy_it_now;gold_special;True;;MLA90319;Juegos y Juguetes
MLA824244376;Juego De Tejo De Goma Dep Grande Premium;1190.0;50;250;buy_it_now;gold_special;True;;MLA90312;Juegos y Juguetes
MLA789232800;Carpa India Tipi Infantil Casita Niño Juego Pijamada Teepe;3299.0;50;500;buy_it_now;gold_special;True;;MLA90306;Juegos y Juguetes
MLA883231564;Juego De Memoria Con Luz Y Sonido Memo Star Duende Azul 7530;1299.0;1;150;buy_it_now;gold_special;True;1559.0;MLA1161;Juegos y Juguetes
MLA870902539;Muñecos Pjmasks Héroes En Pijamas Set De 5;1899.0;1;50;buy_it_now;gold_special;True;;MLA3422;Juegos y Juguetes
MLA807400052;Monopatín 3 Ruedas Con Luz - Moose - Planet Toys;4390.0;1;500;buy_it_now;gold_special;True;;MLA12065;Juegos y Juguetes
MLA854716293;Kit Set Pool Taco Bola Triangulo Tiza Puntera Salida - Envio;6650.0;1;200;buy_it_now;gold_special;True;;MLA47782;Juegos y Juguetes
MLA762209476;Peluches Banda Bangtan Boys Bts Bt21 Muy Lindos X Unidad;1150.0;1;500;buy_it_now;gold_special;True;;MLA1166;Juegos y Juguetes
MLA870933113;Punky Pets Feisty Petslalelu Peluche Con Actitud Original Tv;1629.0;50;500;buy_it_now;gold_special;True;;MLA1166;Juegos y Juguetes
MLA693508510;Cama Elastica 2.44 Metros Para Niños Adultos Grande Con Red;23999.0;100;500;buy_it_now;gold_pro;True;29999.0;MLA90319;Juegos y Juguetes
MLA615027107;Resorte Cama Elástica 14 Cm X 10 Unidades;860.0;500;5000;buy_it_now;gold_special;True;;MLA431546;Juegos y Juguetes
MLA870933852;Antex - Oso Polo - Juego De Mesa 8325;1149.0;1;500;buy_it_now;gold_special;True;;MLA1161;Juegos y Juguetes
MLA609351620;Shopkins Pack De 12 Con 1 Sorpresa + 2 Mini Mochilas Serie 5;1199.0;250;500;buy_it_now;gold_special;True;;MLA3422;Juegos y Juguetes
MLA754278405;Tobogán Simple Pileta Agua Colchoneta Inflable Bestway;1999.0;100;500;buy_it_now;gold_special;True;;MLA40387;Juegos y Juguetes
MLA809232337;Cubre Resortes 2.44 Original Cama Elastica Gravity Xtreme !;5000.0;500;200;buy_it_now;gold_special;True;;MLA431546;Juegos y Juguetes
MLA832803931;Bloques Ladrillos Gigantes - 120 Unidades - Super Oferta;6400.0;1;250;buy_it_now;gold_special;True;;MLA1157;Juegos y Juguetes
MLA871565091;Atril Pizarra 3 En 1  Montessori Infantil Niños;3999.0;1;100;buy_it_now;gold_special;True;;MLA418286;Juegos y Juguetes
MLA868886157;Carpa India Carpita Infantil Teepe Pijamada Tipi Completa!! ;3799.0;1;250;buy_it_now;gold_special;True;;MLA90306;Juegos y Juguetes
MLA634488112;Monky Loco Juego De Mesa Original Ditoys Recoleta;1499.0;1;250;buy_it_now;gold_special;True;;MLA1161;Juegos y Juguetes
MLA878662476;Littlest Pet Shop Mascotas Diversión En La Costa Hasbro;3599.0;250;100;buy_it_now;gold_special;True;4500.0;MLA3422;Juegos y Juguetes
MLA855372622;Hamaca Balancin Montessori ;4350.0;500;500;buy_it_now;gold_special;True;;MLA11236;Juegos y Juguetes
MLA809232515;Cubre Resortes 3.05 Original Cama Elastica Gravity Xtreme !!;5600.0;500;250;buy_it_now;gold_special;True;;MLA431546;Juegos y Juguetes
MLA870933854;Pinball Antex Lanza Y Atrapa La Pelota ;789.0;1;250;buy_it_now;gold_special;True;;MLA432255;Juegos y Juguetes
MLA831197285;Lote De 12 Prendas Y Accesorios Barbie;1790.0;1;150;buy_it_now;gold_special;True;;MLA409419;Juegos y Juguetes
MLA856211699;Cocinita Para Niños Con Sticker + Heladera Madera Fibrofacil;4845.0;1;500;buy_it_now;gold_special;True;5100.0;MLA11239;Juegos y Juguetes
MLA844364241;Juego Hdp Hasta Donde Puedas Bureau Buro Humor Negro Manias;2060.0;1;250;buy_it_now;gold_special;True;;MLA1161;Juegos y Juguetes
MLA885485475;Among Us Dead Or Alive 2 Piezas Colores Muñeco Desarmable;219.0;200;250;buy_it_now;gold_special;True;;MLA3422;Juegos y Juguetes
MLA827796491;Cama Elastica 2,44 Metros Oferta Red Niño Adulto En 6 Cuotas;18999.0;250;500;buy_it_now;gold_special;True;30999.0;MLA90319;Juegos y Juguetes
MLA747741441;Colchoneta Inflable Agua Pileta Playa Bestway Flip Pillow;1069.0;500;250;buy_it_now;gold_special;True;;MLA40387;Juegos y Juguetes
MLA693508673;Cama Elastica Precio Oferta Venta Infantil Niño Adulto 2.44m;18999.0;100;500;buy_it_now;gold_special;True;24999.0;MLA90319;Juegos y Juguetes
MLA901176907;Mochila Pistola De Agua Mascara Spiderman ;1690.0;1;100;buy_it_now;gold_special;True;;MLA90321;Juegos y Juguetes
MLA875219598;Shopkins Happy Places Princess Puppy Garden Party 56930 ;1600.0;1;100;buy_it_now;gold_special;True;;MLA12400;Juegos y Juguetes
MLA866149573;Juego Mesa Destreza Mental Desafios Cognitivos Mente Ingenio;1899.0;1;200;buy_it_now;gold_special;True;;MLA1161;Juegos y Juguetes
MLA836539381;Pista Beyblade. Estadio. Producto Nuevo. Oferta!!!;1500.0;50;100;buy_it_now;gold_special;True;;MLA1910;Juegos y Juguetes
MLA772817692;Dinosaurio T-rex Con Luz Sonido Y Movimiento El Duende Azul;2999.0;1;250;buy_it_now;gold_special;True;3749.0;MLA3422;Juegos y Juguetes
MLA882146589;Garras Wolverine Marvel X-men Cosplay 230mm;1099.0;1;150;buy_it_now;gold_special;True;;MLA352391;Juegos y Juguetes
MLA847892946;Cocina Para Niños Fibrofacil;3300.0;1;500;buy_it_now;gold_special;True;;MLA11239;Juegos y Juguetes
MLA826998941;Hamaca Balancín Montessori Mdf 18mm Para Pintar;2480.0;500;250;buy_it_now;gold_special;True;;MLA11236;Juegos y Juguetes
MLA741322503;Peluche Bendy And The Ink Machine 30 Cm ;1150.0;1;250;buy_it_now;gold_special;True;;MLA1166;Juegos y Juguetes
MLA713710465;Juego De Mesa El Futbolero De Maldon;2690.0;1;250;buy_it_now;gold_special;True;;MLA1161;Juegos y Juguetes
MLA857241383;Casita Fibrofacil Casa Lolita Valija + 32 Muebles + Tobogan;1850.0;1;500;buy_it_now;gold_special;True;;MLA409417;Juegos y Juguetes
MLA809527001;Red De Proteccion 3.05 Sola Cama Elastica Gravity Xtreme;5800.0;500;250;buy_it_now;gold_special;True;;MLA431546;Juegos y Juguetes
MLA702890739;Transformers Rescue Bots Energize Pack X1  ;2450.0;1;100;buy_it_now;gold_special;True;;MLA3422;Juegos y Juguetes
MLA783493796;Resortes 14cm Zincados X10 Cama Elastica Original Reforzados;830.0;500;250;buy_it_now;gold_special;True;;MLA431546;Juegos y Juguetes
MLA614262348;Tacos Cortos De Pool;849.99;50;500;buy_it_now;gold_special;True;;MLA9496;Juegos y Juguetes
MLA789236486;Carpa India Tipi Casita Niño Pijamada Cuotas Envio Gratis;3299.0;150;250;buy_it_now;gold_special;True;;MLA90306;Juegos y Juguetes
MLA843310521;Movies Juego De Mesa Cine Dígalo Con Mímica Ruibal Lelab;1389.95;1;200;buy_it_now;gold_special;True;;MLA1161;Juegos y Juguetes
MLA855936394;Dinosaurios De Goma X 8;990.0;1;250;buy_it_now;gold_special;True;;MLA432992;Juegos y Juguetes
MLA849730637;2 Muñecas Elsa Y Anna De Frozen;1699.0;1;500;buy_it_now;gold_special;True;;MLA2968;Juegos y Juguetes
MLA836349426;Cama Elastica 1.85 Metros Red Protectora Chicos Trampolin;16999.0;500;500;buy_it_now;gold_pro;True;;MLA90319;Juegos y Juguetes
MLA684411696;Shopkins Happy Places Muñeca O Pony Shoppies Mini + Petkin;899.0;200;250;buy_it_now;gold_special;True;;MLA3422;Juegos y Juguetes
MLA786579091;Neocube 216 Esferas  5mm!!! Iman Neodimio Mejor Precio!;1799.0;1;200;buy_it_now;gold_special;True;2289.0;MLA76134;Juegos y Juguetes
MLA870933129;Juego De Jardineria Antex Con Mis Manos 0041;1289.0;1;200;buy_it_now;gold_special;True;;MLA418289;Juegos y Juguetes
MLA804089107;El Camarero- Juego De Mesa- Invictvs;1879.0;1;100;buy_it_now;gold_special;True;;MLA1161;Juegos y Juguetes
MLA756986091;Conservadora Colchoneta Hielera Pileta Inflable Bestway ;1999.0;500;250;buy_it_now;gold_special;True;;MLA40387;Juegos y Juguetes
MLA897814075;Monopatín Moose Plegable 4 Ruedas Luces Led;6499.0;1;200;buy_it_now;gold_special;True;6999.0;MLA12065;Juegos y Juguetes
MLA856797507;Bellies Mini Con Sonido Bebe Pinky Muak Yummy O Boo Famosa;2499.0;50;500;buy_it_now;gold_special;True;;MLA2968;Juegos y Juguetes
MLA809833713;Set X3 Muñecos Thanos Hulk Hulkbuster Avengers Endgame Guant;2999.0;1;50;buy_it_now;gold_special;True;;MLA3422;Juegos y Juguetes
MLA873001543;Monopatin Vegui Quickly Nena 4 Ruedas / Open Music Jb 34;1739.0;1;200;buy_it_now;gold_special;True;;MLA12065;Juegos y Juguetes
MLA865507154;Peluche 30cm Modelos: Sonic Shadow Silver Knuckles Amy Rose ;1080.0;250;250;buy_it_now;gold_special;True;;MLA1166;Juegos y Juguetes
MLA764918399;Fábrica Kit Para Hacer Slime Flúo Fórmula Fácil Y No Tóxica;950.0;1;500;buy_it_now;gold_special;True;;MLA1161;Juegos y Juguetes
MLA724631222;Cocina 100% Chef New Plast Distribuidora Lv;2999.0;1;200;buy_it_now;gold_special;True;;MLA11239;Juegos y Juguetes
MLA837680661;Bonetes Sombrerito X 8 Para Cama Elastica Nuevos !!!;2500.0;500;150;buy_it_now;gold_special;True;;MLA431546;Juegos y Juguetes
MLA836358537;Cama Elastica 1.85 Metros Red Protectora Chicos Niño Adulto;16999.0;500;200;buy_it_now;gold_pro;True;;MLA90319;Juegos y Juguetes
MLA901502492;Patineta Skate Profesional Madera Doble Cola Calavera;3290.0;1;50;buy_it_now;gold_special;True;3990.0;MLA90337;Juegos y Juguetes
MLA871165396;5 Muñecos Five Nigths At Freddy's Y Armas A Springtrap ;3999.0;1;50;buy_it_now;gold_special;True;;MLA3422;Juegos y Juguetes
MLA901500491;Patineta Skate Profesional Madera Doble Cola Roja/negra;3290.0;1;50;buy_it_now;gold_special;True;3990.0;MLA90337;Juegos y Juguetes
MLA751620074;Juego Bomb Game Que No Explote En Tus Manos Original Ditoys;3850.0;1;500;buy_it_now;gold_special;True;4490.0;MLA1161;Juegos y Juguetes
MLA824360783;Laberinto De Bolitas Vuelta Al Mundo 3326;1639.0;1;250;buy_it_now;gold_special;True;;MLA352342;Juegos y Juguetes
