id;title;price;available_quantity;sold_quantity;buying_mode;listing_type_id;accepts_mercadopago;original_price;category_id;category_name
MLA609821686;Carragenina Kappa X 1 Kg - Carragenato. Alimentos.;1200.0;1;500;buy_it_now;gold_special;True;;MLA8830;Salud y Equipamiento Médico
MLA855068651;Pre War 400 Gr Pre Entrenamiento Ena + Beta Alanina Creatina;916.55;50;250;buy_it_now;gold_special;True;1329.0;MLA3551;Salud y Equipamiento Médico
MLA783861491;Centrifuga Laboratorio P/6 Tubos Y Taimer;19400.0;1;50;buy_it_now;gold_special;True;;MLA432938;Salud y Equipamiento Médico
MLA899097346;Tapaboca Verano Stoper Pileta No Transpira Doble Valvula;990.0;500;100;buy_it_now;gold_special;True;;MLA445787;Salud y Equipamiento Médico
MLA886789433;Barbijo Termosellado Anmat Descartable Pack X 50;1520.0;1;50;buy_it_now;gold_special;True;;MLA69570;Salud y Equipamiento Médico
MLA835409177;Isoprot 100% Proteína Isolate Ena;2969.0;1;200;buy_it_now;gold_special;True;;MLA3551;Salud y Equipamiento Médico
MLA841385652;Happy Pill | 5htp 100mg X 60 Vcaps. | Serotonina. Triptofano;1990.0;500;250;buy_it_now;gold_special;True;;MLA8830;Salud y Equipamiento Médico
MLA897377524;One Touch Ultra Mini Repuestos Tiras X 50 Un.;3350.0;50;25;buy_it_now;gold_special;True;;MLA413468;Salud y Equipamiento Médico
MLA845452564;Lubricante Anal Try Miss V Gel Intimo ;257.4;50;250;buy_it_now;gold_special;True;286.0;MLA400500;Salud y Equipamiento Médico
MLA868413242;Kit Sanitario Cofia Camisolin Cubrebota Desechable Completo;138.0;250;5000;buy_it_now;gold_special;True;;MLA69570;Salud y Equipamiento Médico
MLA880887653;Agua De Mar Pranamar - Bidón 20 Litros - 100% Pura Y Natural;1440.0;500;150;buy_it_now;gold_special;True;;MLA8830;Salud y Equipamiento Médico
MLA841391078;Balanza Personal De Baño Digital Electrónica 150 Kgs.;1759.0;500;500;buy_it_now;gold_special;True;2199.0;MLA9554;Salud y Equipamiento Médico
MLA619154636;Guantes De Nitrilo Color Negro Mediglove X100u Combustible;1940.0;200;500;buy_it_now;gold_special;True;;MLA409140;Salud y Equipamiento Médico
MLA773443153;Masajeador 8 Rodillos Cervical Lumbar Pie Calor Con Magneto;3854.0;50;250;buy_it_now;gold_pro;True;5099.0;MLA417723;Salud y Equipamiento Médico
MLA867898170;Filtro De Repuesto Para Mascara Deportiva De Carbono Activo;120.0;150;500;buy_it_now;gold_special;True;290.0;MLA69570;Salud y Equipamiento Médico
MLA880042405;Bidon Alcohol 96% Bialcohol - Porta - Envio ;1130.0;1;250;buy_it_now;gold_special;True;;MLA69569;Salud y Equipamiento Médico
MLA772573138;Tallímetro Altímetro Autoadhesivo Mednib 2.1m;699.0;1;150;buy_it_now;gold_special;True;;MLA191885;Salud y Equipamiento Médico
MLA701422804;Aceite De Germen De Trigo 250 Ml Virgen Puro Super Oferta;375.25;500;250;buy_it_now;gold_special;True;395.0;MLA29934;Salud y Equipamiento Médico
MLA874264420;Cera De Soja  X 10kg + Pabilos + Ojalillos +endurecedor;4215.0;1;250;buy_it_now;gold_special;True;;MLA29920;Salud y Equipamiento Médico
MLA808775855;Vaso Precipitado Plastico 100ml;114.11;500;150;buy_it_now;gold_special;True;;MLA387585;Salud y Equipamiento Médico
MLA861145790;Atma Ba7504n Balanza Digital Vidrio Templado Hasta 150kg;2699.0;500;100;buy_it_now;gold_special;True;3856.0;MLA9554;Salud y Equipamiento Médico
MLA874074294;Barbijos Descartables Niños (10 Unidades);1300.0;100;100;buy_it_now;gold_special;True;;MLA69570;Salud y Equipamiento Médico
MLA875376486;Serrapep- Serrapeptasa - X 30 Cápsulas;1390.0;1;150;buy_it_now;gold_special;True;;MLA8830;Salud y Equipamiento Médico
MLA635770838;Glutamina 300 Gr Star Nutrition Evolution;1040.0;50;500;buy_it_now;gold_special;True;1470.0;MLA3551;Salud y Equipamiento Médico
MLA696311309;Guante De Nitrilo Descartable Por 100unidades;1670.0;250;500;buy_it_now;gold_special;True;;MLA409140;Salud y Equipamiento Médico
MLA735926952;Gel Lubricante Anal Sextual 200 Ml Anal Sin Dolor;499.0;500;500;buy_it_now;gold_special;True;;MLA400500;Salud y Equipamiento Médico
MLA884620624;Barbijo Electrónico Purely By Xiaomi Cooler Usb Recarga Kn;5999.0;1;5;buy_it_now;gold_special;True;;MLA69570;Salud y Equipamiento Médico
MLA872828214;Kit Termometro Infrarrojo + Oximetro Maverick 1 Año Garantía;6199.0;1;50;buy_it_now;gold_special;True;6509.0;MLA408023;Salud y Equipamiento Médico
MLA898586147;Mascarilla Social Atom-protect Tapaboca Conicet Original X5 ;1890.0;500;50;buy_it_now;gold_special;True;;MLA445788;Salud y Equipamiento Médico
MLA855067512;Ultra Mass Ena 1,5 Kg Ganador De Peso Y Masa;1192.41;100;250;buy_it_now;gold_special;True;;MLA3551;Salud y Equipamiento Médico
MLA883649772;Tapabocas Deportivo Premium Con Doble Valvula De Exhalacion;799.99;50;150;buy_it_now;gold_special;True;;MLA69570;Salud y Equipamiento Médico
MLA879530460;Keto 360 Slim El Mas Fuerte 1600mg!! Usa Orginal!;4255.84;100;500;buy_it_now;gold_special;True;4625.92;MLA8830;Salud y Equipamiento Médico
MLA816561951;Humidificador Vaporizador Aromaterapia Aire Saludable Usb P;1349.0;150;500;buy_it_now;gold_special;True;1600.0;MLA381270;Salud y Equipamiento Médico
MLA857577406;Ligas Intermaxilares X1 Pack De 100 Uni C/u Ortodoncia;485.0;50;150;buy_it_now;gold_special;True;;MLA409314;Salud y Equipamiento Médico
MLA877810802;Empecid Crema Clotrimazol 1g;274.5;1;150;buy_it_now;gold_pro;True;;MLA431660;Salud y Equipamiento Médico
MLA868650159;Barbijos Pack X50 Triple Filtro Con Anmat Termosellados;1999.0;500;200;buy_it_now;gold_special;True;;MLA69570;Salud y Equipamiento Médico
MLA706415756;Oximetro Profesional Saturometro De Pulso Silfab Digital ;3549.0;50;500;buy_it_now;gold_special;True;;MLA408023;Salud y Equipamiento Médico
MLA797302190;Preservativos Prime Ultra Fino X72u (24x3) - Envío Discreto;2999.0;50;500;buy_it_now;gold_special;True;;MLA384750;Salud y Equipamiento Médico
MLA727061580;Naara Colágeno Hidrolizado Vitamina C B6 B12 Sin Tacc;2959.0;1;500;buy_it_now;gold_special;True;;MLA3551;Salud y Equipamiento Médico
MLA710340059;Satial Food Original Oferta-polvo- Pack X 2u ;3099.0;250;5000;buy_it_now;gold_special;True;;MLA8830;Salud y Equipamiento Médico
MLA872223818;Barbijo Tapaboca Pack X 3  Muy Cómodos Y Suaves!;990.0;150;50;buy_it_now;gold_special;True;;MLA69570;Salud y Equipamiento Médico
MLA855759497;Freshlook Colorblends Lentes Color + Liquido 60ml + Estuche;2490.0;1;250;buy_it_now;gold_special;True;;MLA7185;Salud y Equipamiento Médico
MLA804604053;Aceite Esencial De Rosa 30cc 100% Natural Aromaterapia;427.5;500;500;buy_it_now;gold_special;True;450.0;MLA29934;Salud y Equipamiento Médico
MLA885526014;Oximetro De Pulso Con Curva Saturometro Oxigeno Anmat ;2029.0;150;50;buy_it_now;gold_special;True;2399.0;MLA408023;Salud y Equipamiento Médico
MLA772348098;Aceite De Neem 100cc Super Oferta Puro Virgen Natural ;289.75;500;500;buy_it_now;gold_special;True;305.0;MLA29934;Salud y Equipamiento Médico
MLA897438329;Combo 5 Cajita Kn Barbijos En Bolsa Individual;3200.0;1;50;buy_it_now;gold_special;True;;MLA69570;Salud y Equipamiento Médico
MLA871423479;Almohadilla Eléctrica Térmica Silfab Cervical Cuello Al82;2799.0;500;200;buy_it_now;gold_pro;True;;MLA29933;Salud y Equipamiento Médico
MLA834330671;Zma Gold Nutrition Zinc Magnesio Precursor De Testosterona;974.99;1;250;buy_it_now;gold_special;True;;MLA3551;Salud y Equipamiento Médico
MLA716404442;Tijera De Trauma - Multiproposito - Emergencias Bomberos Gua;525.0;1;500;buy_it_now;gold_special;True;;MLA409363;Salud y Equipamiento Médico
MLA809959169;Xtrenght Best Whey Protein Proteina De Suero Wpc80 + Creatina + Taurina  + Enzimas Digestivas Tienda Oficial Oferta;1510.5;50;500;buy_it_now;gold_special;True;1590.0;MLA3551;Salud y Equipamiento Médico
MLA870425115;Tapaboca Deportivo Válvulas Barbijo Deportes Negro Granmarc;990.0;50;250;buy_it_now;gold_pro;True;;MLA69570;Salud y Equipamiento Médico
MLA808588062;Arlyt Solucion Fisiologica Salina Esteril 500ml;270.0;500;500;buy_it_now;gold_special;True;450.0;MLA420674;Salud y Equipamiento Médico
MLA879668117;Otoscopio Tipo Heine Fibra Optica Luz Led Color A Elección.;2940.0;1;50;buy_it_now;gold_special;True;;MLA408019;Salud y Equipamiento Médico
MLA855301892;Ultraflex Magnesio Colágeno Hidrolizadox420gr (envío Gratis);1860.0;250;500;buy_it_now;gold_special;True;;MLA8830;Salud y Equipamiento Médico
MLA863793975;Bidón Alcohol Etílico 70% Sanitizante Liquido 5lt Con Anmat;892.05;1;500;buy_it_now;gold_special;True;948.99;MLA69569;Salud y Equipamiento Médico
MLA795710762;Vaso Vidrio Precipitado  Hda  Boro 3.3 50ml Importado;208.04;250;250;buy_it_now;gold_special;True;;MLA387585;Salud y Equipamiento Médico
MLA884877062;Barbijos Mascara Respirador Recién Importados Pack 50 Anmat;899.0;1;50;buy_it_now;gold_special;True;;MLA69570;Salud y Equipamiento Médico
MLA855760703;Spirulina Natural 1 Kg Polvo 100% Pura Proteina De Alga;3149.99;50000;250;buy_it_now;gold_special;True;;MLA3551;Salud y Equipamiento Médico
MLA715885696;Masajeador De Espalda Asiento Cuello Auto Silla Vibra Calor ;3499.0;1;250;buy_it_now;gold_special;True;4500.0;MLA417723;Salud y Equipamiento Médico
MLA801913400;Mini Audifono De Oido Para Sordo Con Regulador De Volumen ;3054.99;150;100;buy_it_now;gold_special;True;3249.99;MLA43687;Salud y Equipamiento Médico
MLA829038285;Mesa Camilla Cirugía Veterinaria Pet Animales Medico Diferro;13700.0;1;150;buy_it_now;gold_special;True;;MLA430549;Salud y Equipamiento Médico
MLA879094690;Cubrecalzados Descartables Termosellados Cert Anmat 50 U;459.99;1;150;buy_it_now;gold_special;True;;MLA69570;Salud y Equipamiento Médico
MLA688490601;Pediómetro Tallímetro Medidor De Crecimiento Pediatría ;5560.0;1;50;buy_it_now;gold_special;True;;MLA191885;Salud y Equipamiento Médico
MLA883021705;Mascarilla Atom-protect Social Conicet Original X10;3900.0;1;200;buy_it_now;gold_special;True;;MLA445788;Salud y Equipamiento Médico
MLA846831607;Mct Oil X 475 Ml | Origen Alemania | Keto - Vegan - Gmo Free;3490.0;50;250;buy_it_now;gold_special;True;;MLA8830;Salud y Equipamiento Médico
MLA818927987; Hydroxycut Hardcore Elite Original Usa!! Envio Sin Cargo!!;4999.0;1;500;buy_it_now;gold_special;True;;MLA3551;Salud y Equipamiento Médico
MLA872224980;Pack Tapabocas Tapa Boca Mascarilla Descartable X50;799.0;5000;100;buy_it_now;gold_special;True;;MLA69570;Salud y Equipamiento Médico
MLA801907832;Audifono Amplificador D Oido Para Sordo Hipoacusico Volumen ;1410.75;250;200;buy_it_now;gold_special;True;1485.0;MLA43687;Salud y Equipamiento Médico
MLA851547746;Ripped Fast Universal X 120 Capsulas - Quemador De Grasa ;2058.0;1;200;buy_it_now;gold_special;True;2167.0;MLA3551;Salud y Equipamiento Médico
MLA828586359;1kg De Creatina Micronizada Premium, Saborizada!;750.0;1;250;buy_it_now;gold_special;True;;MLA8830;Salud y Equipamiento Médico
MLA810056461;Mascara Nasal Bmc Ivolve N2 (cpap/bpap);4790.0;1;50;buy_it_now;gold_special;True;;MLA413961;Salud y Equipamiento Médico
MLA880661609;Barbijos Medicos Descartables Anmat X 100 Unidades ;2943.99;1;100;buy_it_now;gold_special;True;3199.99;MLA69570;Salud y Equipamiento Médico
MLA808785934;Preservativos Prime Mega X72u (24x3) - Envío Discreto;2999.0;1;250;buy_it_now;gold_special;True;;MLA384750;Salud y Equipamiento Médico
MLA877987584;Oximetro Saturometro Pulso Adulto Pediatrico Trinidad Fs10 D;2599.0;1;25;buy_it_now;gold_special;True;;MLA408023;Salud y Equipamiento Médico
MLA718086964;Masajeador Cervical 8 Rodillos Wolke + Calor + Bolso + Gtia ;6174.0;150;500;buy_it_now;gold_pro;True;8199.0;MLA417723;Salud y Equipamiento Médico
MLA672533101;Masajeador Cervical Wolke Espalda+calor+rodillos+pies Oferta;3854.0;1;500;buy_it_now;gold_pro;True;5099.0;MLA417723;Salud y Equipamiento Médico
MLA864725519;Tapaboca Barbijo Reutilizable X 3 Unidades Incluye 90filtros;1170.0;1;500;buy_it_now;gold_pro;True;;MLA445788;Salud y Equipamiento Médico
MLA898942526;Barbijo Atom-protect X10 Envio Gratis! Ultimo Modelo;3890.0;50;25;buy_it_now;gold_special;True;;MLA69570;Salud y Equipamiento Médico
MLA857743010;Cera De Soja 100 % Natural Velas. X 5 Kg+ Ojalillos+ Pabilo;1665.0;50;500;buy_it_now;gold_special;True;;MLA29920;Salud y Equipamiento Médico
MLA866045584;Hojas De Bisturi N°20 Odontologia / Podologia ;819.0;1;100;buy_it_now;gold_special;True;;MLA429428;Salud y Equipamiento Médico
MLA770534026;Termometro Digital Lcd Bipper Niños Adultos Super Oferta !!;522.5;1;500;buy_it_now;gold_special;True;550.0;MLA5420;Salud y Equipamiento Médico
MLA899716180;Barbijo Super Seguro Y Super Pequeño -verano Pileta Playa 1v;850.0;250;50;buy_it_now;gold_special;True;;MLA454846;Salud y Equipamiento Médico
MLA873405270;Oxímetro De Pulso Saturometro Dedo Adulto/pediatrico Anmat;2500.0;1;250;buy_it_now;gold_special;True;;MLA408023;Salud y Equipamiento Médico
MLA855081980;Carnitina Ena 1500 Mg Pro Burn X 60 Caps Quemador De Grasa;656.16;250;500;buy_it_now;gold_special;True;999.0;MLA3551;Salud y Equipamiento Médico
MLA861076965;Esencia Para Velas Y  Jabones 20 Cc;250.0;500;500;buy_it_now;gold_special;True;;MLA29934;Salud y Equipamiento Médico
MLA809529370;Solucion Lente Contacto Optifree Pure Moist 300 Ml Combo 4 ;2490.0;1;200;buy_it_now;gold_special;True;;MLA420674;Salud y Equipamiento Médico
MLA740427931;Combo Adelgazante Satial Food + Ampk X 60 Comp Original;3151.0;1;500;buy_it_now;gold_special;True;;MLA8830;Salud y Equipamiento Médico
MLA857805859;Barbijos Tri Con Elástico Y Ajuste Nasal X50u;889.0;500;150;buy_it_now;gold_special;True;;MLA69570;Salud y Equipamiento Médico
MLA852278790;2 Unidades De Ensure Vainilla X 850 Gr, Abbott, Suplemento;4071.0;1;150;buy_it_now;gold_special;True;;MLA8830;Salud y Equipamiento Médico
MLA635378984;Balanza Personas Consultorio Mecanica Altimetro Roma 150 Kgm;41500.0;1;150;buy_it_now;gold_special;True;;MLA411088;Salud y Equipamiento Médico
MLA878097585;Alcohol Bialcohol Etilico 70% Porta Bidon 5 Lts Rex;1079.0;500;250;buy_it_now;gold_special;True;;MLA413181;Salud y Equipamiento Médico
MLA879891882;Guantes Latex Descartable Talle M Pack 10x100 Unidades ;8900.0;500;100;buy_it_now;gold_special;True;;MLA409140;Salud y Equipamiento Médico
MLA895912110;Cofias Plisada Friselina Descartables X 100 Unidades Anmat;600.0;1;100;buy_it_now;gold_special;True;;MLA69570;Salud y Equipamiento Médico
MLA853429840;Algodon Pre Cortado Estrella Baby X 100gr;71.0;50;500;buy_it_now;gold_special;True;;MLA413223;Salud y Equipamiento Médico
MLA855080768;Ripped Burn Hd Ena X 60 Caps Potente Quemador Termogenico;632.65;50;250;buy_it_now;gold_special;True;;MLA3551;Salud y Equipamiento Médico
MLA838530263;Stress Killer. Magnesio Bisglicinato 220 Mg + Teanina 170mg.;1790.0;1;150;buy_it_now;gold_special;True;;MLA8830;Salud y Equipamiento Médico
MLA753921416;Pasta Provisoria Md Tempfill De Meta Biomed Odontologia;650.0;500;200;buy_it_now;gold_special;True;;MLA417910;Salud y Equipamiento Médico
MLA869420511;50x Barbijos Cubre Boca Mascarilla Elastico Clip Nasal Pack;1899.0;50000;250;buy_it_now;gold_special;True;;MLA69570;Salud y Equipamiento Médico
MLA895973735;Termometro Digital Laser Infrarrojo Humano;1738.5;250;250;buy_it_now;gold_special;True;1830.0;MLA5420;Salud y Equipamiento Médico
MLA782016104;Otoscopio Portatil F. Óptica Led 3x  8 Espéculos ;6300.0;1;100;buy_it_now;gold_special;True;;MLA408019;Salud y Equipamiento Médico
MLA863612059;Ultra T 2020. Importado Usa Con Holograma!!;2260.95;500;250;buy_it_now;gold_special;True;2379.95;MLA8830;Salud y Equipamiento Médico
MLA829025237;Corrector Postura Espaldera Espalda Clavicula Dema Premium;785.0;50;500;buy_it_now;gold_special;True;;MLA388193;Salud y Equipamiento Médico
MLA813870307;Irrigador Higiene Nasal Waterpulse +300ml +2 Picos Lota+ Sal;2279.05;1;250;buy_it_now;gold_special;True;2399.0;MLA429420;Salud y Equipamiento Médico
MLA883648560;Barbijos Importado Tricap C/elastico X100u;1800.0;100;50;buy_it_now;gold_special;True;;MLA69570;Salud y Equipamiento Médico
MLA782733720;Agujas Para Acupuntura. Cloud & Dragon. 0.30mm X  25mm;1000.0;1;500;buy_it_now;gold_special;True;;MLA417741;Salud y Equipamiento Médico
MLA826291047;Corrector Postura Espalda Postural Espaldera Hombre Neoprene;1185.0;100;500;buy_it_now;gold_special;True;;MLA388193;Salud y Equipamiento Médico
MLA815603015;Guantes Latex Negro Peluqueria Barberia Premium X 20 ;784.0;1;500;buy_it_now;gold_special;True;;MLA409140;Salud y Equipamiento Médico
MLA785143174;Ropa Interior Plenitud Femme X 16 Unidades Pack X 4;4316.0;150;500;buy_it_now;gold_special;True;6688.0;MLA95334;Salud y Equipamiento Médico
MLA850532313;Pack 100 Tapabocas Barbijos Personalizados Logo Full Color;2695.28;50;25;buy_it_now;gold_special;True;;MLA69570;Salud y Equipamiento Médico
MLA868709559;Glucometro Accu Chek Guide Kit Nuevo Cerrado ;4500.0;1;50;buy_it_now;gold_special;True;;MLA413468;Salud y Equipamiento Médico
MLA867116990;Testo 360 Traido De Usa. Unico En Argentina;3894.95;500;200;buy_it_now;gold_special;True;4099.95;MLA8830;Salud y Equipamiento Médico
MLA875387144;Tensiometro Aneroide Sin Estetoscopio Y Bolso Bokang Bk2001;1199.0;1;200;buy_it_now;gold_special;True;;MLA410990;Salud y Equipamiento Médico
MLA874957941;Mascara Facial Para Usar Con Barbijo;1600.0;500;100;buy_it_now;gold_special;True;;MLA69570;Salud y Equipamiento Médico
MLA739004631;Detector Y Estimulador Para Auriculoterapia Y Acupuntura;5100.0;1;500;buy_it_now;gold_special;True;;MLA417738;Salud y Equipamiento Médico
MLA880179992;Testo 360 Recien Llegado Usa;3995.97;500;150;buy_it_now;gold_special;True;;MLA8830;Salud y Equipamiento Médico
MLA810307631;Balanza Digital De Baño 180 Kg Vidrio Templado Super Oferta;2789.49;500;250;buy_it_now;gold_special;True;2999.46;MLA9554;Salud y Equipamiento Médico
MLA774110475;Agitador Magnético con Calefacción + Sonda + Buzo Magnético;14330.5;1;50;buy_it_now;gold_special;True;;MLA413980;Salud y Equipamiento Médico
MLA875119360;Mascara Deportiva Carbono Activado + Pack De 5 Filtros;3150.0;150;100;buy_it_now;gold_special;True;;MLA69570;Salud y Equipamiento Médico
MLA873407877;Oxímetro De Pulso Saturometro Dedo Pediatrico Neonatal Anmat;4790.0;1;50;buy_it_now;gold_special;True;;MLA408023;Salud y Equipamiento Médico
MLA849741708;Ambo Zalea Descartable 60cm X 90cm X 60 Unidades;1914.0;1;250;buy_it_now;gold_special;True;;MLA455048;Salud y Equipamiento Médico
MLA738110308;Promoción Cápsulas De Moringa: 2 X 90 U;854.05;250;500;buy_it_now;gold_special;True;899.0;MLA8830;Salud y Equipamiento Médico
MLA843260426;Glicerina Líquida Vegetal X 5 Kilos (usp) Nuevo Envase Duro!;1519.05;500;500;buy_it_now;gold_special;True;1599.0;MLA43677;Salud y Equipamiento Médico
MLA630191526;Faja Lumbar Ombu, De Trabajo - Hacemos Factura A Y B;830.0;500;5000;buy_it_now;gold_special;True;875.0;MLA393896;Salud y Equipamiento Médico
MLA885796975;Mascarilla/tapaboca  Atom-protect, X 3 Unidades;1260.0;100;50;buy_it_now;gold_special;True;;MLA69570;Salud y Equipamiento Médico
MLA876621148;Alcohol En Gel Antibacterial Neutro 500 Ml X12 U Dosificador;1732.0;1;200;buy_it_now;gold_special;True;;MLA69569;Salud y Equipamiento Médico
MLA882600463;Guantes De Nitrilo Sempercare Nitrile Talle M 100 Guantes;1200.0;1;100;buy_it_now;gold_special;True;;MLA409140;Salud y Equipamiento Médico
MLA851260905;Aspen Oximetro Adulto;4399.0;100;50;buy_it_now;gold_special;True;5499.0;MLA408023;Salud y Equipamiento Médico
MLA840126739;Coq10 X 120 Caps 100mg - Coenzima Q10 Puritan´s Pride;4500.0;1;150;buy_it_now;gold_special;True;;MLA8830;Salud y Equipamiento Médico
MLA859496798;Evaplan Digital - Test De Ovulación X 7;2770.0;50;250;buy_it_now;gold_special;True;;MLA414002;Salud y Equipamiento Médico
MLA862695141;Cofias Gorras Descartables Plisadas Packs X 500 U;4499.0;1;150;buy_it_now;gold_pro;True;;MLA69570;Salud y Equipamiento Médico
MLA722800796;Agua De Mar 100% Pura           (20 Ltrs);1300.0;5000;500;buy_it_now;gold_special;True;;MLA8830;Salud y Equipamiento Médico
MLA839538389;Suplemento Keto Advance Dieta Cetogenica Importado Usa;2100.0;1;50;buy_it_now;gold_pro;True;;MLA8830;Salud y Equipamiento Médico
MLA843071857;Brazal Repuesto Brazalete 32 Cm Tensiometro Digital Brazo ;870.0;1;250;buy_it_now;gold_special;True;;MLA410989;Salud y Equipamiento Médico
MLA864984184;Kit Sanitario Descartable Cofia + Camisolín + Cubrecalzados;1000.0;1;250;buy_it_now;gold_pro;True;;MLA69570;Salud y Equipamiento Médico
MLA879472353;Ultraflex Magnesio Colágeno Hidrolizado Oferta X 2 Latas;3799.0;1;250;buy_it_now;gold_special;True;;MLA8830;Salud y Equipamiento Médico
MLA879756039;Oxímetro Saturómetro Adulto Pediátrico Anmat 2 Pilas Regalo;3186.6;1;50;buy_it_now;gold_special;True;3390.0;MLA408023;Salud y Equipamiento Médico
MLA727690181;Moxa Tradicional -caja De 10 Cilindros O Cigarros;1000.0;50;250;buy_it_now;gold_special;True;;MLA417738;Salud y Equipamiento Médico
MLA675262342;Ozonizador Doble - Purificador Ioniza Y Elimina Olores 300m3;16990.0;1;500;buy_it_now;gold_special;True;;MLA434726;Salud y Equipamiento Médico
MLA836876348;Kit Lubricante Anal X2 Dilatacion Sin Dolor - Rhum Chocolate;799.0;1;200;buy_it_now;gold_special;True;;MLA400500;Salud y Equipamiento Médico
MLA877948810;Barbijo Mascara Protector Tapa Boca 95% Anmat X10 Unidades;1399.0;500;100;buy_it_now;gold_special;True;;MLA69570;Salud y Equipamiento Médico
MLA840208941;Glicerina Liquida Pura Vegetal 1000g 1 Kilo Nuevo Envase!!;347.13;250;500;buy_it_now;gold_special;True;399.0;MLA29934;Salud y Equipamiento Médico
MLA820011578;Tulipán Mix Preservativos Surtidos 12 Cajitas X 3;1050.0;1;250;buy_it_now;gold_special;True;;MLA431656;Salud y Equipamiento Médico
MLA613918340;Guantes De Nitrilo Mediglove Color Lavanda/lila X 100u;1549.0;100;500;buy_it_now;gold_special;True;;MLA409140;Salud y Equipamiento Médico
MLA874543156;Camisolín Descartables 20 Gr Con Puño Elastizado X 20 U;1400.0;1;100;buy_it_now;gold_special;True;;MLA69570;Salud y Equipamiento Médico
MLA869402110;Beurer Po30 Pulsioxímetro Adultos Pantalla Lcd Color;5990.0;50;100;buy_it_now;gold_special;True;;MLA408023;Salud y Equipamiento Médico
MLA883111489;Tapaboca Barbijo Transparente Reutilizable X 10 Unidades;2300.0;50;150;buy_it_now;gold_special;True;;MLA445788;Salud y Equipamiento Médico
MLA832202212;Suplemento Keto Advance Dieta Cetogenica Importado Usa;1999.0;500;250;buy_it_now;gold_special;True;;MLA8830;Salud y Equipamiento Médico
MLA820176813;Masajeador Facial Corporal Rodillo Piedra Roller Jade Verde ;1299.0;500;500;buy_it_now;gold_special;True;;MLA417724;Salud y Equipamiento Médico
MLA886104798;Barbijo Descartable Máxima Protección  X 50;1200.0;1;50;buy_it_now;gold_special;True;;MLA69570;Salud y Equipamiento Médico
MLA863049123;Ultraflex Colageno Hidrolizado Con Magnesio X 2 Latas;3699.0;1;250;buy_it_now;gold_special;True;;MLA8830;Salud y Equipamiento Médico
MLA870603616;Bicarbonato De Sodio 1kg Maxima Calidad;199.0;1;250;buy_it_now;gold_pro;True;;MLA417310;Salud y Equipamiento Médico
MLA845951030;Bcaa 2200 X 120 Comp Scfitness (aminos Ramificados) 0% Sodio;1260.0;150;250;buy_it_now;gold_special;True;;MLA3551;Salud y Equipamiento Médico
MLA811918344;Mascara Nasal Bmc Ivolve N2 - Oferta;4383.0;1;100;buy_it_now;gold_special;True;;MLA413961;Salud y Equipamiento Médico
MLA711767952;Estetoscopio Doble Campana Adulto Coronet Hs-30b1 Adulto;350.0;1;250;buy_it_now;gold_special;True;;MLA408018;Salud y Equipamiento Médico
MLA836816466;Preserv. Prime Zero Hiper Fino X36 U (12x3) - Envío Discreto;1890.5;1;250;buy_it_now;gold_special;True;1990.0;MLA384750;Salud y Equipamiento Médico
MLA896311572;Mascarilla Descartable Pack X 50 Cert Ce;860.0;500;150;buy_it_now;gold_pro;True;;MLA69570;Salud y Equipamiento Médico
MLA842998324;Citrato De Magnesio Maxima Pureza Del Mercado Usp Por 1kg;960.0;50;500;buy_it_now;gold_special;True;;MLA8830;Salud y Equipamiento Médico
MLA843978529;Citrato De Magnesio + Citrato De Potacio Combo 1 Kg Cada Uno;1980.0;50;250;buy_it_now;gold_special;True;;MLA8830;Salud y Equipamiento Médico
MLA742953411;Lentes De Contacto Freshlook Colorblends. Óptica Paesani;2090.0;50;250;buy_it_now;gold_special;True;;MLA7185;Salud y Equipamiento Médico
MLA867540754;Cubrecalzados Descartables Friselina 20 Gr. Paq. X 100 Pares;1510.0;1;50;buy_it_now;gold_pro;True;;MLA69570;Salud y Equipamiento Médico
MLA773366664;Aceite Natural Organico De Oregano Apto Para Consumo X 20 Ml;560.0;1;500;buy_it_now;gold_special;True;;MLA29934;Salud y Equipamiento Médico
MLA861123010;Gomas Intraorales Ortodoncia Smile Safari Ortodoncia Novacek;250.0;150;500;buy_it_now;gold_special;True;;MLA409314;Salud y Equipamiento Médico
MLA820562009;Pack 3 Ultraflex Magnesio Colágeno Hidrolizado En Polvo 420g;5897.0;1;250;buy_it_now;gold_special;True;;MLA8830;Salud y Equipamiento Médico
MLA852045353;Arlyt Express Solución Multiuso Para Lentes De Contacto X500;520.1;1;100;buy_it_now;gold_special;True;;MLA420674;Salud y Equipamiento Médico
MLA872759066;Barbijos Quirurjico Tapaboca Termosellado X200 Anmat;5599.0;1;200;buy_it_now;gold_special;True;;MLA69570;Salud y Equipamiento Médico
MLA878920587;Oximetro De Pulso Saturometro, Pulsaciones - Yonker Yk-81c ;2331.19;1;50;buy_it_now;gold_special;True;2480.0;MLA408023;Salud y Equipamiento Médico
MLA777471617;Masajeador Cervical Cuello Hombros Terapia Calor Shiatsu ;3799.0;250;500;buy_it_now;gold_special;True;4999.0;MLA417723;Salud y Equipamiento Médico
MLA896893725;Tapaboca Cubreboca Pasionfan Oficial San Lorenzo -barbijo;700.0;250;50;buy_it_now;gold_pro;True;;MLA445787;Salud y Equipamiento Médico
MLA794979235;Aceite Esencial Ylang Ylang 30ml Oferta;550.0;500;250;buy_it_now;gold_special;True;;MLA29934;Salud y Equipamiento Médico
MLA876724243;Barbijos Pack X50 Triple Filtro Anmat Termosellados Elastico;1999.0;50;50;buy_it_now;gold_pro;True;;MLA69570;Salud y Equipamiento Médico
MLA868644919;Cera De Soja X 3 Kg +pabilo+ojalillos+end. X200g+esencias;2005.0;50;100;buy_it_now;gold_special;True;;MLA29920;Salud y Equipamiento Médico
